,Unnamed: 0,id,title,release_date,revenue,runtime,adult,budget,overview,popularity,poster_path,genres,keywords,year,actors,emotions,director
2575,2575,175774,Ruby Red,2013-03-14,5524381,122,False,0,"Gwendolyn Shepherd is a normal 16-year-old, but her family holds a secret: A time-travel gene is expressed in the clan inherited, but not every member of the family is blessed with. Everyone is certain that Gwen's cousin Charlotte has the gene.  However, someday Gwendolyn suddenly finds herself in London at the end of the 19th century and realizes that it is her, who was born a time traveler. While she is not very enthusiastic about it, she will do everything possible to solve the ancient mysteries of the red ruby.",25.508,/oAEvlYIlbyMxhCKuO3HE9egGzQA.jpg,"['Fantasy', 'Drama', 'Romance']","time travel, teenage romance",2013,"['Maria Ehrich', 'Jannis Niewöhner', 'Laura Berlin', 'Uwe Kockisch', 'Josefine Preuß', 'Florian Bartholomäi', 'Katharina Thalbach', 'Veronica Ferres', 'Anna Böttcher', 'Sibylle Canonica', 'Justine del Corte', 'Levin Henning', 'Gottfried John', 'Gerlinde Locker', 'Axel Milberg', 'Chiara Schoras', 'Johannes Silberschneider', 'Kostja Ullmann', 'Rüdiger Vogler', 'Jennifer Lotsi', 'Johannes von Matuschka', 'Oxana Salzmann', 'Friederike Rhein', 'Thomas Limpinsel', 'Christine Rollar', 'Maurizio Magno', 'Elke Borkenstein', 'Philip Wiegratz', 'Menyhért René Balog-Dutombé', 'Karin Graf', 'Reiner Neffgen', 'Martin Östreicher', 'Peter Simonischek', 'Butz Ulrich Buse', 'Ferenc Hock', 'Ádám Madaras', 'Levente Tamási', 'Markus Daffinger', 'István Kiss', 'Frederic Welter', 'Holger Kriechel', 'Sofi de la Torre', 'Daniel-Emanuel Uhde', 'Benedikt Weißkopf', 'Christopher Scherf', 'Markus Frank Juri Popp']","['romantic', 'fantastical', 'adventurous']",Felix Fuchssteiner
2576,2576,24420,The Time Traveler's Wife,2009-08-14,101344412,108,False,39000000,"Due to a genetic disorder, handsome librarian Henry DeTamble involuntarily zips through time, appearing at various moments in the life of his true love, the beautiful artist Clare Abshire.",25.506,/J3ewuzQwhFro0pDpdcbZ4j7MYy.jpg,"['Drama', 'Romance', 'Fantasy']","future, husband wife relationship, based on novel or book, time travel, time, love, travel, tragic love, relationship, disorder, genetic disorder",2009,"['Eric Bana', 'Rachel McAdams', 'Michelle Nolden', 'Arliss Howard', 'Ron Livingston', 'Stephen Tobolowsky', 'Brian Bisson', 'Maggie Castle', 'Brooklynn Proulx', 'James Lafazanos', 'Dan Duran', 'Jan Caruana', 'Jean Yoon', 'Duane Murray', 'Philip Craig', 'Fiona Reid', 'Alex Ferris', 'Katherine Trowell', 'Bart Bedford', 'Esther Jun', 'Esther Jun', 'Craig Snoyer', 'Carly Street', 'Romyen Tangsubutra', 'Mario Tufino', 'Shawn Storer', 'David Talbot', 'Kenner Ames', 'Alison MacLeod', 'Hailey McCann', 'Donald Carrier', 'Tatum McCann', 'Jon Bruno', 'Scott Menville', 'Paul Francis', 'Matt Birman']","['romantic', 'emotional', 'fantastical']",Robert Schwentke
2577,2577,736545,Nothing Serious,2021-11-24,0,95,False,0,"Woo-ri, 32, and Ja-young, 28, who both dislike being alone but have particular anxieties when it comes to dating, meet through an app.",25.501,/kXG2cSa4QUf5qbgs02T77qHlmLT.jpg,"['Romance', 'Comedy']",magazine editor,2021,"['Jun Jong-seo', 'Son Suk-ku', 'Gong Min-jeung', 'Kim Seul-ki', 'Bae Yoo-ram', 'Kim Jae-hwa', 'Im Sung-jae', 'Lim Sun-woo', 'Kim Yeong-ok', 'Kim Kwang-kyu', 'Lee Hak-ju', 'Park Jong-hwan', 'Jang Eui-soo', 'Jang Seo-kyung']","['romantic', 'comedic', 'lighthearted']",Jeong Ga-young
2578,2578,14438,Fireproof,2008-09-26,33456317,122,False,500000,"A heroic fire captain values dedication and service to others above all else, but the most important partnership in his life, his marriage, is about to go up in smoke.",25.501,/hfoCG75j1YaNyfZGPg0rWy3nFmU.jpg,['Drama'],"fire, husband wife relationship, parent child relationship, faith, marriage, religious conversion, advice, dysfunctional marriage, religion, hospital, marital problem, firefighter, christian film, christian",2008,"['Kirk Cameron', 'Erin Bethea', 'Ken Bevel', 'Stephen Dervan', 'Ric Young', 'Jason McLeod', 'Harris Malcom', 'Phyllis Malcom', 'Perry Revell', 'Stephanie Makulinski', 'Renata Williams', 'Dwan Williams', 'Amberly Marquard', 'Joy Joiner', 'Danielle Brooks', 'Ron Rowe', 'Faye Sharber', 'Ray Wood', 'Sue Holt', 'Bill Stafford', 'Carla Hawkins', 'Kelly Johnson', 'Melanie Tomlinson', 'Bailey Cave', 'Tommy McBride', 'Heidi Johnson', 'Shannon Kendrick', 'Bill Butler', 'Stephen Kendrick', 'Marquez Waller', 'Leigh Cox', 'Luke Bowers', 'Mickey Bradford', 'Cornelious Drake', 'Chad Warbington', 'Rick McDaniel', 'Dee Kelley', 'John Spencer', 'Walter Burnett', 'Shannon Davis', 'Anthony Brown', 'Allison Dawson', 'Taylor Glow', 'Jade Young', 'Janet Lee Dapper', 'Blake Bailey', 'Robin Bushnell', 'Tracy Goode', 'Jim McBride', 'Dot Majors', 'Deena Taylor', 'JJ Jasper', 'Bob Waliszewski', 'Alex Kendrick', 'Rob Whitehurst']","['emotional', 'inspiring', 'heartfelt']",Alex Kendrick
2579,2579,428605,Prostitution,2016-11-24,0,79,False,0,"Soo-hyeon and Hye-ji are sitting on a pile of debt thanks to their husband and father who ran away in the middle of the night. Tae-san the loan shark demands the money no matter what. He rapes the mother and daughter and requires them to join prostitution. They survive day by day selling themselves until one day, Tae-san suggests a way they can clean slate over one night and that is for the mother and daughter to have the most extreme sex with one man.",25.5,/8fYEZfHcIEcKRn9rG2quV2l6IOk.jpg,"['Drama', 'Romance']",softcore,2016,"['Ahn So-hee', 'Baek Se-ri', 'Tae-Hyeon Min', 'Soo-ho Kang', 'Kim\tBeom-jik']","['provocative', 'dramatic', 'intense']",Lee Sang-woo
2580,2580,8698,The League of Extraordinary Gentlemen,2003-07-11,179265204,110,False,78000000,"To prevent a world war from breaking out, famous characters from Victorian literature band together to do battle against a cunning villain.",25.498,/kdAuVFP63XXxnb983ry2pLCKd9S.jpg,"['Fantasy', 'Action', 'Thriller', 'Science Fiction']","saving the world, submarine, venice, italy, immortality, based on comic, steampunk, super power, jekyll and hyde, evil plot, captain nemo, allan quatermain, secret lair, nautilus, immortal, victorian era, moriarty, invisible man, vampiress (female vampire)",2003,"['Sean Connery', 'Naseeruddin Shah', 'Shane West', 'Peta Wilson', 'Stuart Townsend', 'Jason Flemyng', 'Tony Curran', 'Richard Roxburgh', 'Max Ryan', 'Tom Goodman-Hill', 'David Hemmings', ""Terry O'Neill"", 'Rudolf Pellar', 'Robert Willox', 'Robert Orr', 'Joel Kirby', 'Marek Vašut', 'Ewart James Walters', 'Robert Vahey', 'Sylvester Morand', 'Mariano Titanti', 'Huggy Leaver', 'James Babson', 'Pavel Bezděk', 'Stanislav Adamickij', 'Michael McGuffie', 'Michal Grün', 'San Shella', 'Ellen Savaria', 'Riz Meedin', 'Sartaj Garewal', 'Neran Persaud', 'Andrew Rajan']","['action-packed', 'fantastical', 'adventurous']",Stephen Norrington
2581,2581,44115,127 Hours,2010-11-12,35692920,94,False,18000000,The true story of mountain climber Aron Ralston's remarkable adventure to save himself after a fallen boulder crashes on his arm and traps him in an isolated canyon in Utah.,25.491,/xbszsQv3ifdFZtQu8CzNh4zh0MX.jpg,"['Adventure', 'Drama', 'Thriller']","canyon, based on novel or book, pain, utah, photography, despair, hiking, engineer, based on true story, alone, climbing, mountain biking, struggle for survival, trapped, boulder, cavern, video recorder, adventurer, rock climbing, climber, isolated, hikers, memories, biographical, hallucinations, desperation, intrusive thoughts, chance encounter",2010,"['James Franco', 'Kate Mara', 'Amber Tamblyn', 'Clémence Poésy', 'Lizzy Caplan', 'Kate Burton', 'Treat Williams', 'Sean Bott', 'Fenton Quinn', 'John Lawrence', 'Pieter Jan Brugge', 'Rebecca C. Olson', 'Jeffrey Wood', 'Norman Lehnert', 'Darin Southam', 'Koleman Stinger', 'Bailee Michelle Johnson', 'Parker Hadley', 'Peter Joshua Hull', 'Terry S. Mercer', 'Xmas Lutu', 'Luke Drake', 'Robert Bear', 'Brad Johnson', 'Stacey Ann Turner', 'Zachary Haycock', 'Lonzo Liggins', 'Samantha Marsden', 'Johnny Ahn', 'Christopher K. Hagadone', 'Kelsie Mathews', 'Amy Savannah', 'Adam Colvin', 'Elizabeth Hales', 'Kelly Higgins', 'Aron Ralston', 'Jessica Ralston', 'Kyle Paul', 'Priscilla Poland']","['intense', 'emotional', 'inspiring']",Danny Boyle
2583,2583,67120,Sex and the Emperor,1994-02-10,0,92,False,0,"In the Qing Dynasty, the only people who lived in the Forbidden City are the Emperor's concubines, their maids, the eunuchs and the Emperor himself. Li Lianying is an eunuch who enters the Forbidden City with a big secret. One that will have his head on the floor if the wrong people find out.",25.483,/9ormMpTstp3J0EWrUJ9Ql1ecrYe.jpg,"['Drama', 'Comedy', 'Romance']",erotic movie,1994,"['Yvonne Yung Hung', 'Leung See-Ho', 'Sung Boon-Chung', 'Jimmy Wong Shu-Kei', 'Kingdom Yuen King-Tan', 'Stuart Yung Sai-Kit', 'Julie Lee', 'Chin Gwan', 'Wong Yat-Fei', 'Hui Sze-Man', 'Lui Tat']","['provocative', 'erotic', 'dramatic']",Sherman Wong
2584,2584,1903,Vanilla Sky,2001-12-10,203388341,136,False,68000000,"David Aames has it all: wealth, good looks and gorgeous women on his arm. But just as he begins falling for the warmhearted Sofia, his face is horribly disfigured in a car accident. That's just the beginning of his troubles as the lines between illusion and reality, between life and death, are blurred.",25.481,/cAh2pCiNPftsY3aSqJuIOde7uWr.jpg,"['Mystery', 'Science Fiction', 'Romance', 'Fantasy', 'Thriller', 'Drama']","regret, jealousy, amnesia, dream, love of one's life, nightmare, love triangle, virtual reality, ex-girlfriend, surreal, plastic surgery, illusion, face operation, life extension, time, puzzle, flashback, confusion, love, remake, wealth, memory loss, tragic love, doctor, car accident, fear, relationship, heartbreak, freak accident, disfigured face, surgery, lost love, individuality, disfigurement, wealthy man",2001,"['Tom Cruise', 'Penélope Cruz', 'Cameron Diaz', 'Kurt Russell', 'Jason Lee', 'Noah Taylor', 'Timothy Spall', 'Tilda Swinton', 'Michael Shannon', 'Delaina Mitchell', 'Shalom Harlow', 'Oona Hart', 'Ivana Miličević', 'Johnny Galecki', 'Jhaemi Willens', 'Armand Schultz', 'Cameron Watson', 'Robertson Dean', 'W. Earl Brown', 'Ray Proscia', 'Tim Hopper', 'Alicia Witt', 'Ken Leung', 'Carolyn Byrne', 'Mark Pinter', 'Jeff Weiss', ""Conan O'Brien"", 'James Murtaugh', 'Mark Kozelek', 'John Fedevich', 'Bobby Walsh', 'Stacey Sher', 'Fred Schruers', 'Jessica Siemens', 'Julia Carothers Hughes', 'Holly Raye', 'Marty Collins', 'Mark Bramhall', 'Jack Hall', 'David Lewison', 'Jennifer Griffin', 'Adam LeGrant', 'John Kepley', 'Robin Van Sharner', 'Laurel Wiley', 'Nicole Taylor Hart', 'Julia Decker', 'Jennifer Marie Kelley', 'Erin McElmurry', 'Alice Marie Crowe', 'Mel Thompson', 'Jonathan Sanger', 'Tommy Lee', 'Ana Maria Quintana', 'Paul Haggar', 'Randy Woodside', 'Robert F. Harrison', 'Carly Starr Brullo Niles', 'Jane Pratt', 'Patrick McMullen', 'Steven Colvin', 'Cindy Crowe', 'John Sypolt', 'Michael G. Kehoe', 'Danielle Wolff', 'Scotch Ellis Loring', 'Brent Sexton', 'Curt Skaggs', 'Jennifer Gimenez', 'Lori Lezama', 'Todd Harrison', 'Laura Fraser', 'Steven Spielberg', 'Jennifer Aspen', 'Celina Belizan', 'Craig Callow', 'Jean Carol', 'Tony Collucci', 'Janine Foster', 'Zach Hudson', 'Ryan Keating', 'Roger Lim', 'Tara Lipinski', 'William Mapother', 'Christy Meyers', 'Jan Munroe', 'Marie Paquim', 'Ronald Rand', 'Tasha Tae', 'Bryan Todd', 'Christie Will Wolf']","['surreal', 'emotional', 'thought-provoking']",Catherine Hardwicke
2585,2585,157547,Oculus,2013-09-08,44459951,104,False,5000000,A woman tries to exonerate her brother's murder conviction by proving that the crime was committed by a supernatural phenomenon.,25.479,/3J25Xmt3zN9OpsTD5dLNwz7IirD.jpg,['Horror'],"husband wife relationship, supernatural, haunted house, hallucination, family relationships, artifact, skepticism, ghost, fear of mirrors, mirror",2013,"['Karen Gillan', 'Brenton Thwaites', 'Katee Sackhoff', 'Rory Cochrane', 'Annalise Basso', 'Garrett Ryan', 'James Lafferty', 'Miguel Sandoval', 'Kate Siegel', 'Scott Graham', 'Justin Gordon', 'Dave Levine', 'Stephanie Minter', 'Skye L. Johnson', 'Courtney Bell', 'Allison Boyd', 'Jamie Flanagan', 'Alexandra Beer', 'Marc D. Evans', 'Toni White', 'Katie Parker', 'Ginger McNamara', 'Brett Murray']","['horrific', 'suspenseful', 'intense']",Mike Flanagan
2586,2586,200085,The Flu,2013-08-14,19775853,122,False,0,"A case of the flu quickly morphs into a pandemic. As the death toll mounts and the living panic, the government plans extreme measures to contain it.",25.472,/mvTXhTddHIZbOU9pmrcPODI1kRx.jpg,"['Action', 'Adventure', 'Science Fiction']","quarantine, police, flu, survival, disaster, doctor, lethal virus, epidemic, virus, influenza, mother daughter relationship",2013,"['Jang Hyuk', 'Soo Ae', 'Park Min-ha', 'Yoo Hai-jin', 'Don Lee', 'Lee Hee-jun', 'Lee Sang-yeob', 'Cha In-pyo', 'Kim Ki-hyeon', 'Park Hyo-ju', 'Park Jeong-min', 'Choi Byung-mo', 'Kim Moon-Soo', 'Lee Seung-joon', 'Jang Kyoung-up', 'Na Ki-soo', 'Nam Moon-chul', 'Seon Uk-hyeon', 'Seol Chang-hee', 'So Hee-jung', 'Andrew William Brand', 'Park Jin-hyeok', 'Kim Hyeong-seok']","['intense', 'emotional', 'dramatic']",Kim Sung-soo
2587,2587,9912,The World's Fastest Indian,2005-10-12,0,127,False,25000000,"The life story of New Zealander Burt Munro, who spent years building a 1920 Indian motorcycle—a bike which helped him set the land-speed world record at Utah's Bonneville Salt Flats in 1967.",25.47,/i7obsEYXjo725H9vneFqxxUiZw7.jpg,"['Drama', 'Adventure', 'History']","utah, new zealand, life's dream, motor sport, motorcycle, trailer, mortgage, 1960s, speed records",2005,"['Anthony Hopkins', 'Walton Goggins', 'Diane Ladd', 'Bruce Greenwood', 'Iain Rea', 'Tessa Mitchell', 'Aaron Murphy', 'Tim Shadbolt', 'Annie Whittle', 'Greg Johnson', 'Kate Sullivan', 'Antony Starr', 'Craig Hall', 'Jim Bowman', 'Phoebe Falconer', 'Charles Pierard', 'Barry Ryan', 'Alison Bruce', 'Mick Rose', 'Bill Richardson', 'Wesley Dowdell', 'Todd Emerson', 'Tony Wilson', 'James Gaylyn', 'Latham Gaines', 'Jessica Cauffiel', 'Paul Rodríguez', 'William Lucking', 'Chris Williams', 'Saginaw Grant', 'Patrick John Flueger', 'Eric Pierpoint', 'Daniel Sing', 'Mark Ruka', 'Campbell Cooley', ""Steve O'Neill"", 'Dan Moody', 'Martha Carter', 'Noelle Lee Kaine', 'Kristen Marie Holly', 'Tom Jacobsen', 'Chris Kendrick', 'Charles Halford', 'Juliana Bellinger', 'Annette Wright', 'Morgan Lund', 'Christopher Lawford', 'Gavin Grazer', 'Michael Mantell', 'Nicholas Lanier', 'Laurel Moglen', 'Chris Bruno', 'Joe Howard']","['inspiring', 'emotional', 'uplifting']",Roger Donaldson
2588,2588,108450,The Smile of the Fox,1992-05-22,0,86,False,0,"Mark, a hitman haunted by his past as a corrupt Miami cop and the death of his wife and son,  prepares for his next killing. Gradually he becomes fascinated by the beautiful prostitute who lives in the next apartment and they embark on a passionate affair. Their dreams of a life together are complicated by her pimp being a drugs baron; before they can escape he must die, but things are never that simple...",25.467,/jwXeg1EsDjwEb88AcWRFudLfLqU.jpg,['Thriller'],,1992,"['Debora Caprioglio', 'Steve Bond', 'Sharon Marino', 'Leonardo Treviglio', 'Pedro Loeb', 'Raffaella Offidani', 'Raffaele Mottola', 'Martín Coria', 'Roberto Ricci']","['provocative', 'erotic', 'dramatic']",Sergio Martino
2589,2589,114150,Pitch Perfect,2012-09-28,115400000,112,False,17000000,"College student Beca knows she does not want to be part of a clique, but that's exactly where she finds herself after arriving at her new school. Thrust in among mean gals, nice gals and just plain weird gals, Beca finds that the only thing they have in common is how well they sing together. She takes the women of the group out of their comfort zone of traditional arrangements and into a world of amazing harmonic combinations in a fight to the top of college music competitions.",25.464,/ntRIoh8Qf1BI1AYGx0STfq0wUmb.jpg,"['Comedy', 'Music', 'Romance']","competition, roommate, college, female friendship, misfit, hazing, university, audition, group of friends, dorm room, bickering, dj, singing competition, film score, young adult, acapella, music movie",2012,"['Anna Kendrick', 'Brittany Snow', 'Anna Camp', 'Rebel Wilson', 'Ester Dean', 'Skylar Astin', 'Ben Platt', 'Adam Devine', 'Hana Mae Lee', 'Alexis Knapp', 'Utkarsh Ambudkar', 'Kelley Jakle', 'Shelley Regner', 'Caroline Fourmy', 'Wanetah Walmsley', 'Nicole Lovince', 'Michael Viruet', 'David Del Rio', 'Elizabeth Banks', 'John Michael Higgins', 'John Benjamin Hickey', 'Freddie Stroma', 'Jinhee Joung', 'Jacob Wysocki', 'Jawan Harris', 'Richard Kohnke', 'Scott Shilstone', 'Brock Kelly', 'Drew Battles', 'Katrina Despain', 'Cameron Deane Stewart', 'Kether Donohue', 'Karen Gonzales', 'Lauren Gros', 'Alexander Biglane', 'Michael Alix', 'Tyler Forrest', 'Joe Lo Truglio', 'Har Mar Superstar', 'Jason Jones', 'Donald Faison', 'Jabari Thomas', 'Judd Lormand', 'Christopher Mintz-Plasse', 'Steven Bailey', 'Michael Anaya', 'Gregory Gorenc', 'Brian Silver', 'Wes Lagarde', 'Jonathan Brannan', 'Donald Watkins', 'Jessica Jain', 'Nate Howard', 'Ben Haist', 'Rose Davis', 'Emma Graves', 'Emily Rodriguez', 'Sawyer McLeod', 'Chase Cooksey', 'Adam Gilbert', 'Megan Dupre', 'Brittney Alger', 'Monika Guiberteau', 'Jessica Poumaroux', 'Jackie Tuttle', 'Elizabeth Chance', 'Margo Melancon', 'Brooke Fontenot', 'C.J. Perry Barnyashev', 'Maya Estephanos', 'Brian Mason', 'Xavier Wilcher', 'Julia Friedman', 'Esther Long', 'Aakomon Jones', 'Sora Connor', 'Elise Wilson', 'Sean Bankhead', 'Matthew Laraway', 'Madison Benson', 'Kenneth Tipton', 'Jeremy Strong', 'Dylan Cheek', 'Naeemah McCowan', 'Allison Sahonic', 'Codie L. Wiggins', 'Kelly Snow', 'Nathan Swedberg', 'Matthew Savarese', 'Sanford Williams', 'Charles Miller', 'Brandon Borror-Chappell', 'Sean McDonald', 'Nicholas Cafero', 'Alexander Fabian', 'Paul Ruess', ""Andrew O'Shanick"", 'Samuel Brennan', 'Thaddeus Potter', 'Jacob Mainwaring', 'Alexander Sneider', 'William Laverack', 'Renaldo McClinton', 'Richard Coleman', 'Margaret Osburn', 'Dan Iwrey', 'Ali Bloomston', 'Shawn Barry', 'Alexandra Weinroth', 'Ciera Dawn Washington', 'Felipe Fuentes', 'Glen Aucoin', 'Deke Sharon', 'Ed Boyer', 'Brandon Kitchel', 'Jasper Randall', 'Drew Seeley', 'Jeff Lewis', 'Laura Dickinson', 'Candice Helfand', 'Windy Wagner', 'Jessica Rotter', 'Kari Kimmel', 'Kala Balch', 'Emily Benford']","['uplifting', 'fun', 'empowering']",Jason Moore
2590,2590,877183,The Simpsons in Plusaversary,2021-11-12,0,4,False,0,"The Simpsons host a Disney+ Day party and everyone is on the list… except Homer. With friends from across the service and music fit for a Disney Princess, Plusaversary is Springfield's event of the year.",25.462,/p5jzbffrXuBTjsiwrQ3aOMTrvCj.jpg,"['Animation', 'Comedy', 'Fantasy']","beer, adult animation, short film",2021,"['Dan Castellaneta', 'Nancy Cartwright', 'Yeardley Smith', 'Hank Azaria', 'Tress MacNeille']","['humorous', 'nostalgic', 'lighthearted']",David Silverman
2591,2591,492999,Attack on Titan: The Roar of Awakening,2018-01-13,0,120,False,0,"Eren Yeager and others of the 104th Training Corps have just begun to become full members of the Survey Corps. As they ready themselves to face the Titans once again, their preparations are interrupted by the invasion of Wall Rose—but all is not as it seems as more mysteries are unraveled. As the Survey Corps races to save the wall, they uncover more about the invading Titans and the dark secrets of their own members.",25.462,/tLkdCvfmTOvxirrpSaaOBJD7qsU.jpg,"['Animation', 'Action', 'Adventure', 'Fantasy']","giant, edited from tv series, anime",2018,"['Yuki Kaji', 'Yui Ishikawa', 'Marina Inoue', 'Hiro Shimono', 'Yu Kobayashi', 'Shiori Mikami', 'Saki Fujita', 'Yoshimasa Hosoya', 'Kenjiro Tsuda', 'Takehito Koyasu', 'Yu Shimamura', 'Kisho Taniyama', 'Daisuke Ono', 'Hiroshi Kamiya', 'Romi Park', 'Tomohisa Hashizume', 'Risa Shimizu', 'Kimihiko Nakamura']","['intense', 'emotional', 'heroic']",Tetsuro Araki
2592,2592,19918,Spread,2009-01-16,12035862,97,False,0,A gigolo must contend with the prospect that he has found true love.,25.461,/hCA9jeOrVWYyK4bCO55hvDmT2Z3.jpg,"['Comedy', 'Romance']","seduction, gigolo, callboy",2009,"['Ashton Kutcher', 'Anne Heche', 'Margarita Levieva', 'Sebastian Stan', 'Ashley Johnson', 'Sonia Rockwell', 'Rachel Blanchard', 'Shane Brolly', 'Eric Balfour', 'María Conchita Alonso', 'Derek Carter', 'Jordan Black', 'Dani Levine', 'Peter Marc Jacobson', 'Lindsey Broad', 'Amy Motta', 'Lauri Johnson', 'Madison Bauer', 'Josh Richman', 'Estefania Iglesias', 'Reeve Carney', 'Nick Lee', 'Sarah Karijan', 'Jenae Altschwager', 'Sarah Buxton', 'Lourdes Faberes', 'Olivia May', 'Candice A. Buenrostro', 'Anthony Bergeron', 'Hart Bochner', 'Christie Burson', 'Pinky Campbell', 'Vicki Damante', 'Renee Darmiento', 'Lejla Hadzimuratovic', 'Ashley Green Elizabeth', 'Marc Gruninger', 'Lanre Idewu', 'John Ierardi', 'Sarah Karjian', 'Adrienne McQueen', 'Shanna Olson', ""Caitlin O'Connor"", 'Georgia Reed', 'James M. Myers']","['provocative', 'erotic', 'dramatic']",David Mackenzie
2593,2593,11797,Fright Night,1985-08-02,24922237,107,False,9000000,"Charley Brewster, a high school student, accidentally discovers the true and creepy nature of Jerry Dandrige, his dashing and enigmatic new neighbor; but no one seems willing to believe him.",25.453,/upVMb3s1RugX4J0O40zfERjPE5N.jpg,"['Comedy', 'Horror']","vampire, black humor, vampire hunter (slayer), old house, boyfriend girlfriend relationship, mother son relationship, tv actor",1985,"['Chris Sarandon', 'William Ragsdale', 'Amanda Bearse', 'Roddy McDowall', 'Stephen Geoffreys', 'Jonathan Stark', 'Dorothy Fielding', 'Art Evans', 'Stewart Stern', 'Nick Savage', 'Ernie Holmes', 'Heidi Sorenson', 'Irina Irvine', 'Bob Corff', 'Pamela Brown', 'Chris Hendrie', 'Prince Hughes']","['horrific', 'suspenseful', 'intense']",Tom Holland
2594,2594,241554,Run All Night,2015-03-11,71561644,114,False,50000000,"Brooklyn mobster and prolific hit man Jimmy Conlon has seen better days. Longtime best friend of a mob boss, Jimmy is haunted by the sins of his past—as well as a dogged police detective who’s been one step behind Jimmy for 30 years. But when Jimmy’s estranged son becomes a target, Jimmy must make a choice between the crime family he chose and the real family he abandoned long ago. Now, with nowhere safe to turn, Jimmy has just one night to figure out exactly where his loyalties lie and to see if he can finally make things right.",25.445,/frzdzHceByAIlwVKvSvY9zqpjyV.jpg,"['Action', 'Crime', 'Thriller']","hitman, revenge, murder, mobster, on the run",2015,"['Liam Neeson', 'Joel Kinnaman', 'Ed Harris', ""Vincent D'Onofrio"", 'Bruce McGill', 'Genesis Rodriguez', 'Boyd Holbrook', 'Holt McCallany', 'Common', 'Nick Nolte', 'Lois Smith', 'Beau Knapp', 'Daniel Stewart Sherman', 'James Martinez', 'Radivoje Bukvić', 'Tony Naumovski', 'Patricia Kalember', 'Malcolm Goodwin', 'John Cenatiempo', 'Alex Ziwak', 'Lynn Marocola', 'Aubrey Joseph', 'Gavin-Keith Umeh', 'Jessica Ecklund', 'Dan Domingues', 'Barrington Walters Jr.', 'Andy Murray', 'Melissa Beech', 'Dorothi Fox', 'Lauren Slakter', 'Jacqueline Murphy', 'Michael Romeo Ruocco', 'Jelani Robert Joseph', 'Monika Baskiewicz', 'Melissa Bithorn', 'Candice T. Cain', 'Nina Rosenthal', 'Anna Sampson', 'Nancy Ellen Shore', 'Chris Victor', 'Isaiah Seward', 'George Schroeder', 'Paugh Shadow']","['intense', 'suspenseful', 'dramatic']",Jaume Collet-Serra
2595,2595,178809,The Colony,2013-04-12,0,95,False,16000000,"Forced underground by the next ice age, a struggling outpost of survivors must fight to preserve humanity against a threat even more savage than nature.",25.439,/zC4lm38NV09xzHJVAw4jpTfhJjB.jpg,"['Action', 'Science Fiction', 'Thriller']","dystopia, ice age, global warming, cannibal, starvation",2013,"['Kevin Zegers', 'Laurence Fishburne', 'Bill Paxton', 'Charlotte Sullivan', 'John Tench', 'Atticus Mitchell', 'Dru Viergever', 'Romano Orzari', 'Earl Pastko', 'Lisa Berry', 'Lucius Hoyos', 'Michael Mando', 'Eric Murdoch', 'Kimberly-Sue Murray', 'Julian Richings', 'John Healy', 'Kristin Shepherd', 'Sten Eirik', 'Alex Paxton-Beesley', 'Mitchell Nye']","['suspenseful', 'intense', 'dramatic']",Jeff Renfroe
2596,2596,21422,Detective Conan: The Time Bombed Skyscraper,1997-04-19,9107390,95,False,0,"Conan Edogawa is facing a dilemma: Ran Mouri has asked Shinichi Kudou out to the movies and he is unable to provide a convincing excuse not to go. However, when the day of the date arrives, he has more pressing problems to worry about—a great amount of plastic explosives has recently been stolen and the culprit has challenged Shinichi to find and dispose of the bombs he has scattered across the city. Now forced in a race against time, Conan must not only protect the city, but also figure out who the mastermind is and his reason for confronting Shinichi.",25.435,/5RB171WScK3nh4PqoRn8bj3iNLa.jpg,"['Adventure', 'Mystery', 'Animation']","new love, revenge, anime",1997,"['Minami Takayama', 'Kappei Yamaguchi', 'Wakana Yamazaki', 'Akira Kamiya', 'Kenichi Ogata', 'Yukiko Iwai', 'Wataru Takagi', 'Ikue Otani', 'Naoko Matsui', 'Chafurin', 'Kaneto Shiozawa', 'Tarō Ishida', 'Tomoko Miyadera', 'Kazuhiro Yamaji', 'Kayoko Fujii', 'Jin Hirao', 'Shun Tanigawa', 'Yuzuru Fujimoto', 'Yuji Fujishiro', 'Asako Dodo', 'Ako Mayama', 'Kazuya Ichijo', 'Meidai Nomura', 'Takumi Yamazaki']","['mysterious', 'suspenseful', 'intense']",Kenji Kodama
