,Unnamed: 0,id,title,release_date,revenue,runtime,adult,budget,overview,popularity,poster_path,genres,keywords,year,actors,emotions,director
5148,5148,235704,Commitment,2013-11-05,0,113,False,0,"The son of a North Korean spy decides to follow in his father's footsteps to protect his little sister. After his father's botched espionage mission, North Korean Myung-hoon and his young sister Hye-in are sent to a labor prison camp. In order to save his sister's life, Myung-hoon volunteers to become a spy and infiltrates the South as a teenage defector. While attending high school in the South, he meets another girl named Hye-in, and rescues her when she comes under attack.",17.025,/ybM400b3vesnoNzOlTlAmHeEYPq.jpg,"['Drama', 'Action', 'Thriller']","high school, assassin, secret mission, spy, secret agent, bullying, murder, motorcycle, government assassin, inter-korean relations",2013,"['Choi Seung-hyun', 'Han Ye-ri', 'Yoon Je-moon', 'Cho Seong-ha', 'Kim You-jung', 'Lee Joo-sil', 'Jung Ho-bin', 'Kim Sun-kyung', 'Kim Min-jae', 'Park Sung-woong', 'Kang Han-na', 'Yoo Jae-myung', 'Lee Shin-seong', 'Um Tae-goo', 'Park Gil-su', 'Hwang Yeon-hui', 'Park Kyung-man']","['sacrifice', 'duty', 'family']",
5149,5149,9701,North Country,2005-02-12,25224242,126,False,35000000,"A fictionalized account of the first major successful sexual harassment case in the United States -- Jenson vs. Eveleth Mines, where a woman who endured a range of abuse while working as a miner filed and won the landmark 1984 lawsuit.",17.023,/upxUN4zmX79o49mBW9htKZDeNq7.jpg,['Drama'],"rape, court, minnesota, harassment, witness, based on true story, lawsuit, miner, insult, love, sexual harassment, battle, single mother, woman director, landmark, 1980s",2005,"['Charlize Theron', 'Frances McDormand', 'Woody Harrelson', 'Sean Bean', 'Jeremy Renner', 'Richard Jenkins', 'Sissy Spacek', 'Thomas Curtis', 'Elle Peterson', 'Michelle Monaghan', 'Linda Emond', 'James Cada', 'Xander Berkeley', 'John Aylward', 'Corey Stoll', 'Chris Mulkey', 'Rusty Schwimmer', 'Amber Heard', 'Jillian Armenante', 'Cole Williams', 'Bryan Fagerstrom', 'Arron Shiver', 'Clif Stokes', 'J.D. Garfield', 'Boots Southerland', 'John Hardman', 'Forrest Norgaard', 'Sage Coy', 'Marcus Chait', 'Dennis E. Garber', 'Alex Layton', 'Jacqueline Wright', 'Catherine Campion', 'Tom Bower', 'David Lislegard', 'Kurt Peterson', 'Pete Pellinen', 'Bruce Bohne', 'Todd Anderson', 'Kit Gwin', 'Patrick McDowell', 'Raye Birk', 'Sally Wingert', 'Katherine Ferrand', 'Curtis Plagge', 'Marc Miles', 'J.C. Cutler', 'Gus Lynch', 'Mark Sivertsen', 'Rand Kennedy']","['resilience', 'injustice', 'empowerment']",Niki Caro
5150,5150,11210,Robinson Crusoe,1997-05-12,0,92,False,0,"Robinson Crusoe flees Britain on a ship after killing his friend over the love of Mary. A fierce ocean storm wrecks his ship and leaves him stranded by himself on an uncharted island. Left to fend for himself, Crusoe seeks out a tentative survival on the island, until he meets Friday, a tribesman whom he saves from being sacrificed. Initially, Crusoe is thrilled to finally have a friend, but he has to defend himself against the tribe who uses the island to sacrifice tribesman to their gods. During time their relationship changes from master-slave to a mutual respected friendship despite their difference in culture and religion.",17.023,/e494USnDTBxvo13rtf818eZguRe.jpg,"['Action', 'Adventure', 'Drama']","friendship, island, indigenous, shipwreck, survival, loneliness, cannibal, deserted island",1997,"['Pierce Brosnan', 'William Takaku', 'Polly Walker', 'Ian Hart', 'James Frain', 'Damian Lewis', 'Ben Robertson', 'Tim McMullan', 'Martin Grace', 'Sean Brosnan']","['isolation', 'survival', 'adaptation']",George T. Miller
5151,5151,38057,The Secret of the Magic Gourd,2007-06-29,0,85,False,0,"When schoolboy  Wang Bao discovers a magical gourd that can instantly grant his every wish, the awkward child suddenly becomes a hero amongst his curious classmates. When the gourd proves more of a burden than a blessing and the boy decides to get rid of it, he quickly discovers that's easier said than done.",17.023,/uwJilsNFXDpdI6UNd2IJgL3R2GN.jpg,"['Drama', 'Family', 'Fantasy']",,2007,"['Chen Pei-Si', 'Zhu Qilong', 'Zheng Jiahao', 'Guo Kaimin', 'He Qing', 'Meng Qian', 'Gigi Leung Wing-Kei', 'Sean Lau', 'Lao Yijia', 'Wang Jiakun']","['magic', 'gratitude', 'self-reliance']",
5152,5152,247849,Odnoklassniki.ru: The Magic Laptop,2013-12-12,0,104,False,0,An advertising creative in a rut finds his life turned upside down when he discovers his ability to write his wishes into reality.,17.016,/22sdR6QKMCsMjSFpWpTFPd9wQFa.jpg,"['Comedy', 'Romance']",,2013,"['Pyotr Fyodorov', 'Fyodor Bondarchuk', 'Snoop Dogg', 'Zhanna Friske', 'Sergey Druzyak', 'Mikhail Evlanov', 'Sergey Nikonenko', 'Aleksandr Revva', 'Yury Skulyabin', 'Olga Tumaykina', 'Semyon Strugachyov', 'Nikita Panfilov', 'Igor Jijikine', 'Yan Tsapnik', 'Kseniya Sobchak', 'Galina Urazova', 'Aleksandr Stepanov', 'Andrey Sergeev', 'Skoti Collins', 'Sergey Galakhov', 'Maxim Zhitnik', 'Sergey Styopin', 'Oleg Vereshchagin', 'Michael Idov', 'Igor Vernik', 'Aleksandr Katin', 'Timur Yunusov']","['fantasy', 'wish fulfillment', 'youth']",
5153,5153,11443,Dead Presidents,1995-10-06,24147179,119,False,10000000,On the streets they call cash dead presidents. And that's just what a Vietnam veteran is after when he returns home from the war only to find himself drawn into a life of crime. With the aid of his fellow vets he plans the ultimate heist -- a daring robbery of an armored car filled with unmarked U.S. currency!,17.014,/wRLepMZoUCwjLFb1WSbuUT6uVWR.jpg,"['Action', 'Crime']","vietnam, drug abuse, post-traumatic stress disorder (ptsd), war veteran, redemption, loss of virginity, heist, money, revolutinoary, mercy killing, armored truck, bronx, new york city, medic, 1960s",1995,"['Larenz Tate', 'Keith David', 'Chris Tucker', 'Freddy Rodríguez', 'Rose Jackson', ""N'Bushe Wright"", 'Clifton Powell', 'Terrence Howard', 'Bokeem Woodbine', 'Clifton Collins Jr.', 'Elizabeth Rodriguez', 'Michael Imperioli', 'Cheryl Freeman', 'James Pickens Jr.', 'Jenifer Lewis', 'Larry McCoy', 'Rodney Winfield', 'Sticky Fingaz', 'David Barry Gray', 'Jaimz Woolvett', 'Jean-Claude La Marre', 'Daniel Kruse', 'Bernard Telsey', 'Rik Colitti', 'Heather B.', 'Carlton Wilborn', 'Frank Albanese', 'Monti Sharp', 'Tony Sirico', 'Robert LuPone', 'Martin Sheen', 'Isaiah Washington', 'Chad Bonsack', 'Michael Carrara', 'Seymour Cassel', 'Danny Chung', 'Brian Donahue', 'Collin Fowler', 'Ryan Williams']","['anger', 'betrayal', 'struggle']",Albert Hughes
5154,5154,451997,The Merciless,2017-05-17,0,120,False,0,"Jae-ho, who aims to become the number one in a crime organization, gets to build up trust with Hyun-su, an ambitious newbie in the prison. While they try to take over the organization after the prison release, their ulterior motives starts to emerge.",17.014,/dMNGy8kfySmmNDHw3X4puqPIbx8.jpg,"['Action', 'Crime', 'Mystery']","prison, undercover, undercover cop, gang, bromance, neo-noir, prison release",2017,"['Sul Kyung-gu', 'Yim Si-wan', 'Kim Hee-won', 'Jeon Hye-jin', 'Lee Kyung-young', 'Moon Ji-yoon', 'Jang In-sub', 'Kim Ji-hoon', 'Kim Seung-o', 'Jin Sun-kyu', 'Huh Joon-ho', 'Shin So-yul', 'Kim Bo-mi', 'Lee Ru-ahn', 'Choi Byung-mo', 'Andreas Fronk', 'Lee Si-hoon', 'Choi Jun-young', 'Yoon Yeong-gyun', 'Lee Kyu-ho', 'Jeon Gwon-ha', 'Kim Ki-ho', 'Park Soo-young', 'Nam Kee-ae', 'Kim Ik-tae', 'Lee Ji-hoon', 'Go Bong-goo', 'Hong In', 'Lee Dong-Young', 'Jason Scott Nelson', 'Ju Ye-eun', 'Lee Dong-yong', 'Ryu Kee-san', 'Ko Dong-hyoung', 'Carson Allen', 'Park Kwang-jae', 'Kim Tae-jeong', 'Park Jun-hyuk', 'Yoon Young-kyun']","['loyalty', 'violence', 'betrayal']",Byun Sung-hyun
5155,5155,22171,Ms .45,1981-04-24,0,81,False,62000,"A shy and mute seamstress goes insane after being attacked and raped twice in one day. She wanders the New York streets at night in a sexy black dress with her attacker's gun strapped to her garter belt, blowing away any man who tries to pick her up.",17.011,/9ulPP8hcBjIrWRqeXsZVjL0uX3E.jpg,"['Crime', 'Thriller', 'Action']","new york city, rape, revenge, mute, killing spree, rape and revenge, revenge killing, meltdown, sex pest",1981,"['Zoë Lund', 'Albert Sinkys', 'Darlene Stuto', 'Abel Ferrara', 'Helen McGara', 'Editta Sherman', 'Stephen Singer', 'Jayne Kennedy', 'Jack Thibeau', 'Nike Zachmanoglou', 'Bogey', 'Peter Yellen', 'Vincent Gruppi', 'Stanley Timms', 'Faith Peters', 'Lawrence Zavaglia', 'Alex Jachno', 'Wayne Caro', 'Mariana Tripaldi', 'Scott Covert', ""Karen O'Shea"", 'The Kog', 'Cindy Green', 'Nancy Ulrich', 'Eddie Sanchez', 'Larry Chua', 'Omar Patino', 'Robert Allen', 'Daniel Goodine', 'Michael R. Chin', 'Gerri Igarashi', 'Eddie Eisele', 'Evelyn Smith', 'Patrick Loughran', 'Eileen Trotta', 'Bobby Weismann', 'Alvin Moore', 'Nicholas St. John', 'Steve Dash', 'Paul Varni', 'John Scarangella', 'Aris Sakellaridis', 'Ben Falk', 'Michael D. Minard', 'Robert North', 'Robert Fish', 'Harry Maurer', 'Beth Ann Lonergan', 'Kathleen Gati', 'Jerome Le Page', 'Renata Hickey', 'Peter Abbay']","['trauma', 'revenge', 'empowerment']",Abel Ferrara
5156,5156,103269,Superman vs. The Elite,2012-06-12,0,76,False,3500000,The Man of Steel finds himself outshone by a new team of ruthless superheroes who hold his idealism in contempt.,17.009,/kozJARWRoGHlOu6UVCdVPD4n8Jm.jpg,"['Science Fiction', 'Animation', 'Action']","england, superhero, cartoon, superhuman, super power, superhero team, the elite",2012,"['George Newbern', 'Pauley Perrette', 'Robin Atkin Downes', 'Dee Bradley Baker', 'Ogie Banks', 'Catero Colbert', 'Grey DeLisle', 'Melissa Disney', 'Paul Eiding', 'Troy Evans', 'Jennifer Hale', 'David Kaufman', 'Andrew Kishino', 'Pamela Kosh', 'Jeff Lapensee', 'Marcella Lentz-Pope', 'Dave B. Mitchell', 'Sumalee Montano', 'Laraine Newman', 'Nolan North', 'Henry Simmons', 'Stephen Stanton', 'Tara Strong', 'Fred Tatasciore', 'Bruce Timm', 'Julie Wittner', 'Rick Zieff']","['justice', 'violence', 'ideology']",Michael Chang
5157,5157,34653,A Single Man,2009-10-19,24964890,97,False,7000000,"The life of George Falconer, a British college professor, is reeling with the recent and sudden loss of his longtime partner. This traumatic event makes George challenge his own will to live as he seeks the console of his close girl friend Charley, who is struggling with her own questions about life.",17.004,/vhoM2LmcPlzcgBIztqqsSAYwaF7.jpg,"['Drama', 'Romance']","based on novel or book, suicidal, death of lover, teacher student relationship, grieving, 1960s, lgbt interest",2009,"['Colin Firth', 'Julianne Moore', 'Nicholas Hoult', 'Matthew Goode', 'Jon Kortajarena', 'Paulette Lamori', 'Ryan Simpkins', 'Ginnifer Goodwin', 'Teddy Sears', 'Paul Butler', 'Aaron Sanders', 'Aline Weber', 'Keri Lynn Pratt', 'Jenna Gavigan', 'Alicia Carr', 'Lee Pace', 'Adam Shapiro', 'Marlene Martinez', 'Ridge Canipe', 'Elisabeth Harnois', 'Erin Daniels', 'Nicole Steinwedell', 'Tricia Munford', 'Jon Hamm', 'Melissa Goodwin Shepherd']","['grief', 'loneliness', 'beauty']",Tom Ford
5158,5158,76758,The Flowers of War,2011-12-15,95311434,146,False,94000000,"A Westerner finds refuge with a group of women in a church during Japan's rape of Nanking in 1937. Posing as a priest, he attempts to lead the women to safety.",17.004,/pYltmnA1VDWl45EcVQoJYPsTpLW.jpg,"['Drama', 'History', 'War']","rape, based on novel or book, brothel, based on true story, atrocity, prostitution, forced prostitution, nanking massacre china 1937, japanese occupation of china",2011,"['Christian Bale', 'Ni Ni', 'Tong Dawei', 'Zhang Xinyi', 'Shigeo Kobayashi', 'Atsuro Watabe', 'Shawn Dou', 'Paul Schneider', 'Cao Kefan', 'Huang Tianyuan', 'Han Xiting', 'Zhang Doudou', 'Yuan Yangchunzi', 'Takashi Yamanaka', 'Huang Haibo', 'Su Xiaomei', 'Atsuji Matsuda', 'Sun Jia', 'Li Yuemin', 'Qi Dao']","['tragedy', 'sacrifice', 'war']",Zhang Yimou
5159,5159,264644,Room,2015-10-16,35401758,118,False,13000000,"Held captive for 7 years in an enclosed space, a woman and her young son finally gain their freedom, allowing the boy to experience the outside world for the first time.",17.002,/dIxoYFcj6EqD5KScuU8lWCftnvH.jpg,"['Drama', 'Thriller']","based on novel or book, escape, isolation, carpet, kidnapping, imprisonment, grandparents, hospital, dog, captive, children's perspectives, skylight, mother son relationship",2015,"['Brie Larson', 'Jacob Tremblay', 'Joan Allen', 'Sean Bridgers', 'Tom McCamus', 'William H. Macy', 'Cas Anvar', 'Amanda Brugel', 'Wendy Crewson', 'Joe Pingue', 'Sandy McMaster', 'Matt Gordon', 'Zarrin Darnell-Martin', 'Jee-Yun Lee', 'Randal Edwards', 'Justin Mader', 'Ola Sturik', 'Rodrigo Fernandez-Stoll', ""Rory O'Shea"", 'Kate Drummond', 'Jack Fulton', 'Chantelle Chung', 'Brad Wietersen', 'Graeme Potts', 'Katelyn Wells', 'Celeste Bruno', 'Megan Park']","['trauma', 'love', 'freedom']",Lenny Abrahamson
5160,5160,265177,Mommy,2014-09-19,3494070,138,False,4900000,"A peculiar neighbor offers hope to a recent widow who is struggling to raise a teenager who is unpredictable and, sometimes, violent.",16.999,/u5jbTMqze9U2nEhfFJmtDXxc89m.jpg,['Drama'],"canada, parent child relationship, karaoke, quebec, dysfunctional family, coming of age, single mother, juvenile delinquent, mental illness, dream sequence, institutionalization, oedipus complex, behavioral disorders, mother son relationship",2014,"['Anne Dorval', 'Suzanne Clément', 'Antoine Olivier Pilon', 'Patrick Huard', 'Alexandre Goyette', 'Michèle Lituac', 'Viviane Pacal', 'Natalie Hamel-Roy', 'Isabelle Nélisse', 'Ted Pluviose', 'Pierre-Yves Cardinal', 'Reda Guerinik', 'Justin Laramée', 'Sabrina Bisson', 'Huguette Gervais', 'Vincent Fafard', 'Jean-Philippe Baril Guérard', 'Dominic Desnoyers', 'Guenièvre Sandré', 'Isabeau Blanche', 'Catherine Brunet', 'Johanne Garneau', 'Michael Rudder', 'Robin-Joël Cool', 'Guillaume Laurin', 'Mathieu Dufresne', 'Stéphane Julien', 'Julie De Lafrenière', 'Sylvie Lemay', 'Danielle Lepine', 'Jeanne Roux-Coté', 'Rosalie Fortier', 'Steven Chevrin', 'Pierre-François Bouffard']","['bond', 'anger', 'struggle']",Xavier Dolan
5161,5161,44977,Dhoom 3,2013-12-19,91000000,171,False,19500000,"To avenge his father's death, a circus entertainer trained in magic and acrobatics turns thief to take down a corrupt bank in Chicago. Two cops from Mumbai are assigned to the case.",16.996,/rUVTM5EQUQ2I0fcfE46AkvBYWae.jpg,"['Action', 'Adventure', 'Crime', 'Thriller']","circus, bank robber, sequel, heist, bank heist, motorcycle chase",2013,"['Aamir Khan', 'Abhishek Bachchan', 'Katrina Kaif', 'Uday Chopra', 'Jackie Shroff', 'Tabrett Bethell', 'Andrew Bicknell', 'Riya Ray', 'Elizabeth Reiners', 'Jacqueline Scislowski', 'Kim DeJesus', 'Parth Suri', 'Michael L. Howard', 'Michael David Hammond', 'Madison Moran']","['revenge', 'spectacle', 'duality']",Vijay Krishna Acharya
5162,5162,11968,Into the Blue,2005-09-30,46117696,110,False,50000000,"When they take some friends on an extreme sport adventure, the last thing Jared and Sam expect to see below the shark-infested waters is a legendary pirate ship rumored to contain millions of dollars in gold. But their good fortune is short-lived, as a ruthless gang of criminals gets word of what they have uncovered.",16.996,/h5oXcjRu0EOiAxSxYuGq58897tu.jpg,"['Action', 'Thriller', 'Adventure', 'Crime']","treasure, airplane, diving, shipwreck, cocaine, shark attack, sailing, bahamas, treasure hunt, wrack, scuba diving, shark, scuba, adventurer",2005,"['Paul Walker', 'Jessica Alba', 'Scott Caan', 'Ashley Scott', 'Josh Brolin', 'James Frain', 'Dwayne Adway', 'Chris Taloa', 'Tyson Beckford', 'Gill Montie']","['adventure', 'greed', 'danger']",Lars P. Winther
5163,5163,1600,The Double Life of Véronique,1991-05-15,1999955,98,False,0,"Véronique is a beautiful young French woman who aspires to be a renowned singer; Weronika lives in Poland, has a similar career goal and looks identical to Véronique, though the two are not related. The film follows both women as they contend with the ups and downs of their individual lives, with Véronique embarking on an unusual romance with Alexandre Fabbri, a puppeteer who may be able to help her with her existential issues.",16.995,/oqRyO9xrNBRaxqF9pCHHgLuaATx.jpg,"['Drama', 'Mystery', 'Fantasy']","music teacher, kraków, poland, puppeteer, heart disease, fake identity, puppet, poland, chorus, doppelgänger, parallel lives, soprano, warsaw, poland, choral music, marionettes",1991,"['Irène Jacob', 'Halina Gryglaszewska', 'Philippe Volter', 'Guillaume de Tonquédec', 'Kalina Jędrusik', 'Aleksander Bardini', 'Władysław Kowalski', 'Jerzy Gudejko', 'Janusz Sterninski', 'Sandrine Dumas', 'Louis Ducreux', 'Claude Duneton', 'Lorraine Evanoff', 'Gilles Gaston-Dreyfus', 'Alain Frérot', 'Youssef Hamid', 'Thierry de Carbonnières', 'Chantal Neuwirth', 'Nausicaa Rampony', 'Bogusława Schubert', 'Jacques Potin']","['mystery', 'longing', 'identity']",Krzysztof Kieślowski
5164,5164,127560,The Railway Man,2013-12-02,24174885,116,False,18000000,"A victim from World War II's ""Death Railway"" sets out to find those responsible for his torture. A true story.",16.992,/yuADLCxGCA5rFWk2QDXvX5plBrD.jpg,"['Drama', 'History']","post-traumatic stress disorder (ptsd), world war ii, victim, redemption, based on true story, autobiography, revenge, torture",2013,"['Colin Firth', 'Nicole Kidman', 'Stellan Skarsgård', 'Jeremy Irvine', 'Hiroyuki Sanada', 'Tanroh Ishida', 'Michael MacKenzie', 'Jeffrey Daunton', 'Tom Stokes', 'Bryan Probets', 'Tom Hobbs', 'Sam Reid', 'Akos Armont', 'Takato Kitamoto', 'Keith Fleming', 'Ben Aldridge', 'Yutaka Izumihara', 'Louis Toshio Okada', 'Micheal Doonan', 'Shoota Tanahshi', 'Peter Tuinstra', 'Shogo Tanikawa', 'Ben Warren', 'Yasuhiko Miyauchi', 'Keiichi Enomoto', 'Masa Yamaguchi', 'Ewen Leslie', 'Shinji Ikefuji', 'Jack McTaggart', 'Sarah McVicar', 'Therese Bradley', 'Byron J. Brochmann', 'Marta Dusseldorp', 'Charlie Ruedpokanon', 'Kate Rutter', 'Inessa Kraft']","['trauma', 'forgiveness', 'war']",Jonathan Teplitzky
5165,5165,78428,Erotic Ghost Story II,1991-01-23,0,96,False,0,"Wutung a sex demon returns in another body where he falls for the mortal girl Hsiao-yen, but heaven thinks otherwise with the girl being burned at the stake and her soul being incarnated in the just born Fang Yu-yin. Anger fills Wutung, and to stop this vengeance the town near his lair promise to offer him a virgin girl at the end of every month to become his sex slave. Ya-Yin is selected; however her lover rescues her from the clutches of Wutung. So Wutung sends his demon concubine to get her back, and to cause havoc on the village for the interference.",16.992,/ighnU4PYk0AQDW9qkD64E5p4hRd.jpg,['Horror'],,1991,"['Anthony Wong', 'Charine Chan Ka-Ling', 'Kwok Yiu-Wah', 'Chik King-Man', 'Sayuri Ichijo', 'Tsang Siu-Yin', 'Amy Yip Chi-Mei', 'Man Siu', 'Wong Woon-Lok', 'Andy Kwong Ting-Wo', 'Naomi Hagio', 'Wong Mei-Guen']","['lust', 'fantasy', 'punishment']",Casey Chan Lai-Ying
5166,5166,39206,Detective Conan: Jolly Roger in the Deep Azure,2007-04-21,0,110,False,0,"The Isle of Koumi, a beautiful island in the Pacific Ocean. On the island, people pass an old legend down from generation to generation that there was the Seabed Palace, an ancient ruin at the bottom of the sea, where the treasure of 2 female pirates, Anne Bonnie & Mary Reed (who really existed 300 years ago), was left. When Conan and his friends visit Koumi Island while on vacation, they meet some treasure hunters. There was something suspicious about them.",16.989,/3qiBRbIsfpw6O32TfD1FZ81MiKw.jpg,"['Animation', 'Adventure']",,2007,"['Minami Takayama', 'Kappei Yamaguchi', 'Wakana Yamazaki', 'Naoko Matsui', 'Akira Kamiya', 'Kenichi Ogata', 'Megumi Hayashibara', 'Yukiko Iwai', 'Wataru Takagi', 'Ikue Otani', 'Chafurin', 'Kazuhiko Inoue', 'Atsuko Yuya', 'Kenyu Horiuchi', 'Jouji Nakata', 'Nobutoshi Canna', 'Takaya Kuroda', 'Makiko Ohmoto', 'Masayo Kurata', 'Minoru Inaba', 'Takanobu Hozumi']","['mystery', 'adventure', 'teamwork']",Yasuichiro Yamamoto
5167,5167,11087,The Hand that Rocks the Cradle,1992-01-10,88036683,110,False,11700000,"A suburban family chooses seemingly sweet Peyton Flanders as their newborn's nanny. Only much later does the infant's mother, Claire Bartel, realize Peyton's true intentions -- to destroy Claire and replace her in the family. The nail-biting suspense builds quickly in this chilling psychological thriller about deception and bitter revenge.",16.986,/1fBnyO3SbNBplck45js6O4pQaLw.jpg,"['Drama', 'Thriller']","rage and hate, loss of loved one, nanny, destroy, family's daily life, infant, childlessness, malice, desire to have children, child",1992,"['Annabella Sciorra', 'Rebecca De Mornay', 'Matt McCoy', 'Ernie Hudson', 'Madeline Zima', 'Julianne Moore', 'John de Lancie', 'Kevin Skousen', 'Mitchell Laurance', 'Jane Jones', 'Brian T. Finney', 'Julie Clemmons', 'Patrick Ryals', 'Charles Lucia', 'Rachel Glenn']","['revenge', 'deception', 'threat']",Curtis Hanson
5168,5168,261470,Sorry If I Call You Love,2014-06-20,0,105,False,0,"A successful, attractive, intelligent and brilliant advertising executive is longing to finally find emotional stability in his life, and decides to propose to his girlfriend. After she refuses his proposal, his life takes a turn when a new young lady enters his life.",16.984,/7RQdmFiEhb8zn5jmsLqdNnmepUE.jpg,"['Romance', 'Drama']","age difference, girlfriend, man woman relationship, love, relationship, boyfriend",2014,"['Paloma Bloyd', 'Daniele Liotti', 'Irene Montalà', 'Andrea Duro', 'Cristina Brondo', 'Jan Cornet', 'Pablo Chiapella', 'Joel Bosqued', 'Lucía Guerrero', 'Marina Gatell', 'Àlex Batllori', 'Adrià Collado', 'Olalla Moreno', 'Patricia Vico', 'Pep Munné', 'Oriol Vila', 'Mariona Ribas', 'Garazi Beloki', 'Àlex Maruny']","['romance', 'age gap', 'idealism']",Joaquín Llamas
5169,5169,38541,The Divide,2012-01-13,156362,112,False,3000000,"Survivors of a nuclear attack are grouped together for days in the basement of their apartment building, where fear and dwindling supplies wear away at their dynamic.",16.978,/hnwX5cUuzBDM0OWJB2UtnjkrHDm.jpg,"['Horror', 'Science Fiction', 'Thriller']","basement, septic tank, town in panic, welding, gunshot",2012,"['Lauren German', 'Michael Biehn', 'Milo Ventimiglia', 'Courtney B. Vance', 'Ashton Holmes', 'Rosanna Arquette', 'Iván González', 'Michael Eklund', 'Abbey Thickson', 'Jennifer Blanc']","['paranoia', 'fear', 'desperation']",Xavier Gens
5170,5170,13785,Best in Show,2000-09-29,0,90,False,0,"The tension is palpable, the excitement is mounting and the heady scent of competition is in the air as hundreds of eager contestants from across America prepare to take part in what is undoubtedly one of the greatest events of their lives -- the Mayflower Dog Show. The canine contestants and their owners are as wondrously diverse as the great country that has bred them.",16.977,/kVNaXzoX64YwLC99o4gXyKPnplS.jpg,['Comedy'],"philadelphia, pennsylvania, pet shop, illinois, poodle, mockumentary, dog, terrier, kimono, dog show, pets",2000,"['Bob Balaban', 'Jennifer Coolidge', 'Christopher Guest', 'John Michael Higgins', 'Michael Hitchcock', 'Eugene Levy', 'Jane Lynch', 'Michael McKean', ""Catherine O'Hara"", 'Parker Posey', 'Fred Willard', 'Ed Begley Jr.', 'Patrick Cranshaw', 'Linda Kash', 'Don Lake', 'Larry Miller', 'Jim Piddock', 'Jay Brazeau', 'Lewis Arquette', 'Dany Canino', 'Will Sasso', 'Stephen E. Miller', 'Colin Cunningham', 'Jehshua Barnes', 'Scott Williamson', 'Deborah Theaker', 'Rachael Harris', 'Fulvio Cecere', 'Cody Greg', 'Teryl Rothery', 'Tony Alcantar', 'Camille Sullivan', 'Dave Cameron', 'Lynda Boyd', 'Madeleine Kipling', 'Merrilyn Gann', 'Andrew Johnston', 'Malcolm Stewart', 'Jay-Lyn Green', 'Earlene Luke', 'Carmen Aguirre', 'Harold Pybus', 'Hiro Kanagawa', 'Cleo A. Laxton', 'Corrine Koslo', 'Andrew Wheeler', 'Don Emslie', 'Don S. Davis', 'Steven M. Porter', 'Melanie Angel', 'Doane Gregory', 'Carrie Aizley']","['absurdity', 'competition', 'eccentricity']",Tracy Young
5171,5171,214597,Fright Night 2: New Blood,2013-08-31,0,100,False,8000000,"By day Gerri Dandridge is a sexy professor, but by night she transforms into a real-life vampire with an unquenchable thirst for human blood. When a group of high school students travel abroad to study in Romania, they find themselves ensnared in her chilling web of lust and terror. Charlie and 'Evil' Ed must stop Gerri from drinking and bathing in the blood of a 'new moon virgin', who just so happens to be Charlie’s ex-girlfriend.",16.971,/cp2959zvia5B3wgsv4pOurHndvb.jpg,"['Horror', 'Comedy']","vampire, professor, vampire hunter (slayer), romania",2013,"['Will Payne', 'Sean Power', 'Sacha Parkinson', 'Chris Waller', 'Jaime Murray', 'John-Christian Bateman', 'Liana Margineanu', 'Alina Minzu', 'Adi Hostiuc', 'Joelle Coutinho', 'Ada Galeș', 'Constantin Bărbulescu', 'Catalin Banghea', 'Calin Andrei Razvan', 'Marius Chivu', 'Roxana Girleanu', 'Nicholas Lupu', 'Deliu Ionut', 'Andreea Mihalascu', 'Ana Maria Saragia', 'Costinel Lenghel', 'Banica Gheorghe', 'Mihai Verbintschi', 'Carmen Popa', 'Anastasia Pirogova', 'Dalila Poch', 'Ian Fisher']","['vampires', 'fear', 'seduction']",Eduardo Rodríguez
