,Unnamed: 0,id,title,release_date,revenue,runtime,adult,budget,overview,popularity,poster_path,genres,keywords,year,actors,emotions,director
5914,5914,44639,Inside Job,2010-10-08,7871522,109,False,2000000,"A film that exposes the shocking truth behind the economic crisis of 2008. The global financial meltdown, at a cost of over $20 trillion, resulted in millions of people losing their homes and jobs. Through extensive research and interviews with major financial insiders, politicians and journalists, Inside Job traces the rise of a rogue industry and unveils the corrosive relationships which have corrupted politics, regulation and academia.",15.381,/8fy2LWdZhfoM4xZ9QbHkjSpGjPX.jpg,['Documentary'],"banker, corruption, capitalism, globalization, bank, crisis, fraud, banking, wall street, global economy, finances, money, economics, financial crisis, stock market, corporation",2010,"['Matt Damon', 'William Ackman', 'Barack Obama', 'George W. Bush', 'Jonathan Alpert', 'Christine Lagarde', 'Ann Curry', 'Daniel Alpert', 'Sigridur Benediktsdottir', 'Gylfi Zoega', 'Andri Snær Magnason', 'Paul Volcker', 'Dominique Strauss-Kahn', 'George Soros', 'Barney Frank', 'Scott Talbott', 'Andrew Sheng', 'Lee Hsien Loong', 'Gillian Tett', 'Nouriel Roubini', 'R. Glenn Hubbard', 'Eliot Spitzer', 'Samuel Hayes', 'Charles Morris', 'Robert Gnaizda', 'Willem Buiter', 'Andrew Lo', 'Michael Greenberger', 'Satyajit Das', 'Frank Partnoy', 'Eric Halperin', 'Martin Wolf', 'Kenneth Rogoff', 'Raghuram Rajan', 'Lawrence McDonald', 'Harvey Miller', 'Kristin Davis', 'Allan Sloan', 'Jerome Fons', 'Frederic Mishkin', 'David McCormick']","['anger', 'shock', 'betrayal']",Charles Ferguson
5915,5915,138038,Girl vs. Monster,2012-10-12,0,89,False,0,Skylar finds out that her parents are monster hunters after she accidentally releases some monsters from a secret containment chamber; so she and her techno friends must recapture all the monsters and also save her mom and dad from these monsters who are out for revenge.,15.381,/9CMRe7lE9bZxgz9cEwkPHmF8yc3.jpg,"['Family', 'Comedy', 'Science Fiction', 'TV Movie']","monster, halloween, teen movie, fighting supernatural",2012,"['Olivia Holt', 'Jennifer Aspen', 'Kerris Dorsey', 'Katherine McNamara', 'Tracy Dawson', 'Brendan Meyer', 'Luke Benward', 'Brian Palermo', 'Adam Chambers', 'Latonya Williams', 'Genea Charpentier']","['courage', 'fun', 'self-discovery']",Stuart Gillard
5916,5916,24556,The Land Before Time XI: Invasion of the Tinysauruses,2005-01-11,0,82,False,0,"Littlefoot and his friends return in another adventure. But this time, they aren't the smallest dinosaurs in the valley anymore.",15.379,/2HjewVsAHjizJTmJ8L69f5Qir12.jpg,"['Animation', 'Family', 'Fantasy', 'Adventure']","family relationships, dinosaur",2005,"['Aaron Spann', 'Jeff Bennett', 'Aria Noelle Curzon', 'Anndi McAfee', 'Rob Paulsen', 'John Ingle', 'Michael Clarke Duncan', 'Miriam Flynn', 'Kenneth Mars', 'Nika Futterman', 'Leigh Kelly', 'Tress MacNeille', 'Camryn Manheim', 'Ashley Rose Orr', 'Cree Summer', 'Frank Welker']","['friendship', 'jealousy', 'forgiveness']",Charles Grosvenor
5917,5917,4415,Les Misérables,1998-05-01,14096321,134,False,0,"Jean Valjean, a Frenchman imprisoned for stealing bread, must flee a police officer named Javert. The pursuit consumes both men's lives, and soon Valjean finds himself in the midst of the student revolutions in France.",15.379,/3TOgmlIY8X3WjIjvU7Z0jqeNkyU.jpg,"['Crime', 'Drama', 'History', 'Romance']","prisoner, paris, france, based on novel or book, falsely accused, blackmail, french revolution, motherly love, 19th century, altruism",1998,"['Liam Neeson', 'Tim Barlow', 'Geoffrey Rush', 'Uma Thurman', 'Claire Danes', 'Hans Matheson', 'Peter Vaughan', 'Jon Kenny', 'Gillian Hanna', 'Silvie Koblížková', 'Mimi Newman', 'Ian Cregg', 'Shane Hervey', 'Lennie James', 'Julian Rhind-Tutt', 'Kelly Hunter', 'Toby Jones', 'Alex Norton', 'Edward Tudor-Pole', 'Kathleen Byron', 'Patsy Byrne', 'Václav Chalupa', 'Ben Crompton', 'Paola Dionisotti', 'Edna Doré', 'Tony Vogel', 'James Saxon']","['justice', 'revolution', 'hope']",Bille August
5918,5918,8409,A Man Apart,2003-04-04,44350926,109,False,36000000,"When Vetter's wife is killed in a botched hit organized by Diablo, he seeks revenge against those responsible. But in the process, Vetter and Hicks have to fight their way up the chain to get to Diablo but it's easier said than done when all Vetter can focus on is revenge.",15.373,/z0JUBNk4BTBmeMOudrRH9GnOmK0.jpg,"['Action', 'Drama']","loss of loved one, repayment, arbitrary law, cop",2003,"['Vin Diesel', 'Larenz Tate', 'Timothy Olyphant', 'Geno Silva', 'Jacqueline Obradors', 'Steve Eastin', 'Juan Fernández', 'Jeff Kober', 'Marco Rodríguez', 'Mike Moroff', 'Emilio Rivera', 'George Sharperson', 'Malieek Straughter', 'Alice Amter', 'Jim Boeke', 'April Flowers', 'Terri Hoyos', 'Julia Lee', 'Thomas Kopache', 'Karrine Steffans', 'Rachel Sterling', 'Sonia Enriquez', 'Kristin Eckert', 'Cristina LaMonica', 'Laura Salem', 'Elizabeth Álvarez', 'Brooke Lewis Bellas', 'Joe Rodriguez', 'Maria Arcé', 'Ken Davitian', 'Roslyn Bezanilla', 'Ray Conchado', 'Michael Papajohn']","['revenge', 'grief', 'action']",F. Gary Gray
5919,5919,11543,Kingpin,1996-07-04,25023434,114,False,27000000,"After bowler Roy Munson swindles the wrong crowd and is left with a hook for a hand, he settles into impoverished obscurity. That is, until he uncovers the next big thing: an Amish kid named Ishmael. So, the corrupt and the hopelessly naive hit the circuit intent on settling an old score with Big Ern.",15.37,/cT3vdSxcEOTHPf99sbopWt7rdHa.jpg,['Comedy'],"sports, stripper, handicap, sexual favor, star spangled banner, bowling team, hair loss, comb over, inflatable doll, combover, unlikely lovers, kingpin, carriage, lancaster, pa",1996,"['Woody Harrelson', 'Randy Quaid', 'Vanessa Angel', 'Bill Murray', 'Chris Elliott', 'William Jordan', 'Nancy Frey-Jarecki', 'Richard Tyson', 'Lin Shaye', 'Zen Gesner', 'Prudence Wright Holmes', 'Rob Moran', 'Daniel Greene', 'Will Rothhaar', 'Mark Charpentier', 'Brad Faxon', 'Sayed Badreya', 'Linda Carola', 'Danny Murphy', 'David Shackelford', 'Rick Barker', 'Gretchen Treser', 'Willie Garson', 'Googy Gress', 'Suzan Hughes', 'Michael Corrente', 'Herbie Flynn', 'Hank Brandt', 'Libby Langdon', 'Liza Oxnard', 'Lorri Bagley', 'Steve Tyler', 'Nancy Farrelly', 'Cynthia Farrelly Gesner', 'Morganna', ""Victoria Scott D'Angelo"", 'Jonathan Richman', 'Lou Consolo']","['humor', 'desperation', 'redemption']",Bobby Farrelly
5920,5920,9763,Goal!,2005-09-29,27610873,118,False,10000000,"Like millions of kids around the world, Santiago harbors the dream of being a professional footballer... However, living in the Barrios section of Los Angeles, he thinks it is only that--a dream. Until one day an extraordinary turn of events has him trying out for Premiership club Newcastle United.",15.368,/9YZhJGoIbJtrjDYbENGhR6f6SZE.jpg,['Drama'],"sports, restaurant, coach, football (soccer), computer game",2005,"['Kuno Becker', 'Alessandro Nivola', 'Anna Friel', 'Stephen Dillane', 'Gary Lewis', ""Kieran O'Brien"", 'Sean Pertwee', 'Marcel Iureș', 'Tony Plana', 'Miriam Colon', 'Kate Tomlinson', 'Emma Field-Rayner', 'Zachary Johnson', 'Frances Barber', 'Kevin Knapman', 'Nicholas Lumley', 'Christopher Fairbank', 'Stephen Graham', 'Leslie Randall', 'Steven Gerrard', 'David Beckham', 'Donald Li', 'Alfredo Rodríguez', 'Herman Chavez', 'Jonathan Hernandez', 'Jorge Cervera', 'Leonardo Guerra', 'Zinédine Zidane', 'Martin Tyler']","['ambition', 'inspiration', 'struggle']",Danny Cannon
5921,5921,244506,Camp X-Ray,2014-10-17,59744,117,False,1000000,"A young woman joins the military to be part of something bigger than herself and her small-town roots. Instead, she ends up as a new guard at Guantanamo Bay, where her mission is far from black and white. Surrounded by hostile jihadists and aggressive squadmates, she strikes up an unusual friendship with one of the detainees.",15.367,/aqNzRiaEsfv567Ji9njJofblRBE.jpg,['Drama'],"military officer, guantanamo bay, female soldier, female protagonist, american abroad, military police, military, unlikely friendship, detainee, female",2014,"['Kristen Stewart', 'Payman Maadi', 'Lane Garrison', 'J. J. Soria', 'John Carroll Lynch', 'Julia Duffy', 'Cory Michael Smith', 'Nawal Bengholam', 'Tara Holt', 'Yousuf Azami', 'Marco Khan', 'Robert Tarpinian', 'Kyle Bornheimer', 'Holli Dean', 'Jennae Hoving', 'Ladell Preston', 'Daniel Leavitt']","['empathy', 'isolation', 'conscience']",Peter Sattler
5922,5922,10664,[REC]²,2009-09-15,18469680,84,False,5600000,"The action continues from [REC], with the medical officer and a SWAT team outfitted with video cameras are sent into the sealed off apartment to control the situation.",15.362,/i7wr12YmZfJxXv2R6ksvSffyhAT.jpg,"['Thriller', 'Horror']","religion and supernatural, blood sample, occult, gas mask, night vision, freezer, found footage",2009,"['Manuela Velasco', 'Jonathan D. Mellor', 'Óscar Zafra', 'Ariel Casas', 'Alejandro Casaseca', 'Pablo Rosso', 'Rafa Parra', 'Pep Molina', 'Andrea Ros', 'Àlex Batllori', 'Pau Poch', 'Juli Fàbregas', 'Ferrán Terraza', 'Claudia Silva', 'Martha Carbonell', 'Jorge-Yamam Serrano', 'Ana Isabel Velásquez', 'Carlos Lasarte', 'Kao Chenmin', 'Akemi Goto', 'David Vert', 'Carlos Olalla', 'Anna García Cuartero', 'Héctor Vidales', 'Lazzaro E. Oertli Ortiz', 'Alex Lameiro Blanch', 'Joan Hostench Martínez', 'Oscar Foronda', 'Javier Botet', 'Paco Plaza', 'Jaume Balagueró', 'Laura Díez Mora', 'Pere Vall', 'Marga Villalonga', 'Gerard Espert']","['terror', 'claustrophobia', 'supernatural']",Paco Plaza
5923,5923,11884,The Last Starfighter,1984-07-13,28733290,101,False,15000000,A video game expert Alex Rogan finds himself transported to another planet after conquering The Last Starfighter video game only to find out it was just a test. He was recruited to join the team of best Starfighters to defend their world from the attack.,15.361,/an1H0DPADLDlEsiUy8vE9AWqrhm.jpg,"['Adventure', 'Science Fiction', 'Action']","android, flying car, space marine, trailer park, laser gun, shapeshifting, fighter pilot, games, alien, 1980s, arcade game, universal translator",1984,"['Lance Guest', 'Robert Preston', 'Chris Hebert', 'Kay E. Kuter', 'Dan Mason', ""Dan O'Herlihy"", 'Catherine Mary Stewart', 'Barbara Bosson', 'Norman Snow', ""John O'Leary"", 'George McDaniel', 'Charlene Nelson', 'John Maio', 'Robert Starr', 'Al Berry', 'Wil Wheaton', 'Marc Alaimo', 'Vernon Washington', 'Bunny Summers', 'Peggy Pope', 'Peter Nelson', 'Suzanne Snyder', 'Meg Wyllie']","['wonder', 'destiny', 'heroism']",Faye Brenner
5924,5924,88852,Amon Saga,1986-07-18,0,80,False,0,"Set in a world of fantasy and adventure, Amon is a young warrior embarking on a quest to avenge the death of his mother. When the hunt leads him ultimately to the kingdom of Valhiss, Amon enlists in the ranks of the Emperor's army in order to gain an opportunity to exact his revenge. However, a chance encounter with the Princess Lichia, being held captive by the Emperor in an effort to ransom a map away from his main rival, King Darai-Sem, Amon must decide whether to follow his path of revenge or to help rescue the Princess in an effort to save a lost kingdom.",15.361,/2n86GPjcd51wMNgGJj7dwCJhG4a.jpg,"['Animation', 'Fantasy', 'Adventure', 'Action', 'Drama']","swordplay, historical, seinen, anime",1986,"['Kenyu Horiuchi', 'Banjo Ginga', 'Mugihito', 'Koji Toya', 'Yoshino Takamori', 'Ichiro Nagai', 'Kiyoshi Kobayashi']","['revenge', 'fantasy', 'adventure']",Shunji Ôga
5925,5925,1365,Monster's Ball,2001-06-07,44909486,113,False,4000000,A prison guard begins a tentative romance with the unsuspecting widow of a man whose execution he presided over.,15.357,/rPhs7Mw4ql2CotjxDCwUs5PBPxo.jpg,"['Drama', 'Romance']","new love, ethnic stereotype, waitress, unsociability, overweight child, parent child relationship, southern usa, loss of loved one, interracial relationship, electric chair, xenophobia",2001,"['Billy Bob Thornton', 'Heath Ledger', 'Halle Berry', 'Sean Combs', 'Yasiin Bey', 'Will Rokos', 'Milo Addica', 'Coronji Calhoun', 'Peter Boyle', 'Taylor Simpson', 'Gabrielle Witcher', 'Amber Rules', 'Charles Cowan Jr.', 'Taylor LaGrange', 'Anthony Bean', 'Francine Segal', 'John McConnell', 'Marcus Lyle Brown', 'Leah Loftin', 'Larry Lee', 'Troy Poret', 'Paul Smith', 'Marshall Cain', 'Anthony Michael Frederick', 'John Wilmot', 'Dennis Clements', 'Stephanie Claire', 'James Haven', 'Ritchie Montgomery', 'Clara Hopkins Daniels', 'Carol Sutton', 'Bernard Johnson']","['grief', 'intimacy', 'redemption']",Marc Forster
5926,5926,293670,The Wailing,2016-05-12,49851770,156,False,10951000,A stranger arrives in a little village and soon after a mysterious sickness starts spreading. A policeman is drawn into the incident and is forced to solve the mystery in order to save his daughter.,15.353,/aXlL7yYwpXInhltamtzKQFBG08G.jpg,"['Horror', 'Mystery']","daughter, small town, police, investigation, exorcism, possession, murder, priest, rural area, curse, shaman, zombie, demon, shrine, macabre, ghost, gluttony, folk horror, grim, acupuncture, divination, anxious, distressing, frightened",2016,"['Kwak Do-won', 'Hwang Jung-min', 'Chun Woo-hee', 'Jun Kunimura', 'Kim Hwan-hee', 'Heo Jin', 'Jang So-yeon', 'Kim Do-yoon', 'Jo Han-chul', 'Son Kang-gook', 'Park Seong-yeon', 'Bae Yong-geun', 'Kim Ki-cheon', 'Yoo Soon-woong', 'Lee Yong-nyeo', 'Hwang Seok-jeong', 'Moon Chang-gil', 'Lee Jung-eun', 'Jeon Bae-soo', 'Song Min-seok', 'Jo Yeon-hee', 'Lee Sun-hee', 'Kim Chun-gi', 'Kim Ah-ra']","['horror', 'mystery', 'despair']",Na Hong-jin
5927,5927,21309,River's Edge,1986-08-27,0,100,False,19000000,"A group of high-school friends must come to terms with the fact that one of them, Samson, killed another, Jamie. Faced with the brutality of death, each must decide whether to turn their friend in to the police, or to help him escape the consequences of his dreadful deed.",15.351,/bT68aKa9d7zDF7Z8MaskbWBRqzb.jpg,"['Thriller', 'Drama', 'Crime']","police, friends, murder",1986,"['Crispin Glover', 'Keanu Reeves', 'Ione Skye', 'Roxana Zal', 'Daniel Roebuck', 'Dennis Hopper', 'Joshua John Miller', 'Tom Bower', 'Danyi Deats', 'Constance Forslund', 'Leo Rossi', 'Phillip Brock', 'Josh Richman', 'Jim Metzler', 'Tammy L. Smith', 'Yuzo Nishihara', 'Taylor Negron', 'Christopher Peters', 'Richard Richcreek', 'Maeve Odum', ""Francis De L'Etanche du Bois"", 'Michael Hungerford', 'James Terry']","['alienation', 'nihilism', 'confusion']",Tim Hunter
5928,5928,14325,The Express,2008-10-10,9793496,130,False,40000000,"Based on the incredible true story, The Express follows the inspirational life of college football hero Ernie Davis, the first African-American to win the Heisman Trophy.",15.35,/l4bOPaxwx1WebQXTeqXzXwf9n3M.jpg,['Drama'],"sports, american football, college, biography, syracuse university",2008,"['Rob Brown', 'Dennis Quaid', 'Darrin Henson', 'Omar Benson Miller', 'Nelsan Ellis', 'Charles S. Dutton', 'Justin Martin', 'Justin Jones', 'Nicole Beharie', 'Aunjanue Ellis-Taylor', 'Elizabeth Shivers', 'Clancy Brown', 'Danny McCarthy', 'Regina Hoyles', 'Chelcie Ross', 'Saul Rubinek', 'Craig Hawksley', 'Jeff Still', 'Geoff Stults', 'Derek Graf', 'Evan Jones', 'Maximilian Osinski', 'Enver Gjokaj', 'LaRoyce Hawkins', 'Lucas Ellman', 'Josh Odor', 'Matt Trissel', 'Chad L. Stevens', 'Keir Thirus', 'Chaz Black', 'Garth Gelker', 'David Darlow', 'Michael Skewes', 'Gary Houston', 'Ned Schmidtke', 'Keith Kupferer', 'Christopher Sullivan', 'Aaron Roman Weiner', 'Tim Grimm', 'Matthew Settle', 'Stu Lisson', 'Lance Baker', 'Christian Stolte', 'Mike Bradecich', 'Chris Farrell', 'Doug James', 'Ron Hawking', 'Linara Washington', 'Chadwick Boseman', 'Kevin R. Kelly', 'Bruce Jarchow', 'Ridge Canipe', 'Stephen Louis Grush', 'Louie Cesario', 'Paul Turner', 'Rick Uecker', 'Kris Wolff', 'Jeffrey Zabrin', 'Darryl Warren', 'Brian Mahoney', 'Philip Rayburn Smith', 'Laurie Larson', 'Will Zahrn', 'Phillip Edward Van Lear', 'Michael Hargrove', 'F. David Roth', 'Richard Henzel', 'Howie Johnson', 'James Anthony Zoccoli', 'Eddie Bo Smith Jr.', 'Jeff Christian', 'Victor Cole', 'William Dick', 'Sam Derence', 'Brian Boland', 'Walker Howard', 'Leonard House', 'Allan Graf', 'Kevin Stark', 'Kurt Naebig', 'Ernest Perry Jr.', 'Ed Smaron', 'Dan Flannery', 'Chet Coppock', 'Robert Cullent', 'Guy Klinzing', 'Barry Tolli', 'Chris Cowan', 'Michael Malczyk', 'Torrey Vogel', 'Kenya Drew', 'John Anderson', 'Jeff Welsh', 'Michael Labus', 'Mike Ullrich', 'Lonnie Brooks', 'Angelina Lyubomirova', 'Jimmy Styx']","['racism', 'triumph', 'inspiration']",Gary Fleder
5929,5929,84348,V/H/S,2012-07-28,100345,116,False,0,"When a group of misfits is hired by an unknown third party to burglarize a desolate house and acquire one rare VHS tape, they discover more found footage than they had bargained for.",15.346,/xVGfCaTwVdZt3lFqtOVhTDqmG58.jpg,"['Thriller', 'Horror']","webcam, anthology, burglary, vhs, handheld camera, found footage, vcr",2012,"['Calvin Lee Reeder', 'Lane Hughes', 'Kentucker Audley', 'Adam Wingard', 'Simon Barrett', 'Andrew Droz Palermo', 'Joe Swanberg', 'Sophia Takal', 'Kate Lyn Sheil', 'Hannah Fierman', 'Mike Donlan', 'Joe Sykes', 'Drew Sawyer', 'Jasper Lewis', 'Nicholas Tecosky', 'Lisa Marie Thomas', 'Rob Mosca', 'Chad Villella', 'Matt Bettinelli-Olpin', 'Tyler Gillett', 'Paul Natonek', 'Nicole Erb', 'John Walcutt', 'Bilal Mir', 'Damion Stephens', 'Koz McRae', 'Eric Curtis', 'Nicole Boccumini', 'Melinda Fleming', 'Drew Moerlein', 'Jason Yachanin', 'Norma C. Quinones', 'Glenn McQuaid', 'Liz Harvey', 'Helen Rogers', 'Daniel Kaufman']","['terror', 'shock', 'disturbance']",David Bruckner
5930,5930,11158,"Honey, I Blew Up the Kid",1992-07-16,58662452,89,False,40000000,"Wayne Szalinski is at it again. But instead of shrinking things, he tries to make a machine that can make things grow. As in the first one, his machine isn't quite accurate. But when he brings Nick & his toddler son Adam to see his invention, the machine unexpectedly starts working. And when Adam comes right up to the machine, he gets zapped along with his stuffed bunny.",15.343,/iLWZJAIcSqthsmJ3pMbtiE9Ap6N.jpg,"['Adventure', 'Comedy', 'Family', 'Science Fiction']","inventor, becoming an adult, infant, family",1992,"['Rick Moranis', 'Marcia Strassman', 'Robert Oliveri', 'Daniel Shalikar', 'Joshua Shalikar', 'Lloyd Bridges', 'John Shea', 'Keri Russell', 'Ron Canada', ""Amy O'Neill"", 'Michael Milhoan', 'Gregory Sierra', 'Leslie Neale', 'Julia Sweeney', 'Linda Carlson', 'Lisa Mende', 'John Paragon', 'Kenneth Tobey', 'Bill Moseley', 'Edward S. Feldman', 'Suzanne Kent', 'Alex Daniels', 'Robert Jaffe', 'Ron Lawrence', 'John Hora', 'Mary Ellen Moore', 'Randy Swallow', 'Pamela Cederquist', 'James M. Lauten', 'Shannon M. Steger', 'Minori Goto', 'Mamoru Kanal', 'Gregory McCurdy', 'David Scates', 'Marion Palmer', 'Kathy Pastor', 'Bill Loska', 'Richard Simmons']","['chaos', 'family', 'absurdity']",Randal Kleiser
5931,5931,1909,Don Juan DeMarco,1994-10-12,68792531,97,False,25000000,"John Arnold DeMarco is a man who believes he is Don Juan, the greatest lover in the world. Clad in a cape and mask, DeMarco undergoes psychiatric treatment with Dr. Jack Mickler to cure him of his apparent delusion. But the psychiatric sessions have an unexpected effect on the psychiatric staff and, most profoundly, Dr Mickler, who rekindles the romance in his complacent marriage.",15.343,/fe0TuYz9jCKUba2Omj48K8bWJ8z.jpg,"['Romance', 'Drama', 'Comedy']","sex addiction, love, mental institution, patient, psychiatrist, don juan",1994,"['Johnny Depp', 'Marlon Brando', 'Faye Dunaway', 'Géraldine Pailhas', 'Bob Dishy', 'Rachel Ticotin', 'Talisa Soto', 'Stephen Singer', 'Jo Champa', 'Marita Geraghty', 'Richard C. Sarafian', 'Tresa Hughes', 'Carmen Argenziano', 'Tommy Lister Jr.', 'Selena Quintanilla', 'Gilbert Lewis', 'Franc Luz', 'Lorenzo Caccialanza', 'Mark Winn']","['romance', 'delusion', 'charm']",Francis Ford Coppola
5932,5932,9722,Bewitched,2005-06-21,131426169,102,False,85000000,"Thinking he can overshadow an unknown actress in the part, an egocentric actor unknowingly gets a witch cast in an upcoming television remake of the classic show ""Bewitched"".",15.342,/bQqHksFAeUdozGGABxHJt3YVIyA.jpg,"['Comedy', 'Fantasy', 'Romance']","witch, enchantment, falling in love, woman director",2005,"['Nicole Kidman', 'Will Ferrell', 'Shirley MacLaine', 'Michael Caine', 'Jason Schwartzman', 'Kristin Chenoweth', 'Heather Burns', 'Jim Turner', 'Stephen Colbert', 'David Alan Grier', 'Michael Badalucco', 'Carole Shelley', 'Steve Carell', 'Katie Finneran', 'James Lipton', ""Conan O'Brien"", 'Amy Sedaris', 'Richard Kind', 'Ken Hudson Campbell', 'P.J. Byrne', 'Carole Androsky', 'Annie Mumolo', 'Andrew Friedman', 'Clay Bravo', 'Heather Maristella', 'Jonathan T. Floyd', 'Ed McMahon', 'Alison MacInnis', 'Bridget Brno', 'Dana Daurey', 'Dorie Barton', 'Katie Carroll', 'Jennifer Elise Cox', 'Laura Sorenson', 'Brittany Krall', 'Dawn Ashley Cook', 'Julia Decker', 'Jennifer Hall', 'Roxanne Beckford', 'Hugh Davidson', 'Joe Zymblosky', 'J.J. Sacha', 'Susan Chuang', 'Jordan Black', 'Mo Rocca', 'Jason George', 'Wendi McLendon-Covey', 'Julie Claire', 'Terry Savage', 'Dianne Dreyer', 'Kate Walsh', 'Valerie Azlynn', 'Jarrad Paul', 'Victor Williams', 'Liesel Staubitz', 'Ruby Rose Skotchdopole', 'Molly Gordon', 'Nick Lachey', 'Abbey DiGregorio', 'Dick York', 'Amelinda Embry', 'Jessica Mathews']","['magic', 'humor', 'romance']",Dianne Dreyer
5933,5933,47951,The Adventures of Milo and Otis,1986-06-27,13299749,76,False,7520000,"When Milo the cat and Otis the dog are separated, they each set off on an adventurous and often perilous quest across mountains, plains, and snow-covered lands to reunite with one another.",15.34,/1RrJIOUg0aLhO6h84RK6tTj49f1.jpg,"['Adventure', 'Drama', 'Family']","fight, pig, cat, chicken, barn, milk, survival, dog, pets",1986,"['Dudley Moore', 'Kyoko Koizumi', 'Shigeru Tsuyuki', 'Chatran', 'Pû']","['friendship', 'wonder', 'innocence']",Masanori Hata
5934,5934,873,The Color Purple,1985-12-18,146292000,154,False,15000000,"An epic tale spanning forty years in the life of Celie, an African-American woman living in the South who survives incredible abuse and bigotry. After Celie's abusive father marries her off to the equally debasing 'Mister' Albert Johnson, things go from bad to worse, leaving Celie to find companionship anywhere she can. She perseveres, holding on to her dream of one day being reunited with her sister in Africa.",15.337,/mHKrzeBR4SBzc9g4hT9ncIAvM4E.jpg,"['Drama', 'History']","prison, rape, sibling relationship, jazz, southern usa, africa, black people, empowerment, adoption, violent father, violent husband, jazz singer or musician, letter, incest",1985,"['Danny Glover', 'Whoopi Goldberg', 'Margaret Avery', 'Oprah Winfrey', 'Willard E. Pugh', 'Akosua Busia', 'Desreta Jackson', 'Adolph Caesar', 'Rae Dawn Chong', 'Dana Ivey', 'Leonard Jackson', 'Bennet Guillory', 'John Patton Jr.', 'Carl Anderson', 'Susan Beaubian', 'James Tillis', 'Phillip Strong', 'Laurence Fishburne', 'Peto Kinsaka', 'Lelo Masamba', 'Margaret Freeman', 'Howard Starr', 'Daphaine Oliver', 'Jadili Johnson', 'Lillian Njoki Distefano', 'Donna Buie', 'Leon Rippy', 'John R. Hart', 'David Thomas', 'Carrie Murphy', 'Juliet Poe', 'Katie Simon', 'Ethel Taylor', 'Marcus Covington', 'Marcus Liles', 'April Myers', 'Maurice Moore', 'Lechanda Latharp', 'Drew Bundini Brown', 'Arnold F. Turner', 'Jeris Poindexter', 'Hawthorne James', 'Sonny Terry', 'Greg Phillinganes', 'Roy Gaines', 'Paulinho da Costa', 'Nana Yaw Asiedu', 'Clarence Avant', 'Bayo Martin', 'Ndugu Chandler', 'Jeffrey Kwashi', 'Pete Munzhi', 'Aniijia Rae Schockley', 'Maria Howell', 'Gayle King']","['abuse', 'resilience', 'sisterhood']",Steven Spielberg
5935,5935,12236,Speed Zone,1989-04-21,3077361,94,False,18000000,"An illegal race that takes place over the United States and nothing will stop this bunch of racers except for the occasional cop or a damsel in distress. Jackie Chan's car is not in this one, but many new cars make up for that. Who will win? Who will crash? Who will not even finish? Sit down and buckle up for the ride of your life.",15.335,/cmAgnjrH7TlKjYUpS9NMGMlbkre.jpg,"['Comedy', 'Action']","car race, sports, illegality, cannonball, capture, starting over",1989,"['John Candy', 'Donna Dixon', 'Matt Frewer', 'Joe Flaherty', 'Tim Matheson', 'Mimi Kuzyk', 'Melody Anderson', 'Shari Belafonte', 'Brian George', 'Art Hindle', 'Dick Smothers', 'Tom Smothers', 'Peter Boyle', 'Eugene Levy', 'John Schneider', 'Jamie Farr', 'Don Lake', 'Alyssa Milano', 'Brooke Shields', 'Michael Spinks', 'Lee Van Cleef', 'Harvey Atkin', 'Louis Del Grande', 'Carl Lewis']","['absurdity', 'racing', 'humor']",Jim Drake
