,Unnamed: 0,id,title,release_date,revenue,runtime,adult,budget,overview,popularity,poster_path,genres,keywords,year,actors,emotions,director
5713,5713,13310,Let the Right One In,2008-10-24,10785801,114,False,4000000,"Set in 1982 in the suburb of Blackeberg, Stockholm, twelve-year-old Oskar is a lonely outsider, bullied at school by his classmates; at home, Oskar dreams of revenge against a trio of bullies. He befriends his twelve-year-old, next-door neighbor Eli, who only appears at night in the snow-covered playground outside their building.",15.833,/4hezTKTuZMp0l2ufihKwPgLmfLg.jpg,"['Horror', 'Drama']","based on novel or book, vampire, sweden, bullying, castration, bully, child vampire, murder, androgyny, new neighbor, young love",2008,"['Kåre Hedebrant', 'Lina Leandersson', 'Per Ragnar', 'Henrik Dahl', 'Karin Bergquist', 'Peter Carlberg', 'Ika Nord', 'Mikael Rahm', 'Karl-Robert Lindgren', 'Anders T. Peedu', 'Pale Olofsson', 'Cayetano Ruiz', 'Patrik Rydmark', 'Johan Sömnes', 'Mikael Erhardsson', 'Rasmus Luthander', 'Sören Källstigen', 'Malin Cederblad', 'Bernt Östman', 'Kajsa Linderholm', 'Adam Stone', 'Ingemar Raukola', 'Kent Rishaug', 'Linus Hanner', 'Tom Ljungman', 'Fredrik Ramel', 'Christoffer Bohlin', 'Julia Nilsson', 'Elin Almén', 'Bengt Bylund', 'Bengt Lindström', 'Susanne Ruben', 'Elif Ceylan']","['loneliness', 'horror', 'connection']",Tomas Alfredson
5714,5714,37936,Happy Birthday to Me,1981-05-15,0,110,False,0,"Virginia is proud that she belongs to a clique. The best students at a private school. But before her 18th birthday, a gruesome set of murders take place and her friends are the ones who are falling prey. Could it be her? She suffers from blackouts due to a freak accident one year earlier. We soon learn the truth behind her accident and what is going on...",15.833,/yxGYpW43UzZuy4yvCP6Rzb5wyvS.jpg,"['Drama', 'Horror', 'Thriller', 'Mystery']","birthday, psychopath, birthday party, murder, marijuana, serial killer, slasher, mystery killer, brain surgery, canuxploitation, medical experiment, black gloves, giallo, college campus, american giallo",1981,"['Melissa Sue Anderson', 'Glenn Ford', 'Lawrence Dane', 'Sharon Acker', 'Frances Hyland', 'Tracey E. Bregman', 'Jack Blum', 'Matt Craven', 'Lenore Zann', 'David Eisner', 'Lisa Langlois', 'Michel-René Labelle', 'Richard Rebiere', 'Lesleh Donaldson', 'Earl Pennington', 'Murray Westgate', 'Jérôme Tiberghien', 'Maurice Podbrey', 'Vlasta Vrana', 'Walter Massey', 'Griffith Brewer', 'Allan Katz', 'Ron Lea', 'Terry Haig', 'Karen Stephen', 'Louis Del Grande', 'Nicholas Kilbertus', 'Damir Andrei', 'Gina Dick', 'Stephanie Miller', 'Steven Mayoff', 'Victor Knight', 'Roland Nincheri', 'Aram Barkev', 'Alan Barnett', 'Paul Board', 'Marc DeGagne', 'Bruce Gooding', 'Keith Sutherland', 'Herbert Vool', 'Len Watt', 'Joe Wertheimer', 'Nancy Allan', 'Karen Hynes', 'Tracy-Marie Langdon', 'Debbie McGellin', 'Kathy Reid', 'Lori Timmons', 'Debbie Tull', 'Lynn Wilson']","['shock', 'jealousy', 'fear']",J. Lee Thompson
5715,5715,16392,Redline,2007-04-13,0,95,False,0,A gorgeous young automobile fanatic--and front to the hottest unsigned band on the West coast--finds herself caught up in illegal drag-racing competitions organized by exotic car fanatics,15.832,/lE1XfidwJml7lNGi0D4KlB8uQFY.jpg,"['Action', 'Drama', 'Thriller']",street race,2007,"['Nathan Phillips', 'Nadia Bjorlin', 'Eddie Griffin', 'Tim Matheson', 'Jesse Johnson', 'Barbara Niven', 'Denyce Lawton', 'Neill Skylar', 'Marc Crumpton', 'Nancy Stelle', 'Angus Macfadyen', 'Faleolo Alailima', 'Hal Ozsan', 'Todd Lowe', 'Danica Dias', 'Michael Hagiwara', 'Christopher Backus', 'Aalok Mehta', 'Mary Elise Hayden', 'Armando Pucci', 'Doug Budin', 'Joey Sagal', 'Kevin Levrone', 'Monica Allgeier', 'Amber Lancaster', 'Mike Massa', 'Tierre Turner', 'David Dayan Fisher', 'Ernie Reyes Jr.', 'Mariela Navarro', 'Josh Gogarty', 'Katarina van Derham']","['excitement', 'chaos', 'competition']",Mitch Gould
5716,5716,8011,Highlander III: The Sorcerer,1994-11-29,36800000,99,False,26000000,"Starts off in the 15th century, with Connor McLeod training with another immortal swordsman, the Japanese sorcerer Nakano. When an evil immortal named Kane kills the old wizard, the resulting battle leaves him buried in an underground cave. When Kane resurfaces in the 20th century to create havoc, it's up to McLeod to stop him.",15.828,/4lVKy9bsVw78EFhd4yHTDwgBr0U.jpg,"['Fantasy', 'Action']","new york city, martial arts, japan, immortality, scotland, morocco, sorcery, sword fight, katana sword, fictional war, dark fantasy, archeology, warrior, action hero, sword and sorcery, supernatural power, good versus evil",1994,"['Christopher Lambert', 'Mario Van Peebles', 'Deborah Kara Unger', 'Mako', 'Martin Neufeld', 'Daniel Dõ', 'Michael Jayston', 'Louis Bertignac', 'Lisa Vitello', 'Christopher Heyerdahl', 'Raoul Max Trujillo', 'Jean-Pierre Pérusse', 'Gabriel Kakon', 'Darcy Laurie', 'David Francis', 'Matt Holland', 'Richard Jutras', 'Liz MacRae', 'Emidio Michetti', 'André Oumansky', 'Charles S. Doucet', 'Garth Gilker', 'Paul Hopkins', 'Michael McGill', 'Chip Chuipka', 'Patrick Fierry', 'Clifford De Spenser', 'John Dunn-Hill', 'Vlasta Vrana', 'Aron Tager', 'Sheena Larkin', 'Robert Ozores', 'Joe De Paul', 'Richard Raybourne', 'Goûchy Boy', 'Bonnie Mak', 'Philippe Hartmann', 'Mariano Mendoza', 'Jason Cavalier']","['immortality', 'honor', 'destiny']",Andrew Morahan
5717,5717,9978,Stormbreaker,2006-07-21,23937870,93,False,40000000,"Alex Rider thinks he is a normal school boy, until his uncle is killed. He discovers that his uncle was actually spy on a mission, when he was killed. Alex is recruited by Alan Blunt to continue the mission. He is sent to Cornwall to investigate a new computer system, which Darrius Sayle has created. He plans to give the new computer systems to every school in the country, but Mr. Blunt has other ideas and Alex must find out what it is.",15.827,/l0vSLU0tsYuQsvMxsC52rJsd583.jpg,"['Adventure', 'Action', 'Family']","martial arts, london, england, double life, based on novel or book, secret intelligence service, wretch, villain, child hero, training camp, training, caretaker, mi6, housekeeper, teenage boy, secret life, high school student, uncle nephew relationship, dead parents, skills, teen spy, death of uncle, underground complex, underground facility, based on young adult novel",2006,"['Alex Pettyfer', 'Sarah Bolger', 'Ewan McGregor', 'Robbie Coltrane', 'Stephen Fry', 'Damian Lewis', 'Bill Nighy', 'Sophie Okonedo', 'Missi Pyle', 'Mickey Rourke', 'Andy Serkis', 'Alicia Silverstone', 'Jimmy Carr', 'Ashley Walters', 'Morgan Walters', 'Martin Herdman', 'Scott Chisholm', 'Richard Huw']","['adventure', 'bravery', 'espionage']",Geoffrey Sax
5718,5718,11859,Fair Game,1995-11-03,11534477,91,False,50000000,"Max Kirkpatrick is a cop who protects Kate McQuean, a civil law attorney, from a renegade KGB team out to terminate her",15.823,/qcxsWOzBaF7MZNNThtRQWQ9Wrdk.jpg,['Action'],"hacker, based on novel or book, miami, florida, bomb, chase, sadism, kidnapping, hostage, psychopath, spy, detective, handcuffs, fbi, kgb, pizza, parking garage, police protection, car crash, remake, fugitive, on the run, conspiracy, shootout, gunfight, sadist, foot chase, police detective, police station, held at gunpoint, double cross, machine gun, grenade launcher, rogue agent, woman lawyer, damsel in distress",1995,"['William Baldwin', 'Cindy Crawford', 'Steven Berkoff', 'Christopher McDonald', 'Miguel Sandoval', 'Johann Carlo', 'Salma Hayek Pinault', 'John Bedford Lloyd', 'Jenette Goldstein', 'Paul Dillon', 'Olek Krupa', 'Gustav Vintas', 'Marc Macaulay', 'Ruben Rabasa', 'Sonny Carl Davis', 'Antoni Corone', 'Dan Hedaya']","['truth', 'injustice', 'courage']",Andrew Sipes
5719,5719,11893,Runaway Train,1985-11-15,7936012,111,False,9000000,A hardened convict and a younger prisoner escape from a brutal prison in the middle of winter only to find themselves on an out-of-control train with a female railway worker while being pursued by the vengeful head of security.,15.823,/dqViXokpi1xTZmsotfyhvGmzyZo.jpg,"['Action', 'Thriller', 'Drama', 'Adventure']","attempt to escape, train accident, prison warden, prison escape, alaska, train, freezing",1985,"['Jon Voight', 'Eric Roberts', 'Rebecca De Mornay', 'Kyle T. Heffner', 'John P. Ryan', 'T.K. Carter', 'Kenneth McMillan', 'Stacey Pickren', 'Walter Wyatt', 'Edward Bunker', 'Reid Cruickshanks', 'Dan Wray', 'Michael Lee Gogin', 'John Bloom', 'Hank Worden', 'Danny Trejo', 'Tommy Lister Jr.', 'Dennis Franz', 'John Otrin', 'Norman Alexander Gibbs', 'Dennis Ott', 'Don Pugsley', 'John Fountain', 'Wally Rose', 'John Richard Petersen', 'William Tregoe']","['desperation', 'freedom', 'survival']",Andrei Konchalovsky
5720,5720,23988,Stan Helsing,2009-10-27,1400000,90,False,365000,"It's Halloween night and video store clerk Stan Helsing just got stuck with a last minute request to deliver some videos. With his best friend, his best friend's date, and a smoking hot ex-girlfriend waiting to go to a party, Stan convinces them to take a side trip to Stormy Night Estates for the drop. But the group gets locked inside and Stan discovers he's actually Stan Van Helsing, descendan",15.822,/qDlmKahejt0NoQzw65tnLayEhHZ.jpg,['Comedy'],"halloween, parody, slapstick comedy, duringcreditsstinger",2009,"['Steve Howey', 'Diora Baird', 'Leslie Nielsen', 'Kenan Thompson', 'Tara Wilson', 'Ben Cotton', 'Ildiko Ferenczi', 'Desi Lydic', 'Elysia Rotaru', 'Zorianna Kit', 'Denise Poole', 'Kathryn Kirkpatrick', 'Twan Holliday', 'Alain Chanoine', 'Charles Zuckermann', 'Lara Babalola', 'Jeff Gulka', 'Nathan Dashwood', 'Grayson Gabriel', 'Robin Nielsen', 'Jon Johnson', 'Lee Tichon', 'Mikey Granger', 'Aaron Rota', 'Kelsey McIlroy', 'Jeremy Crittenden', 'John Burnside', 'Holly Eglington', 'Chad Krowchuk']","['parody', 'silliness', 'fear']",
5721,5721,864,Cool Runnings,1993-10-01,154856263,98,False,14000000,"When a Jamaican sprinter is disqualified from the Olympic Games, he enlists the help of a dishonored coach to start the first Jamaican bobsled team.",15.821,/6fXuGEb7EqGmAeUodxm7l5ELPZ.jpg,"['Comedy', 'Adventure', 'Drama']","underdog, sports, winter, olympic games, jamaica, trainer, training camp, reggae, bobsleighing, bobsled, calgary",1993,"['Leon', 'Doug E. Doug', 'Rawle D. Lewis', 'Malik Yoba', 'John Candy', 'Raymond J. Barry', 'Peter Outerbridge', 'Paul Cœur', 'Larry Gilman', 'Charles Hyatt', 'Winston Stona', 'Bertina Macauley', 'Pauline Stone Myrie', 'Kristoffer Cooper', 'Bill Dow', 'Jay Brazeau', 'Campbell Lane', 'Matthew Walker', 'Christopher Gaze', 'Jack Goth', 'David Lovgren', 'Kerwin Kerr', 'Deamion Robinson', 'Beverly Brown', 'Cyrene Tomlinson', 'Oliver Hunter', 'Fitz Weir', 'Teddy Price', 'Charles Harvey', 'Clive Anderson', 'Michael London', 'Lloyd Roache', 'Cheryl Kroeker', 'Karyn J. Scott', 'Craig Lehto', 'Al Trautwig', 'John Morgan']","['inspiration', 'determination', 'joy']",Jon Turteltaub
5722,5722,43956,Tom and Jerry Meet Sherlock Holmes,2010-08-24,0,49,False,0,"Tom and Jerry need to learn to work together in order to help Sherlock Holmes with an investigation of a jewel theft. But still, they are cat and mouse!",15.816,/8TAd3Cky2D8dHzWIirna1IHa2N3.jpg,"['Family', 'Animation', 'Adventure', 'Comedy']","london, england, england, detective, cartoon, anthropomorphism, animal, sherlock holmes",2010,"['Michael York', 'Malcolm McDowell', 'John Rhys-Davies', 'Billy West', 'Grey DeLisle', 'Phil LaMarr', 'Kath Soucie', 'Jeff Bergman', 'Greg Ellis', 'Jess Harnell', 'Richard McGonagle']","['fun', 'mystery', 'teamwork']",Jeff Siergey
5723,5723,297596,Dying of the Light,2014-12-04,0,94,False,15000000,"Evan Lake, a veteran CIA agent, has been ordered to retire. But when his protégé uncovers evidence that Lake's nemesis, the terrorist Banir, has resurfaced, Lake goes rogue, embarking on a perilous, intercontinental mission to eliminate his sworn enemy.",15.812,/gL6riNxQeyPXT5YsgqE2aWhl1zi.jpg,"['Thriller', 'Drama']","cia, espionage, retirement, terrorism",2014,"['Nicolas Cage', 'Anton Yelchin', 'Alexander Karim', 'Irène Jacob', 'Aymen Hamdouchi', 'Tomiwa Edun', 'Claudius Peters', 'Robert G. Slade', 'Derek Ezenagu', 'Geff Francis', 'Tim Silano', 'Silas Carson', 'Șerban Celea', 'David Lipper', 'Ovidiu Niculescu']","['paranoia', 'decline', 'revenge']",Cornelia Stefan
5724,5724,359983,The Lion Guard: Return of the Roar,2015-11-22,0,44,False,0,"Set in the African savannah, the film follows Kion as he assembles the members of the 'Lion Guard'. Throughout the film, the diverse team of young animals will learn how to utilize each of their unique abilities to solve problems and accomplish tasks to maintain balance within the Circle of Life, while also introducing viewers to the vast array of animals that populate the prodigious African landscape.",15.811,/duqg6CiSik02nSXjiQHo8TcwY4b.jpg,"['Family', 'TV Movie', 'Animation']","africa, lion",2015,"['Max Charles', 'Joshua Rush', 'Madison Pettis', 'Andrew Kishino', 'Vargus Mason', 'Rob Lowe', 'Gabrielle Union', 'Eden Riegel', 'Khary Payton', 'Ernie Sabella', 'James Earl Jones', 'Kevin Schon', 'Jeff Bennett', 'Diamond White', 'Dusan Brown', 'Atticus Shaffer', 'Sarah Hyland', 'Greg Ellis', 'Kevin Schon', 'Dee Bradley Baker', 'Ford Riley', 'Beau Black', 'Blair Underwood', 'Lyons Mathias', 'Carter Hastings', 'Sam Lavagnino']","['courage', 'family', 'legacy']",Howy Parkins
5725,5725,1997,Two Brothers,2004-04-07,62172050,109,False,74500000,"Two tigers are separated as cubs and taken into captivity, only to be reunited years later as enemies by an explorer (Pearce) who inadvertently forces them to fight each other.",15.808,/5I2pRuJI3SZVsxP5iaorGaczzkI.jpg,"['Adventure', 'Drama', 'Family']","governor, cambodia, sibling relationship, chase, tiger, loss of loved one, royalty, traveling circus, archaeologist",2004,"['Guy Pearce', 'Jean-Claude Dreyfus', 'Freddie Highmore', 'Oanh Nguyen', 'Philippine Leroy-Beaulieu', 'Moussa Maaskri', 'Vincent Scarito', 'Maï Anh Le', 'Jaran Petcharoen', 'Stéphanie Lagarde', 'Bernard Flavien', 'Annop Varapanya', 'David Gant', 'Teerawat Mulvilai', 'Somjin Chimwong', 'Nozha Khouadra', 'Jerry Hoh', 'Juliet Howland', 'Caroline Wildi', 'Bô Gaultier de Kermoal', 'Alan Fairbairn', 'Ham Chau Luong', 'Saïd Serrari', 'Xavier Castano', 'Christophe Cheysson', 'Stéphanie Campion']","['bond', 'innocence', 'separation']",Jean-Jacques Annaud
5726,5726,1710,Copycat,1995-10-27,32000000,124,False,20000000,An agoraphobic psychologist and a female detective must work together to take down a serial killer who copies serial killers from the past.,15.805,/lKNjGQXTy5WkSjAtLzLzAN9IHCD.jpg,"['Thriller', 'Crime', 'Mystery']","police brutality, psychology, police operation, police protection, psychologist, serial killer, cowardliness",1995,"['Sigourney Weaver', 'Holly Hunter', 'Dermot Mulroney', 'William McNamara', 'Harry Connick Jr.', 'J.E. Freeman', 'Will Patton', 'John Rothman', ""Shannon O'Hurley"", 'Bob Greene', 'Tony Haney', 'Danny Kovacs', 'Tahmus Rounds', 'Scott Devenney', 'David Michael Silverman', 'Diane Amos', 'Kelly De Martino', 'Richard Conti', 'Nick Scoggin', 'Bert Kinyon', 'Dennis Richmond', 'Rob Nilsson', 'Kenny Kwong', 'Charles Branklyn', 'Rebecca Klingler', 'Terry Brown', 'Corie Henninger', 'Bill Bonham', 'Kathleen Stefano', 'Chris Beale', 'Hansford Prince', 'Don West', 'Jay Jacobus', 'John Charles Morris', 'Keith Phillips', 'Johnetta Shearer', 'Ron Kaell', 'Kelvin Han Yee', 'James Cunningham', 'Victor Talmadge', 'Brian Keith Russell', 'Damon Lawner', 'Russ Christoff', 'Doug Morrisson', 'Edith Bryson', 'Jeni Chua', 'William Oates', 'Lee Kopp', 'Thomas J. Fieweger', 'Floyd Gale Holland', 'Anthony Moore', 'Stephanie Smith', 'S. J. Spinali', 'Katherine Fitzhugh', 'Robert Benscoter', 'Arlon G. Greene', 'Stuart W. Yee', 'Vincenetta Gunn', 'David D. Ferguson', 'Eleva Singleton', 'Gena Bingham', 'Jon Briddell']","['fear', 'intellect', 'suspense']",Jon Amiel
5727,5727,15802,Tokyo Decadence,1992-01-06,795312,135,False,0,"A submissive hooker goes about her trade, suffering abuse at the hands of Japanese salarymen and Yakuza types. She's unhappy about her work, and is apparently trying to find some sort of appeasement for the fact that her lover has married.",15.804,/ya3HsnwavmtQYMxnGS5T5RV6do0.jpg,['Drama'],"japan, prostitute, opium, yakuza, sadomasochism, drugs, bdsm, pink film, erotic movie",1992,"['Miho Nikaido', 'Sayoko Amano', 'Tenmei Kano', 'Kan Mikami', 'Masahiko Shimada', 'Yayoi Kusama', 'Chie Sema']","['loneliness', 'submission', 'isolation']",
5728,5728,345920,Collateral Beauty,2016-12-15,88528280,97,False,36000000,"Retreating from life after a tragedy, a man questions the universe by writing to Love, Time and Death. Receiving unexpected answers, he begins to see how these things interlock and how even loss can reveal moments of meaning and beauty.",15.804,/pVIAPiIvHcitgXV8BA7uTyCcEuk.jpg,"['Drama', 'Romance']","friendship, despair, group therapy, loss, grief, death, grieving father, central park, new york city, actors",2016,"['Will Smith', 'Edward Norton', 'Kate Winslet', 'Michael Peña', 'Helen Mirren', 'Jacob Latimore', 'Keira Knightley', 'Naomie Harris', 'Ann Dowd', 'Kylie Rogers', 'Natalie Gold', 'Liza Colón-Zayas', 'Shirley Rumierk', 'Alyssa Cheatham', 'Benjamin Snyder', 'Mary Beth Peil', 'Andy Taylor', 'Michael Cumpsty', 'Claire Glassford', 'Joseph Castillo-Midyett', 'Bryan Terrell Clark', 'Marcus Paul James', 'Mykal Kilgore', 'Jimmy Palumbo', 'Elia Monte-Brown', 'Suzy Jane Hunt', 'Crystal Anne Dickinson', 'Andres Munar', 'Harriett D. Foy', 'Maureen Mueller', 'Steven Hauck', ""Robert 'Toshi' Kar Yuen Chan"", 'Willie C. Carpenter', 'Jabriah Anderson', 'Laura Hart', 'Emily Bennett', 'Liz Celeste', 'Madeline Lupi', 'Reginald L. Barnes', 'Lily Peterson']","['grief', 'healing', 'connection']",David Frankel
5729,5729,10362,Two Lovers,2008-11-19,16303643,110,False,9800000,A depressed man moves back in with his parents following a recent heartbreak and finds himself with two women.,15.801,/8uaXKQmOJPUJSCSO6GkjXrJKp2w.jpg,"['Drama', 'Romance']","new year's eve, new york city, love of one's life, neighbor, brooklyn, new york city, based on short story",2008,"['Joaquin Phoenix', 'Gwyneth Paltrow', 'Vinessa Shaw', 'Isabella Rossellini', 'Moni Moshonov', 'Elias Koteas', 'Bob Ari', 'David Ross', 'Anne Joyce', 'Elliot Villar', 'Craig Walker', 'Carmen M. Herlihy', 'Donald J. Hewitt Jr.', 'Christian Albrizo', 'Julie Budd', 'Iain J. Bopp', 'Samantha Ivers', 'Jeanine Serralles', 'Miguel Rivera', 'Clinton C. Ingram', 'Doug Wright', 'Shiran Nicholson', 'Marion McCorry', 'Saidah Arrika Ekulona', 'David Cale', 'Sy Fader', 'Joel Horwitz', 'John Baker', 'Kathryn Gerhardt', 'Luis Dalmasy Jr.', 'Alex Felix', 'Geronimo Frias', 'Mari Koda', 'Pedro Saint Morillo', 'Anthony Ramos', 'Diosmer Reynoso', 'Edwige Sam', 'Franco Bulaon', 'Renee Fishman', 'Bianca Giancoli', 'Nick Gillie', 'Andrew Ginsburg', 'Brian Hopson', 'RJ Konner', 'Evan Lewis', 'Uzimann', 'Mark Vincent']","['conflict', 'love', 'despair']",James Gray
5730,5730,10025,Just My Luck,2006-05-12,38159905,103,False,28000000,"Manhattanite Ashley is known to many as the luckiest woman around. After a chance encounter with a down-and-out young man, however, she realizes that she's swapped her fortune for his.",15.8,/wWpqG3zrrPZhvNLflYJdbW1NgY3.jpg,"['Comedy', 'Drama', 'Family', 'Fantasy', 'Romance']","kiss, bad luck, romantic comedy, jinx, alcohol abuse, celebration, envy, luck, manhattan, new york city, mysterious stranger, masquerade, music industry",2006,"['Lindsay Lohan', 'Chris Pine', 'Samaire Armstrong', 'Bree Turner', 'Faizon Love', 'Missi Pyle', 'Makenzie Vega', 'Carlos Ponce', 'Danny Jones', 'Tom Fletcher', 'Harry Judd', 'Dougie Poynter', 'Tovah Feldshuh', 'Dane Rhodes', 'Jaqueline Fleming', 'Ira Hawkins', 'J.C. Sealy', 'Mikki Val', 'Marcus Hester', 'Ameer Baraka', 'Anne Ewen', 'Hannah Tointon', 'Mark Wystrach', 'Kathy Tong', 'Chris Carmack', 'Kayla Ewell', ""Craig 'Radio Man' Castaldo""]","['luck', 'romance', 'reversal']",Donald Petrie
5731,5731,65180,New Tokyo Decadence: The Slave,2007-03-09,0,60,False,0,A secretary is introduced to the world of BDSM by her boss. She becomes his personal slave as they take a walk on the wild side of experimentations. This film is based on main actress Rinako Hirasawa’s personal experiences.,15.799,/o8VeklDz6xxH4cwWcdrmbuzYcdh.jpg,['Drama'],"erotic movie, 情色",2007,"['Rinako Hirasawa', 'Kikujirō Honda', 'Naoyuki Chiba', 'Tarō Araki', 'Komari Awashima', 'Shinji Kubo']","['despair', 'submission', 'isolation']",Osamu Satō
5732,5732,11342,Warlock,1989-06-01,9094451,103,False,7000000,"In 17th century New England, witch hunter Giles Redferne captures an evil warlock, but the conjurer eludes death with supernatural help. Flung into the future, the warlock winds up in the 1980s and plans to bring about the end of the world. Redferne follows the enchanter into the modern era and continues his mission, but runs into trouble in such unfamiliar surroundings. With the help of a young woman, can Redferne finally defeat the warlock?",15.798,/1QHjr4lBd3vBN4kEqdDFlnJbsa7.jpg,"['Horror', 'Fantasy', 'Action']","witch, magic, cemetery, time travel, aging, curse, warlock, witch hunt",1989,"['Julian Sands', 'Lori Singer', 'Richard E. Grant', 'Mary Woronov', ""Kevin O'Brien"", 'Richard Kuss', 'Allan Miller', 'Anna Thomson', 'David Carpenter', 'Kay E. Kuter', 'Ian Abercrombie', 'Kenneth Danziger', 'Robert Breeze', 'Frank Renzulli', 'Brandon Call', 'Nancy Fox', 'Juli Burkhart', 'Rob Paulsen', 'Peter Sherayko', 'Gyl Roland', 'Meta King', 'Bill Dunnam', 'Wendy Feiner', 'Harry Johnson', 'Art Smith']","['fear', 'magic', 'evil']",Steve Miner
5733,5733,381341,Perfect Strangers,2016-02-11,31640626,97,False,0,"During a dinner, a group of friends decide to share whatever message or phone call they will receive during the evening, with unforeseen consequences.",15.797,/3wknM629Vryofb1HNo2YnLQnQyn.jpg,"['Comedy', 'Drama']","friendship, jealousy, husband wife relationship, italian, italy, truth, confidence, honesty, love, love affair, trust, game, childhood friends, love fiction",2016,"['Giuseppe Battiston', 'Anna Foglietta', 'Marco Giallini', 'Edoardo Leo', 'Valerio Mastandrea', 'Alba Rohrwacher', 'Kasia Smutniak', 'Benedetta Porcaroli', 'Elisabetta De Palo', 'Tommaso Tatafiore', 'Noemi Pagotto']","['secrets', 'discomfort', 'surprise']",Paolo Genovese
5734,5734,18892,Jawbreaker,1999-01-30,3076820,87,False,3000000,"When an exclusive clique of teenage socialites accidentally murder their best friend on the morning of her birthday, the three girls responsible conspire to hide the truth.",15.797,/gwjJPAraQy5fDd3NJvK677uItU4.jpg,"['Comedy', 'Crime']","high school, jealousy, nightmare, confession, groupie, ambition, female friendship, revenge, prom, dead body, dating, fashion, rock band, makeover, polaroid camera, public humiliation, social outcast, prank gone wrong, social climbing, back stabbing, accidental killing",1999,"['Rose McGowan', 'Rebecca Gayheart', 'Julie Benz', 'Judy Greer', 'Pam Grier', 'Carol Kane', 'Chad Christ', 'Ethan Erickson', 'Tatyana Ali', 'Charlotte Ayanna', 'Jeff Conaway', 'William Katt', 'P. J. Soles', 'Marilyn Manson', 'Vylette Fagerholm', 'The Donnas', 'Alexandra Adi', 'Claudine Claudio', 'Brian Gattas', 'Lisa Robin Kelly', 'Sandy Martin', 'Michael McLafferty', 'Donna Pieroni', 'Ann Russo', 'Rebecca Street', 'Rachel Winfree']","['deception', 'popularity', 'guilt']",Darren Stein
5735,5735,13192,Moonwalker,1988-10-29,67000000,93,False,22000000,"A movie that starts out with the ""Man in the Mirror"" music video, it then changes to a montage of video clips of Michael's career. Next comes a parody of his Bad video by children, and then Michael is chased by fans in a fantasy sequence. 2 more videos are shown, and then a movie in which Michael plays a hero with magical powers. In it he is chased by drug dealer Mr. Big and saves three children. Videos included in the movie are ""Smooth Criminal"" and ""Come Together"".",15.794,/3GwTPQkAcgDeAirRpEuJG8HDdRz.jpg,"['Fantasy', 'Music']","dancing, drug crime, gangster, entertainer, parody, stop motion, live performance, robot, claymation",1988,"['Michael Jackson', 'Joe Pesci', 'Sean Ono Lennon', 'Kelley Parker', 'Brandon Quintin Adams', 'Ben Aaron', 'Bilal', 'Brent Kelly', 'Danial Brown', 'Khiry Abdul-Samad', 'Jose Chaidez', 'Garland Spencer', 'D.J. Dellos', 'Dylan Stewart', 'Dove Dellos', 'Tajh Abdul-Samad', 'Amaris Dupree', 'Dion Turner', 'Hakeem Abdul-Samad', 'Cory Tyler', 'Tony Williams', 'Reggie Williams', 'Dion Basco', 'Eric Ryan', 'Nikki Cox', 'Maurissa Tancharoen', 'Kimberly Duncan', 'Tisha Tucker', 'Jermaine Jackson II', 'Terrance Williams', 'Frank DiLeo', 'Cindera Che', 'Tina Landon', 'Alif Sankey', 'LaVelle Smith', 'Miko C. Brando', 'Jennifer Batten', 'Paul Reubens', 'Clancy Brown', 'Taryll Jackson', 'TJ Jackson', 'Scott L. Treger', 'Brenda Barrett']","['wonder', 'surrealism', 'awe']",Colin Chilvers
5736,5736,76589,Justice League: Doom,2012-02-28,0,77,False,0,"An adaptation of Mark Waid's ""Tower of Babel"" story from the JLA comic. Vandal Savage steals confidential files Batman has compiled on the members of the Justice League, and learns all their weaknesses.",15.792,/seCbcjdZYUl8SRKjeWfyi2ngzFj.jpg,"['Action', 'Animation', 'Science Fiction']","based on comic, super power, superhero team, woman director",2012,"['Kevin Conroy', 'Tim Daly', 'Susan Eisenberg', 'Michael Rosenbaum', 'Carl Lumbly', 'Paul Blackthorne', 'Bumper Robinson', 'Phil Morris', 'Nathan Fillion', 'Carlos Alazraqui', 'Claudia Black', ""Olivia d'Abo"", 'Alexis Denisof', 'David Kaufman', 'Grey DeLisle', 'Robin Atkin Downes', 'Dee Bradley Baker', 'Brian George', 'Juliet Landau', 'Jim Meskimen', 'Andrea Romano', 'Bruce Timm', 'Danny Jacobs']","['danger', 'teamwork', 'suspense']",Lauren Montgomery
