,Unnamed: 0,id,title,release_date,revenue,runtime,adult,budget,overview,popularity,poster_path,genres,keywords,year,actors,emotions,director
6840,6840,7300,One Fine Day,1996-12-20,97529550,108,False,0,"Melanie Parker, an architect and mother of Sammy, and Jack Taylor, a newspaper columnist and father of Maggie, are both divorced. They meet one morning when overwhelmed Jack is left unexpectedly with Maggie and forgets that Melanie was to take her to school. As a result, both children miss their school field trip and are stuck with the parents. The two adults project their negative stereotypes of ex-spouses on each other, but end up needing to rely on each other to watch the children as each must save his job. Humor is added by Sammy's propensity for lodging objects in his nose and Maggie's tendency to wander.",13.433,/ubEExGaBdbfZEMGLV7kWdqSY68j.jpg,"['Romance', 'Comedy']","single mother, divorced, single father",1996,"['Michelle Pfeiffer', 'George Clooney', 'Mae Whitman', 'Alex D. Linz', 'Charles Durning', 'Jon Robin Baitz', 'Ellen Greene', 'Amanda Peet', 'Joe Grifasi', 'Pete Hamill', 'Anna Maria Horsford', 'Gregory Jbara', 'Sheila Kelley', 'Bitty Schram', 'Barry Kivel', 'Robert Klein', 'George Martin', 'Michael Massee', 'Holland Taylor', 'Rachel York', 'Marianne Muellerleile', 'Steven Jang', 'Samantha Cintrón', 'Victor Truro', 'Ashley Greenfield', 'Sidney Armus', 'Hal Panchansky', 'Maggie Wagner', 'Isabelle Ashland', 'Jasmin Hartmann', 'Larry Sherman', 'Shaun Duke', 'Thomas Schall', 'Michael Badalucco', 'Jeanie Van Dam', 'Kirstin Allen', 'Michael Genet', 'Julia Ryder Perce', 'P.J. Aliseo', 'Liam Ahern', 'José Rabelo', 'Darla Hill', 'Joe Avellar', 'Jullie Chung', 'Dale Kasman', 'Andrew Magarian', 'Katherine Argo', 'Rob Buntzen', 'Brian Cahill', 'Fred Goehner', 'Kuniko Narai', 'Gideon Jacobs']","['romantic comedy', 'parenthood', 'chance encounters']",Michael Hoffman
6841,6841,26672,The Thief and the Cobbler,1993-09-23,669276,72,False,28000000,"It is written among the limitless constellations of the celestial heavens, and  in the depths of the emerald seas, and upon every grain of sand in the vast  deserts, that the world which we see is an outward and visible dream, of an  inward and invisible reality ... Once upon a time there was a golden city. In  the center of the golden city, atop the tallest minaret, were three golden  balls. The ancients had prophesied that if the three golden balls were ever  taken away, harmony would yield to discord, and the city would fall to  destruction and death. But... the mystics had also foretold that the city might  be saved by the simplest soul with the smallest and simplest of things. In the  city there dwelt a lowly shoemaker, who was known as Tack the Cobbler. Also in  the city... existed a Thief, who shall be... nameless.",13.432,/3OKtFuTxahr7hokPB9aO38qgOfc.jpg,"['Adventure', 'Fantasy', 'Animation', 'Family']","witch, princess, prophecy, battle, desert, cobbler, evil mastermind, professional thief",1993,"['Vincent Price', 'Matthew Broderick', 'Jennifer Beals', 'Anthony Quayle', 'Joan Sims', 'Donald Pleasence', 'Jonathan Winters', 'Paul Matthews', 'Miriam Margolyes', 'Eric Bogosian', 'Toni Collette', 'Joss Ackland', 'Clinton Sundberg', 'Kenneth Williams', 'Stanley Baxter', 'Rik Mayall', 'Steve Lively', 'Bobbi Page', 'Ed E. Carroll', 'Sara Crowe', 'Mona Marshall', 'Christopher Greener', 'Kevin Dorsey', 'Windsor Davies', 'Thick Wilson']","['animation', 'fantasy', 'adventure']",Richard Williams
6842,6842,8382,Today You Die,2005-09-13,0,92,False,0,A former thief who is trying to go straight seeks vengeance on those who framed him.,13.43,/fSL56vXRp4Qh23vXPiAhJMFKZgB.jpg,"['Action', 'Crime']","martial arts, showdown, fight, shotgun, revenge, vigilante, betrayed, quick draw, action hero, vigilante justice",2005,"['Steven Seagal', 'Treach', 'Sarah Buxton', 'Mari Morrow', 'Nick Mancuso', 'Robert Miano', 'Kevin Tighe', 'Jamie McShane', 'Lawrence Turner', 'Brett Rice', 'Lance Jonathan Mancuso', 'Chloë Grace Moretz', 'Jerry Trimble', 'Justin Riemer', 'Elayn J. Taylor', 'Hawthorne James', 'David Frye', 'Morann Peri', 'John P. Gulino', 'Smalls', 'Lesley-Anne Down', 'J. Anthony Pena', 'Rachel Specter', 'Simona Williams', 'Dennis Keiffer', 'Dian Hristov', 'Eddie Perez', 'Randy Couture']","['action', 'revenge', 'crime']",
6843,6843,35588,Geronimo: An American Legend,1993-12-10,18635620,115,False,35000000,"The Apache Indians have reluctantly agreed to settle on a US Government approved reservation. Not all the Apaches are able to adapt to the life of corn farmers. One in particular, Geronimo, is restless. Pushed over the edge by broken promises and necessary actions by the government, Geronimo and thirty or so other warriors form an attack team which humiliates the government by evading capture, while reclaiming what is rightfully theirs.",13.43,/oW4IM0G5fCR68YalmemTGbPK15F.jpg,"['Western', 'History', 'Action']","apache nation, native american, historical figure, historical, cavalry, geronimo",1993,"['Jason Patric', 'Gene Hackman', 'Robert Duvall', 'Wes Studi', 'Matt Damon', 'Rodney A. Grant', 'Kevin Tighe', 'Steve Reevis', 'Carlos Palomino', 'Victor Aaron', 'Stuart Proud Eagle Grant', 'Stephen McHattie', 'John Finn', 'Lee de Broux', 'Rino Thunder', 'Hoke Howell', 'Richard Martin Jr.', 'Raliegh Wilson', 'Jackie Old Coyote', 'Monty Bass', 'Pato Hoffmann', 'Roger Callard', 'Juddson Keith Linn', 'Mark Boone Junior', 'M.C. Gainey', 'Michael Ruud', 'Michael Minjarez', 'Burnette Bennett', 'Jonathan Ward', 'Luis Contreras', 'Scott Wilson', 'J. Young', 'Scott Crabbe', 'Patricia Pretzinger', 'Davina Smith', 'Jaquelin Lee', 'Jim Manygoats', 'Eva Larson', 'Greg Goossen', 'Sonny Skyhawk', 'Michael Adams', 'Walter Robles', 'Anthony G. Schmidt', 'Jim Beaver', 'Buzz Augare', 'Arland F. Ben', 'Virgil Joe Ben', 'Billy Brown', 'Clifford Brown', 'Jimmy Brownfeather', 'James Burgdorf', 'Michael Case', 'R.B. Dunn', 'Jefferson Gatewood', 'Frank Gobert', 'Anderson Harvey', 'Steven Holiday', 'Craig Ironpipe', 'Aarie E. Madplume', 'Harrison Nez', 'Peter P. Oliver', 'Leo J. Saggboy', 'Donahue Tom', 'Robert Whipple', 'Larry White Jr.', 'George Lee', 'Kurt Hamilton Cox', 'Cary A. Davisson', 'Barry Edward', 'Robert Erickson', 'Mark B. Farris', 'Chuck Fitzpatrick', 'Glen Gamble', 'Eric W. Glatthaar', 'William C. Honohan', 'Armond Jones', 'Francisco Cruz López', 'Kevin McNiven', 'Mark Myers', 'Gary L. Norwood', 'Richard Jay Reed', 'Sam Reed', 'Lonnie Rodriguez', 'Stanley Schultz', 'Michael Stein', 'James N. Strouss', 'Rocky Bonifield', 'Lena Banks', 'Eugene Biscardi', 'Jessica Biscardi', 'Morgan Blanchard', 'Deirdre Fitzpatrick', 'Gordon Frye', 'Michael Gier', 'Allan Graf', 'Lynn Dee Smith', 'Regina Whitcomb']","['history', 'resistance', 'culture']",Walter Hill
6844,6844,9356,Look Who's Talking Too,1990-12-14,47789074,81,False,0,"Mollie and James are together and raising a family, which now consists of an older Mikey and his baby sister, Julie. Tension between the siblings arises, and as well with Mollie and James when Mollie's brother Stuart moves in. Mikey is also learning how to use the toilet for the first time.",13.428,/m409mVHmvDOZJltNzHJYigUthsW.jpg,"['Romance', 'Comedy']","baby, sibling relationship, pregnancy, family, woman director",1990,"['Kirstie Alley', 'John Travolta', 'Bruce Willis', 'Roseanne Barr', 'Gilbert Gottfried', 'Damon Wayans', 'Mel Brooks', 'Olympia Dukakis', 'Elias Koteas', 'Twink Caplan', 'Lorne Sussman', 'Megan Milner', 'Danny Pringle', 'Don S. Davis', 'Rick Avery']","['family', 'comedy', 'parenting']",Amy Heckerling
6845,6845,9388,Thank You for Smoking,2005-09-09,24793509,92,False,6500000,"Nick Naylor is a charismatic spin-doctor for Big Tobacco who'll fight to protect America's right to smoke -- even if it kills him -- while still remaining a role model for his 12-year old son. When he incurs the wrath of a senator bent on snuffing out cigarettes, Nick's powers of ""filtering the truth"" will be put to the test.",13.427,/yuJtEgVZ9TCWaOSN41hcMiCdz26.jpg,"['Comedy', 'Drama']","research, based on novel or book, capitalism, politics, smoking, cigarette, lie, politician, tobacco, health, marketing, social satire, morality, advertising, lung cancer, lobbyist, tobacco industry, nicotine, father son relationship",2005,"['Aaron Eckhart', 'Maria Bello', 'Cameron Bright', 'Adam Brody', 'Sam Elliott', 'Katie Holmes', 'Rob Lowe', 'William H. Macy', 'Robert Duvall', 'David Koechner', 'J.K. Simmons', 'Kim Dickens', 'Connie Ray', 'Joan Lunden', 'Mary Jo Smith', 'Todd Louiso', 'Jeff Witzke', 'Marianne Muellerleile', 'Jordan Garrett', 'Courtney Taylor Burness', 'Daniel Travis', 'Richard Speight Jr.', 'Renée Graham', 'Timothy Dowling', 'Dennis Miller', 'Terry James', 'Marc Scizak', 'Rachel Thorp', 'Aaron Lustig', 'Melora Hardin', 'Brian Palermo', 'Michael Mantell', 'Spencer Garrett', 'Earl Billings', 'Catherine Reitman', 'Sean Patrick Murphy', 'David O. Sacks', ""Nancy O'Dell"", 'Roy Jenkins', 'Bruce French', 'Christopher Buckley', 'Dana E. Glauberman', 'Eva La Dare', 'Robert Malina', 'Aloma Wright', 'Elon Musk']","['satire', 'ethics', 'persuasion']",Jason Reitman
6846,6846,23730,C.H.U.D.,1984-08-31,3412497,97,False,1250000,"A rash of bizarre murders in New York City seems to point to a group of grotesquely deformed vagrants living in the sewers. A courageous policeman, a photo journalist and his girlfriend, and a nutty bum, who seems to know a lot about the creatures, band together to try and determine what the creatures are and how to stop them.",13.426,/8BVw5RIDBTZwdMAR1VKpAkwrMjj.jpg,"['Horror', 'Science Fiction']","new york city, monster, police, shower, mutant, blood splatter, gore, toxic, decapitation, zombie, cannibal, police detective, flamethrower, bum, sewer, police investigation, nuclear waste, hobo",1984,"['John Heard', 'Daniel Stern', 'Christopher Curry', 'Kim Greist', 'Laure Mattos', 'Brenda Currin', 'Justin Hall', 'Michael O’Hare', 'Cordis Heard', 'Sam McMurray', 'Vic Polizos', 'Eddie Jones', 'Frank Adu', 'Ruth Maleczech', 'J.C. Quinn', 'Frankie Faison', 'John Goodman', 'Jay Thomas', 'Bill Raymond', 'George Martin', 'Jon Polito', 'Ivar Brogger', 'Hallie Foote', 'John Bedford Lloyd', 'Peter Michael Goetz', 'Patricia Richardson', 'Ray Baker', 'Lou Leccese', 'James Dudley', 'Carey Eidel', 'Sanford Clark', 'Kelly Nichols']","['horror', 'mutation', 'urban legend']",Douglas Cheek
6847,6847,11566,Dave,1993-05-07,92000000,110,False,28000000,A sweet-natured Temp Agency operator and amateur Presidential look-alike is recruited by the Secret Service to become a temporary stand-in for the President of the United States.,13.425,/wIUuf1NFchdCJe833JBTiSMzqfv.jpg,['Comedy'],"coma, usa president, the white house, apoplectic stroke, doppelgänger, corgi",1993,"['Kevin Kline', 'Sigourney Weaver', 'Frank Langella', 'Kevin Dunn', 'Ving Rhames', 'Ben Kingsley', 'Charles Grodin', 'Faith Prince', 'Laura Linney', 'Bonnie Hunt', 'Parley Baer', 'Stefan Gierasch', 'Anna Deavere Smith', 'Charles Hallahan', 'Tom Dugan', 'Alba Oms', 'Steve Witting', 'Kellen Sampson', 'Lexie Bigham', 'Frederic W. Barnes', 'Ronald Brownstein', 'Eleanor Clift', 'Tom Harkin', 'Bernard Kalb', 'Larry King', 'Michael Kinsley', 'Morton Kondracke', 'Jay Leno', 'Frank Mankiewicz', 'Chris Matthews', 'John McLaughlin', 'Howard Metzenbaum', 'Abner J. Mikva', 'Robert D. Novak', ""Tip O'Neill"", 'Richard Reeves', 'Paul Simon', 'Ben Stein', 'Oliver Stone', 'Kathleen Sullivan', 'Jeff Tackett', 'Helen Thomas', 'Nina Totenberg', 'Sander Vanocur', 'John Yang', 'Stephen Root', 'Catherine Reitman', 'Dawn Arnemann', 'Marianna Harris', 'Sarah Marshall', 'Ralph Manza', 'George Martin', 'Laurie Franks', 'Tom Kurlander', 'Dendrie Taylor', 'Joe Kuroda', 'Geneviève Robert', 'Jason Reitman', 'Ruth Goldway', 'Frank Birney', 'Paul Collins', 'Peter White', 'Robin Gammell', 'Heather Hewitt', 'Gary Ross', 'Jeffrey Joseph', 'Bonnie Bartlett', 'Robert V. Walsh', 'William Pitts', 'Dan Butler', 'Wendy Gordon', 'Ben Patrick Johnson', 'Steve Kmetko', 'Chris Dodd', 'Alan K. Simpson', 'Arnold Schwarzenegger']","['politics', 'comedy', 'identity']",Karen Hale Wookey
6848,6848,11347,The Lair of the White Worm,1988-09-21,1189315,93,False,2500000,"When an archaeologist uncovers a strange skull in a foreign land, the residents of a nearby town begin to disappear, leading to further inexplicable occurrences.",13.423,/bhL5Z8srwSXJuosfBqei9Dxv41C.jpg,"['Comedy', 'Horror']","virgin, rape, temple, nun, vampire, snake charmer, worm, derbyshire, human sacrifice, paganism, archaeologist, monastery, folk horror",1988,"['Amanda Donohoe', 'Hugh Grant', 'Catherine Oxenberg', 'Peter Capaldi', 'Sammi Davis', 'Stratford Johns', 'Paul Brooke', 'Imogen Claire', 'Chris Pitt', 'Gina McKee', 'Christopher Gable', 'Lloyd Peters', 'Miranda Coe', 'Linzi Drew', 'Caron Anne Kelly', ""Fiona O'Connor"", 'Caroline Pope', 'Elisha Scott', 'Tina Shaw', 'Paul Easom', 'James Hicks', 'David Kiernan', 'Matthew King', 'Ross Murray', 'Andy Norman', 'Bob Smith', 'Jackie Russell', 'Ken Russell']","['horror', 'mythology', 'seduction']",Ken Russell
6849,6849,12780,Iron Monkey,1993-09-03,14681661,90,False,11000000,"Iron Monkey is a Hong Kong variation of Robin Hood. Corrupt officials of a Chinese village are robbed by a masked bandit known as ""Iron Monkey"", named after a benevolent deity. When all else fails, the Governor forces a traveling physician into finding the bandit.",13.422,/gLELnixQLunQOTm9PCpNRxrhU58.jpg,"['Action', 'Crime', 'Drama']","martial arts, kung fu, secret identity, robin hood, iron monkey",1993,"['Yu Rongguang', 'Donnie Yen', 'Jean Wang Ching-Ying', 'Angie Tsang Sze-Man', 'Yen Shi-Kwan', 'James Wong Jim', 'Yuen Shun-Yi', 'Hsiao Ho', 'Lee Fai', 'Chun Kwai-Bo', 'Chan Siu-Wah', 'Mandy Chan Chi-Man', 'Alex Yip Choi-Nam', 'Cheung Fung-Lei', 'Sze Mei-Yee', 'William Duen Wai-Lun', 'Tang Tai-Wo', 'Wong Kim-Bun', 'Patrick Ling Chi-Hung', 'Dion Lam', 'Wong Kim-Wai', 'Yuen Gam-Fai', 'Jack Wong Wai-Leung', 'Tony Ling Chi-Wah', 'Lam Chi-Tai']","['martial arts', 'justice', 'heroism']",Yuen Woo-Ping
6850,6850,5491,Battlefield Earth,2000-05-12,29000000,117,False,73000000,"In the year 3000, man is no match for the Psychlos, a greedy, manipulative race of aliens on a quest for ultimate profit. Led by the powerful Terl, the Psychlos are stripping Earth clean of its natural resources, using the broken remnants of humanity as slaves. What is left of the human race has descended into a near primitive state. After being captured, it is up to Tyler to save mankind.",13.416,/wXCRuBHdJ5aTFQdsuGJFXNdo79T.jpg,"['Action', 'Adventure', 'Comedy', 'Science Fiction']","based on novel or book, dystopia, post-apocalyptic future, mining, fighter jet, alien invasion, scientology, cavemen, bureaucrat, city ruin, distressing, inflammatory, matter of fact",2000,"['John Travolta', 'Barry Pepper', 'Forest Whitaker', 'Kim Coates', 'Sabine Karsenti', 'Christian Tessier', 'Sylvain Landry', 'Michael Byrne', 'Richard Tyson', 'Christopher Freeman', 'Shaun Austin-Olsen', 'Tim Post', 'Earl Pastko', 'Michel Perron', 'Andy Bradshaw', 'Tait Ruppert', 'Kelly Preston', 'Marie-Josée Croze', 'Andrew Campbell']","['sci-fi', 'rebellion', 'dystopia']",Roger Christian
6851,6851,2246,Malice,1993-09-29,46405336,107,False,20000000,"A tale about a happily married couple who would like to have children. Tracy teaches infants, Andy's a college professor. Things are never the same after she is taken to hospital and operated upon by Jed, a ""know all"" doctor.",13.413,/oQoe4eIzDjQSSqGvLgJFjXtEkNv.jpg,['Thriller'],"married couple, insurance fraud, boarder, desire to have children",1993,"['Alec Baldwin', 'Nicole Kidman', 'Bill Pullman', 'Bebe Neuwirth', 'George C. Scott', 'Anne Bancroft', 'Peter Gallagher', 'Josef Sommer', 'Tobin Bell', 'William Duff-Griffin', 'Debrah Farentino', 'Gwyneth Paltrow', 'David Bowe', 'Diana Bellamy', 'Michael Hatt', 'Paula Plum', 'Sara Melson', 'Ken Cheeseman', 'Richard Rho', 'Joshua Malina', 'Christine Wheeler', 'Sharon Albright', 'Tom Kemp', 'Robin Joss', 'Patricia Dunnock', 'Brenda Strong', 'Michael Bofshever', 'Laura Langdon', 'David Candreva', 'Ann Cusack']","['suspense', 'deception', 'drama']",Harold Becker
6852,6852,12138,3000 Miles to Graceland,2001-02-23,18720175,125,False,62000000,"It was an ingenious enough plan: rob the Riviera Casino's count room during an Elvis impersonator convention. But Thomas Murphy decided to keep all the money for himself and shot all his partners, including recently-freed ex-con Michael Zane. With $3.2 million at stake, the Marshals Service closing in, Michael must track down Murphy.",13.412,/nJgr5sGoXnsgZ0EVt80i6X9dQiA.jpg,"['Action', 'Adventure', 'Comedy', 'Crime', 'Thriller']","prison, robbery, casino, submachine gun, kidnapping, mass murder, dark comedy, trial, betrayal, las vegas, disguise, death, duringcreditsstinger",2001,"['Kurt Russell', 'Kevin Costner', 'Courteney Cox', 'Christian Slater', 'Kevin Pollak', 'David Arquette', 'Jon Lovitz', 'Howie Long', 'Thomas Haden Church', 'Bokeem Woodbine', 'Ice-T', 'David Kaye', 'Louis Lombardi', 'Shawn Michael Howard', 'Michael Kopsa', 'Daisy McCrackin', 'Sharron Leigh', 'J. Winston Carroll', 'Paul Anka', 'Eric James', 'Kim Hawthorne', 'Gianni Russo', 'Christine Chatelain', 'Campbell Lane', 'Doug Abrahams', 'Frank C. Turner', ""Robert 'Bobby Z' Zajonc"", 'Susse Budde', 'Kelly Carlson', 'Shawn Klush']","['heist', 'action', 'comedy']",Demian Lichtenstein
6853,6853,17473,The Room,2003-06-27,1752988,99,False,6000000,"Johnny is a successful banker with great respect for and dedication to the people in his life, especially his future wife Lisa. The happy-go-lucky guy sees his world being torn apart when his friends begin to betray him one-by-one.",13.412,/9QscHN4pXj6Ja1k7e1ZT4vWDGnr.jpg,"['Comedy', 'Drama', 'Romance']","infidelity, american football, friends, slice of life, drug pusher, relationship, love affair, gold digger, san francisco",2003,"['Tommy Wiseau', 'Juliette Danielle', 'Greg Sestero', 'Philip Haldiman', 'Carolyn Minnott', 'Robyn Paris', 'Kyle Vogt', 'Scott Holmes', 'Greg Ellery', 'Dan Janjigian', 'Piper Gore', 'Kari McDermott', 'Jennifer Vanderbliek', 'Bennett Dunn', 'Padma Moyer', 'Daron Jennings', 'Thomas E. Webster', 'Nora DeMarcky', 'Arelle Mitkowski', 'Frank Willey']","['drama', 'cult classic', 'melodrama']",Sandy Schklair
6854,6854,38157,Wishmaster 4: The Prophecy Fulfilled,2002-06-10,0,92,False,500000,"The unspeakable evil of the soul-devouring djinn rises again in this fourth electrifying installment of the unstoppable Wishmaster horror legacy! But now, as a host of new victims see their most nightmarish wishes come true, the world faces the ultimate demonic terror: an onslaught of multiple djinns hell-bent on destroying everything in their path!",13.412,/vSw6lky9e4jKy0QnzfEKQx5T6FT.jpg,"['Horror', 'Fantasy']","wheelchair, hell, sequel, death",2002,"['Tara Spencer-Nairn', 'Michael Trucco', 'Jason Thompson', 'John Novak', 'Victor Webster', 'John Benjamin Martin', 'Kimberly Huie', 'Mariam Bernstein', 'Mandy Hochbaum', 'Jennifer Pudavick', 'Ernesto Griffith', 'Rea Kavanagh', 'Janice Tetreault', 'Cara Bisiak', 'Aleks Paunovic', 'Darren Ross', 'Eric Blais', 'Jeremy Kozielec', 'Chad Bruce', 'Chris Angel']","['horror', 'supernatural', 'consequences']",Chris Angel
6855,6855,17880,Because of Winn-Dixie,2005-02-18,32645546,106,False,14000000,"A girl, abandoned by her mother when she was three, moves to a small town in Florida with her father. There, she adopts an orphaned dog she names Winn-Dixie. The bond between the girl and her special companion brings together the people in a small Florida town and heals her own troubled relationship with her father.",13.411,/oMUFS7HmIyTeui5xuoIEkPYTWC8.jpg,"['Family', 'Comedy', 'Drama']","dog, pets, father daughter relationship",2005,"['Jeff Daniels', 'AnnaSophia Robb', 'Cicely Tyson', 'Eva Marie Saint', 'Dave Matthews', 'Courtney Jines', 'Elle Fanning', 'Luke Benward', 'Nick Price', 'B.J. Hopper', 'Marca Price', 'Lenore Banks', 'John McConnell', 'Harland Williams', 'William Arthur Pitts', 'Enid Trotiner', 'Charles A. Daigle', 'Clarice H. Gauthreaux', 'Guy G. Gauthreaux', 'Jared Day', 'Sergio Kato', 'Matthew D. Miller', 'Ross Rouillier']","['friendship', 'family', 'healing']",Wayne Wang
6856,6856,10258,The Madagascar Penguins in a Christmas Caper,2005-09-23,0,11,False,0,"During the holiday season, when the animals of the Central Park Zoo are preparing for Christmas, Private, the youngest of the penguins notices that the Polar Bear is all alone. Assured that nobody should have to spend Christmas alone, Private goes into the city for some last-minute Christmas shopping. Along the way, he gets stuffed into a stocking",13.41,/gOVdfrRfzQjYwezOxIap13j05d8.jpg,"['Animation', 'Comedy', 'Family']","rescue, holiday, zoo, penguin, cartoon, madagascar, animal, christmas, short film, talking animal",2005,"['Tom McGrath', 'Chris Miller', 'Christopher Knights', 'John DiMaggio', 'Bill Fagerbakke', 'Rif Hutton', 'Holly Dorff', 'Hope Levy', 'Mitch Carter', 'Elisa Gabrielli', 'Sean Bishop', 'Richard Miro', 'Lynnanne Zager']","['comedy', 'holiday', 'animation']",Gary Trousdale
6857,6857,4483,The Return of Martin Guerre,1982-05-14,0,107,False,0,"Village of Artigat, southern France, summer 1542, during the reign of Francis I. Martin Guerre and Bertrande de Rols marry. A few years later, accused of having committed a robbery, Martin suddenly disappears. When, almost a decade later, a man arrives in Artigat claiming to be Martin, the Guerre family recognizes him as such; but doubts soon arise about his true identity.",13.407,/74wCIIhCSxX63nD9pu39QwgX6Lv.jpg,"['Drama', 'History']","husband wife relationship, court case, southern france, based on true story, historical figure, rural area, small village, french countryside, identity theft, 16th century",1982,"['Gérard Depardieu', 'Nathalie Baye', 'Maurice Barrier', 'Bernard-Pierre Donnadieu', 'Isabelle Sadoyan', 'Rose Thiéry', 'Chantal Deruaz', 'André Chaumeau', 'Maurice Jacquemont', 'Roger Planchon', 'Francis Arnaud', 'Philippe Babin', 'Axel Bogousslavsky', 'Valérie Chassigneux', 'Neige Dolsky', 'Adrien Duquesne', 'Gilbert Gilles', 'Tchéky Karyo', 'Jean-Claude Perrin', 'Dominique Pinon', 'Alain Recoing', 'René Bouloc', 'Alain Frérot', 'Stéphane Péan', 'André Delon', 'Danièle Loo', 'Marcel Champel', 'Sylvie Méda', 'Yvette Petit', 'Jean Juillac', 'Guy Bertrand', 'Jean-Paul Barathieu', 'Bruno Bentegeac', 'Pierre Bouchet', 'Francis Chevillon', ""André D'Avant-Cour"", 'Christian Fiter', 'Daniel Giraud', 'Guy Jacquet', 'Roger Payrot']","['identity', 'historical', 'drama']",Daniel Vigne
6858,6858,1420,Breakfast on Pluto,2005-09-03,3942254,128,False,0,"In the 1970s, a foundling lass, Patrick ""Kitten"" Braden, leaves her small Irish town for London in search of love, acceptance of her gender identity, and her long-lost mother.",13.407,/14tmdb1PiLNDZf3VD29S2nUKVV0.jpg,"['Drama', 'Comedy']","london, england, transvestism, transsexuality, loss of loved one, transvestite, 1970s, pregnancy, pastor, male homosexuality, ireland, lgbt",2005,"['Cillian Murphy', 'Stephen Rea', 'Brendan Gleeson', 'Liam Neeson', 'Eva Birthistle', 'Ruth Negga', 'Laurence Kinlan', 'Bryan Ferry', 'Ruth McCabe', 'Morgan Jones', 'Mary Coughlan', 'Conor McEvoy', 'Charlene McKenna', 'Seamus Reilly', 'Peter Owens', 'Emmet Lawlor McHugh', ""Bianca O'Connor"", 'Paraic Breathnach', 'Pat McCabe', 'Owen Roe', ""Rynagh O'Grady"", 'Steven Blount', 'Keith McCoy', 'Liam Cunningham', ""Liam O'Toole"", 'Peter Halpin', 'Peter Gowen', 'Mark Doherty', 'Gavin Friday', 'Tony Devlin', 'Kieran Lally', 'Stephen McDaid', 'Pete Reddy', 'Maurice Seezer', 'Lex Shrapnel', 'Eamonn Owens', 'Ciaran Nolan', 'Mary Ryan', 'Kathryn Pogson', 'Alan Moloney', 'Derek Elroy', 'Mal White', ""Paul O'Toole"", 'Antonia Campbell-Hughes', 'Janet Moran', 'Andy Moore', ""Marc O'Shea"", 'Rachel Donovan', 'Neil Jackson', 'Dominic Cooper', 'Alan Heyburn', 'Ian Hart', 'Steven Waddington', 'James Greene', 'Fiona Clarke', 'Gillian Johnson', 'Chris McHallem', 'Sid Young', 'Britta Smith', 'Doreen Keogh', 'Catherine Dunne', 'Tom Hickey', 'Mark Lambert']","['identity', 'journey', 'acceptance']",Neil Jordan
