,Unnamed: 0,id,title,release_date,revenue,runtime,adult,budget,overview,popularity,poster_path,genres,keywords,year,actors,emotions,director
5690,5690,37495,Four Lions,2010-05-07,6149356,97,False,967686,A group of Muslim men living in Sheffield hatch an inept plan to become suicide bombers.,15.871,/x4JzaRPXBs9wiHCe3e3ymXWuwfd.jpg,"['Comedy', 'Crime', 'Drama']","muslim, northern england, pacifism, dark comedy, satire, yorkshire, conservatism, terrorism, religious fundamentalism, suicide bomber, extremist, sheffield, england",2010,"['Riz Ahmed', 'Nigel Lindsay', 'Kayvan Novak', 'Adeel Akhtar', 'Arsher Ali', 'Preeya Kalidas', 'Benedict Cumberbatch', 'Julia Davis', 'Craig Parkinson', 'Wasim Zakir', 'Mohammad Aqil', 'Karl Seth', 'Waleed Elgadi', 'Alex Macqueen', 'Shameem Ahmad', 'Jonathan Maitland', 'Marcus Garvey', 'Darren Boyd', 'Kevin Eldon', 'Adil Mohammed Javed', 'Toby Longworth', 'Danny Ashok', 'Will Adamsdale']","['absurdity', 'tragedy', 'satire']",Joe Geary
5691,5691,11353,Bowfinger,1999-08-12,98625775,97,False,55000000,"On the verge of bankruptcy and desperate for his big break, aspiring filmmaker Bobby Bowfinger concocts a crazy plan to make his ultimate dream movie. Rallying a ragtag team that includes a starry-eyed ingenue, a has-been diva and a film studio gofer, he sets out to shoot a blockbuster featuring the biggest star in Hollywood, Kit Ramsey -- only without letting Ramsey know he's in the picture.",15.871,/iGuiFYEYwFkaRPl3FgLJYEm6dWq.jpg,['Comedy'],"movie business, celebrity, fame, hollywood, los angeles, california, filmmaking, famous actor",1999,"['Steve Martin', 'Eddie Murphy', 'Heather Graham', 'Christine Baranski', 'Jamie Kennedy', 'Barry Newman', 'Adam Alexi-Malle', 'Kohl Sudduth', 'Terence Stamp', 'Robert Downey Jr.', 'Alejandro Patiño', 'Alfred De Contreras', 'Ramiro Fabian', 'Johnny Sanchez', 'Claude Brooks', 'Kevin Scannell', 'John Prosky', 'Michael Dempsey', 'Walter Powell', 'Phill Lewis', 'Marisol Nichols', 'Nathan Anderson', 'Brogan Roche', 'John Cho', 'Lloyd Berman', 'Zaid Farid', 'Aaron Brumfield', 'Kevin Grevioux', 'Kimble Jemison', 'Alex Craig Mann', 'Laura Grady', 'Reamy Hall', 'Michelle Boehle', 'Kimberly Baum', 'Megan Denton', 'Janet Jaeger', 'Hope Wood', 'Addie Yungmee', 'Andrea Toste', 'Carl Kocis', 'Steve J. Termath', 'Alan Oliney']","['ambition', 'deception', 'humor']",Richard Patterson
5692,5692,334394,Baskin,2015-12-31,318155,97,False,350000,A squad of unsuspecting cops go through a trapdoor to Hell when they stumble upon a Black Mass in an abandoned building.,15.869,/oNiinNDzPUH0I3K4puCwrJa7Hn1.jpg,"['Horror', 'Crime', 'Thriller', 'Mystery']","cop, remake, madness",2015,"['Mehmet Cerrahoglu', 'Görkem Kasal', 'Ergun Kuyucu', 'Muharrem Bayrak', 'Fatih Dokgöz', 'Sabahattin Yakut', 'Berat Efe Parlar', 'Şevket Süha Tezel', 'Seyithan Özdemir', 'Sevinc Kaya', 'Mümin Kaar', 'Fulya Peker', 'Fadik Bülbül', 'Elif Dağ']","['nightmare', 'horror', 'madness']",Can Evrenol
5693,5693,20441,Messengers 2: The Scarecrow,2009-07-21,0,94,False,0,"The family man farmer John Rollins is stressed with his financial situation: the crows and the lack of irrigation are destroying his crop of corn; the bank is near closure of his mortgage; he does not have credit to fix the water pump or to buy seeds; and his marriage is in crisis and his wife Mary is giving too much attention to her friend Tommy. When John accidentally discovers a hidden compartment in the barn, he finds a creepy scarecrow but his son Michael makes him promise to destroy it. However, his neighbor Jude Weatherby visits him, gives a six-pack of beer to the abstemious John and convinces him to put the scarecrow in the cornfield. Out of the blue, the life of John changes: the crows die; the pump works again irrigating the land; and the banker responsible for the closure has an accident and dies. However, he feels that his land is possessed by something evil that is threatening his beloved family.",15.868,/xav4wnkLQiVAUTVxNPMKrXTBdkf.jpg,['Horror'],"farm, scarecrow, prequel, killer scarecrow",2009,"['Norman Reedus', 'Heather Stephens', 'Claire Holt', 'Richard Riehle', 'Darcy Fowers', 'Matthew McNulty', 'Laurence Belcher', 'Vladimir Yossifov', 'Todd Jensen', 'Michael McCoy', 'Kalina Green', 'Erbi Ago']","['terror', 'curse', 'dread']",Martin Barnewitz
5694,5694,306819,The Danish Girl,2015-11-27,64191523,119,False,15000000,"When Gerda Wegener asks her husband Einar to fill in as a portrait model, Einar discovers the person she's meant to be and begins living her life as Lili Elbe. Having realized her true self and with Gerda's love and support, Lili embarks on a groundbreaking journey as a transgender pioneer.",15.865,/mXZZIacI5FC8thzSC0lgQBQ2uAX.jpg,['Drama'],"paris, france, based on novel or book, denmark, copenhagen, denmark, artist, painter, historical fiction, art, transsexual, surgery, lgbt, 1920s, loving, intimate, gentle, sincere, sympathetic, tragic",2015,"['Eddie Redmayne', 'Alicia Vikander', 'Matthias Schoenaerts', 'Ben Whishaw', 'Sebastian Koch', 'Pip Torrens', 'Nicholas Woodeson', 'Amber Heard', 'Emerald Fennell', 'Adrian Schiller', 'Henry Pettigrew', 'Sophie Kennedy Clark', 'Miltos Yerolemou', 'Jake Graf', 'Tusse Silberg', 'Claus Bue', 'Peter Krag', 'Angela Curran', 'Richard Dixon', 'Paul Bigley', 'Nancy Crane', 'Nicola Sloane', 'Sonya Cullingford', 'Clare Fettarappa', 'Victoria Emslie', 'Raphael Acloque', 'Alexander Devrient', 'Philip Arditti', 'Cosima Shaw', 'Rebecca Root', 'Issy van Randwyck', 'Aisha Fabienne Ross', 'Holly Weston', 'Eleanor Hafner', 'Maya Lindh', 'Rebecca Clay', 'Erich Redman', 'Johanna Smitz']","['identity', 'love', 'pain']",Tom Hooper
5695,5695,12658,Someone Like You...,2001-03-30,38689940,97,False,23000000,"Jane Goodale has everything going for her. She's a producer on a popular daytime talk show, and is in a hot romance with the show's dashing executive producer Ray. But when the relationship goes terribly awry, Jane begins an extensive study of the male animal, including her womanizing roommate Eddie. Jane puts her studies and romantic misadventure to use as a pseudonymous sex columnist -- and becomes a sensation.",15.862,/j6lr8jE8hDgx75GeRRL1greDmkz.jpg,"['Comedy', 'Romance']","feminism, cohabitant, romantic comedy, man woman relationship, man between two women",2001,"['Ashley Judd', 'Greg Kinnear', 'Hugh Jackman', 'Marisa Tomei', 'Ellen Barkin', 'Catherine Dent', 'Laura Regan', 'Peter Friedman', 'Mireille Enos', 'Colleen Camp', 'Sue Jin Song', 'Donna Hanover', 'Veronica Webb', 'Carrie Navarro', 'Krysten Ritter', 'Julie Kavner', 'Nicolle Rochelle', 'Derick Karlton Grant', 'Matthew Coyle', 'Pon Yang', 'Keith Reddin']","['heartbreak', 'self-discovery', 'hope']",Mary A. Kelly
5696,5696,8986,Milk Money,1994-08-31,18137661,108,False,0,"Three young boys pool their money and pay V, a kindhearted prostitute, to strip for them. Afterward, she drives them home to the suburbs -- but then her car breaks down. It's just as well, though, because a mobster named Waltzer is after her, and V realizes the suburbs are the perfect place to hide. But things get a lot more complicated when V falls in love with Tom, a single father who is unaware of her real profession.",15.858,/od8SCOMLDq4iRYaHNqihQVn1SNE.jpg,"['Comedy', 'Romance']","prostitute, tree house, red-light district, stripper, make a match, mob boss, father son relationship",1994,"['Melanie Griffith', 'Ed Harris', 'Michael Patrick Carter', 'Malcolm McDowell', 'Anne Heche', 'Casey Siemaszko', 'Philip Bosco', 'Adam LaVorgna', 'Brian Christopher', 'Jessica Wesson', 'Amanda Sharkey', 'Margaret Nagle', 'Katie Powell', 'Tom Coop', 'Greg Procaccino', 'Andrea Afanador', 'John Alvin', 'Jack Arwine', 'Nathan Williams']","['humor', 'innocence', 'desire']",Frank Marshall
5697,5697,18215,Boxing Helena,1993-03-22,1796389,107,False,0,"A top surgeon is besotted with a beautiful woman who once rebuffed him. Unable to come to terms with life without her, he tries to convince her that they need each other. She has other ideas, but a horrific accident leaves her at his mercy.",15.855,/fL8b32TY3Cxe661kztmzz5AlIM0.jpg,"['Drama', 'Romance', 'Thriller', 'Horror']","dream, kidnapping, obsession, unrequited love, doctor, car accident, obsessive love, woman director, captivity",1993,"['Julian Sands', 'Sherilyn Fenn', 'Bill Paxton', 'Art Garfunkel', 'Betsy Clark', 'Kurtwood Smith', 'Nicolette Scorsese', 'Meg Register', 'Bryan Smith', 'Marla Levine', 'Kim Lentz', 'Lloyd T. Williams', 'Carl Mazzocone Sr.', 'Erik Shoaff', 'Lisa Oz', 'Ted Manson', 'Adele K. Schaeffer', 'Amy Levin', 'Matt Berry', 'D. Taylor Loeb']","['obsession', 'control', 'madness']",Jennifer Lynch
5698,5698,74018,A Cinderella Story: Once Upon a Song,2011-09-05,0,88,False,0,"In this modern telling of the classic tale, aspiring singer Katie Gibbs falls for the new boy at her performing arts high school. But Katie's wicked stepmother and stepsister are scheming to crush her dream before she can sing her way into his heart.",15.852,/awuuwPA8Hy9c5EH04xwkEXOSYiL.jpg,"['Comedy', 'Family', 'Romance']","high school, aspiring singer, orphan, teenage romance, modern fairy tale",2011,"['Lucy Hale', 'Freddie Stroma', 'Missi Pyle', 'Megan Park', 'Matt Lintz', 'Jessalyn Wanlim', 'Titus Makin Jr.', 'Alyson Stoner', 'Manu Narayan', 'Dikran Tulaine', 'Lucy Davenport', 'Onira Tarés', 'Julie Champagne', 'Ashley Kellogg', 'Adriana Leonard', 'Jackson Alvarez', 'Jazmia Battle', 'Taylor Bradley', 'Rusty Deats', 'Abby Earnest', 'Kiara Ely', 'Natalie Griffie', 'Shena Holley', 'George Lawrence Jr.', 'Asia Diamond Mason', 'Brittany McGinley', 'Abbey Moody', 'Leah Perison', 'Anna Rednour', 'Joy Spears', 'Brooklyne Willaimson', 'Khadijah Wilson']","['ambition', 'insecurity', 'romance']",Damon Santostefano
5699,5699,13121,Teeth,2008-01-18,2340110,94,False,2000000,"Dawn is an active member of her high-school chastity club but, when she meets Tobey, nature takes its course, and the pair answer the call. They suddenly learn she is a living example of the vagina dentata myth, when the encounter takes a grisly turn.",15.851,/32AEAcgy2hZbZn2zHRJDkW9QfGR.jpg,"['Comedy', 'Horror']",sexual assault,2008,"['Jess Weixler', 'John Hensley', 'Josh Pais', 'Hale Appleman', 'Lenny Von Dohlen', 'Vivienne Benesch', 'Ashley Springer', 'Nicole Swahn', 'Laila Liliana Garro', 'Adam Wagner', 'Hunter Ulvog', 'Ava Ryen Plumb', 'Trent Moore', 'Mike Yager', 'Nathan Parsons', 'Paul Galvan', 'Kasey Kitzmiller', 'Taylor Sheppard', 'Frank G. Curcio', 'Lana Dieterich', 'Carter Doyle', 'Denia Ridley', 'Kiri Weatherby', 'Michael Swanner', 'Andra Millian', 'Tom Byrne']","['horror', 'empowerment', 'shock']",Kathie Tull
5700,5700,99,All About My Mother,1999-04-16,67872296,101,False,8272296,"Following the tragic death of her teenage son, Manuela travels from Madrid to Barcelona in an attempt to contact the long-estranged father the boy never knew. She reunites with an old friend, an outspoken transgender sex worker, and befriends a troubled actress and a pregnant, HIV-positive nun.",15.851,/hjQhzhkGYXPNM96k0mOgob6HMmn.jpg,"['Comedy', 'Drama']","drug abuse, barcelona, spain, transvestism, transplantation, madrid, spain, transsexuality, birthday, autograph, friends, lgbt, melodrama",1999,"['Cecilia Roth', 'Marisa Paredes', 'Candela Peña', 'Antonia San Juan', 'Penélope Cruz', 'Rosa María Sardà', 'Fernando Fernán Gómez', 'Fernando Guillén', 'Toni Cantó', 'Eloy Azorín', 'Carlos Lozano', 'Manuel Morón', 'José Luis Torrijo', 'Juan José Otegui', 'Carmen Balagué', 'Malena Gutiérrez', 'Yael Barnatán', 'Carme Fortuny', 'Patxi Freytez', 'Juan Marquez', 'Michel Ruben', 'Daniel Lanchas', 'Rosa Manaut', 'Carlos García Cambero', 'Agustín Almodóvar', 'Paz Sufrategui', 'Lola García', 'Esther García', 'Inma Subirà', 'Cayetana Guillén Cuervo', 'Alexia Pardo', 'Lluís Pasqual', 'Fito Páez']","['grief', 'identity', 'love']",Pedro Almodóvar
5701,5701,11059,House of the Dead,2003-04-11,13818181,90,False,12000000,"Set on an island off the coast, a techno rave party attracts a diverse group of college coeds and a Coast Guard officer. Soon, they discover that their X-laced escapades are to be interrupted by zombies and monsters that attack them on the ground, from the air, and in the sea, ruled by an evil entity in the House of the Dead... Prequel to the House of the Dead video games.",15.847,/lI6UBnxwHztggSq8PhLibdOe2Nd.jpg,"['Horror', 'Action', 'Thriller']","island, rave, based on video game",2003,"['Jonathan Cherry', 'Tyron Leitso', 'Clint Howard', 'Ona Grauer', 'Sonya Salomaa', 'Ellie Cornell', 'Erica Durance', 'Michael Eklund', 'Jürgen Prochnow', 'Will Sanderson', 'Kira Clavell', 'Enuka Okuma', 'David Palffy', 'Steve Byers', 'Birgit Stein', 'Jay Brazeau', 'Adam J. Harrington', 'Elisabeth Rosen', 'Mashiah Vaughn-Hulbert', 'Bif Naked', 'Penny Phang', 'Colin Lawrence', 'Ben Derrick', 'Kris Pope', 'Anthony Timpone', 'Christoph Nuehlen', 'Steven Kriozere', 'Pam McCartney']","['terror', 'survival', 'chaos']",Uwe Boll
5702,5702,81836,To Rome with Love,2012-04-20,73244881,111,False,17000000,"Four tales unfold in the Eternal City: While vacationing in Rome, architect John encounters a young man whose romantic woes remind him of a painful incident from his own youth; retired opera director Jerry discovers a mortician with an amazing voice, and he seizes the opportunity to rejuvenate his own flagging career; a young couple have separate romantic interludes; a spotlight shines on an ordinary man.",15.847,/zQvitRPoq0UdoNrFZR0xQBvQIf6.jpg,"['Comedy', 'Romance']","rome, italy, anthology, expatriate, episodic",2012,"['Woody Allen', 'Roberto Benigni', 'Penélope Cruz', 'Alec Baldwin', 'Judy Davis', 'Jesse Eisenberg', 'Greta Gerwig', 'Elliot Page', 'Alessandro Tiberi', 'David Pasquesi', 'Lynn Swanson', 'Alison Pill', 'Augusto Fornari', 'Mariano Rigillo', 'Gianmarco Tognazzi', 'Riccardo Scamarcio', 'Alessandra Mastronardi', 'Ornella Muti', 'Antonio Albanese', 'Flavio Parenti', 'Sergio Solli', 'Vinicio Marchioni', 'Monica Nappo', 'Duccio Camerini', 'Lina Sastri', 'Gabriele Rapone', 'Giuseppe Pambieri', 'Ruggero Cara', 'Maria Rosaria Omaggio', 'Giacomo Fadda', 'Corrado Fortuna', 'Marta Zoffoli', 'Pierluigi Marchionne', 'Fabio Massimo Bonini', 'Carol Alt', 'Edoardo Leo', 'Donatella Finocchiaro', 'Nusia Gorgone', 'Antonino Bruschetta', 'Carlo Luca De Ruggieri', 'Giuliano Gemma', 'Fabio Armiliato', 'Ilaria Serrato', 'Cristiana Palazzoni', 'Giovanni Esposito', 'Isabella Ferrari', 'Lino Guanciale', 'Cecilia Capriotti', 'Marina Rocco', 'Roberto Della Casa', 'Ariella Reggio', 'Gustavo Frigerio', 'Simona Caparrini', 'Massimo Ferroni', 'Alessandro Procoli', 'Paolo De Vita', 'Rita Cammarano', 'Francesco De Vito', 'Margherita Vicario', 'Rosa Di Brigida', 'Maurizio Argentieri', 'Anna Teresa Rossini', 'Gaetano Amato', 'Antonio Rampino', 'Camilla Pacifico', 'Alberto Mangiante', 'Massimo De Lorenzo', 'Alessio Zucchini', 'Alessandro Tallarida', 'Luca Calvani', 'Maricel Álvarez', 'Mariella Milani', 'Roberta Ronconi', 'Brunella Matteucci', 'Sergio Bini Bustric', 'Margherita Di Rauso', 'Federica Corti', 'Matteo Bonetti', 'Antonio Taschini', 'Vinicio Cecere']","['whimsy', 'romance', 'humor']",Woody Allen
5703,5703,14392,The Warlords,2007-12-12,0,126,False,40000000,"A heroic tale of three blood brothers and their struggle in the midst of war and political upheaval. It is based on ""The Assassination of Ma,"" a Qing Dynasty (1644-1911) story about the killing of general Ma Xinyi.",15.846,/9sAWyaASakMW9f3LSXK8Br3RCED.jpg,"['Action', 'Drama', 'History']","assassin, civil war, general, brother, dynasty, blood brother, 19th century",2007,"['Jet Li', 'Andy Lau', 'Takeshi Kaneshiro', 'Xu Jinglei', 'Wei Zongwan', 'Ku Pao-Ming', 'Wang Kuirong', 'Zhou Bo', 'Guo Xiaodong', 'Shi Zhaoqi', 'Peng Guo', 'Ding Kai', 'Yu Ailei', 'Sun Jian', 'Wong Dungdung', 'Tao Hai', 'Wang Xichao', 'Wong Hau-Wan', 'Li Chongxiao', 'Jacky Heung', 'Zhang You']","['betrayal', 'brotherhood', 'tragedy']",Peter Chan
5704,5704,110416,Song of the Sea,2014-09-06,857522,93,False,0,"The story of the last Seal Child’s journey home. After their mother’s disappearance, Ben and Saoirse are sent to live with Granny in the city. When they resolve to return to their home by the sea, their journey becomes a race against time as they are drawn into a world Ben knows only from his mother’s folktales. But this is no bedtime story; these fairy folk have been in our world far too long. It soon becomes clear to Ben that Saoirse is the key to their survival.",15.844,/3DBX7QOEzWPNcDhqXInk6GBEvhK.jpg,"['Family', 'Animation', 'Fantasy']","fairy tale, lighthouse, folk music, lighthouse keeper   , swimming, dog, seal (animal), irishman, folklore, selkie, irish music, underwater cave, irish folklore",2014,"['David Rawle', 'Brendan Gleeson', 'Lisa Hannigan', 'Fionnula Flanagan', ""Lucy O'Connell"", 'Jon Kenny', 'Pat Shortt', ""Colm Ó'Snodaigh"", 'Liam Hourican', 'Kevin Swierszcz', 'Will Collins', 'Paul Young']","['wonder', 'loss', 'family']",Tomm Moore
5705,5705,2155,Reindeer Games,2000-02-25,32168970,124,False,42000000,"After assuming his dead cellmate's identity to get with his girlfriend, an ex-con finds himself the reluctant participant in a casino heist.",15.843,/mj9OYd0bL6iGcrk53G6981OCICG.jpg,"['Thriller', 'Action', 'Crime']","prison, small town, robbery, casino, villainess, manipulation, role reversal, extramarital affair, voyeurism, christmas",2000,"['Ben Affleck', 'Charlize Theron', 'Gary Sinise', 'Dennis Farina', 'Clarence Williams III', 'Danny Trejo', 'Donal Logue', 'James Frain', 'Isaac Hayes', 'Ashton Kutcher', 'Dana Stubblefield', 'Tom Heaton', 'Hrothgar Mathews', 'Mark Acheson', 'Enuka Okuma', 'Michael Sunczyk', 'Douglas Arthurs', 'Dean Wray', 'Ron Sauvé', 'Ron Jeremy', 'Lonny Chapman', 'Robyn Driscoll', 'Alonso Oyarzun', 'Ron Perkins', 'Gordon Tootoosis', 'Lee Jay Bamberry', 'Paula Shaw', 'Don S. Williams', 'Michael Puttonen', 'Ken Camroux-Taylor', 'Jimmy Herman', 'Govindini Murty', 'Larry Lam', 'James Hutson']","['deception', 'suspense', 'revenge']",John Frankenheimer
5706,5706,14202,The Painted Veil,2006-12-09,26910847,125,False,19400000,"A British medical doctor fights a cholera outbreak in a small Chinese village, while also being trapped at home in a loveless marriage to an unfaithful wife.",15.842,/k41IvHDLgZO2ae7RuU77wQjScIj.jpg,"['Romance', 'Drama']","infidelity, china, based on novel or book, shanghai, china, nun, cholera, foreign aid, doctor, epidemic, convent (nunnery), loveless marriage, 1920s, bacteriologist",2006,"['Edward Norton', 'Naomi Watts', 'Liev Schreiber', 'Toby Jones', 'Diana Rigg', 'Anthony Wong', 'Yu Xia', 'Juliet Howland', 'Ian Renwick', 'Li Bin', 'Zoe Telford', 'Marie-Laure Descoureaux', 'Lorraine Laurence', 'Maggie Steed', 'Li Feng', 'Yan Lü', 'Catherine An', 'Bill Marcus', 'Maurice Herschtal', 'Shobauro Hiratsuka', 'John Cann', 'Yin Qing', 'Alan David', 'Sally Hawkins']","['forgiveness', 'redemption', 'isolation']",John Curran
5707,5707,2103,Solaris,2002-11-27,30002758,99,False,47000000,A troubled psychologist is sent to investigate the crew of an isolated research station orbiting a bizarre planet.,15.841,/drdrB1hEZmzFlK1xtW5HMxK3LUJ.jpg,"['Drama', 'Science Fiction', 'Mystery']","loss of sense of reality, based on novel or book, loss of loved one, clone, hallucination, space travel, grief, space, psychologist, astronaut, space station, unusual phenomena",2002,"['George Clooney', 'Natascha McElhone', 'Viola Davis', 'Jeremy Davies', 'Ulrich Tukur', 'Michael Ensign', 'John Cho', 'Morgan Rusler', 'Shane Skelton', 'Donna Kimball', 'Elpidia Carrillo', 'Kent Faulcon', 'Lauren Cohn', 'Jennie Baek', 'Tony Clemons', 'Annie Morgan', 'Antonio Rochira', 'Jude S. Walko']","['melancholy', 'grief', 'mystery']",Steven Soderbergh
5708,5708,66,Absolute Power,1997-02-14,50068310,121,False,50000000,"A master thief coincidentally is robbing a house where a murder—in which the President of The United States is involved—occurs in front of his eyes. He is forced to run, while holding evidence that could convict the President.",15.84,/xX9gmwtnTi0Y8WcTF7Jsg9Hdp6W.jpg,"['Crime', 'Drama', 'Action']","daughter, rape, assassination, usa president, washington dc, usa, government, corruption, the white house, politics, secret service, u.s. secret service agent",1997,"['Clint Eastwood', 'Gene Hackman', 'Ed Harris', 'Laura Linney', 'Judy Davis', 'Scott Glenn', 'Dennis Haysbert', 'E.G. Marshall', 'Melora Hardin', 'Kenneth Welsh', 'Penny Johnson Jerald', 'Richard Jenkins', 'Mark Margolis', 'Elaine Kagan', 'Alison Eastwood', 'Yau-Gene Chan', 'George Orrison', 'Charles McDaniel', 'John Lyle Campbell', 'Kimber Eastwood', 'Eric Dahlquist Jr.', 'Jack Stewart Taylor', 'Joy Ehrlich', 'Robert Harvey']","['power', 'secrecy', 'justice']",Dodi Lee Rubenstein
5709,5709,46441,Mirrors 2,2010-10-18,0,86,False,0,"When Max, who is recovering from a traumatic accident, takes a job as a nighttime security guard, he begins to see visions of a young mysterious woman in the store's mirror.",15.838,/gDr5TaM129kUNwXkUUZ7Cha2CNn.jpg,"['Horror', 'Mystery', 'Fantasy']",death,2010,"['Nick Stahl', 'William Katt', 'Emmanuelle Vaugier', 'Lawrence Turner', 'Christy Carlson Romano', 'Evan Jones', 'Stephanie Honoré', 'Jon Michael Davis', 'Wayne Pére', 'Lance E. Nichols', 'Ann McKenzie', 'Jennifer Sipes']","['terror', 'guilt', 'supernatural']",Víctor García
5710,5710,193610,The Other Woman,2014-04-16,196781193,109,False,40000000,"After discovering her boyfriend is married, Carly soon meets the wife he's been cheating on. And when yet another affair is discovered, all three women team up to plot mutual revenge on the three-timing SOB.",15.837,/yHnbb6z8REuFIyBLT2Nj3MX54dY.jpg,"['Comedy', 'Romance']","infidelity, revenge, unfaithful boyfriend, extramarital affair, unfaithful husband",2014,"['Cameron Diaz', 'Leslie Mann', 'Kate Upton', 'Nikolaj Coster-Waldau', 'Don Johnson', 'Nicki Minaj', 'Taylor Kinney', 'David Thornton', 'Victor Cruz', 'Kenneth Maharaj', 'Alyshia Ochse', 'Madison McKinley', 'Olivia Culpo', 'Chelsea Turnbo', 'Brooke Stacy Mills', ""John 'B.J.' Bryant"", 'Raushanah Simmons', 'Cheryl Horne', 'Ruisdael Cintron', 'Virginia Cassavetes', 'Nancy De Mayo', 'Nina Barry', 'Colin Bannon', 'Zac La Roc', 'Jennifer Lee Crowl', 'Katherine Andreassen', 'Daniel Reton', 'Tony Costa', 'Alex Stebbins', 'Yueh Hwa Chan', 'Meki Saldana', ""Craig 'Radio Man' Castaldo"", 'Sarah Tymon', 'Jude Donnelly', 'Gordon B. Andrews', 'Cucu Diamantes', 'Brittany Binger', 'Amanda Li Paige', 'Ashley Cusato', 'Leanna Bartlett', 'Nicole Domecus', 'Cynthia Basinet', 'Andrés Levin']","['betrayal', 'humor', 'revenge']",Nick Cassavetes
5711,5711,2295,Clerks II,2006-07-21,26888376,97,False,5000000,"A calamity at Dante and Randall's shops sends them looking for new horizons - but they ultimately settle at Mooby's, a fictional Disney-McDonald's-style fast-food empire.",15.836,/cLSW0nW94XT0DmBS69ublcLfQ9c.jpg,['Comedy'],"aftercreditsstinger, duringcreditsstinger, day in a life",2006,"[""Brian O'Halloran"", 'Jeff Anderson', 'Rosario Dawson', 'Jason Mewes', 'Kevin Smith', 'Jennifer Schwalbach Smith', 'Ben Affleck', 'Trevor Fehrman', 'Scott Mosier', 'Jason Lee', 'Jake Richardson', 'Ethan Suplee', 'Harley Quinn Smith', 'Kevin Weisman', 'Wanda Sykes', 'Zak Knutson', 'Kevin Michael Richardson', 'Walt Flanagan', 'Earthquake', 'Grace Smith', 'Ryan Thomas', 'Rebecca Lin', 'Christopher Martinez', 'Tracy Phillips', 'Joel Manning']","['absurdity', 'nostalgia', 'friendship']",Kevin Smith
5712,5712,15019,I Could Never Be Your Woman,2007-05-11,9576495,97,False,24000000,"Rosie, an ageing single mother, is helped by Mother Nature in experiencing love again through Adam, a charming young man. But matters complicate when her young daughter falls in love with a local boy.",15.834,/xNTnlokpkAww47QwVCNXge1likN.jpg,"['Comedy', 'Drama', 'Romance']","assistant, sarcasm, diva, teen angst, falling in love, single mother, divorcee, tv show in film, first love, older woman younger man relationship, ex-husband ex-wife relationship, woman director, pre-teen, mother nature, professional woman, tv actor, tv show, actor, funny, tv show writer, physical attraction, tv producer",2007,"['Michelle Pfeiffer', 'Paul Rudd', 'Saoirse Ronan', 'Tracey Ullman', 'Stacey Dash', 'Fred Willard', 'Jon Lovitz', 'Sarah Alexander', 'Yasmin Paige', 'Graham Norton', 'David Mitchell', 'O-T Fagbenle', 'Rory Copus', 'Steve Pemberton', 'Henry Winkler', 'Twink Caplan', 'Ashley Lloyd', 'Wallace Shawn', 'Mackenzie Crook', 'Peter Polycarpou', 'Olivia Colman', 'Archie Panjabi', 'Ed Byrne', 'Chike Chan', 'Troy Gentile', 'Sally Kellerman', 'Phil Cornwell', 'Iddo Goldberg', 'Noah Lee Margetts', 'Jonathan Ryland', 'Simon Kunz', 'Victoria Chalaya', 'Doña Croll', 'Cassandra Bell', 'Sam Fusaro', 'Jennifer Sims', 'Joe Montana', 'Melanie Martin', 'Wallace Shawn', 'Kya Garwood', 'Erin Gavin', 'David Cassidy', 'Richard Nixon', 'Benito Mussolini', 'Rene Costa', 'Ronan Summers']","['romance', 'aging', 'insecurity']",Amy Heckerling
