,Unnamed: 0,id,title,release_date,revenue,runtime,adult,budget,overview,popularity,poster_path,genres,keywords,year,actors,emotions,director
3080,3080,567604,Once Upon a Deadpool,2018-12-11,0,118,False,0,"A kidnapped Fred Savage is forced to endure Deadpool's PG-13 rendition of Deadpool 2 as a Princess Bride-esque story that's full of magic, wonder & zero F's.",23.001,/5Ka49BWWyKMXr93YMbH5wLN7aAM.jpg,"['Comedy', 'Action', 'Adventure']","superhero, based on comic, christmas",2018,"['Ryan Reynolds', 'Josh Brolin', 'Morena Baccarin', 'Julian Dennison', 'Zazie Beetz', 'T.J. Miller', 'Leslie Uggams', 'Karan Soni', 'Brianna Hildebrand', 'Jack Kesy', 'Eddie Marsan', 'Shioli Kutsuna', 'Stefan Kapičić', 'Randal Reeder', 'Nikolai Witschl', 'Thayr Harris', 'Rob Delaney', 'Lewis Tan', 'Bill Skarsgård', 'Terry Crews', 'Brad Pitt', 'Paul Wu', 'Robert Maillet', 'Alan Tudyk', 'Matt Damon', 'Michasha Armstrong', 'Joe Doserro', 'Hayley Sales', 'Islie Hirvonen', 'Jagua Arneja', 'Gerry South', 'Mike Dopud', 'Luke Roessler', 'Andy Canete', 'Tanis Dolman', 'Eleanor Walker', 'Hunter Dillon', 'Sala Baker', 'Sonia Sunger', 'Paul Wernick', 'Rhett Reese', 'Abiola Uthman', 'Tony Bailey', 'David Cook', 'Alex Kliner', 'Elaine Kliner', 'David Leitch', 'Valencia Budijanto', 'Stefania Indelicato', 'Myfanwy Williams', 'Sam Armstrong', 'Alison Pickford', 'Paul Lazenby', 'Noah Beggs', 'Andrei Kovski', 'Alicia Morton', 'Fred Savage', 'Andre Tricoteux', 'James McAvoy', 'Nicholas Hoult', 'Evan Peters', 'Tye Sheridan', 'Alexandra Shipp', 'Kodi Smit-McPhee']","['satire', 'heroism', 'family']",David Leitch
3081,3081,6957,The 40 Year Old Virgin,2005-08-11,177378645,116,False,26000000,"Andy Stitzer has a pleasant life with a nice apartment and a job stamping invoices at an electronics store. But at age 40, there's one thing Andy hasn't done, and it's really bothering his sex-obsessed male co-workers: Andy is still a virgin. Determined to help Andy get laid, the guys make it their mission to de-virginize him. But it all seems hopeless until Andy meets small business owner Trish, a single mom.",22.984,/mVeoqL37gzhMXQVpONi9DGOQ3tZ.jpg,"['Comedy', 'Romance']","first time, virgin, male friendship, co-workers relationship, poker game, sex comedy, virginity, sex",2005,"['Steve Carell', 'Catherine Keener', 'Paul Rudd', 'Romany Malco', 'Seth Rogen', 'Elizabeth Banks', 'Leslie Mann', 'Jane Lynch', 'Gerry Bednob', 'Shelley Malil', 'Kat Dennings', 'Jordan Masterson', 'Chelsea Smith', 'Jonah Hill', 'Erica Vittina Phillips', 'Marika Domińczyk', 'Mindy Kaling', 'Mo Collins', 'Gillian Vigman', 'Kimberly Page', 'Siena Goines', 'Charlie Hartsock', 'Nancy Carell', 'Cedric Yarbrough', 'David Koechner', 'Jeff Kahn', 'Nick Lashaway', 'Loren Berman', 'Julian Foster', 'Loudon Wainwright III', 'Lee Weaver', 'Gloria Helena Jones', 'Jazzmun', 'Miki Mia', 'Denise Meyerson', 'Shannon Bradley', 'Brianna Brown', 'Liz Carey', 'Elizabeth DeCicco', 'Hilary Shepard', 'Barret Swatek', 'Carla Gallo', 'Michael Bierman', 'Marisa Guterman', 'Stormy Daniels', 'Kevin Hart', 'Wayne Federman', 'Ron Marasco', 'Joseph T. Mastrolia', 'Kate Luyben', 'Joe Nuñez', 'Matthew McKane', 'Rose Abdoo', 'Steve Bannos', 'Brooke Hamlin', 'Miyoko Shimosawa', 'Marilyn Dodds Frank', 'Ann Christine', 'Brandon Killham', 'Nicole Randall Johnson', 'Suzy Nakamura', 'Jenna Fischer', 'Stephanie Lemelin', 'Jamie Elle Mann', 'Leah McCormick', 'Samantha J. Reese', 'Brittney Skye', 'Wyatt Smith', 'Kira Turnage', 'Penny Vital', 'Christa Nicole Wells']","['insecurity', 'hope', 'comedy']",Judd Apatow
3082,3082,38810,Dogtooth,2009-06-01,110197,98,False,275576,"Three teenagers are confined to an isolated country estate that could very well be on another planet. The trio spend their days listening to endless homemade tapes that teach them a whole new vocabulary. Any word that comes from beyond their family abode is instantly assigned a new meaning. Hence 'the sea' refers to a large armchair and 'zombies' are little yellow flowers. Having invented a brother whom they claim to have ostracized for his disobedience, the uber-controlling parents terrorize their offspring into submission.",22.973,/7nLuUGlH12cegPfR84QX4xIIH9k.jpg,['Drama'],"hostage, paranoia, dysfunctional family, incest, mental illness, tooth, sexual awakening, fantasy world, isolated house, home education, nordic",2009,"['Christos Stergioglou', 'Michele Valley', 'Hristos Passalis', 'Angeliki Papoulia', 'Mary Tsoni', 'Anna Kalaitzidou', 'Steve Krikris', 'Sissi Petropoulou', 'Alexander Voulgaris']","['control', 'repression', 'isolation']",Yorgos Lanthimos
3083,3083,51828,One Day,2011-03-02,59389433,107,False,15000000,"A romantic comedy centered on Dexter and Emma, who first meet during their graduation in 1988 and proceed to keep in touch regularly. The film follows what they do on July 15 annually, usually doing something together.",22.97,/xGclxjTTbOdR18zqoldGTjfzSkl.jpg,"['Drama', 'Romance']","based on novel or book, comedian, love, author, writer, divorce, friends in love, woman director, missed opportunity",2011,"['Anne Hathaway', 'Jim Sturgess', 'Tom Mison', 'Jodie Whittaker', 'Rafe Spall', 'Patricia Clarkson', 'Ken Stott', 'Romola Garai', 'Matt Berry', 'Toby Regbo', 'Matthew Beard', 'Georgia King', 'Heida Reed', 'Joséphine de la Baume', 'Amanda Fairbank-Hynes', 'Diana Kent', 'James Laurenson', 'Sébastien Dupuis', 'Lorna Gayle', 'Emilia Jones', 'Eden Mengelgrein', 'Kayla Mengelgrein', 'Clara Paget', 'Tim Key', 'Thomas Arnold', 'Gil Alma', 'David Ajala', 'Ukweli Roach', 'Phoebe Fox', 'Joanna Ampil', 'Augustina Amoa']","['romance', 'fate', 'loss']",Lone Scherfig
3084,3084,12405,Slumdog Millionaire,2008-11-12,378410542,120,False,15000000,"A teenager reflects on his life after being accused of cheating on the Indian version of ""Who Wants to be a Millionaire?"".",22.969,/5leCCi7ZF0CawAfM5Qo2ECKPprc.jpg,"['Drama', 'Romance']","based on novel or book, slum, cheating, suspicion, mumbai (bombay), india, game show, quiz, orphan, duringcreditsstinger, taj mahal, india",2008,"['Dev Patel', 'Freida Pinto', 'Madhur Mittal', 'Anil Kapoor', 'Mahesh Manjrekar', 'Saurabh Shukla', 'Irrfan Khan', 'Ankur Vikal', 'Tanay Chheda', 'Ayush Mahesh Khedekar', 'Ashutosh Lobo Gajiwala', 'Azharuddin Mohammed Ismail', 'Tanvi Ganesh Lonkar', 'Rubina Ali', 'Raj Zutshi', 'Jeneva Talwar', 'Sharib Hashmi', 'Mia Drake', 'Shruti Seth', 'Anjum Sharma', 'Jira Banjara', 'Sheikh Wali', 'Sanchita Choudhary', 'Himanshu Tyagi', 'Virendra Chatterjee', 'Feroze Khan', 'Sunil Kumar Agrawal', 'Virender Kumar', 'Devesh Rawal', 'Tiger', 'Chirag Parmar', 'Nazneen Shaikh', 'Farzana Ansari', 'Anupam Shyam', 'Salim Chaus', 'Harvinder Kaur', 'Narendra Singh Bhati', 'Satya Mudgal', 'Janet de Vigne', 'William Relton', 'David Gilliam', 'Kinder Singh', 'Christine Matovich Singh', 'Thomas Lehmkuhl', 'Siddesh Patil', 'Najma Shaikh', 'Saeeda Shaikh', 'Alka Satpute', 'Tabassum Khan', 'Sitaram Panchal', 'Nigel Caesar', 'Ajit Pandey', 'Kedar Thapar', 'Amit Leonard', 'Rajesh Kumar', 'Sagar Ghopalkar', 'Pradeep Solanki', 'Abdul Hamid Shaikh', 'Dheeraj Waghela', 'Arfi Lamba', 'Taira Colah', 'Varun Bagri', 'Ankur Tewari', 'Sarfaraz Khan', 'Syed Fazal Hussain', 'Umar Khan', 'Imran Hasnee', 'Homai Billimoria', 'Udayan Baijal', 'Sandeep Kaul', 'Rufee Ahmed', 'Rhea Lawyer', 'Deepali Dalvi', 'Anisha Nagar', 'Farrah Shaikh', 'Mamta Sharma', 'Neha M. Khatarawalla', 'Tanya Singh', 'Anand Tiwari', 'Faezeh Jalali', 'Meghana Jhalani', 'Rupali Mehra', 'Anju Singh', 'Saurabh Agarwal', 'Mark Boucher', 'Andre Nel', 'Yuvraj Singh', 'Sachin Tendulkar', 'Amitabh Bachchan']","['hope', 'love', 'resilience']",Danny Boyle
3085,3085,334,Magnolia,1999-12-10,48451803,189,False,37000000,"An epic mosaic of many interrelated characters in search of happiness, forgiveness, and meaning in the San Fernando Valley.",22.963,/tpfC325Jk6S38VTe5dDWjWtoyxr.jpg,['Drama'],"dying and death, daughter, farewell, regret, unsociability, chance, becoming an adult, parent child relationship, suicide attempt, loss of loved one, child prodigy, reconciliation, san fernando valley, multiple storylines, frog",1999,"['Tom Cruise', 'Philip Baker Hall', 'Philip Seymour Hoffman', 'Julianne Moore', 'William H. Macy', 'John C. Reilly', 'Melora Walters', 'Jeremy Blackman', 'Jason Robards', 'Melinda Dillon', 'Michael Bowen', 'April Grace', 'Ricky Jay', 'Emmanuel Johnson', 'Pat Healy', 'Genevieve Zweig', 'Mark Flanagan', 'Neil Flynn', 'Rod McLachlan', 'Allan Graf', 'Patton Oswalt', ""Raymond 'Big Guy' Gonzales"", 'Brad Hunt', 'Jim Meskimen', ""Chris O'Hara"", 'Clement Blake', 'Frank Elmore', 'John Kraft Seitz', 'Cory Buck', 'Tim Soronen', 'Jim Ortlieb', 'Thomas Jane', 'Holly Houston', 'Benjamin Niedens', 'Veronica Hart', 'Missy Spell Tanner', 'James Kiriyama-Lem', 'Jake Cross', 'Charlie Scott Jr.', 'Juan Medrano', 'John Pritchett', 'Cleo King', 'Don McManus', 'Michael Shamus Wiles', 'Jason Andrews', 'John S. Davies', 'Kevin Breznahan', 'Miguel Pérez', 'Alfred Molina', 'David Masuda', 'Neil Pepe', 'Lionel Mark Smith', 'Annette Helde', 'Lynne Lerner', 'Felicity Huffman', 'Scott Burkett', 'Bob Brewer', 'Julie Brewer', 'Nancy Marston', 'Maurey Marston', 'Jamala Gaither', 'Danny Wells', 'Amy Brown', 'Eileen Ryan', 'Meagen Fay', 'Patricia Forte', 'Luis Guzmán', 'Patrick Warren', 'Orlando Jones', 'Virginia Pereira', 'Craig Kvinsland', 'Patricia Scanlon', 'Henry Gibson', 'Natalie Elizabeth Marston', 'Bobby Brewer', 'Clark Gregg', 'Art Frankel', 'Matt Gerald', 'Guillermo Melgarejo', 'Paul F. Tompkins', 'Mary Lynn Rajskub', 'Jim Beaver', 'Ezra Buzzington', 'Denise Woolfork', 'Michael Murphy', 'Robert Downey Sr.', 'William Mapother', 'Larry Ballard', 'Brett Higgins', 'Brian Higgins', 'Michael Lee Phillips Jr.', 'Lillian Adams', 'Steven Bush', 'Mike Massa', 'Dale Gibson', 'Scott Alan Smith', 'Paul Thomas Anderson', 'Miriam Margolyes', 'Bruno Angelico', 'Robert Bella', 'Greg Bronson', 'Douglas Busby', 'Marc Davies', 'Bruce Gregory', 'Phil Hawn', 'Spencer Kayden', 'Brian Kehew', 'Michael Laren', 'Aimee Mann', 'Tom Ohmer', 'Colleen Pelletier', 'Herb Santos Jr.', 'Tom Tangen']","['grief', 'chance', 'chaos']",Paul Thomas Anderson
3086,3086,565028,Candyman,2021-08-25,77411570,91,False,25000000,"Anthony and his partner move into a loft in the now gentrified Cabrini-Green. After a chance encounter with an old-timer exposes Anthony to the true story behind Candyman, he unknowingly opens a door to a complex past that unravels his own sanity and unleashes a terrifying wave of violence.",22.957,/ygyoaQ8bCp4kDcLc6SdP5GvqmDW.jpg,"['Horror', 'Mystery', 'Thriller']","sequel, murder, urban legend, bee, evil, mirror",2021,"['Yahya Abdul-Mateen II', 'Teyonah Parris', 'Colman Domingo', 'Nathan Stewart-Jarrett', 'Kyle Kaminsky', 'Vanessa Williams', 'Brian King', 'Miriam Moss', 'Rebecca Spence', 'Carl Clemons-Hopkins', 'Christiana Clark', 'Michael Hargrove', 'Rodney L Jones III', 'Ireon Roach', 'Breanna Lind', 'Heidi Grace Engerman', 'Sarah Lo', 'Ro White', 'Mark Montgomery', 'Torrey Hanson', 'Cassie Kramer', 'Sarah Wisterman', 'Cedric Mays', 'Alec Silver', 'Hannah Love Jones', 'J. Nicole Brooks', 'Pamela Jones', 'Genesis Denise Hale', 'Katherine Purdie', 'Tien Tran', 'Mike Geraghty', 'Aaron Crippen', 'Dan Fierro', 'Nadia Simms', 'Nancy Pender', 'Johnny Westmoreland', 'Guy Spencer', 'Daejon Staeker', 'Tony Todd', 'Virginia Madsen', 'Ben Marten']","['urban legend', 'fear', 'vengeance']",Nia DaCosta
3087,3087,853,Enemy at the Gates,2001-03-14,96976270,131,False,68000000,A Russian and a German sniper play a game of cat-and-mouse during the Battle of Stalingrad in WWII.,22.953,/9cSoNnB31hGY2mL78VT8mAbz6nR.jpg,"['Drama', 'War', 'History']","sniper, hero, winter, world war ii, stalingrad, based on true story, nazi officer, battle, bombing, death, 1940s, soviet propaganda, nikita khrushchev",2001,"['Jude Law', 'Joseph Fiennes', 'Rachel Weisz', 'Ed Harris', 'Bob Hoskins', 'Ron Perlman', 'Eva Mattes', 'Gabriel Thomson', 'Matthias Habich', 'Alexander Schwan', 'Lenn Kudrjawizki', 'Gennadi Vengerov', 'Dan van Husen', 'Ivan Shvedoff', 'Sophie Rois', 'Mario Bandi', 'Hans Martin Stier', 'Clemens Schick', 'Hendrik Arnst', 'Claudius Freyer', 'Dietmar Nieder', 'Bernd Lambrecht', 'Jim Dowdall', 'Maxim Kovalevski', 'Peter Silbereisen', 'Markus Majowski', 'Robert Stadlober', 'Gotthard Lange', 'Anna Böttcher', 'Holger Handtke', 'Marc Bischoff', 'Mark Zak', 'Thomas Petruo', 'Dmitri Alexandrov', 'David Pagel', 'Galina Dobberstein', 'Igor Rozinsky', 'Sergei Tokarev', 'Tom Wlaschiha', 'Marischka Schubarth', 'Natalya Bondar', 'Dana Cebulla', 'Piotr Papierz', 'Jarek Wozniak', 'Genia Makarov', 'Werner Daehn', 'Birol Ünel', 'Grigori Kofmann', 'Aleksei Nesterov', 'Vladimir Vilanov', 'Aleksei Volodin', 'Gennadi Tselbyansky', 'André Emanuel Kaminski', 'Michael Schenk', 'Jury Cooper', 'Manfred Witt', 'Arslan Kodirov', 'Axel Neumann', 'Morin Smole', 'Inna Samain', 'Keta Burowa', 'Toby Cockerell', 'Jürgen G.H. Hoppmann', 'Kay Hunsicker', 'Eddy Joseph', 'Martin Glyn Murray', 'Valentin Plătăreanu', 'Thomas Rösicke', 'Mikhail Matveev']","['sacrifice', 'duty', 'fear']",Jean-Jacques Annaud
3088,3088,16614,Adventureland,2009-04-03,17164820,107,False,9800000,"In the summer of 1987, a college graduate takes a 'nowhere' job at his local amusement park, only to find it's the perfect course to get him prepared for the real world.",22.949,/eeSJNAR1aWcgANq26KWIHm3cbyB.jpg,"['Comedy', 'Drama']","infidelity, amusement park, summer job, carny, marijuana joint, reconciliation, ticket booth, job seeking, leaving home, duringcreditsstinger, young adult, 1980s",2009,"['Jesse Eisenberg', 'Kristen Stewart', 'Martin Starr', 'Kristen Wiig', 'Bill Hader', 'Ryan Reynolds', 'Margarita Levieva', 'Jack Gilpin', 'Josh Pais', 'Wendie Malick', 'Mary Birdsong', 'Matt Bush', 'Paige Howard', 'Dan Bittner', 'Barret Hackney', 'Michael Zegen', 'Kimisha Renee Davis', 'Vanessa Hope', 'Kelsey Ledgin', 'Ryan McFarland', 'Moe Slinger', 'Todd Cioppa', 'Jesse Slinger', 'Jack Baldwin', 'Stephen Mast', 'Adam Kroloff', 'Kevin Breznahan', 'Marc Grapey', 'Andrew Ransom', 'Joe Sanderson', 'Cliff Chien', 'Russell Steinberg', 'Rob Orr', 'Eric Schaeffer', 'Gennaro DiSilvio', 'Alexis Ferrante', 'Joe Pawlenko', 'Zachary Palmer', 'Declan Baldwin', 'Ian Harding', 'Ashtin Petrella', 'Amy Landis', 'Janine Viola', 'Alana Hixson', 'Erin Cappiccie', 'Lisa Lamendola', 'Jackson Nunn']","['growing up', 'love', 'awkwardness']",Greg Mottola
3089,3089,339259,The Man with the Iron Heart,2017-05-25,4412639,120,False,32679734,"With the Third Reich at its peak in 1942, the Czech resistance in London plans the most ambitious military operation of WWII –  Anthropoid. Two young recruits are sent to Prague to assassinate the most ruthless Nazi leader – Reinhardt Heydrich, head of the SS, the Gestapo and the architect of the Final Solution.",22.945,/ZVQfCY2DgCjrm8w2saXvT8Ao3B.jpg,"['War', 'Action', 'History', 'Thriller']","assassination, based on novel or book, nazi, world war ii, operation anthropoid, czech history, assassination of reinhard heydrich (1942)",2017,"['Jason Clarke', 'Rosamund Pike', ""Jack O'Connell"", 'Jack Reynor', 'Mia Wasikowska', 'Stephen Graham', 'Thomas M. Wright', 'Barry Atsma', 'Geoff Bell', 'Enzo Cilenti', 'David Horovitch', 'Abigail Lawrie', 'David Rintoul', 'Ian Redford', 'Adam Nagaitis', 'Céline Sallette', 'Gilles Lellouche', 'Steve Evets', 'Noah Jupe', 'Volker Bruch', 'Oscar Kennedy', 'Vernon Dobtcheff', 'Paul Brennen', 'Luca Fiorilli', 'Krisztina Goztola', 'Lloyd Owen', 'Bart Edwards', 'Jim Sturgeon', 'Peter Sztojanov, Jr.', 'Álmos Előd']","['resistance', 'ideology', 'revenge']",Cédric Jimenez
3090,3090,3989,Team America: World Police,2004-10-10,50907422,97,False,32000000,"Team America World Police follows an international police force dedicated to maintaining global stability. Learning that dictator Kim Jong il is out to destroy the world, the team recruits Broadway star Gary Johnston to go undercover. With the help of Team America, Gary manages to uncover the plan to destroy the world. Will Team America be able to save it in time? It stars… Samuel L Jackson, Tim Robbins, Sean Penn, Michael Moore, Helen Hunt, Matt Damon, Susan Sarandon, George Clooney, Danny Glover, Ethan Hawke, Alec Baldwin… or does it?",22.931,/m1Q2VFe1DVVbjfu1LDZe7tlp9yb.jpg,"['Adventure', 'Action', 'Comedy']","egypt, government, france, paris, france, cairo, capitalism, loss of loved one, shotgun, war on terror, shipwreck, patriotism, pentagon, american dream, destroy, louvre museum, american  way of life, panama, damage, parody, failure, puppetry, eiffel tower, paris, global politics, mass destruction, agents",2004,"['Trey Parker', 'Matt Stone', 'Kristen Miller', 'Chelsea Marguerite', 'Masasa Moyo', 'Daran Norris', 'Fred Tatasciore', 'Phil Hendrie', 'Jeremy Shada', 'Maurice LaMarche']","['absurdity', 'patriotism', 'mockery']",
3091,3091,34134,Barbie in A Mermaid Tale,2010-01-25,16441438,75,False,0,"Barbie stars as Merliah, a surfer who learns a shocking secret: she's a mermaid! She and her dolphin friend set out for an undersea adventure to rescue her mother, the queen of Oceana.",22.922,/jtOlo3AaXVBnqfMeKGFrZUMPFui.jpg,"['Animation', 'Family', 'Fantasy']","princess, surfing, surfboard, beach, atlantis, mermaid, surf, based on toy, female surfer",2010,"['Kelly Sheridan', 'Kathleen Barr', 'Tabitha St. Germain', 'Peter Mel', 'Nakia Burrise', 'Maryke Hendrikse', 'Emma Pierson', 'Ciara Janson', 'Garry Chalk', 'Nicole Oliver', 'Alistair Abell', 'Andrea Libman', 'Shannon Chan-Kent', 'Ellen Kennedy', 'Scott McNeil', 'Melissa Lyons', 'Alex Ferris']","['courage', 'dreams', 'friendship']",Adam Wood
3092,3092,77883,The Possession,2012-08-30,85446075,92,False,14000000,"A young girl buys an antique box at a yard sale, unaware that inside the collectible lives a malicious ancient spirit. The girl's father teams with his ex-wife to find a way to end the curse upon their child.",22.918,/loZYdcmgvnonHtH0XH0RI7rm8iA.jpg,"['Horror', 'Thriller']","exorcism, house, rabbi, hospital, demonic possession, divorced parents, basketball coach, dybbuk box, sister sister relationship, hebrew text, jewish folklore",2012,"['Jeffrey Dean Morgan', 'Kyra Sedgwick', 'Natasha Calis', 'Madison Davenport', 'Rob LaBelle', 'Matisyahu', 'Quinn Lord', 'Jay Brazeau', 'Jim Thorburn', 'Erin Simms', 'John Cassini', 'Grant Show', 'Tim Perez', 'Ned Bellamy', 'Scott J. Ateah', 'Paul Wu', 'Antoine Safi', 'Cameron Sprague', 'Sharmaine Yeoh', 'Frank Ferrucci', 'Jordan Stein', 'Sol Pavony', 'Nana Gbewonyo']","['possession', 'family', 'fear']",Ole Bornedal
3093,3093,820,JFK,1991-12-20,205405498,189,False,40000000,Follows the investigation into the assassination of President John F. Kennedy led by New Orleans district attorney Jim Garrison.,22.918,/r0VWVTYlqdRCK5ZoOdNnHdqM2gt.jpg,"['Drama', 'Thriller', 'History']","vietnam war, cia, assassination, usa president, government, politics, homophobia, texas, new orleans, louisiana, investigation, john f. kennedy, historical figure, president, conspiracy, district attorney, death, john f. kennedy assassination, assassination of president, usa history, 1960s, courtroom drama, legal thriller, jacqueline kennedy",1991,"['Kevin Costner', 'Tommy Lee Jones', 'Gary Oldman', 'Kevin Bacon', 'Michael Rooker', 'Jack Lemmon', 'Laurie Metcalf', 'Sissy Spacek', 'Joe Pesci', 'John Candy', 'Pruitt Taylor Vince', 'Jay O. Sanders', 'Walter Matthau', 'Sally Kirkland', 'Donald Sutherland', 'Ed Asner', 'Brian Doyle-Murray', 'Ray LePere', ""Vincent D'Onofrio"", 'Tom Howard', 'Lolita Davidovich', 'Jim Garrison', 'Wayne Knight', 'Gary Grubbs', 'Beata Pozniak', 'Tony Plana', 'John William Galt', 'Ron Jackson', 'Sean Stone', 'John S. Davies', 'Tomas Milian', 'Raul Aranas', 'Gail Cronauer', 'Gary Carter', 'James N. Harrell', 'Ellen McElduff', 'Jo Anderson', 'Marco Perella', 'Edwin Neal', 'Darryl Cox', 'T.J. Kennedy', 'J.J. Johnston', 'R. Bruce Elliott', 'William Larsen', 'Wayne Tippit', 'Dale Dye', 'Jerry Douglas', 'Ryan MacDonald', 'Duane Grey', 'George R. Robertson', 'Baxter Harris', 'John Seitz', 'Alex Rodine', 'Sam Stoneburner', 'Bob Gunton', 'John Finnegan', 'Walter Breaux', 'Melodee Bowman', 'Peter Maloney', 'Richard Rutowski', 'Bill Bolender', 'Price Carson', 'Gil Glasgow', 'Bob Orwig', 'Hugh Feagin', 'George Kelly', 'Victor Kempster', 'John Larroquette', 'Maria Mason', 'Ron Rifkin', 'Frank Whaley', 'Kevin Beard', 'Jeffrey Bornstein', 'Marie Del Marco', 'Alan Donnes', 'Orlando Gallegos', 'Robert J. Groden', 'Chuck Kelley', 'Codie Scott', 'Martin Sheen', 'John F. Kennedy', 'Anthony Ramirez', 'Stanley White', 'Fidel Castro', 'Jacqueline Kennedy', 'John Connally', 'Richmond Hoxie', 'Allison Pratt Davis', 'Scott Krueger', 'Ngô Đình Diệm', 'Agnes Aurelio', 'Gary Taggart', 'E.J. Morris', 'Cheryl Penland', 'Jim Gough', 'Perry R. Russo', 'Mike Longman', 'Ann Strub', 'Pat Perkins', 'Amy Long', 'Red Mitchell', 'Ronald von Klaussen', 'Michael Ozag', 'John C. Martin', 'Henri Alciatore', 'Willem Oltmans', 'Roxie M. Frnka', 'Zeke Mills', 'Ray Redd', 'Sally Nystuen Vahle', 'Spain Logue', 'Carolina McCullough', 'Barry Chambers', 'Linda Flores Wade', 'Alec Gifford', 'Eric A. Vicini', 'Michael Gurievsky', 'Caroline Crosthwaite-Eyre', 'Helen Miller', 'Harold G. Herthum', 'Norman Davis', 'Errol McLendon', 'Bruce Gelb', 'Nathan Scott', 'Jorge Fernández', 'Doug Jackson', 'Murray Stokes', 'Odin K. Langford', 'John St. Paul', 'Roy Barnitt', 'Alvin Spicuzza', 'Carolyn T. Wright', 'Henry Tull III', 'Michael Skipper', 'I.D. Brickman', 'Joseph Nadell', 'Chris Robinson', 'Chris Renna', 'Johnny Brink', 'David Benn', 'Dalton Dearborn', 'Merlyn Sexton', 'Steve F. Price Jr.', 'Tom Bullock', ""Ruary O'Connell"", 'Christopher Kosiciuk', 'John Reneau', 'Larry Melton', 'Carol Farabee', 'Willie Minor', 'Ted Pennebaker', 'Bill Pickle', 'Mykel Chaves', 'Loys T. Bergeron', 'Kristina Hare']","['mystery', 'conspiracy', 'truth']",Oliver Stone
3094,3094,546726,Sub Rosa,2014-08-10,0,22,False,0,"Bullied by his father to grow up, a teen fights between the love of his step-mother over his father's life.",22.916,/yVwt1gPaQxCUV8iC8i1rca6FSji.jpg,"['Drama', 'Romance']",short film,2014,"['Julie Kendall', 'Mario Nalini', 'Mario Temes']","['erotic', 'mystery', 'obsession']",Krisstian de Lara
3095,3095,137094,Jack Ryan: Shadow Recruit,2014-01-15,135511030,105,False,60000000,"Jack Ryan, as a young covert CIA analyst, uncovers a Russian plot to crash the U.S. economy with a terrorist attack.",22.913,/m7HcLUodrD4lM4s0Hui1tzO2pjO.jpg,"['Action', 'Drama', 'Thriller']","sniper, new york city, london, england, cia, corruption, based on novel or book, explosive, rehabilitation, murder, conspiracy, terrorism, surveillance, ex-marine, jack ryan, u.s. marine, 9/11, undercover operation, fiancé fiancée relationship, ex military, moscow, russia, political thriller, helicopter crash, intelligence service, cia analyst, intelligence analyst",2014,"['Chris Pine', 'Keira Knightley', 'Kevin Costner', 'Kenneth Branagh', 'Lenn Kudrjawizki', 'Colm Feore', 'Gemma Chan', 'Alec Utgoff', 'Peter Andersson', 'Nonso Anozie', 'Aleksandar Aleksiev', 'Deborah Rosan', 'Price Lindsey', 'Celine Jedidi', 'Ricky Rajpal', 'Karen David', 'David Paymer', 'David Hayman', 'Amy J. Kim', 'Bogdan Kominowski', 'Maggie Daniels', 'Annika Pergament', 'Seth Ayott', 'Andrew Byron', 'Derek Lea', 'Andy Butcher', 'Pat Kiernan', 'Ian Bonar', 'Elena Velikanova', 'Lloyd Bass', 'Santino Fontana', 'Mikhail Baryshnikov', 'Matt Rippy', 'Kieron Jecchinis', 'William Meredith', 'Leonard Redlich', 'Angus Wright', 'Emmanuel Imani', 'Alexander Terentyev', 'Mike Siegel', 'Donald E G Bentley', 'Isobel Pravda', 'Paul Blackwell']","['loyalty', 'suspense', 'identity']",Martha Pinson
3096,3096,37233,The Firm,1993-06-30,270248367,155,False,42000000,"Mitch McDeere is a young man with a promising future in Law. About to sit his Bar exam, he is approached by 'The Firm' and made an offer he doesn't refuse. Seduced by the money and gifts showered on him, he is totally oblivious to the more sinister side of his company. Then, two Associates are murdered. The FBI contact him, asking him for information and suddenly his life is ruined. He has a choice - work with the FBI, or stay with the Firm. Either way he will lose his life as he knows it. Mitch figures the only way out is to follow his own plan...",22.902,/mTsDqwE4ZyZ8FWflD0wPw9l2YMS.jpg,"['Drama', 'Mystery', 'Thriller']","fbi, tennessee, lawyer, law firm, bar exam, legal thriller",1993,"['Tom Cruise', 'Jeanne Tripplehorn', 'Gene Hackman', 'Hal Holbrook', 'Terry Kinney', 'Wilford Brimley', 'Ed Harris', 'Holly Hunter', 'Karina Lombard', 'David Strathairn', 'Gary Busey', 'Steven Hill', 'Tobin Bell', 'Barbara Garrick', 'Jerry Hardin', 'Paul Calderon', 'Jerry Weintraub', 'Sullivan Walker', 'Margo Martindale', 'John Beal', 'Dean Norris', 'Lou Walker', 'Tommy Cresswell', 'David A. Kimball', 'David Dwyer', 'Afemo Omilami', 'Clint Smith', 'Jonathan Kaplan', 'Paul Sorvino', 'Joe Viterelli', 'Janie Paris', 'Susan Elliott', 'Erin Branham', 'Joey Anderson', 'Deborah Thomas', 'Tommy Matthews', 'Rebecca Glenn', 'Terri Welles', 'Chris Schadrack', 'Jeffrey Buckner Ford', 'Andy Armstrong', 'Ron Clinton Smith', 'Julia Hayes', 'Yvonne Sayers']","['ambition', 'law', 'pressure']",Sydney Pollack
