,Unnamed: 0,id,title,release_date,revenue,runtime,adult,budget,overview,popularity,poster_path,genres,keywords,year,actors,emotions,director
5128,5128,11864,Enemy Mine,1985-12-12,12303411,108,False,40000000,"A soldier from Earth crashlands on an alien world after sustaining battle damage. Eventually he encounters another survivor, but from the enemy species he was fighting; they band together to survive on this hostile world. In the end the human finds himself caring for his enemy in a completely unexpected way.",17.065,/a3dr9L8VIjhEvivzQ2M12VQDere.jpg,"['Drama', 'Science Fiction']","future, friendship, narration, slavery, space battle, complicated birth, alien, space, stranded, racism, planet, slave, reptilian, severed ear, man eating monster, two-hander",1985,"['Dennis Quaid', 'Louis Gossett Jr.', 'Brion James', 'Richard Marcus', 'Carolyn McCormick', 'Lance Kerwin', 'Bumper Robinson', 'Jim Mapp', 'Scott Kraft', 'Lou Michaels', 'Andy Geer', 'Henry Stolow', 'Danmar', 'Mandy Hausenberger', 'Herb Andress', 'Jack Luceno', 'Barry Stokes', 'Ulrich Günther', 'Emily Woods', 'Colin Gilder', 'Charles M. Huber', 'Frank Henson', 'Jazzer Jeyes', 'Doug Robinson', 'Mark McBride', 'Menyhért René Balog-Dutombé', 'Tony L. Moore', 'Tom Baker']","['friendship', 'war', 'survival']",Wolfgang Petersen
5129,5129,339988,The Circle,2017-04-27,40651864,110,False,18000000,"A young tech worker takes a job at a powerful Internet corporation, quickly rises up the company's ranks, and soon finds herself in a perilous situation concerning privacy, surveillance and freedom. She comes to learn that her decisions and actions will determine the future of humanity.",17.063,/bQVqd5rWrx5GbXhJNuvKy4Viz6j.jpg,"['Drama', 'Thriller', 'Science Fiction']","technology, video surveillance, criminal, technicians, tech company",2017,"['Emma Watson', 'Tom Hanks', 'John Boyega', 'Karen Gillan', 'Ellar Coltrane', 'Patton Oswalt', 'Glenne Headly', 'Bill Paxton', 'Poorna Jagannathan', 'Nate Corddry', 'Mamoudou Athie', 'Amir Talai', 'Smith Cho', 'Ellen Wong', 'Judy Reyes', 'Elvy', 'Roger Joseph Manning Jr.', 'Joey Waronker', 'Michael Shuman', 'Katie Costick', 'Regina Saldivar', 'Steven Klein', 'Hunter Burke', 'Eve Gordon', 'Amie McCarthy Winn', 'Lauren Baldwin', 'Nicola Bertram', 'Julian von Nagel', 'Beck', 'Nick Peine', 'Michael Dean Russell Jr', 'Jason Sheridan', 'Drew Droege', 'Jimmy Wong', 'Sandeep Parikh', 'Mele Ihara', 'Andrew Hwang', 'Lizzie Prestel', 'Alana Aimaq', 'Daniel William Jordan', 'Melanie Steinmann', 'Ken Narasaki', 'Frederick Koehler', 'Jedediah Jenk', ""Claudia O'Doherty"", 'Ara Woland', 'Brandon Van Vliet', 'Alan Trujillo', 'Derek Sulek', 'Jasper Salon', 'Parker Russell', 'Samir Patel', 'Afsheen Olyaie', ""James O'Connor"", 'Henry Nolin', 'Rob Morris', 'Dez Mabunga', 'Shandel Love', 'Abraham Lim', 'Punnavith Koy', 'Slim Khezri', 'Stephen Michael Joseph', 'Allyson Nicole Jones', 'Jenine Giusto', 'Lori Crow', 'Reverend John Atom', 'Steven Adkins', 'Matt Van Beck', 'Jennifer Fernandez', 'Kelli Barksdale', 'Patrick Russo', 'Troy Murray', 'Johny Walsh', 'Adam Aseem Tiwari', 'Nick Valensi']","['paranoia', 'technology', 'control']",James Ponsoldt
5130,5130,291276,Unlocked,2017-04-27,0,98,False,0,"After failing to apprehend the terrorist behind a Paris attack that claimed dozens of lives, CIA agent Alice Racine is forced to live in London as a caseworker. Her mentor unexpectedly calls her back into action when the CIA discovers that another attack is imminent. Alice soon learns that the classified information she's uncovered has been compromised...",17.063,/fBDLdEraxCBKGmOPb6pJPYiDQh1.jpg,"['Action', 'Thriller']","london, england, cia, biohazard, agent, mi5, bio terrorism, terrorist threat",2017,"['Noomi Rapace', 'Orlando Bloom', 'Michael Douglas', 'John Malkovich', 'Toni Collette', 'Matthew Marsh', 'Makram J. Khoury', 'Brian Caspe', 'Philip Brodie', 'Tosin Cole', 'Michael Epp', 'Tom Reed', 'Raffaello Degruttola', 'Kevin Shen', 'Aymen Hamdouchi', 'Akshay Kumar', 'Robert Alexander Russell', 'Rami Nasr', 'Jessica Boone', 'Jim High', 'Michael Pitthan', 'Olivette Cole-Wilson', 'Adelayo Adedayo', 'Sienna Sinclair', 'Begum Burian', 'Kendrick Roger Ong', 'Oktambek Usmanjanovich Karimov', 'Booda', 'Alexandr Minajev', 'Filip Antonio', 'Adam Horton', 'James Grogan', 'Martin David', 'Jan Loukota', 'David Szeeleszan', 'Helena Dvořáková', 'David Bowles', 'Joe Weintraub', 'Logan Hillier', 'Dan Bradford', 'Henry Townsley', 'Mohammed Ali', 'Emilio Aniba', 'Lee Nicholas Harris', 'Kim-Anh Le-Pham']","['espionage', 'betrayal', 'action']",Michael Apted
5131,5131,470,21 Grams,2003-09-06,60427839,124,False,20000000,"Paul Rivers, an ailing mathematician lovelessly married to an English émigré; Christina Peck, an upper-middle-class suburban housewife and mother of two girls; and Jack Jordan, a born-again ex-con, are brought together by a terrible accident that changes their lives.",17.06,/hdS0to9nUpgK0Zm1bZAF6BWRae7.jpg,"['Drama', 'Crime', 'Thriller']","life and death, rage and hate, transplantation, faith, suicide attempt, loss of loved one, widow, ex-detainee, new mexico, sadness, car crash, multiple storylines",2003,"['Sean Penn', 'Naomi Watts', 'Danny Huston', 'Carly Nahon', 'Claire Pakis', 'Benicio del Toro', 'Nick Nichols', 'Charlotte Gainsbourg', 'John Rubinstein', 'Eddie Marsan', 'Loyd Keith Salter', 'Antef A. Harris', 'Melissa Leo', 'Marc Musso', 'Teresa Delgado', 'Trent Dee', 'Tony Guyton', 'Wayne E. Beech, Jr.', 'Keith Lamont Johnson', 'Clea DuVall', 'David Chattam', 'John Boyd West', 'Jeff Schmidt', 'Tony Vaughn', 'Paul Calderon', ""Denis O'Hare"", 'Anastasia Herin', 'Carlo Alban', 'Hai Quang Tran', 'Annie Corley', 'Sharon Bishop', 'Jerry Chipman', 'Tom Irwin', 'Roberto Medina', 'Arita Trahan', 'Rodney Ingle', 'Catherine Dent', 'Kevin Chapman', 'Randall Hartzog', 'Verda Davenport', 'Dorothy Armstrong-Miles', 'Barclay Roberts', 'Lisa Sanchez', 'Stephen Bridgewater', 'Michael Finnell', 'Juan Corrigan', 'Charlie B. Brown', 'Arron Shiver', 'Pamela Blair', 'Jennifer Pfalzgraff', 'Lew Temple', 'Tricia Branch', 'Jessica Scott']","['grief', 'guilt', 'fate']",Alejandro González Iñárritu
5132,5132,31933,The Land Before Time XII: The Great Day of the Flyers,2006-02-27,0,77,False,0,"As the Great Day of the Flyers nears, the Great Valley's flying youngsters are eager to participate in the annual exhibition to show off their skills. Everyone, that is, except free-spirited pterodactyl Petrie, whose individualism causes problems when it comes to staying in formation. Enter his dinosaur pals Littlefoot, Cera, Spike and Ducky, who encourage Petrie to embrace his uniqueness.",17.06,/tvJxoQCIwt2AO0svf1GQfS4OR47.jpg,"['Animation', 'Family', 'Adventure']",,2006,"['John Ingle', 'Nick Price', 'Frank Welker', 'Aria Noelle Curzon', 'Rob Paulsen', 'Camryn Manheim', 'Anndi McAfee', 'Kenneth Mars', 'Miriam Flynn', 'Tress MacNeille', 'Jeff Bennett', 'Nika Futterman', 'Susan Blu', 'Ken Stacey', 'Windy Wagner']","['teamwork', 'growth', 'belonging']",Charles Grosvenor
5133,5133,72113,Carnage,2011-09-16,30722632,80,False,25000000,"After 11-year-old Zachary Cowan strikes his classmate across the face with a stick after an argument, the victim's parents invite Zachary's parents to their Brooklyn apartment to deal with the incident in a civilized manner.",17.059,/3Imx53XV3T02ADlMxYazYXVNysZ.jpg,"['Comedy', 'Drama']","flat, hamster, dark comedy, vomit, based on play or musical, insult, writer, tulips, meeting, puke, pants, liberal",2011,"['Jodie Foster', 'Kate Winslet', 'Christoph Waltz', 'John C. Reilly', 'Elvis Polanski', 'Eliot Berger', 'Joseph Rezwin', 'Nathan Rippy', 'Tanya Lopert', 'Julie Adams', 'Lexie Kendrick', 'Roman Polanski']","['conflict', 'awkwardness', 'absurdity']",Roman Polanski
5134,5134,1808,Velvet Goldmine,1998-08-28,4313644,123,False,0,"Almost a decade has elapsed since Bowiesque glam-rock superstar Brian Slade escaped the spotlight of the London scene. Now, investigative journalist Arthur Stuart is on assignment to uncover the truth behind the enigmatic Slade. Stuart, himself forged by the music of the 1970s, explores the larger-than-life stars who were once his idols and what has become of them since the turn of the new decade.",17.058,/4EJkObEJFvXCuoVqOP7XBXGqdQ1.jpg,"['Drama', 'Music']","great britain, narration, bisexuality, glam rock, lgbt, music journalism, imaginary band, baby left on doorstep, fictional band, down feather, 19th century, 1980s, gay theme",1998,"['Ewan McGregor', 'Jonathan Rhys Meyers', 'Toni Collette', 'Christian Bale', 'Eddie Izzard', 'Emily Woof', 'Michael Feast', 'Janet McTeer', 'Mairead McKinley', 'Luke Morgan Oliver', 'Osheen Jones', 'Micko Westmoreland', 'Damian Suchet', 'Danny Nutt', 'Wash Westmoreland', 'Don Fellows', 'Ganiat Kasumu', 'Ray Shell', 'Alastair Cumming', 'Zoe Boyce', 'Jim Whelan', 'Sylvia Grant', 'Tim Hans', 'Ryan Pope', 'Stuart Callaghan', 'James Francis', 'Callum Hamilton', 'Lindsay Kemp', 'Carlos Miranda', 'Emma Handy', 'Matthew Glamour', 'Daniel Adams', 'Bryan Torfeh', 'Joseph Beattie', 'Sarah Cawood', 'David Hoyle', 'Winston Austin', 'Ivan Cartwright', 'Peter Swords King', 'Justin Salinger', 'Roger Alborough', 'Peter Bradley Jr.', 'Jonathan Cullen', 'William Key', 'Vincent Marzello', 'Corey Skaggs', 'Nathan Osgood', 'Nadia Williams', 'Brian Molko', 'Antony Langdon', 'Xavior', 'Steve Hewitt', 'Guy Leverton', 'Vinney Reck', 'Keith-Lee Castle', 'Eden Ford', 'Jono McGrath', 'Perry Clayton', 'Donna Matthews', 'Ritz', 'Stefan Olsdal', 'Trevor Sharpe']","['identity', 'freedom', 'glamour']",Todd Haynes
5135,5135,294652,Son of a Gun,2014-10-16,0,108,False,0,"Locked up for a minor crime, 19 year old JR quickly learns the harsh realities of prison life. Protection, if you can get it, is paramount. JR soon finds himself under the watchful eye of Australia's most notorious criminal, Brendan Lynch, but protection comes at a price.",17.056,/yRLVyhQfkW2hn15e8NIqarswLAr.jpg,"['Action', 'Crime', 'Drama', 'Thriller']","prison, australia, gold, robbery, chase, boat, mine, motel, heist, murder, melbourne, australia, double cross, prison break, prison life, perth, australia",2014,"['Ewan McGregor', 'Brenton Thwaites', 'Alicia Vikander', 'Jacek Koman', 'Matt Nable', 'Tom Budge', 'Nash Edgerton', 'Damon Herriman', 'Eddie Baroo', 'Marko Jovanović', 'Sam Hutchin', 'Lucas Brown', 'Jesse McGinn', 'Brendan Kerkvliet', 'Matt Flannagan', 'Geoff Kelso', 'Peter Neaves', 'Kazimir Sas', 'Craig Sparrowhawk', ""Jared De' Har"", 'Stephanie Power', 'Warwick Sadler', 'Mick Innes', 'Sarah Filippi', 'John Boxer', 'Russell Kiefel', 'Nick Britton', 'Richard Suliman', 'Isaac Money', 'David Thomson']","['mentorship', 'betrayal', 'survival']",Julius Avery
5136,5136,9969,Deck the Halls,2006-11-22,47231070,93,False,51000000,"Determined to unseat Steve Finch's reign as the town's holiday season king, Buddy Hall plasters his house with so many decorative lights that it'll be visible from space! When their wives bond, and their kids follow suit, the two men only escalate their rivalry - and their decorating.",17.056,/muRplVEe8xU1jVlq9WpQSOamb6s.jpg,"['Comedy', 'Family']","husband wife relationship, holiday, christmas tree, rivalry, feud, neighbor, christmas lights, christmas, father son relationship, father daughter relationship, christmas decorations",2006,"['Danny DeVito', 'Matthew Broderick', 'Kristin Davis', 'Kristin Chenoweth', 'Alia Shawkat', 'Fred Armisen', 'Jorge Garcia', 'Dylan Blue', 'Kelly Aldridge', 'Sabrina Aldridge', ""Sean O'Bryan"", 'Gillian Vigman', 'Ryan Devlin', 'SuChin Pak', 'Jackie Burroughs', 'Garry Chalk', 'Nicola Peltz Beckham', 'Zak Santiago', 'David James Lewis', 'Daniel Bacon', 'Ken Kramer', 'Jill Morrison', 'Alf Humphreys', 'Brenda Crichlow', 'Jill Krop', 'Agam Darshi', 'David Stuart', 'Quinn Lord', 'Nathaniel DeVeaux', 'Fulvio Cecere', 'Eliza Norbury', 'Randi Lynne', 'Dan Joffre', 'Aurora Faulkner-Killam', 'Melissa Howell', 'Lori Johnson', 'David Shaw', 'Myles Wolfe', 'Ty Olsson', 'Stephen Holmes', 'Andrew Hedge', 'Cory Monteith', 'Cassidy Bot-Devire', 'Aaron Craven', 'Blair Gorrell', 'Rachel Lana Li', 'Lochlyn Munro', 'Kal Penn', 'Caroline Redekopp', 'Arden Rhine', 'Calum Worthy']","['rivalry', 'holiday spirit', 'humor']",John Whitesell
5137,5137,24575,Raise the Titanic,1980-08-01,7000000,115,False,36000000,"To obtain a supply of a rare mineral, a ship raising operation is conducted for the only known source, the Titanic.",17.055,/a8u1FiMXdOlNfhHlpjAr48seQ2g.jpg,['Adventure'],titanic,1980,"['Jason Robards', 'Richard Jordan', 'David Selby', 'Anne Archer', 'Alec Guinness', 'Bo Brundin', 'M. Emmet Walsh', 'J.D. Cannon', 'Norman Bartold', 'Ilya Baskin', 'Dirk Blocker', 'Robert Broyles', 'Paul Carr', 'Michael C. Gwynne', 'Harvey Lewis', 'Charles Macaulay', 'Stewart Moss', 'Michael Pataki', 'Marvin Silbersher', 'Mark L. Taylor', 'Maurice Kowalewski', 'Nancy Nevinson', 'Sander Vanocur', 'Michael Ensign', 'Hilly Hicks', 'Clive Cussler']","['adventure', 'mystery', 'national pride']",Jerry Jameson
5138,5138,14092,Ghost in the Shell 2.0,2008-07-12,0,85,False,0,"In the year 2029, Section 9, a group of cybernetically enhanced cops, are called in to investigate and stop a highly-wanted hacker known as 'The Puppetmaster'.  Ghost in the Shell 2.0 is a reproduced version of its original 1995 counterpart. Among a numerous enhancements, for the film's 2.0 release, were a number of scenes were overhauled with 3D animation, visual improvements, and soundtrack rerecorded in 6.1 surround sound.",17.054,/4Vzlmvb9EyTnr5kN8mFVCMs8f3I.jpg,"['Action', 'Animation', 'Science Fiction']","future, android, cyborg, dystopia, cyberpunk, anime",2008,"['Atsuko Tanaka', 'Akio Otsuka', 'Koichi Yamadera', 'Tamio Ohki', 'Tessyo Genda', 'Masato Yamanouchi', 'Shinji Ogawa', 'Yoshiko Sakakibara', 'Kazuhiro Yamaji', 'Shigeru Chiba', 'Maaya Sakamoto']","['identity', 'technology', 'existentialism']",Mamoru Oshii
5139,5139,630639,High School Teacher: Maturing,1985-01-15,0,69,False,0,"A female highschool teacher must deal with sexual harrassment from her students and being trapped in a love triangle with two men, neither of whom has any interest in marrying her.",17.052,/qB7Sj1ueAFPIDNenSjpjagzYI6L.jpg,['Drama'],"high school teacher, softcore, pink film",1985,"['Rei Akasaka', 'Saeko Kuga', 'Toshiyuki Kitami', 'Jouji Nakata', 'Kosuke Yoda', 'Ryōko Watanabe', 'Koji Umeda', 'Kunpei Sakamoto']","['lust', 'taboo', 'manipulation']",Shōgorō Nishimura
5140,5140,432836,Memoir of a Murderer,2017-09-07,0,118,False,125000,A former serial killer with Alzheimer's fights to protect his daughter from her mysterious boyfriend who may be a serial killer too.,17.045,/nnaBFDUCiv6BjWaVHNsIqsh4UCi.jpg,"['Thriller', 'Action', 'Crime', 'Mystery', 'Adventure']","based on novel or book, dementia, alzheimer's disease, serial killer",2017,"['Sul Kyung-gu', 'Kim Nam-gil', 'Kim Seol-hyun', 'Oh Dal-su', 'Hwang Seok-jeong', 'Kil Hae-yeon', 'Lee Byung-joon', 'Kim Min-jae', 'Jo Jae-yun', 'Choi Yoo-song', 'Kim Han-joon', 'Kim Hye-yoon', 'Jung Ji-woo', 'Lee Myung-ha', 'Lee Sae-ro-mi', 'Chae Kook-hee', 'Don Lee']","['dementia', 'guilt', 'suspense']",Won Shin-yeon
5141,5141,17124,Wild Things: Diamonds in the Rough,2005-02-19,0,87,False,0,"Two young women will stop at nothing for one to gain a $4 million inheritance of two priceless diamonds, while two detectives try to thwart their plans, but find complications abound.",17.041,/1O01MpwB6eV0ars0Jxk0yh4x5ED.jpg,"['Crime', 'Drama', 'Mystery']","florida, diamond, seduction, double cross, incest, threesome, rape accusation",2005,"[""Serah D'Laine"", 'Sandra McCoy', 'Brad Johnson', 'Claire Coffee', 'Van Epperson', 'Ron Melendez', 'Dina Meyer', 'Nikki Griffin', 'Elena Maria Garcia', 'Michael Horvath', 'Kenneth Cameron', 'Claudio Sad', 'Eric Fleeks', 'Linden Ashby']","['deception', 'greed', 'desire']",Jay Lowi
5142,5142,184098,Think Like a Man Too,2014-06-20,70181428,105,False,24000000,"All the couples are back for a wedding in Las Vegas, but plans for a romantic weekend go awry when their various misadventures get them into some compromising situations that threaten to derail the big event.",17.035,/bsKfhf0y9Zx7h4j5GHu1JANpKwl.jpg,"['Comedy', 'Romance']",,2014,"['Adam Brody', 'Michael Ealy', 'Jerry Ferrara', 'Meagan Good', 'Regina Hall', 'Kevin Hart', 'Dennis Haysbert', 'Taraji P. Henson', 'Terrence J', 'Jenifer Lewis', 'Romany Malco', 'Wendi McLendon-Covey', 'Gary Owen', 'Gabrielle Union', 'David Walton', 'La La Anthony', 'Jim Piddock', 'Wendy Williams', 'Caleel Harris', 'Angela Elayne Gibbs', 'Luenell', 'Chelsea Dawn', 'Fonzworth Bentley', 'Ernestine Johnson', 'George Wallace', 'Ray Proscia', 'Will Packer', 'Janina Gavankar', 'Malea Rose', 'Nicholas Guilak', 'Pedro Miguel Arce', 'Terrell Carter', 'Chasty Ballesteros', 'Jason Suhrke', 'Morann Peri', 'Jeff Corbett', 'Corey Holcomb', 'Paul X. Campanella', 'Charles Goldsmith', 'Courtney Enea', 'Jordan Bondurant', 'Floyd Mayweather Jr.', 'Coco Austin', 'Shelia Joy Burford', 'Teresa McAuliffe', 'Kristel Nichols', 'Nicole Hamilton-Bolin', 'Paige Annette', 'Jennifer Roush', 'Ashley Kacvinsky', 'Brian Ventimiglia', 'Roni Meron', 'Kastika Xhurka', 'Brenda Vivian', 'Drake', 'Ndamukong Suh', 'Steven Jackson', 'Steve Terada', 'Ronnie DeVoe', 'J.T. Jackson', 'Jason Sarcinelli', 'Rick Rockne', 'Denny Ogden', 'Dan Rossi', 'Itzel Aguilar', 'Belle Angel', 'Ana Antimo', 'Eleazar Barzart', 'Joseph Bell', 'Leonardo Biasiucci', 'Michael Bivins', 'Brian Blu', 'Michael Bower', 'John Brooks Jr.', 'Romina Carabelli', 'Nicole Chauvet', 'Liz Clark', 'Trina Colon', 'Chrissie Coon-Sanders', 'Melissa Dacher', 'Kevin Deon', 'Jackie Di Crystal', 'Timothy Skyler Dunigan', 'Maureen E. Durocher', 'Casey Ellsworth', 'Scott Ford', 'Toni Fox', 'Jeff Fuell', 'Chris Gann', 'Shad Gaspard', 'Gladis Giada', 'Max Gideon', 'Jacob Godzak', 'Kelsey Grammer', 'David Hershwitzky', 'Cheryl Hines', 'Tish Hoyer', 'Zee James', 'Mark Justice', 'Rebecca Kernes', 'Raul Limon', 'Ann Lippert', 'Dean Mauro', 'Julian McCleary', 'Bonnie Mercado', 'Angela Meryl', 'Brian Mganga', 'George D. Miklos', 'Michael Monteiro', 'Milli Moto', 'B.J. Parker', 'Joshua Paule', 'Jessica Pizarro', 'Carly Richardson', 'Joan Riegert', 'Chris Rodgers', 'Rocky Self', 'Vanessa Sheri', 'Alex Soria', 'Marie Stark', 'Jenna Ung', 'Chekesha Van Putten', 'Carl Weathers', 'Chaun Williams', 'Shawn Wilson', 'Dona Wood', 'Karen E. Wright', 'Mercedes Young', 'Del Zamora']","['romance', 'chaos', 'comedy']",Tim Story
5143,5143,379291,Justice League vs. Teen Titans,2016-03-26,0,78,False,0,Robin is sent by Batman to work with the Teen Titans after his volatile behavior botches up a Justice League mission. The Titans must then step up to face Trigon after he possesses the League and threatens to conquer the world.,17.033,/ctHGhbe19xIX6wlECsFydHiha4W.jpg,"['Science Fiction', 'Action', 'Animation', 'Adventure', 'Comedy']","superhero, cartoon, based on comic, super power, superhero team, teen superhero, dc animated movie universe",2016,"['Stuart Allan', 'Taissa Farmiga', ""Jason O'Mara"", 'Rosario Dawson', ""Jerry O'Connell"", 'Jon Bernthal', 'Sean Maher', 'Kari Wahlgren', 'Jake T. Austin', 'Brandon Soo Hoo', 'Christopher Gorham', 'Shemar Moore', 'Laura Bailey', 'Steve Blum', ""Terrence 'T.C.' Carson"", 'Rick D. Wasserman']","['conflict', 'teamwork', 'growth']",Sam Liu
5144,5144,255718,Barbie: The Pearl Princess,2014-02-15,0,73,False,0,"Barbie plays Lumina, a mermaid girl with the power to change the color of pearls. Cheerful and creative, Lumina finds herself working in a mermaid salon customizing fabulous hairstyles. And when Lumina has the chance to attend the royal ball, her friends adorn her with a gown fit for a princess. At the ball, villains try to seize power over the kingdom, and Lumina finds within herself an unexpected power that proves she is much more than a hair stylist.",17.032,/zA4csIbIKzPOd6DwN5rKxHkVCu6.jpg,"['Family', 'Animation']","mermaid, based on toy",2014,"['Kelly Sheridan', 'Katie Crown', 'Mark Oliver', 'Rebecca Shoichet', 'Trish Pattendon', 'John Novak', 'Simon Hill', 'Peter New', 'Kathleen Barr', 'Patrick Gilmore', 'Louis Chirillo', 'James Higuchi', 'MacKenzie Porter', 'Nicki Burke', 'Tabitha St. Germain', 'Brian Doe', 'Jeff Evans-Todd']","['self-discovery', 'kindness', 'magic']",Ezekiel Norton
5145,5145,11896,Throw Momma from the Train,1987-12-11,57915972,88,False,14000000,"Larry Donner, an author with a cruel ex-wife, teaches a writing workshop in which one of his students, Owen, is fed up with his domineering mother. When Owen watches a Hitchcock classic that seems to mirror his own life, he decides to put the movie's plot into action and offers to kill Larry's ex-wife, if Larry promises to murder his mom. Before Larry gets a chance to react to the plan, it seems that Owen has already set things in motion.",17.027,/Ap0Wo7hNS6WW1wdPOKYM3SNpewY.jpg,"['Comedy', 'Crime']","writer's block, train, overbearing mother, ex-wife, aspiring writer, mystery writer, crime fiction writer, dominant mother, murder swap",1987,"['Danny DeVito', 'Billy Crystal', 'Kim Greist', 'Anne Ramsey', 'Kate Mulgrew', 'Branford Marsalis', 'Rob Reiner', 'Bruce Kirby', 'Annie Ross', 'Oprah Winfrey', 'Raye Birk', 'Olivia Brown', 'Joey DePinto', 'Philip Perlman', 'Stu Silver', 'J. Alan Thomas', 'Randall Miller', 'Andre Rosey Brown', 'Tony Ciccone', 'Larry McCormick', 'Peter Brocco', 'Hettie Lynne Hurtes']","['dark humor', 'revenge', 'awkwardness']",Barry Sonnenfeld
5146,5146,11615,The Life of David Gale,2003-02-21,38955598,130,False,50000000,A man against capital punishment is accused of murdering a fellow activist and is sent to death row.,17.026,/7tcAvE82JyxIi79cwQV5br90KVz.jpg,"['Drama', 'Thriller', 'Crime']","prison, journalist, death penalty, professor, texas, death row, interview, murder, reporter, intern, innocent, activist",2003,"['Kevin Spacey', 'Kate Winslet', 'Laura Linney', 'Rhona Mitra', 'Gabriel Mann', 'Matt Craven', 'Jim Beaver', 'Cleo King', 'Leon Rippy', 'Melissa McCarthy', 'Lee Ritchey', 'Brandy Little', 'Jesse De Luna', 'Vernon Grote', 'Larissa Wolcott', 'Sean Hennigan', 'Charles Sanders', 'Marco Perella', 'Michael Crabtree', 'Julio Cesar Cedillo', 'Christopher Meister', 'Cliff Stephens', 'James Huston', 'Chris Warner', 'Julia Lashae', 'Matthew Posey', 'Lynn Mathis', 'Robert Lott', 'Mark Voges', 'Katherine Willis', 'Amparo Moreno', 'Janis Kelly', 'Barbara Petricini-Buxton', 'Asia De Marcos', 'Amparo García', 'Kirk Sisco', 'Cassandra L. Small', 'Oliver Tull', 'George Haynes', 'Kathy Lamkin', 'Constance Jones', 'Cindy Waite', 'Kimberly Tortorice', 'Katie Lott', 'Noah Truesdale', 'Chuck Cureau', 'Mike Fontaine', 'Elizabeth Gast', 'Chris Drewy', 'Katina Potts', 'Katherine James', 'Cindy Michelle', 'Jennifer Dorsey', 'Maurice Moore', 'Brenda Sendejo', 'Rick Morrow', 'Julia Kay-Laskowski', 'Donald Braswell', 'Jack Gould', 'Jack Watkins', 'Gwyn Little', 'Patrick Fries', 'Pilar Ferreiro', 'Claudia Parker', 'Joan Gispert', 'Mark Richardson', 'Justin Lavender', 'David Dahl', 'Catenya McHenry', 'Brian Orr', 'Michelle Valen', 'Tanya Zieger', 'Nick Dawson', 'Steve Flanagin', 'Evelyn Lindsey', 'T.J. McFarland', 'Deborah Abbott', 'Stacy Lynn Austin', 'Jerry M. Barker', 'Richard R. Bartholomew', 'Keith Bright', 'Ryan Brooks', 'Pei-San Brown', 'Dian Childs', 'Starla Christian', 'Wade Couturiaux', 'Constance Dasse', 'Matthew J. Dunn', 'Ken Edwards', 'Nikki Folsom', 'Ryan Hancock', 'Garrett Hargrove', 'Peyton Hayslip', 'David Scott Heck', 'Reda Hicks', 'Robert H. Lambert', 'Gabriel R. Martinez', 'C.K. McFarland', 'Josh Meyer', 'Brent Mitchell', 'Cindy Palla', 'Roger Eduardo Palomino', 'Alan Parker', 'Paul A. Partain', 'Keith Poulson', 'Glen Powell Sr.', 'George Renteria', 'Nicole R. Roberts', 'Michael Schmid', 'Ryan Schneider', 'Robin Simmons', 'Melanie Stovall', 'Danny Trevino', 'Ryan Wickerham', 'Michele Williams', 'Christine Wolf', 'Willie Wright', 'Jeff Gibbs']","['injustice', 'sacrifice', 'truth']",Alan Parker
5147,5147,159117,V/H/S/2,2013-06-06,21833,96,False,0,"Inside a darkened house looms a column of TVs littered with VHS tapes, a pagan shrine to forgotten analog gods. The screens crackle and pop endlessly with monochrome vistas of static white noise permeating the brain and fogging concentration. But you must fight the urge to relax: this is no mere movie night. Those obsolete spools contain more than just magnetic tape. They are imprinted with the very soul of evil.",17.025,/o4hcWsHaHaNQ9BBReOxLvYJNRhA.jpg,"['Horror', 'Thriller']","gore, vhs, zombie, alien abduction, found footage, videotape",2013,"['Lawrence Michael Levine', 'Kelsy Abbott', 'L.C. Holt', 'Simon Barrett', 'Mindy Robinson', 'Adam Wingard', 'Hannah Hughes', 'John T. Woods', 'Hannah Al Rashid', 'Fachry Albar', 'Oka Antara', 'Epy Kusnandar', 'Andrew Suleiman', 'Devon Brookshire', 'Kevin Hunt', 'Carly Robell', 'Jay Saunders', 'Samantha Gracie', 'Jeremie Saunders', 'Roxanne Benjamin']","['shock', 'terror', 'found footage']",Eduardo Sánchez
