,Unnamed: 0,id,title,release_date,revenue,runtime,adult,budget,overview,popularity,poster_path,genres,keywords,year,actors,emotions,director
6799,6799,8066,Stay,2005-09-24,8342132,99,False,50000000,"Psychiatrist Sam Foster has a new patient, Henry Letham, who claims to be suicidal. In trying to diagnose him, Sam visits Henry's prior therapist and also finds Henry's mother -- even though Henry has said that he murdered both of his parents. As reality starts to contradict fact, Sam spirals into an unstable mental state. Then he finds a clue as to how and when Henry may try to kill himself, and races to try to stop him.",13.519,/tJ9fRkb3Erxkwdext2A8Qx71m87.jpg,"['Mystery', 'Thriller', 'Drama']","loss of sense of reality, time warp, suicide attempt, psychiatrist, parallel world",2005,"['Ewan McGregor', 'Ryan Gosling', 'Naomi Watts', 'Kate Burton', 'Elizabeth Reaser', 'Bob Hoskins', 'Janeane Garofalo', 'BD Wong', 'John Tormey', 'José Ramón Rosario', 'Becky Ann Baker', 'Lisa Kron', 'Gregory Mitchell', 'John Dominici', 'Jessica Hecht', 'Sterling K. Brown', 'Amy Sedaris', 'Michael Devine', 'Jolly Abraham', 'Mark Margolis', 'Mary Testa', 'Angela Pietropinto', 'Oni Faida Lampley', 'Jarlath Conroy', 'Michael Gaston', 'Noah Bean', 'Isaach de Bankolé', 'G.A. Aguilar', 'Riley G. Matthews, Jr.', 'Vito Violante', 'Douglas Crosby', 'Blaise Corrigan', 'Hank Eulau', 'Mam Smith', 'Caroline Vexler', 'Joan Chiang', 'Ron DeJesus', 'Carolyn Dorfman', 'Emily Gayeski', 'Noel MacDuffie', 'Kevin Osgood', 'Elizabeth H. Parkinson', 'Karine Plantadit', 'John Selya', 'Kyle Sheldon', 'Tom Titone', 'Pamela B. Wagner', 'Amber Gristak', 'Andrew Horne', 'Jerry Quinn']","['grief', 'surrealism', 'psychological mystery']",Marc Forster
6800,6800,10361,Ginger Snaps 2: Unleashed,2004-01-30,0,94,False,0,Brigitte has escaped the confines of Bailey Downs but she's not alone. Another werewolf is tailing her closely and her sister's specter haunts her. An overdose of Monkshood - the poison that is keeping her transformation at bay - leads to her being incarcerated in a rehabilitation clinic for drug addicts where her only friend is an eccentric young girl by the name of Ghost.,13.511,/nTtyzQ1qFDJXLWvXX4wvOu0nYun.jpg,"['Drama', 'Horror']","transformation, werewolf",2004,"['Emily Perkins', 'Tatiana Maslany', 'Katharine Isabelle', 'Eric Johnson', 'Janet Kidder', 'Brendan Fletcher', 'Chris Fassbender', 'Pascale Hutton', 'Patricia Idlette', 'Michelle Beaudoin', 'Susan Adam', 'David McNally', 'Lydia Lau', 'Coralie Cairns', 'Shaun Johnston', 'Jake McKinnon']","['transformation', 'isolation', 'horror']",Grant Harvey
6801,6801,403,Driving Miss Daisy,1989-12-13,145793296,99,False,7500000,"The story of an old Jewish widow named Daisy Werthan and her relationship with her black chauffeur, Hoke. From an initial mere work relationship grew in 25 years a strong friendship between the two very different characters in a time when those types of relationships where shunned.",13.51,/iaCzvcY42HihFxQBTZCTKMpsI0P.jpg,['Drama'],"individual, chauffeur, culture clash, self-discovery, widow, 1970s, atlanta, pulitzer prize, civil rights, racial segregation, based on play or musical, car accident, unlikely friendship, elderly, african american servant, 1940s, 1950s, 1960s, elderly lady, race relations",1989,"['Morgan Freeman', 'Jessica Tandy', 'Dan Aykroyd', 'Patti LuPone', 'Esther Rolle', 'Joann Havrilla', 'William Hall Jr.', 'Alvin M. Sugarman', 'Clarice F. Geigerman', 'Muriel Moore', 'Sylvia Kaler', 'Carolyn Gold', 'Crystal R. Fox', 'Bob Hannah', 'Ray McKinnon', 'Ashley Josey', 'Jack Rousso', 'Fred Faser', 'Indra A. Thomas', 'Trilby Beresford', 'Dean DuBois', 'Jay Freer', 'Jen Harper', 'D. Taylor Loeb']","['friendship', 'prejudice', 'dignity']",Bruce Beresford
6802,6802,65869,Attraction,2001-04-22,0,95,False,0,A writer/radio advice show host fails to heed his own advice as he stalks his ex-girlfriend and then becomes involved with an actress friend of hers.,13.51,/sTexeAs91LXC3qp8SbI73pYsqVr.jpg,"['Thriller', 'Romance']",,2001,"['Matthew Settle', 'Tom Everett Scott', 'Gretchen Mol', 'Samantha Mathis', 'Josh Hutchinson', 'Michelle Stafford', 'Hilda van der Meulen', 'Cee Cee Michaela', 'Joel Polis', 'Chris Jagger', 'Brent Roam', 'Corie Vickers', 'Gina-Raye Carter']","['alien encounter', 'mystery', 'romance']",
6803,6803,8996,Europa Europa,1990-11-14,0,112,False,0,A Jewish boy separated from his family in the early days of WWII poses as a German orphan and is taken into the heart of the Nazi world as a 'war hero' and eventually becomes a Hitler Youth.,13.509,/hkh3GzBHquwB5nkdEeQUbFSo5Ju.jpg,"['History', 'Drama', 'War']","nazi, jewry, world war ii, hitler youth, based on memoir or autobiography, woman director, jewish boy, children in wartime",1990,"['Solomon Perel', 'Marco Hofschneider', 'René Hofschneider', 'Piotr Kozłowski', 'Klaus Abramowsky', 'Michèle Gleizer', 'Ashley Wanninger', 'Marta Sandrowicz', 'Nathalie Schmidt', 'Delphine Forest', 'Andrzej Mastalerz', 'Włodzimierz Press', 'Martin Maria Blau', 'Klaus Kowatsch', 'Holger Kunkel', 'Bernhard Howe', 'André Wilms', 'Hanns Zischler', 'Anna Seniuk', 'Jörg Schnass', 'Norbert Schwarz', 'Erich Schwarz', 'Ashley Wanninger', 'Julie Delpy', 'Halina Łabonarska', 'Wolfgang Bathke', 'Aleksiej Awdiejew', 'Artur Barciś', 'Aleksander Bednarz', 'Zbigniew Bielski', 'Marcin Bielawski', 'Marek Brand', 'Arkadiusz Brukner', 'Dariusz Buchowiecki', 'Bohdan Ejmont', 'Alfred Freudenheim', 'Jarosław Gajewski', 'Jarosław Gruda', 'Kama Kowalewska', 'Martin Latallo', 'Nicolas Lormeau', 'Aleksey Maslov', 'Cezary Morawski', 'Włodzimierz Musiał', 'Ryszard Pietruski', 'Hanna Sylberg', 'Bogusława Schubert', 'Grzegorz Wons', 'Stanisław Zatłoka', 'Jan Paweł Kruk', 'Agnieszka Kumor', 'Wojciech Skibiński', 'Tadeusz Wojtych']","['identity', 'survival', 'war']",Agnieszka Holland
6804,6804,10685,The Watcher,2000-09-08,0,96,False,33000000,"FBI agent Joel Campbell, burnt-out and shell-shocked after years spent chasing serial killers, flees L.A. to begin a new life for himself in Chicago. But five months later, Joel's best laid plans are abruptly cut short when his new hometown becomes the setting for some particularly gruesome murders--murders that could only have been committed by one man: David Allen Griffin. One of Joel's most elusive and cunning nemeses, Griffin has followed his former pursuer to Chicago in order to play a sadistic game of cat and mouse. Taunting Joel with photographs of his intended victims and leaving his crime scenes meticulously free of clues in order to keep the police at bay, Griffin derives as much pleasure out of watching Joel react to every movement as watching his victims die. But when Griffin moves into Joel's inner circle, Joel must quickly find some way to stop him before someone close to him becomes the next one to die.",13.509,/hsMvndtd3KPAvJ3q7zKZuNSB1R3.jpg,"['Mystery', 'Thriller']","chicago, illinois, fbi, menace, investigation, covered investigation, state of emergency, serial killer, little girl, psychiatrist, psychotherapy",2000,"['James Spader', 'Keanu Reeves', 'Marisa Tomei', 'Ernie Hudson', 'Chris Ellis', 'Robert Cicchini', 'Yvonne Niami', 'Jenny McShane', 'Gina Alexander', 'Joseph Sikora', 'Jillian Peterson', 'Michele DiMaso', 'Andrew Rothenberg', 'David Pasquesi', 'Jason Wells', 'Rebekah Nanfria']","['suspense', 'obsession', 'cat-and-mouse']",Joe Charbanic
6805,6805,8010,Highlander II: The Quickening,1991-01-13,15556340,109,False,30000000,"In the year 2024, the ozone layer is believed to have been destroyed. It is up to MacLeod and Rameriz to set things right. Opposition comes from both the planet Ziest (MacLeod and Ramirez's homeworld) and a corporation profiting from the supposed lack of ozone. Also, flashbacks show the story behind MacLeod and Ramirez's exile from Ziest.",13.506,/qxKeykPNGbKAK0DJijMUaZ5cVPo.jpg,"['Fantasy', 'Science Fiction']","new york city, martial arts, immortality, scotland, sword fight, fictional war, dark fantasy, warrior, action hero, sword and sorcery, supernatural power, good versus evil",1991,"['Christopher Lambert', 'Sean Connery', 'Virginia Madsen', 'Michael Ironside', 'John C. McGinley', 'Phillip Brock', 'Rusty Schwimmer', 'Ed Trucco', 'Steven Grives', 'Jimmy Murray', 'Pete Antico', 'Peter Bucossi', 'Peter Bromilow', 'Jeff Altman', 'Allan Rich', 'Diana Rossi', 'Karin Drexler', 'Matt Johnston']","['immortality', 'action', 'sci-fi']",Russell Mulcahy
6806,6806,14462,The Manchurian Candidate,2004-07-30,96105964,129,False,80000000,"Years after his squad was ambushed during the Gulf War, Major Ben Marco finds himself having terrible nightmares. He begins to doubt that his fellow squad-mate Sergeant Raymond Shaw, now a vice-presidential candidate, is the hero he remembers him being. As Marco's doubts deepen, Shaw's political power grows, and, when Marco finds a mysterious implant embedded in his back, the memory of what really happened begins to return.",13.506,/4xEWtEbKK2EXMZ8UPff8hDCSiVW.jpg,"['Drama', 'Thriller', 'Mystery']","gulf war, senator, canoe, kuwait, conspiracy, war hero, u.s. congress, implant",2004,"['Denzel Washington', 'Meryl Streep', 'Liev Schreiber', 'Simon McBurney', 'Kimberly Elise', 'Bruno Ganz', 'Jon Voight', 'Jeffrey Wright', 'Anthony Mackie', 'Ted Levine', 'Miguel Ferrer', 'Dean Stockwell', 'Vera Farmiga', 'Pablo Schreiber', 'Jude Ciccolella', 'Obba Babatundé', 'Zeljko Ivanek', 'Paul Lazar', 'John Bedford Lloyd', 'Tom Stechschulte', 'BeBe Winans', 'Robyn Hitchcock', 'Charles Napier', 'David Keeley', 'Alyson Renaldo', 'Dorian Missick', 'Jose Pablo Cantillo', 'Teddy Dunn', 'Joaquin Perez-Campbell', 'Tim Artz', 'Antoine Taylor', 'Joe Alessi', 'Raymond Anthony Thomas', 'Bill Irwin', 'Al Franken', 'Danny Darst', 'Stephanie McBride', 'Molly Hickok', 'Victoria Haynes', 'Adam LeFevre', 'Roger Corman', 'Leona E. Sondreal', 'Jim Roche', 'Ann Dowd', 'Harry Northup', 'James B. Howard', 'Walter Mosley', 'Gordon Brummer', 'Gayle King', 'Brad Holbrook', 'Stacey Newsome Santiago', 'Kristen Shaughnessy', 'Prue Lewarne', 'Forrest Sawyer', 'Ukee Washington', 'Ed Crane', 'Kaity Tong', 'Roma Torre', 'William Meisle', 'Dan Olmstead', 'Sakina Jaffrey', 'Robert W. Castle', 'John Aprea', 'Jane DeNoble', 'Christopher M. Russo', 'Michael C. Pierce', 'Marin Ireland', 'Glen Hartell', 'Tracey Walter', 'Edwidge Danticat', 'Kenneth Utt', 'Enrique Correa', 'David Neumann', 'Neda Armian', 'Paul Johnson', 'James McCauley', 'Darrell Larson', 'Kate Valk', 'Beau Sia', 'Duana C. Butler', 'Big Jim Wheeler', 'Lauren Roselli', 'Stephen Richardson', 'Shing Ka', 'Malcolm Simpson', 'Cassius Kumar Wilkinson', 'Jos Demme', 'Gabriela Fung', 'Denzel Delahoussaye', 'Aaron Scoenfeld', 'Geovonne Long', 'Jonathan Borst', 'Michael Shehata', 'Tom Chapin', ""Lewis 'Jiggs' Walker"", 'Joey Perillo', 'Buzz Kilman', 'Marie Runyon', 'Eliza Simpson', 'Julie Adamy', 'Andre B. Blake', 'Tymberly Canale', 'Lilly McDowell', 'Joshua Elrod', 'Craig Branham', 'Sidney Lumet', 'Reno', 'Anna Deavere Smith', 'Roy Blount Jr.', 'Fab 5 Freddy']","['paranoia', 'manipulation', 'thriller']",Jonathan Demme
6807,6807,8435,A Cock and Bull Story,2005-07-17,0,94,False,0,"Steve Coogan, an arrogant actor with low self-esteem and a complicated love life, is playing the eponymous role in an adaptation of ""The Life and Opinions of Tristram Shandy, Gentleman"" being filmed at a stately home. He constantly spars with actor Rob Brydon, who is playing Uncle Toby and believes his role to be of equal importance to Coogan's.",13.503,/ww8nEKv3gPOfIkRMGS2A3j566Fr.jpg,['Comedy'],"based on novel or book, film in film, filmmaking",2005,"['Steve Coogan', 'Rob Brydon', 'Keeley Hawes', 'Shirley Henderson', 'Raymond Waring', 'Conal Murphy', 'Joe Williams', 'Paul Kynman', 'Mark Tandy', 'Dylan Moran', 'Jack Shepherd', 'David Walliams', 'Jeremy Northam', 'Benedict Wong', 'Naomie Harris', 'Claire Keelan', 'Kelly Macdonald', 'Mark Hadfield', 'Elizabeth Berrington', 'Mark Williams', 'Jenny Ogilvie', 'Tony Wilson', 'Justine Mitchell', ""Kieran O'Brien"", 'Roger Allam', 'Ashley Jensen', 'James Fleet', 'Ian Hart', 'Ronni Ancona', 'Greg Wise', 'Paul Rider', 'Stephen Fry', 'Sara Stewart', 'Gillian Anderson', 'Stephen Rodrick', 'Rosie Cavaliero', 'Damon Caliendo', 'Andy Callaghan', 'Richard Tree', 'Mary Healey', 'Stuart Wilson']","['meta', 'comedy', 'literature']",Michael Winterbottom
6808,6808,9507,Runaway,1984-12-14,6770587,100,False,8000000,"In the near future, a police officer specializes in malfunctioning robots. When a robot turns out to have been programmed to kill, he begins to uncover a homicidal plot to create killer robots... and his son becomes a target.",13.503,/8xMeKeXGHY2KbiMjSpEGqlIjAEp.jpg,"['Science Fiction', 'Crime', 'Thriller']","future, chase, technology, revenge, murder, conspiracy, robot, explosion",1984,"['Tom Selleck', 'Cynthia Rhodes', 'Gene Simmons', 'Kirstie Alley', 'Stan Shaw', 'G.W. Bailey', 'Joey Cramer', 'Chris Mulkey', 'Anne-Marie Martin', 'Michael Paul Chan', 'Elizabeth Norment', 'Cec Verrell', 'Babs Chula', 'Carol Teesdale', 'Natino Bellantoni', 'Judy Johns', 'Andrew Rhodes', 'Louise Johann', 'Jackson Davies', 'Paul Batten']","['technology', 'action', 'thriller']",Lorin Bennett Salob
6809,6809,24099,Dreamscape,1984-08-15,12145169,99,False,0,"A government funded project looks into using psychics to enter people's dreams, with some mechanical help. When a subject dies in their sleep from a heart attack, Alex Gardner becomes suspicious that another of the psychics is killing people in the dreams somehow and that is causing them to die in real life. He must find a way to stop the abuse of the power to enter dreams.",13.503,/yTx46x6Aa2uNW8fRSyOnro7PISf.jpg,"['Adventure', 'Science Fiction', 'Horror']","dream, monster, usa president, heart, telekinesis, psychic, snake man",1984,"['Dennis Quaid', 'Max von Sydow', 'Christopher Plummer', 'Eddie Albert', 'Kate Capshaw', 'David Patrick Kelly', 'George Wendt', 'Larry Gelman', ""Cory 'Bumper' Yothers"", 'Redmond Gleeson', 'Peter Jason', 'Chris Mulkey', 'Jana Taylor', 'Madison Mason', 'Kendall Carly Browne', 'Kate Charleson', 'Eric Gold', 'Virginia Kiser', 'Carl Strano', 'Brian Libby', 'Bob Terhune', 'Fred Waugh', 'Timothy Blake', 'Carey Fox', 'Marii Mak', 'Claudia Lowe', 'Anna Chavez', 'Ben Kronen', 'John Malone', 'Mindi Iden', 'Betty Kean', 'Trent Dolan', 'Andrew Boyer', 'George Caldwell', 'Ernest Harada', 'Tina Greenberg', 'Alan Buchdahl', 'Larry Cedar']","['dreams', 'sci-fi', 'adventure']",Joseph Ruben
6810,6810,13098,Paid in Full,2002-10-25,3090862,98,False,0,"Ace is an impressionable young man working for a dry cleaning business. His friend, drug dealer Mitch goes to prison. In an unrelated incident, he finds some cocaine in a pants pocket. Soon, Ace finds himself dealing cocaine for Lulu. Via lucky breaks and solid interpersonal skills, Ace moves to the top of the Harlem drug world. Of course, unfaithful employees and/or rivals conspire to bring about Ace's fall.",13.498,/oiG5BObjENJjEacFdWw1KfK3TFx.jpg,"['Action', 'Crime', 'Drama']","new york city, street gang, drug smuggling, gangster, drug trafficking, rapper, ghetto, fistfight, organized crime, urban setting, racial slur, street life",2002,"['Wood Harris', ""Cam'ron"", 'Mekhi Phifer', 'Kevin Carroll', 'Chi McBride', 'Regina Hall', 'Esai Morales', 'Cynthia Martells', 'Elise Neal', 'Ron Cephas Jones', 'Nelson Tynes', 'Derrick Simmons', 'Damon Dash', 'Jamie Hector', 'Hassan Johnson', 'Tobias Truvillion', 'Bruce Robinson', 'Busy Bee', 'Doug E. Fresh', 'Martin Roach']","['crime', 'ambition', 'friendship']",Charles Stone III
6811,6811,16619,Ordinary People,1980-09-19,54766923,124,False,6000000,"Beth, Calvin, and their son Conrad are living in the aftermath of the death of the other son. Conrad is overcome by grief and misplaced guilt to the extent of a suicide attempt. He is in therapy. Beth had always preferred his brother and is having difficulty being supportive to Conrad. Calvin is trapped between the two trying to hold the family together.",13.498,/kPt2AQiSP39g3I1TtAnjSGQwN9S.jpg,['Drama'],"chicago, illinois, depression, post-traumatic stress disorder (ptsd), based on novel or book, suicide attempt, middle class, dysfunctional family, grief, psychiatrist, guilt, grieving",1980,"['Donald Sutherland', 'Mary Tyler Moore', 'Judd Hirsch', 'Timothy Hutton', 'M. Emmet Walsh', 'Elizabeth McGovern', 'Dinah Manoff', 'Fredric Lehne', 'James B. Sikking', 'Basil Hoffman', 'Quinn K. Redeker', 'Mariclare Costello', 'Meg Mundy', 'Elizabeth Hubbard', 'Adam Baldwin', 'Richard Whiting', 'Scott Doebler', 'Carl DiTomasso', 'Tim Clarke', 'Ken Dishner', 'Lisa Smyth', 'Ann Eggert', 'Randall Robbins', 'Cynthia Baker', 'John Stimpson', 'Liz Kinney', 'Steven Hirsch', 'Rudy Hornish', 'Clarissa Downey', 'Cynthia Burke', 'Jane Alderman', 'Paul Preston', 'Gustave Lachenauer', 'Marilyn Rockafellow', 'Don Billett', 'Ronald Solomon', 'Virginia Long', 'Paula Segal', 'Estelle Meyers', 'Stuart Shiff', 'Rose Wool', 'Douglas Kinney', 'Constance Addington', 'Edwin Bederman', 'Bobby Coyne', 'Michael Creadon']","['grief', 'family', 'healing']",Jeff Kanew
6812,6812,24546,Into the Sun,2005-11-26,175563,97,False,15000000,"After the assassination of Tokyo's Governor by Yakuza members, the CIA bureau chief (William Atherton) for Tokyo puts out a call to an agent (Steven Seagal) that had been raised in Japan and trained by ex-Yakuza. Using his former ties, he quickly determines that a war is brewing between old-guard Yakuza members and a young, crazed leader (Takao Osawa) with ties to the Chinese Tong.",13.497,/rrfGzNwsIycS8uQZ9eb0iJhPbgs.jpg,"['Action', 'Thriller']","martial arts, cia, fight, sword, gangster, fbi, yakuza, katana, blood splatter, strip club, sword fight, revenge, fate, broken neck, gunfight, one man army, combat, action hero, fbi agent",2005,"['Steven Seagal', 'Matthew Davis', 'Takao Osawa', 'Namihiko Ohmura', 'Daisuke Honda', 'Ken Lo Wai-Kwong', 'Kanako Yamaguchi', 'William Atherton', 'Juliette Marquis', 'Kosuke Toyohara', 'Pace Wu Pui-Tsi', 'Masatô Ibu', 'Akira Terao', 'Chiaki Kuriyama', 'Roy Oguri', 'Sokyu Fujita', 'Vikrom Suebsaeng', 'Eddie George', 'Mac Yasuda', 'Kairi Narita', 'Sôtarô', 'Kazuaki Kubo', 'Ezawa Daiki', 'Rie Takeda', 'Ginji Yoshikawa', 'Naoto Adachi', 'Tamaki Sakura', 'Ken Yasuda', 'Colorque', 'Kittipong Subthawonpan']","['action', 'revenge', 'espionage']",mink
6813,6813,15318,The Taste of Tea,2004-07-17,0,143,False,0,"A spell of time in the life of a family in rural Tochigi prefecture. Yoshiko is not an ordinary housewife, instead working on an animated film project. Uncle Ayano, a successful music producer, is looking to get his head together after living in Tokyo. Meanwhile, Sachiko is concerned with why she seems to be followed by a giant version of herself. As the lazy days pass by, each member of the family is followed in a series of episodic vignettes.",13.496,/yapwfNElQYFY9TaVS03jv6Gk2Rs.jpg,"['Comedy', 'Drama']","japan, surreal, family history, relatives, rural area, magic realism",2004,"['Maya Suzuno', 'Takahiro Sato', 'Tadanobu Asano', 'Satomi Tezuka', 'Tatsuya Gashûin', 'Tomokazu Miura', 'Anna Tsuchiya', 'Tomoko Nakajima', 'Ikki Todoroki', 'Kirin Kiki', 'Kaiji Moriyama', 'Ryo Kase', 'Kenji Mizuhashi', 'Hideaki Anno', 'Yoshinori Okada', 'Susumu Terajima', 'Shinji Takeda', 'Emi Wakui', 'Tsuyoshi Kusanagi', 'Saki Aibu', 'Keisuke Horibe', 'Yuka Nomura', 'Yoji Tanaka', 'Shunichiro Miki', 'Machiko Ono', 'Kenichi Matsuyama', 'Issey Takahashi', 'Ryu Morioka', 'Kotaro Shiga', 'Yoshiyuki Morishita', 'Hiroshi Kuze', 'Eiko Sakurai', 'Seiji Tanaka', 'Taketeru Murata', 'Daigaku Sekine', 'Rinko Kikuchi']","['family', 'whimsy', 'introspection']",Katsuhito Ishii
6814,6814,13166,Freddy Got Fingered,2001-04-18,14343028,87,False,14000000,"An unemployed cartoonist moves back in with his parents and younger brother Freddy. When his parents demand he leave, he begins to spread rumors that his father is sexually abusing Freddy.",13.495,/gVmSZgxiT7ynyRLsEgg8Xs8ZVWX.jpg,['Comedy'],"wheelchair, satire, surrealism, dysfunctional family, slacker, sausage, crude humor, unemployment, rumor, cartoonist, father son relationship, absurd, bold",2001,"['Tom Green', 'Rip Torn', 'Marisa Coughlan', 'Eddie Kaye Thomas', 'Harland Williams', 'Anthony Michael Hall', 'Julie Hagerty', 'Jackson Davies', 'Connor Widdows', 'John R. Taylor', 'Bob Osborne', 'Fiona Hogan', 'George Gordon', 'Ron Selmour', 'Drew Barrymore', 'David Neale', 'Scott Heindl', 'Wendy Chmelauskas', 'R. Nelson Brown', 'Lorena Gale', 'Simon Longmore', 'Giacomo Baessato', 'Eric Keenleyside', ""Shaquille O'Neal"", 'Rick Tae', 'Noel Fisher', 'Irene Karas', 'Ted Friend', 'Balinder Johal', 'Kamaljeet Kler', 'Ralph Wagner', 'Mike Bullard', 'Ralph Alderman', 'Chris Carver', 'Michele Cummins', 'Joe Flaherty', 'Stephen E. Miller', 'John Rigg', 'Jorge Rodriguez', 'Cliff Solomon', 'Stephen Tobolowsky', 'Henry O. Watson', 'Tom Hallick', 'Darren Moore', 'Allan Gray']","['absurdity', 'shock humor', 'surreal']",Cristina Weigmann
6815,6815,10878,Saving Silverman,2001-02-09,19351569,90,False,22000000,"A pair of buddies conspire to save their best friend from marrying the wrong woman, a cold-hearted beauty who snatches him from them and breaks up their Neil Diamond cover band.",13.493,/5mq8J11266ZL7HCOwDGXoaU6eIO.jpg,"['Comedy', 'Crime', 'Romance']","kidnapping, harassment, fiancé, marriage, dark comedy, male friendship, dating, group of friends, tied to chair, duringcreditsstinger, domineering, single man, relationship sabotage",2001,"['Steve Zahn', 'Jack Black', 'Jason Biggs', 'Amanda Peet', 'Amanda Detmer', 'R. Lee Ermey', 'Neil Diamond', 'Kyle Gass', 'Andrew McIlroy', 'Norman Armour', 'Colin Foo', 'Christopher Logan', 'Esme Lambert', 'Max Fomitchev', 'Tony Parsons', 'Oscar Goncalves', 'Lillian Carlson', 'Mark Aaron Wagner', 'Stephen Chang', 'Eliza Norbury', 'Michael Roberds', 'Sean Owen Roberts', 'Ken Camroux-Taylor', 'Lowela Jotie', 'Odessa Munroe', 'Tracy Trueman', 'Devin Douglas Drewitz', 'Carly McKillip', 'Carla Boudreau', 'Biski Gugushe', 'Steven McMichael', 'Dennis Dugan', 'Larry Lam', 'Brett Armstrong']","['friendship', 'romantic comedy', 'rescue']",Daniel Silverberg
6816,6816,176177,Verbotenes Verlangen - Ich liebe meinen Schüler,2000-01-18,0,0,False,0,"(Television) melodrama about an established, happily married teacher who falls in love with one of her pupils and becomes pregnant by him.",13.493,/wOGNqkD0fxlPUkjABjn7EeJNu7E.jpg,"['Drama', 'Romance']",,2000,"['Marion Mitterhammer', 'Matthias Schweighöfer', 'Stefan Reck', 'Laura-Charlotte Syniawa', 'Jochen Senf', 'Barbara Focke', 'Konstantin Graudus', 'Esther Seibt', 'Nicolas Solar Lozier', 'Andreas Schmidt-Schaller']","['forbidden love', 'drama', 'controversy']",Zoltan Spirandelli
6817,6817,9443,Chariots of Fire,1981-05-15,58972904,124,False,5500000,"In the class-obsessed and religiously divided UK of the early 1920s, two determined young runners train for the 1924 Paris Olympics. Eric Liddell, a devout Christian born to Scottish missionaries in China, sees running as part of his worship of God's glory and refuses to train or compete on the Sabbath. Harold Abrahams overcomes anti-Semitism and class bias, but neglects his beloved sweetheart in his single-minded quest.",13.492,/qnRaum8k0HqGRml2i7OawFqUtEb.jpg,"['Drama', 'History']","underdog, sports, scotland, missionary, olympic games, jewry, patriotism, mayor, praline, olympian sports team, ambition, based on true story, athletics, olympic athlete, cambridge university",1981,"['Ben Cross', 'Ian Charleson', 'Cheryl Campbell', 'Alice Krige', 'Nigel Havers', 'Ian Holm', 'Nicholas Farrell', 'Daniel Gerroll', 'John Gielgud', 'Lindsay Anderson', 'Nigel Davenport', 'Dennis Christopher', 'Brad Davis', 'Patrick Magee', 'Peter Egan', 'Struan Rodger', 'David Yelland', 'Richard Griffiths', 'Patrick Doyle', 'John Young', 'Yvonne Gilan', 'David John', 'Benny Young', 'Yves Beneyton', 'Stephen Mallatratt', 'Gerry Slevin', 'Colin Bruce', 'Alan Polonsky', 'Edward Wiley', 'Jeremy Sinden', 'Andrew Hawkins', 'Jack Smethurst', 'Peter Cellier', ""Philip O'Brien"", 'Ruby Wax', 'Ralph Lawton', 'Kim Clifford', 'John Rutland', 'Peter Jones', 'Tommy Boyle', 'Wallace Campbell', 'Gordon Hammersley', 'Alan Dudley', 'Tess Dignan', 'Michael Jeyes', 'David Kivlin', 'Eddie Hughson', 'Ted Robbins', 'Kenneth Branagh', 'Stephen Fry']","['determination', 'faith', 'competition']",Hugh Hudson
6818,6818,25556,The Land Before Time IX: Journey to Big Water,2002-12-17,0,71,False,0,"Littlefoot befriends with a mysterious, fun-loving dolphin-like creature named Mo, who is trapped in ""new water"" caused by heavy rain. The gang then goes on an adventure to the ""big water"" to bring Mo home.",13.489,/3QEVfflbBR20AuKp7FEnTeqiv78.jpg,"['Animation', 'Adventure', 'Family']",,2002,"['John Ingle', 'Kenneth Mars', 'Miriam Flynn', 'Thomas Dekker', 'Anndi McAfee', 'Aria Noelle Curzon', 'Rob Paulsen', 'Tress MacNeille', 'Jeff Bennett']","['friendship', 'adventure', 'discovery']",Charles Grosvenor
6819,6819,14903,Pooh's Grand Adventure: The Search for Christopher Robin,1997-08-05,0,76,False,0,"Pooh gets confused when Christopher Robin leaves him a note to say that he has gone back to school after the holidays. So Pooh, Piglet, Tigger, Eeyore and Rabbit go in search of Christopher Robin which leads to a big adventure.",13.486,/x0VfdebBXlgfLN5lSoapwvXdtMz.jpg,"['Animation', 'Family', 'Adventure']","hand drawn animation, cartoon animal, winnie the pooh, courage",1997,"['Jim Cummings', 'John Fiedler', 'Ken Sansom', 'Paul Winchell', 'Peter Cullen', 'Brady Bluhm', 'Andre Stojka', 'David Warner', 'Steven Schatzberg', 'Frankie J. Galasso']","['friendship', 'courage', 'adventure']",Phil Weinstein
