,Unnamed: 0,id,title,release_date,revenue,runtime,adult,budget,overview,popularity,poster_path,genres,keywords,year,actors,emotions,director
3122,3122,59961,Safe House,2012-02-08,208076205,115,False,85000000,"A dangerous CIA renegade resurfaces after a decade on the run. When the safe house he's remanded to is attacked by mercenaries, a rookie operative escapes with him. Now, the unlikely allies must stay alive long enough to uncover who wants them dead.",22.791,/7SYBPjv5ywF6cI4BSFFtlDyChT2.jpg,"['Action', 'Thriller']","martial arts, cia, microchip, betrayal, on the run, shootout, interrogation, safe house, rogue agent, cape town, south africa, football (soccer) stadium, consulate",2012,"['Denzel Washington', 'Ryan Reynolds', 'Vera Farmiga', 'Brendan Gleeson', 'Sam Shepard', 'Rubén Blades', 'Nora Arnezeder', 'Robert Patrick', 'Liam Cunningham', 'Joel Kinnaman', 'Fares Fares', 'Jenna Dover', 'Stephen Rider', 'Daniel Fox', 'Tracie Thoms', 'Stephen Bishop', 'Tanit Phoenix', 'Sara Arrington', 'Kenneth Fok', 'Nicole Sherwin', 'Stephen Bishop', 'Sherry Stone', 'Sebastian Roché', 'Trayan Milenov-Troy', 'Jody J. Abrahams', 'Pope Jerrod', 'Jerry Mofokeng', 'Bryan van Niekerk', 'Allen Irwin', 'Jake McLaughlin', 'Aidan Bennetts', 'Vernon Willemse', 'Dumani Siphosetu Mtya', 'Thembaletu Tyutu', 'Oliver Bailey', 'Roy Taylor', 'Boris Martinez', 'Scott Sparrow', 'Justin Shaw', 'Fana Mokoena', 'Dirk Stoltz', 'Craig Palm', 'Craig Hawks', 'Tyrone Dadd', 'Tilly Powell', 'Lynita Crofford', 'Abdul Ntotera', 'Ayabonga Mtekeli', 'Nambitha Mpumlwana', 'Lelethu Nongalaza', 'Namhla Tshuka', 'Robert Hobbs', 'Aidan Whytock', 'Bruce Young', 'Geon Nel', 'Liaan Ferreira', 'Sean Cameron Michael', 'Mike Monroe', 'De-Wet Nagel', 'Stelio Savante', 'Mark Vincent']","['trust', 'pursuit', 'suspense']",Daniel Espinosa
3123,3123,18707,"Twinkle, Twinkle, Lucky Stars",1985-08-15,0,105,False,9023199,"The third installment in the Lucky Stars series, following Winners and Sinners and My Lucky Stars. The team are released from prison to play detective in order to stop a ruthless gang from ruining their reputations, taking their lives, and that of a key witness in an upcoming trial. They must battle their way through and with the help of Muscles, take down the bad guys.",22.783,/ojeCl4Qw4CmMP7jjpiJU4ZlbsV.jpg,"['Action', 'Comedy']","martial arts, transvestism, sequel, gang, interrupted vacation",1985,"['Sammo Hung Kam-Bo', 'Richard Ng Yiu-Hon', 'Stanley Fung Shui-Fan', 'Michael Miu Kiu-Wai', 'Eric Tsang', 'Charlie Chin Chiang-Lin', 'Jackie Chan', 'Yuen Biao', 'Sibelle Hu Hui-Chung', 'Walter Tso Tat-Wah', 'John Shum Kin-Fun', 'Rosamund Kwan Chi-Lam', 'Jaime Chik Mei-Chun', 'Anthony Chan Yau', 'Melvin Wong Gam-Sam', 'Billy Lau Nam-Kwong', 'Michelle Yeoh', 'Chang Ching-Po', 'Wu Ma', 'Sandra Ng Kwan-Yue', 'Season Ma', 'Ng Ha-Ping', 'Kara Wai Ying-Hung', 'Paul Chung Fat', 'Yasuaki Kurata', 'Richard Norton', 'James Tien Chun', 'Lee Hoi-Sang', 'Dick Wei', 'Phillip Ko Fai', 'Lau Kar-Wing', 'Andy Lau', 'Jason Pai Piao', 'Tai Bo', 'George Lam Tsz-Cheung', 'Deanie Yip Tak-Han', 'Alfred Cheung Kin-Ting', 'David Chiang Da-Wei', 'Philip Chan', 'Peter Yang Kwan', 'Winnie Chin Wai-Yee', 'Cher Yeung Suet-Yee', 'Moon Lee Choi-Fung', 'Pauline Wong Siu-Fung', 'Chin Siu-Ho', 'Tina Lau Tin-Lan', 'Austin Wai Tin-Chi', 'Bryan Leung', 'Kenny Ho Kar-King', 'David Lam Wai', 'Mang Hoi', 'Wong Jing', 'Natalis Chan Pak-Cheung', 'Tai San', 'Wan Fat', 'Ka Lee', 'Lai Kim-Hung', 'Lee Chi-Kit', 'Paul Wong Kwan', 'Chow Gam-Kong', 'Chu Tau', 'Benny Lai Keung-Kuen', 'Danny Chow Yun-Kin', 'Siu Tak-Foo', 'Ho Chi-Wai', 'Fan Chin-Hung', 'Ha Kwok-Wing', 'Lung Ying', 'Pang Yun-Cheung', 'Liu Hok-Ming', 'Yuen Miu', 'Chin Ka-Lok', 'Fruit Chan', 'Woo Wing-Tat', 'Sam Feng-San', 'Chris Lee Kin-Sang']","['chaos', 'action', 'friendship']",Fruit Chan
3124,3124,618162,The Harder They Fall,2021-10-22,0,139,False,0,"Gunning for revenge, outlaw Nat Love saddles up with his gang to take down enemy Rufus Buck, a ruthless crime boss who just got sprung from prison.",22.77,/su9WzL7lwUZPhjH6eZByAYFx2US.jpg,['Western'],"prison, release from prison, revenge, bank robbery, cowboy, wild west, quick draw, outlaw gang, 19th century",2021,"['Jonathan Majors', 'Idris Elba', 'Regina King', 'Zazie Beetz', 'Delroy Lindo', 'Danielle Deadwyler', 'LaKeith Stanfield', 'Edi Gathegi', 'RJ Cyler', 'Deon Cole', 'Julio Cesar Cedillo', 'Damon Wayans Jr.', 'Woody McClain', 'Jacobi Howard', 'Tait Fletcher', 'Dylan Kenin', 'Andria B Langston', 'Ernest Marsh', 'Chanel Mack', 'Tracy Obonna', 'Howard Ferguson Jr.', 'Bonita King', 'Mickey Dolan', 'Michael Beach', 'DeWanda Wise', 'Chase W. Dillon', 'Marissa Freeman', 'Sadiqua Bynum', 'Zacciah Hanson', 'DyNiesha Lysette Whitfield', 'David Hight', 'Stephanie Hill', 'Vic Browder', 'Ivan Lee Holmes', 'Michael E. Stogner', 'Angie Jenkins', 'Steve Corona', 'Peyton Jackson', 'J. Nathan Simmons', 'Terrence Clowe', 'Manny Rubio', 'Nicholas G. Sims', 'Aahkilah Cornelius', 'Mark Rhino Smith']","['revenge', 'brotherhood', 'justice']",Jeymes Samuel
3125,3125,339527,Solace,2015-09-03,22586863,101,False,0,"A psychic doctor, John Clancy, works with an FBI special agent in search of a serial killer.",22.761,/pbcXpZgem8kgr90RwIUNAbC2ite.jpg,"['Thriller', 'Crime', 'Mystery']","fbi, investigation, autopsy, terminal illness, premonition, murder, cancer, psychologist, serial killer, crime scene, psychic, intrigue, dark past, vision of the future",2015,"['Anthony Hopkins', 'Jeffrey Dean Morgan', 'Abbie Cornish', 'Colin Farrell', 'Matt Gerald', 'Jose Pablo Cantillo', 'Marley Shelton', 'Xander Berkeley', 'Kenny Johnson', 'Joshua Close', 'Sharon Lawrence', 'Janine Turner', 'Luisa Moraes', 'Jordan Woods-Robinson', 'Niyi Oni', 'Carter Godwin', 'Autumn Dial', 'Tara Arroyave', 'Rey Hernandez', 'Bruce Taylor', 'Frank Brennan', 'Adam Drescher', 'Jake Lawson', 'Keith Ewell', 'Charles Lawlor', 'Kresh Novakovic', 'Michele Torres', 'David Weiss', 'Christopher Beanland', 'Russell Durham Comegys', 'Adam Boyer', 'David Alessi', 'Kenesha Bolton', 'Malina Germanova', 'Michael D. Jenkins', 'Angela Kerecz', 'Rob Koebel', 'Drew Lamkins', 'Matt Leddo', 'Shaheed Malik', 'John Merical', 'Richard A Moore', 'Michelle Pokopac', 'Timothy Scott', 'Emily Chandler Westergreen']","['loss', 'mystery', 'grief']",Afonso Poyart
3126,3126,11551,Small Soldiers,1998-07-10,54682547,110,False,40000000,"When missile technology is used to enhance toy action figures, the toys soon begin to take their battle programming too seriously.",22.75,/2nuUjSzHsoYlRvTPmLo7m7gCQry.jpg,"['Comedy', 'Adventure', 'Fantasy', 'Science Fiction', 'Action']","defense industry, toy shop, technical toy, soldier, prototype, killer toys, toy comes to life",1998,"['Gregory Smith', 'Kirsten Dunst', 'Denis Leary', 'Phil Hartman', 'David Cross', 'Jay Mohr', 'Kevin Dunn', 'Ann Magnuson', 'Wendy Schaal', 'Jacob Smith', 'Tommy Lee Jones', 'Frank Langella', 'Ernest Borgnine', 'Jim Brown', 'Bruce Dern', 'George Kennedy', 'Clint Walker', 'Christopher Guest', 'Michael McKean', 'Harry Shearer', 'Sarah Michelle Gellar', 'Christina Ricci', 'Dick Miller', 'Belinda Balaski', 'Jackie Joseph', 'Rance Howard', 'Cheri Oteri', 'Robert Picardo', 'Archie Hahn', 'Alexandra Wilson']","['rebellion', 'imagination', 'war']",Joe Dante
3127,3127,9268,Eraser,1996-06-21,242295562,115,False,100000000,"U.S. Marshall John Kruger erases the identities of people enrolled in the Witness Protection Program. His current assignment is to protect Lee Cullen, who's uncovered evidence that the weapons manufacturer she works for has been selling to terrorist groups. When Kruger discovers that there's a corrupt agent within the program, he must guard his own life while trying to protect Lee's.",22.745,/1FUV5ZmEkbxvqwQW0az4tFFOSmo.jpg,"['Action', 'Drama', 'Mystery', 'Thriller']","suicide, showdown, ambush, hitman, hostage, traitor, new identity, witness, witness protection, arms dealer, treason, deception, u.s. marshal, betrayal, conspiracy, gunfight, train, explosion, sabotage, corporate crime, rogue agent, assassination attempt, x-ray vision, railgun",1996,"['Arnold Schwarzenegger', 'Vanessa Williams', 'James Caan', 'James Coburn', 'Robert Pastorelli', 'James Cromwell', 'Danny Nucci', 'Andy Romano', 'Nick Chinlund', 'Michael Papajohn', 'Joe Viterelli', 'Mark Rolston', 'John Slattery', 'Robert Miranda', 'Roma Maffia', 'Tony Longo', 'Gerry Becker', 'John Snyder', 'Melora Walters', 'Olek Krupa', 'Cylk Cozart', 'K. Todd Freeman', 'Rocco Sisto', 'Gerald Berns', 'Steven Ford', ""Ismael 'East' Carlo"", 'Tommy J. Huff', 'Rick Batalla', 'Michael Gregory', 'Patrick Kilpatrick', 'James Short', 'A.J. Nay', 'Camryn Manheim', 'Skipp Sudduth', 'Anthony Fusco', 'Gregory McKinney', 'Craig Barnett', 'Corey Joshua Taylor', 'Rick Marzan', 'Brian Libby', 'Danny Wynands', 'David Fonteno', 'Sonny King', 'Ed W. Rote', 'Mike Cameron', 'Tim Colceri', 'Dieter R. Trippel', 'Matthew Mahaney', 'Denis Forest', 'Christopher Mankiewicz', 'Mike Stone', 'Kevin Fry-Bowers', 'Sam Scarber', 'Richie Varga', 'Ben Shenkman', 'Dominic Marcus', 'Pat Collins', 'Dorin Seymour', 'Clayton Landey', 'Terry Beeman', 'M.G. Gong', 'Sebastian La Cause', 'Frank Minitello', 'Charles Chiquette', 'Glenndon Chatman', 'Camille Winbush', 'Vic Polizos', 'James Frank Clark', 'David Bilson', 'Al Cerullo', 'Rick Shuster', 'Diana Morgan', 'Michael J. Oliver', 'Mischa Hausserman']","['espionage', 'escape', 'rescue']",Chuck Russell
3128,3128,2112,Payback,1999-02-05,161626121,100,False,90000000,"With friends like these, who needs enemies? That's the question bad guy Porter is left asking after his wife and partner steal his heist money and leave him for dead -- or so they think. Five months and an endless reservoir of bitterness later, Porter's partners and the crooked cops on his tail learn how bad payback can be.",22.743,/gl295sH8213lY8aQ8hS2tTbuzYD.jpg,"['Crime', 'Action', 'Drama']","hotel, new york city, prostitute, robbery, based on novel or book, heroin, anti hero, greed, money, revenge, organized crime, drugs, criminal, one against many, double cross, neo-noir, corrupt cop, parker",1999,"['Mel Gibson', 'Gregg Henry', 'Maria Bello', 'David Paymer', 'Bill Duke', 'Deborah Kara Unger', 'John Glover', 'William Devane', 'Lucy Liu', 'Kris Kristofferson', 'Jack Conley', 'Mark Alfa', 'Kwame Amoaku', 'Justin Ashforth', 'Len Bajenski', 'James Coburn', 'Trevor St. John', 'Freddy Rodríguez', 'Kate Buddeke', 'Price Carson', 'Jeff Imada', 'Elizabeth Berridge', 'Jovanna Vitiello', 'David Dunard']","['betrayal', 'payback', 'bitterness']",Mark Cotone
3129,3129,116149,Paddington,2014-11-24,259207227,96,False,55000000,"A young Peruvian bear travels to London in search of a new home. Finding himself lost and alone at Paddington Station, he meets the kindly Brown family.",22.74,/y7lFcSKhFrcelocr2VFflJnVzIH.jpg,"['Comedy', 'Adventure', 'Family']","london, england, based on novel or book, peru, anthropomorphism, bear, based on children's book, family, talking to animals, children's book, taxidermist, live action and animation, personification, natural history museum",2014,"['Ben Whishaw', 'Hugh Bonneville', 'Sally Hawkins', 'Madeleine Harris', 'Samuel Joslin', 'Julie Walters', 'Nicole Kidman', 'Imelda Staunton', 'Peter Capaldi', 'Michael Gambon', 'Jim Broadbent', 'Madeleine Worrall', 'Tim Downie', 'Matt King', 'Simon Farnaby', 'Kayvan Novak', 'Matt Lucas', 'Jonathan Derbyshire', 'Mary Roscoe', 'Jude Wright', 'Lottie Steer', 'Alice Lowe', 'Will Smith', 'Toby Williams', 'Catherine Shepherd', 'Sean Bridgeman', 'Cleo Sylvestre', 'Geoffrey Palmer', 'Gus Brown', 'Rufus Jones', 'Kenneth Hadley', 'David McKail', 'James Bachman', 'Javier Marzan', 'Llewella Gideon', 'Justin Edwards', 'Iain Mitchell', 'Barry Ashton', 'Michael Bond', 'Steve Edge', 'Steve Oram', 'Tom Meeten', 'Hamish McColl', 'Dominic Coleman', 'Tarik Blake', 'Theresa Watson', 'Ross Boatman', 'Eddie Nestor', 'George Newton', 'Alexander Bracq', 'Ancuta Breaban', 'Faith Elizabeth', 'Barrie Martin', 'Stuart Matthews', 'Fabio Vollono', 'Julie Vollono', 'Matthew David McCarthy', 'Dennis Good', 'Jack Philips', 'Asim Chaudhry', 'Nigel Genis', 'Jim Lawrence', 'Vic Waghorn']","['kindness', 'family', 'joy']",Paul King
3130,3130,570670,The Invisible Man,2020-02-26,144492724,124,False,7000000,"When Cecilia's abusive ex takes his own life and leaves her his fortune, she suspects his death was a hoax. As a series of coincidences turn lethal, Cecilia works to prove that she is being hunted by someone nobody can see.",22.738,/5EufsDwXdY2CVttYOk2WtYhgKpa.jpg,"['Thriller', 'Science Fiction', 'Horror']","based on novel or book, pregnancy, architect, fake suicide, stalker, murder, domestic abuse, scientist, police detective, death, invisible person, mental hospital, woman in peril, invisible man",2020,"['Elisabeth Moss', 'Aldis Hodge', 'Storm Reid', 'Michael Dorman', 'Harriet Dyer', 'Oliver Jackson-Cohen', 'Benedict Hardie', 'Zara Michales', 'Renee Lim', 'Sam Smith', 'Nick Kici', 'Vivienne Greer', 'Anthony Brandon Wong', 'Serag Mohammed', 'Nash Edgerton', 'Nicholas Hope', 'Cardwell Lynch', 'Xavier Fernández', 'Cleave Williams', 'Brian Meegan', 'Amali Golden', 'Dennis Kreusler', 'Michael Knott', 'Randolph Fields']","['fear', 'abuse', 'freedom']",Killian Maguire
3131,3131,51481,Mean Girls 2,2011-01-23,0,96,False,0,"After a clique of girls makes life difficult, a new student forms a rival group to take control of the school's corridors.",22.737,/34zKHT98ZgSCz6ag1ZNBul7f1Wu.jpg,['Comedy'],"woman director, high school rivalry",2011,"['Meaghan Jette Martin', 'Jennifer Stone', 'Maiara Walsh', 'Nicole Gale Anderson', 'Claire Holt', 'Diego Boneta', 'Bethany Anne Lind', 'Patrick Johnson', 'Colin Dennard', 'Amber Brooke', 'Juliet Kim', 'Willie Larson', 'Linden Ashby', 'Tim Meadows', 'Donn Lamkin', 'Rhoda Griffis', 'Dan Coleman', 'Mike Pniewski', 'Lil Bit', 'Greg Perrow', 'Kimberly Banta', 'Rachel Filsoof', 'Katelyn E. Bulluck', 'Kelly Gilmore', 'Autumn Dial']","['insecurity', 'competition', 'belonging']",Melanie Mayron
3132,3132,414420,My Student's Mom,2016-08-11,0,80,False,0,"Gyeong-soo and Jeong-min used to be the happiest couple in the world. However, Jeong-min is left home alone after her husband leaves to the regional area for a lengthy business trip. While she tries to deal with her lonely feelings, her son’s tutor Min-hyeok starts flirting with her hard. And although Jeong-min knows she shouldn’t, she starts being attracted to Min-hyeok more and more. Meanwhile, Gyeong-soo finds his place in a boarding house in the regional district and starts getting attracted to the owner of the board house, who is a single mother with a young daughter.",22.737,/bcQtBkJtPHCs3VA1AOJ6T11BaBB.jpg,['Romance'],softcore,2016,"['Han Seol-hwa', 'Park Hyun-jung', 'Kim Jin-seo', 'Park Do-jin', 'Baek Se-ri', 'Kim Seok-ho', 'Han I-soo', 'Park Sya-ron', 'Song-bi', 'Kim Hye-yeon', 'Tae-seong', 'Yoo Jong-hae']","['desire', 'temptation', 'taboo']",Gi Dae-ho
3133,3133,221731,Rurouni Kenshin Part II: Kyoto Inferno,2014-08-01,0,138,False,0,"Kenshin has settled into his new life with Kaoru and his other friends when he is approached with a request from the Meiji government. Makoto Shishio, a former assassin like Kenshin, was betrayed, set on fire and left for dead. He survived, and is now in Kyoto, plotting with his gathered warriors to overthrow the new government. Against Kaoru's wishes, Kenshin reluctantly agrees to go to Kyoto and help keep his country from falling back into civil war.",22.736,/gI2xYpJPQOsmFblvowkW2IgEHkC.jpg,"['Action', 'Adventure', 'Drama', 'Fantasy']","japan, samurai, based on manga, samurai sword, kyoto, japan, 19th century, meiji period",2014,"['Takeru Satoh', 'Emi Takei', 'Munetaka Aoki', 'Kaito Oyagi', 'Yu Aoi', 'Yosuke Eguchi', 'Yûsuke Iseya', 'Min Tanaka', 'Tao Tsuchiya', 'Ryunosuke Kamiki', 'Maryjun Takahashi', 'Tatsuya Fujiwara', 'Kazufumi Miyazawa', 'Yukiyoshi Ozawa', 'Ryosuke Miura', 'Kenichi Takitoh', 'Masataka Kubota', 'Tomomi Maruyama', 'Mitsu Murata', 'Hiroko Yashiki', 'Kentarō Shimazu', 'Kota Yamaguchi', 'Dai Watanabe', 'Aki Nishihara', 'Mantaro Koichi', 'Hidekazu Mashima', 'Tatsuya Nakamura', 'Yuria Eda', 'Ayumi Beppu', 'Yasushi Fuchikami', 'Masaharu Fukuyama', 'Tôru Kizu']","['loyalty', 'duty', 'tragedy']",Keishi Otomo
3134,3134,256835,Toy Story That Time Forgot,2014-12-02,0,22,False,0,"During a post-Christmas play date, the gang find themselves in uncharted territory when the coolest set of action figures ever turn out to be dangerously delusional. It's all up to Trixie, the triceratops, if the gang hopes to return to Bonnie's room in this Toy Story That Time Forgot.",22.731,/pw1YgzcBw4GmwylrFlXMzLdELRo.jpg,"['Animation', 'Family', 'Adventure', 'Comedy']","christmas, television special, short film",2014,"['Kristen Schaal', 'Kevin McKidd', 'Tom Hanks', 'Tim Allen', 'Emily Hahn', 'Steve Purcell', 'R.C. Cope', 'Emma Hudak', 'Wallace Shawn', 'Jonathan Kydd', 'Don Rickles', 'Timothy Dalton', 'Lori Alan', 'Joan Cusack']","['holiday', 'imagination', 'friendship']",
3135,3135,63197,Megan Is Missing,2011-05-01,0,85,False,0,"Fourteen-year–old Megan and her best friend Amy spend a lot of time on the internet, posting videos of themselves and chatting with guys online. One night Megan chats with a guy named Josh who convinces her to meet him for a date. The next day, Megan is missing—forever. Based on actual cases of child abduction.",22.731,/a7ndLikcqvX7dF7gsYx5iDe7qq1.jpg,"['Drama', 'Horror', 'Thriller']","rape, predator, based on true story, murder, teenage girl, internet, torture, high school friends, missing person, found footage, abduction",2011,"['Amber Perkins', 'Rachel Quinn', 'Dean Waite', 'Jael Elizabeth Steinmeyer', 'Kara Wang', 'Brittany Hingle', 'Carolina Sabate', 'Trigve Hagen', 'Rudy Galvan', 'April Stewart', 'John K. Frazier', 'Tammy Klein', 'Lauren Leah Mitchell', 'Jon Simonelli', 'Craig Stoa', 'Nikki Christie', 'Yvette Bartosik', 'Josh Samson', 'Earl Ledebur', 'Marcus Dreeke', 'John Maalis', 'Paula Allen', 'Jennifer Lauren DiBella', 'Andrew Doebbler', 'Jay Gragnani', 'Peter Renaud', 'Tia Streaty', 'Caleb Wells', 'Mighty Swag', 'Sadiq Ali']","['fear', 'trauma', 'isolation']",Maritza Murillo
3136,3136,10040,Miss Congeniality 2: Armed and Fabulous,2005-03-11,101393569,115,False,0,"After her triumph at the Miss United States pageant, FBI agent Gracie Hart becomes an overnight sensation -- and the new ""face of the FBI"". But it's time to spring into action again when the pageant's winner, Cheryl, and emcee, Stan, are abducted.",22.73,/gcYoIHND3ugn2VH1cNHHNQasEyI.jpg,"['Action', 'Comedy']","ship, undercover agent, ransom, drag queen, fbi, press conference, sequel, miss america, office politics, buddy cop, representation, abandonment",2005,"['Sandra Bullock', 'Regina King', 'Enrique Murciano', 'Ernie Hudson', 'William Shatner', 'Heather Burns', 'Diedrich Bader', 'Treat Williams', 'Abraham Benrubi', 'Nick Offerman', 'Eileen Brennan', 'Elisabeth Röhm', 'Leslie Grossman', 'Lusia Strus', 'Molly Gottlieb', 'Susan Chuang', ""William O'Leary"", 'John DiResta', 'Audrey Wasilewski', 'Marjorie Lovett', 'Michelle Page', 'Faith Minton', 'Eve Gordon', 'Kim Morgan Greene', 'Rachel Iverson', 'Regis Philbin', 'Joy Philbin', 'Tommy McGoldrick', 'Esteban Cueto', 'Octavia Spencer', 'Patricia Andrest Davis', 'Christopher Ford', 'James DuMont', 'Sue Tripathy', 'Brendan Patrick Connor', 'Affion Crockett', 'Brian Shortall', 'Vic Chao', 'Benny Nieves', 'Marcelo Tubert', 'Jayne Krashin', 'Rachel Smith', 'Adam LeFevre', 'Stephen Tobolowsky', 'Audrey Berger', 'Richard DeDomenico', 'Ivanan Trnik', 'Dana Lorge', 'Cynthia Pepper', 'Dolly Parton', 'Mary Ann Price', 'Lloyd Kino', 'Fusako Stevenson', 'Scott Noonan', 'Tracy Elizabeth Blackwell', 'Jeff Shelton', 'Emilio Giandomenico', 'Dori Kancher', 'Tim Clark', 'Megan Cavanagh', 'Don Perry', 'Kimble Jemison', 'Susan Leslie', 'Emy Coligado', 'Gregory Stenson', 'Don Mirault', 'Mark S. Lleewellyn', 'L. Sidney', 'Larry Edwards', 'Frank Marino', 'Brad Grunberg', 'Alan James Luzietti', 'Kendall Jackson', 'Boy Thomas', 'Lonnie Henderson', 'Bobby Newberry', 'Nancy Anderson', 'Nicole De Lecia', 'Alejandro Estornel', 'Michele Martinez', 'Jaayda McClanahan', 'Ayesha Orange', 'Tomasina Parrott', 'Christian Vincent', 'Todd Sherry', 'Max Shippee', 'Jasmine Jonas', 'Randy Sutton', 'John Bitley', 'Brian Kehoe', 'Russell S. Pernus', 'Sam Sadovia', 'Mitchell Tannis', 'Jason Toohey', 'Mark Weinhandl', 'Adam Austin', 'Cameron Milzer', 'Nate Bynum', 'Michael Kendall', 'Roxana Ortega', 'David Proval', 'Rose Davidson', 'Anna Wendt', 'Billie Perkins']","['humor', 'empowerment', 'chaos']",John Pasquin
3137,3137,506680,Unbroken: Path to Redemption,2018-09-14,0,98,False,0,"Zamperini returns to California where he wound up marrying Cynthia Applewhite while wrestling with untreated PTSD, suffering constant nightmares, angry, bitter and deeply depressed, his wife convinces Zamperini to attend the 1949 Billy Graham Crusade.",22.725,/oD5RxDJGdJgpX8X61QMX0qNyYYu.jpg,['Drama'],"post-traumatic stress disorder (ptsd), based on novel or book, faith, biography, sequel",2018,"['Samuel Hunt', 'Merritt Patterson', 'Bob Gunton', 'Will Graham', 'David Sakurai', 'Vanessa Bell Calloway', 'Bobby Campo', 'Andrew Lewis Caldwell', 'David DeLuise', 'Gianna Simone', 'James Immekus', 'Vincenzo Amato', 'Trisha LaFache', 'Maddie McCormick', 'Derek Brandon', 'Ali Eagle', 'Gary Cole', 'Maddalena Ischiale', 'Scott Subiono']","['faith', 'redemption', 'resilience']",Harold Cronk
3138,3138,500664,Upgrade,2018-05-31,16706680,100,False,5000000,"A brutal mugging leaves Grey Trace paralyzed in the hospital and his beloved wife dead. A billionaire inventor soon offers Trace a cure — an artificial intelligence implant called STEM that will enhance his body. Now able to walk, Grey finds that he also has superhuman strength and agility — skills he uses to seek revenge against the thugs who destroyed his life.",22.725,/5f28TXtvHioXirX2n1XH8EJ314v.jpg,"['Action', 'Thriller', 'Science Fiction']","future, artificial intelligence (a.i.), hacker, police, technology, cyborg, dystopia, revenge, murder, drone, cyberpunk, transhumanism, brutality, implant, surgery, quadriplegic, near future, body enhancement, violence, microship",2018,"['Logan Marshall-Green', 'Betty Gabriel', 'Harrison Gilbertson', 'Melanie Vallejo', 'Benedict Hardie', 'Linda Cropper', 'Simon Maiden', 'Steve Danielsen', 'Richard Cawthorne', 'Christopher Kirby', 'Abby Craden', 'Richard Anastasios', 'Kenny Low', 'Emily Havea', 'Ming-Zhu Hii', 'Stephanie Demkiw', 'Manjot Jassal', 'Esther Joseph', 'Sachin Joab', 'Matt Davis', 'Clayton Jacobson', 'Arthur Angel', 'Puven Pather', 'Ri-Jie Kwok', 'Dave Mondon', 'Rosco Campbell', 'Kai Bradley', 'Michael M. Foster', 'Zia Kelly', 'Mark Doggett', 'James Ao', 'Kylie Azzopardi', 'Thomas Banda', 'Douglas Embry', 'Cat Franke', 'Savannah Gail', 'Liam Howarth', 'David Lieu', 'Yuki Nagashima', 'Lorie Raymundo', 'Yasemin Islek']","['revenge', 'cybernetics', 'violence']",Kara Masters
3139,3139,528549,Room Salon College Girls,2018-03-29,0,72,False,0,Sexy female college students get part-time jobs at a room salon and provide very special services.,22.722,/xIGPD1QQzxIwRJc55ThQjZpD3tT.jpg,['Romance'],"softcore, college student",2018,"['Kim Hee-jeong', 'Yoon Da-hyeon', 'Choi Chul-min']","['lust', 'student life', 'taboo']",Jo Tae-ho
3140,3140,859041,Crazy Fist,2021-05-06,0,97,False,0,"After an opponent dies mid-match, a prominent MMA champion swore never to fight again and retired to run his family's company. But when his best friend dies under suspicious circumstances, he has no choice but to step back in the ring.",22.719,/jVAEVDNdUPRKJ7hJ4zt6lGcLATD.jpg,['Action'],"drug trafficking, crocodile, undercover cop, martial arts tournament",2021,"['Li Dong-Hao', 'Steve Yoo', 'Areeya Pholphutrakul', 'Liu Mengke', 'Collin Chou', 'Liang Xiaolong', 'Huang Xiaoming', 'Shi Guanghui', 'Zhao Wei', 'Zhu Gechengcheng', 'Wei Wang', 'Ai Yisheng', 'Kai Greene', 'Bao Dazhi', 'Bruce Leung Siu-Lung']","['sports', 'action', 'perseverance']",Li Dong-Hao
3141,3141,68179,Escape from Planet Earth,2013-02-14,74597643,89,False,40000000,Astronaut Scorch Supernova finds himself caught in a trap when he responds to an SOS from a notoriously dangerous alien planet.,22.704,/tkkLIeompowyXFZFe3sBmhm3wwA.jpg,"['Animation', 'Comedy', 'Adventure', 'Family', 'Science Fiction']","rescue, spacecraft, escape, alien, planet, astronaut",2013,"['Rob Corddry', 'Brendan Fraser', 'Jessica Alba', 'Steve Zahn', 'Sarah Jessica Parker', 'Ricky Gervais', 'Gregg Binkley', 'Sofía Vergara', 'Kaitlin Olson', 'Ashley Eckstein', 'Craig Robinson', 'Jane Lynch', 'George Lopez', 'Jonathan Morgan Heit', 'Chris Parnell', 'William Shatner', 'Bob Bergen', 'Joshua Rush', 'Doug Abrahams', 'Sean Kenin', 'Bill Hader']","['family', 'space', 'humor']",
