,Unnamed: 0,id,title,release_date,revenue,runtime,adult,budget,overview,popularity,poster_path,genres,keywords,year,actors,emotions,director
2675,2675,4638,Hot Fuzz,2007-02-14,80573774,121,False,12000000,"As a former London constable, Nicholas Angel finds it difficult to adapt to his new assignment in the sleepy British village of Sandford. Not only does he miss the excitement of the big city, but he also has a well-meaning oaf for a partner. However, when a series of grisly accidents rocks Sandford, Angel smells something rotten in the idyllic village.",24.96,/zPib4ukTSdXvHP9pxGkFCe34f3y.jpg,"['Crime', 'Action', 'Comedy']","police, village, arrest, parody, partner, murder, rural area, conspiracy, serial killer, gunfight, english countryside, police force, buddy cop, accident",2007,"['Simon Pegg', 'Nick Frost', 'Jim Broadbent', 'Paddy Considine', 'Rafe Spall', 'Kevin Eldon', 'Olivia Colman', 'Bill Bailey', 'Karl Johnson', 'Timothy Dalton', 'Edward Woodward', 'Billie Whitelaw', 'Stuart Wilson', 'Paul Freeman', 'Rory McCann', 'Kenneth Cranham', 'Maria Charles', 'Peter Wight', 'Julia Deakin', 'Eric Mason', 'Trevor Nichols', 'Elizabeth Elvin', 'Patricia Franklin', 'Lorraine Hilton', 'Tim Barlow', 'Anne Reid', 'Adam Buxton', 'David Threlfall', 'Lucy Punch', 'David Bradley', 'Ron Cook', 'Alice Lowe', 'Martin Freeman', 'Bill Nighy', 'Stephen Merchant', 'Ben McKay', 'Robert Popper', 'Joe Cornish', 'Chris Waitt', 'Colin Michael Carmichael', 'Tom Strode Walton', 'Troy Woollan', 'Rory Lowings', 'Nicholas Wilson', 'Kevin Wilson', 'Graham Low', 'Alexander King', 'Cate Blanchett', 'Steve Coogan', 'Peter Jackson', 'Garth Jennings', 'Edgar Wright', 'Lesley Wright', 'Peter Wild', 'Gillian Rosemary Smith']","['humor', 'investigation', 'action']",Edgar Wright
2676,2676,13151,Scooby-Doo on Zombie Island,1998-09-22,0,77,False,0,"After going their separate ways, Scooby-Doo, Shaggy, Velma, Daphne, and Fred reunite to investigate the ghost of Moonscar the pirate on a haunted bayou island, but it turns out the swashbuckler's spirit isn't the only creepy character on the island. The sleuths also meet up with cat creatures and zombies... and it looks like for the first time in their lives, these ghouls might actually be real.",24.959,/7EdvFUGvT5Pn8rUFRKCrdUzNthf.jpg,"['Animation', 'Mystery', 'Family', 'Horror']","new orleans, louisiana, haunted house, swamp, curse, tv reporter, criminal investigation, aftercreditsstinger, haunted island, direct to video",1998,"['Scott Innes', 'Billy West', 'Mary Kay Bergman', 'Frank Welker', 'B.J. Ward', 'Adrienne Barbeau', 'Tara Strong', 'Cam Clarke', 'Jim Cummings', 'Mark Hamill', 'Jennifer Leigh Warren', 'Ed Gilbert']","['supernatural', 'mystery', 'nostalgia']",Kazumi Fukushima
2677,2677,407375,Sniper: Ghost Shooter,2016-08-02,0,100,False,3000000,"Elite snipers Brandon Beckett and Richard Miller are fighting extremists in the Middle East when the Colonel gives them a new mission: to protect a gas pipeline stretching from the Republic of Georgia to Western Europe from extremists eager to make a political statement. But when skirmishes with the enemy lead to U.S. snipers being killed by a ghost shooter who locks into their exact location, a security breach is suspected. Fingers are pointed and battle lines are drawn, all leading up to an explosive climax.",24.954,/pk0OypQ6Z3rsOtl7r0UhTEEqu44.jpg,"['Action', 'Drama', 'War']","sniper, mission, gas, gun, shooter, battle, security, killed, elite sniper, ghost shooter, breach",2016,"['Chad Michael Collins', 'Billy Zane', 'Nick Gomez', 'Ravil Isyanov', 'Stephanie Vogt', 'Navid Negahban', 'Presciliana Esparolini', 'Ene Frost', 'Dominic Mafham', 'Nigel Barber', 'Naveed Choudhry', 'Jade Ogugua', 'Dennis Haysbert', 'Vladimir Kolev', 'Mike Straub', 'Asen Asenov', 'Raymond Steers', 'Elitsa Razheva', 'Marinela Angelova', 'Atanas Srebrev', 'Georgi Manchev', 'Tihomir Vinchev', 'Dimiter Doichinov', 'Velizar Peev', 'Boyan Anev', 'Stanimir Stamatov']","['action', 'precision', 'tension']",Don Michael Paul
2678,2678,157433,Pet Sematary,2019-04-04,113118226,101,False,21000000,"Dr. Louis Creed and his wife, Rachel, move from Boston to Ludlow, in rural Maine, with their two young children. Hidden in the woods near the new family home, Ellie, their eldest daughter, discovers a mysterious cemetery where the pets of community members are buried.",24.949,/7SPhr7Qj39vbnfF9O2qHRYaKHAL.jpg,"['Horror', 'Thriller']","husband wife relationship, based on novel or book, cat, remake, tragedy, maine, zombie, pet cemetery, indian burial ground, neighbor neighbor relationship, pets, father daughter relationship, traumatized woman, american countryside",2019,"['Jason Clarke', 'Amy Seimetz', 'John Lithgow', 'Jeté Laurence', 'Hugo Lavoie', 'Lucas Lavoie', 'Obssa Ahmed', 'Sonia Maria Chirila', 'Alyssa Brooke Levine', 'Maria Herrera', 'Jacob Lemieux', 'Maverick Fortin', 'Lou Ferrando', 'Najya Muipatayi', 'Emma Hill', 'Frank Schorpion', 'Linda E. Smith', 'Naomi Frenette', 'Suzi Stingl', 'Kelly Lee', 'Nina Lauren', ""Alison O'Donnell"", 'Raphaël Laporte', 'Simon Pelletier-Gilbert', 'Ambre Dioh-Dikongué', 'Constance St-Denis-Veilleux', 'Bailey Thain', 'Ines Feghouli Bozon']","['grief', 'supernatural', 'horror']",Dennis Widmyer
2679,2679,11838,Ju-on: The Grudge,2002-10-18,3657876,92,False,3500000,"Volunteer home-care worker Rika is assigned to visit a family, she is cursed and chased by two revengeful fiends: Kayako, a woman brutally murdered by her husband and her son Toshio. Each person that lives in or visits the haunted house is murdered or disappears.",24.948,/oulszWeFpIBbbLZbkJNQiYRlcQs.jpg,['Horror'],"dying and death, japan, primal fear, panic, restart, supernatural, egomania, remake",2002,"['Megumi Okina', 'Misa Uehara', 'Yoji Tanaka', 'Misaki Itō', 'Kanji Tsuda', 'Shuri Matsuda', 'Kayoko Shibata', 'Yui Ichikawa', 'Yukako Kukuri', 'Takako Fuji', 'Yuya Ozeki', 'Takashi Matsuyama', 'Hirokazu Inoue', 'Daisuke Honda', 'Yoshiyuki Morishita', 'Hideo Sakaki', 'Chikara Ishikura', 'Chikako Isomura', 'Chiona Ôkuni', 'Miho Fujima', 'Mao Kobayashi', 'Aki Fujî', 'Risa Odagiri', 'Kaori Nakajô', 'Kana Kobayashi', 'Akira Saito', 'Isao Yatsu', 'Haruka Yamano', 'Hiroyuki Yokoo']","['curses', 'fear', 'mystery']",Takashi Shimizu
2680,2680,27582,The Mechanic,2011-01-13,51070807,93,False,40000000,"Arthur Bishop is a 'mechanic' - an elite assassin with a strict code and unique talent for cleanly eliminating targets. It's a job that requires professional perfection and total detachment, and Bishop is the best in the business. But when he is ordered to take out his mentor and close friend Harry, Bishop is anything but detached.",24.947,/k37axEHszFP9WOVvbozxF0r7X7g.jpg,"['Action', 'Thriller', 'Crime']","chicago, illinois, research, martial arts, assassin, prostitute, airport, mentor, new orleans, louisiana, training, car crash, elite, remake, security, set up, mentor protégé relationship, contractor, vengeance, avenging son, colombia, best of the best",2011,"['Jason Statham', 'Ben Foster', 'Donald Sutherland', 'Mini Anden', 'Tony Goldwyn', 'Christa Campbell', 'Katarzyna Wolejnio', 'Jeff Chase', 'Eddie J. Fernandez', 'John McConnell', 'Lara Grice', 'Ardy Brent Carlson', 'James Logan', 'Joshua Bridgewater', 'Joel Davis', 'Mark Nutter', 'David Dahlgren', 'J.D. Evermore', 'John Teague', 'David Leitch', 'Ada Michelle Loridans', 'Matt McColm', 'Chad Stahelski', 'Aaron Saxton', 'Dawn Neufeld']","['revenge', 'mechanics', 'violence']",Simon West
2681,2681,25769,Carriers,2009-09-04,5802422,84,False,0,"A deadly virus has spread across the globe. Contagion is everywhere, no one is safe, and no one can be trusted. Four friends race through the back roads of the American West on their way to a secluded utopian beach in the Gulf of Mexico where they could peacefully wait out the pandemic. Their plans take a grim turn when their car breaks down on an isolated road starting a chain of events that will seal their fates.",24.945,/jxjnjHtHXgvjdhkwpelE9ZwVMg6.jpg,"['Action', 'Drama', 'Horror', 'Science Fiction', 'Thriller']","beach, infection, survival, biohazard, disease, trust, virus, pandemic",2009,"['Lou Taylor Pucci', 'Chris Pine', 'Piper Perabo', 'Emily VanCamp', 'Christopher Meloni', 'Kiernan Shipka', 'Ron McClary', 'Mark Moses', 'Josh Berry', 'Tim Janis', 'Dylan Kenin', 'LeAnne Lynch', 'Dale O´Malley']","['virus', 'apocalypse', 'desperation']",David Allen Cluck
2682,2682,4836,Layer Cake,2004-09-30,11850214,105,False,6500000,"When a seemingly straight-forward drug deal goes awry, XXXX has to break his die-hard rules and turn up the heat, not only to outwit the old regime and come out on top, but to save his own skin...",24.943,/rDOxXteqxALBaSa3V3zTjGJuyWB.jpg,"['Drama', 'Thriller', 'Crime']","london, england, based on novel or book, drug smuggling, hitman, kidnapping, gangster, drug trafficking, ecstasy, cocaine, drug mule, mission of murder, murder, cafe, rooftop, neo-noir, crack head",2004,"['Daniel Craig', 'Sienna Miller', 'Tom Hardy', 'Colm Meaney', 'George Harris', 'Sally Hawkins', 'Kenneth Cranham', 'Jamie Foreman', 'Michael Gambon', 'Ben Whishaw', 'Dragan Mićanović', 'Stephen Walters', 'Louis Emerick', 'Dexter Fletcher', 'Tamer Hassan', 'Jason Flemyng', 'Nathalie Lunghi', 'Rab Affleck', 'Burn Gorman', 'Steve John Shepherd', 'Daniel Moorehead', 'Francis Magee', 'Philip Howard', 'Darren Sean Enright', 'James Dodd', 'Kelly-Marie Kerr', 'Nick Thomas-Webster', 'Don McCorkindale', 'Budge Prewitt', 'Neil Finnighan', 'Ben Brazier', 'Ivan Kaye', 'Darren Healy', 'Matt Ryan', 'Paul Orchard', 'Marvin Benoit', 'Garry Tubbs', 'Dimitri Andreas', 'Marcel Iureș', 'Brinley Green', 'Peter Rnic', 'Kerri Kravin']","['crime', 'power', 'betrayal']",Matthew Vaughn
2683,2683,71880,Jack and Jill,2011-11-11,149673788,91,False,79000000,"Jack Sadelstein, a successful advertising executive in Los Angeles with a beautiful wife and kids, dreads one event each year: the Thanksgiving visit of his twin sister Jill. Jill's neediness and passive-aggressiveness is maddening to Jack, turning his normally tranquil life upside down.",24.94,/p6xV65iiz9agN2IAtf7cgbZC3YF.jpg,['Comedy'],"thanksgiving, los angeles, california, family, celebration, duringcreditsstinger",2011,"['Adam Sandler', 'Al Pacino', 'Katie Holmes', 'Elodie Tougne', 'Rohan Chand', 'Eugenio Derbez', 'David Spade', 'Nick Swardson', 'Tim Meadows', 'Allen Covert', 'Norm Macdonald', 'Geoff Pierson', 'Valerie Mahaffey', 'Gary Valentine', 'Dana Carvey', 'Regis Philbin', 'Gad Elmaleh', 'Dan Patrick', ""Shaquille O'Neal"", 'Drew Carey', 'John McEnroe', 'Christie Brinkley', 'Michael Irvin', 'Bill Romanowski', 'Jared Fogle', 'Billy Blanks', 'Vince Offer', 'Caitlyn Jenner', 'Jackie Seiden', 'Sadie Sandler', 'Sunny Sandler', 'Georgia Hatzis', 'Jonathan Loughran', 'Peter Dante', 'J.D. Donaruma', 'Tyler Spindel', 'Owen Benjamin', 'Chris Titone', 'John Farley', 'Dennis Dugan', 'Robert C. Lopez', 'Jalen Testerman', 'Simrin C. Player', 'Gerardo Hernandez Beltran', 'Kadyr Gutierrez', 'Virginia Louise Smith', 'Daniel Silverberg', 'Richard Kline', 'Donald Agnelli', 'Joseph Balderrama', 'Luis Fernandez-Gil', 'Ruben Rabasa', 'Nick Gillie', 'Andy Goldenberg', 'Marisa Field', 'George Gray', 'Manuela Arbeláez', 'Gwendolyn Osborne-Smith', 'Rachel Reynolds', 'Anna Mathias', 'Robert Harvey', 'Lawrence Tanter', 'Eric Lamonsoff', 'Schmeric Lamonsoff', 'Kara Pacitto', 'Rafael Feldman', 'Yan Feldman', 'David Sontag', 'Larry Sontag', 'Logan Raskin', 'Roger Raskin', 'Erica Jaye Green', 'Lina Green', 'Tiana Madry', 'Tiara Madry', 'January Welsh', 'Marissa Welsh', 'Gary Lane', 'Larry Lane', 'Dingani Beza', 'Zondwayo Beza', 'Jammer', 'Slammer', 'Patty Palmer', 'Diane Palmer', 'Alex Burkart', 'Nathan Burkart', 'Richard Harris', 'Ron Harris', 'Rachel Rife', 'Rebekah Rife', 'Elijah Gipson', 'Elleah Gipson', 'Katie Cockrell', 'Kellie Cockrell', 'Joel Harold', 'Joseph Harold', 'Alexis Stier', 'Megan Stier', 'Albert Pugliese', 'Gregory Pugliese', 'Jordan Tindall', 'Lance Tindall', 'Miles Tindall', 'Johnny Depp', 'Erica Abke', 'Claudia Adams', 'Nick Baga', 'Fileena Bahris', 'Derek Baker', 'Luke Broadlick', 'Erin Shae Bryan', 'Kobe Bryant', 'Peter Chudyba', 'Billy Concha', 'Sarah Davidson', 'Louis Fasanaro', 'Patrick H. Fox', 'Lacey Marisa Friedman', 'Gianna Gomez', 'Fouad Hajji', 'Betsy Hammer', 'Matthew P. Hanson', 'Fatimah Hassan', 'Vahid Jafroodi', 'Jaelyn Jones', 'Amina Julianna', 'Kristin Michelle Keating', 'Carmen Kirby', 'Diamond Nicole Landeen', 'Glen Mauro', 'Gary Mauro', 'Anna Mezentseva', 'Brett Nichols', 'David Osmond', 'Julian Perrin', 'Yvette Rachelle', 'Jazmine Ramay', 'Tia Robinson', 'Santiago Segura', 'Patrice Sepulveda', 'Zach Siegwarth', 'Ashley Speegle', 'Ivan Velez', 'Lloyd G. Vincent', 'Alexis Wilkins', 'Laramie Williams']","['humor', 'awkwardness', 'family']",Conte Mark Matal
2684,2684,257445,Goosebumps,2015-08-05,158162788,103,False,58000000,"After moving to a small town, Zach Cooper finds a silver lining when he meets next door neighbor Hannah, the daughter of bestselling Goosebumps series author R.L. Stine. When Zach unintentionally unleashes real monsters from their manuscripts and they begin to terrorize the town, it’s suddenly up to Stine, Zach and Hannah to get all of them back in the books where they belong.",24.932,/aeZT9pqEgrmXOGdESFkAuVjX6kw.jpg,"['Adventure', 'Horror', 'Comedy']","based on novel or book, magic, yeti, werewolf, family, new home, recluse, autumn, book comes to life, ventriloquist's dummy, praying mantis, new school, girl next door",2015,"['Jack Black', 'Dylan Minnette', 'Odeya Rush', 'Amy Ryan', 'Ryan Lee', 'Jillian Bell', 'Halston Sage', 'Ken Marino', 'Timothy Simons', 'Amanda Lund', 'Steven Krueger', 'Keith Arthur Bolden', 'Karan Soni', 'R.L. Stine', 'Caleb Emery', 'Gabriela Hernandez', 'Nate Andrade', 'Sheldon Brown', 'Melissa Brewer', 'Marshall Choka', 'Melissa Cowan', 'John Deifer', 'Everett Dixon', 'Brian Gabriel', 'Kevin Galbraith', 'Maryann Gorka', 'Clare Halstead', 'Devin Hampton', 'Rory Healy', 'Drew Lamkins', 'Vivian Kyle', 'Charlie Leach', 'Katie Lumpkin', 'Larry Mainland', 'Lucky Mangione', 'Justin Natic', 'Josh Phillips', 'Mickie Pollock', 'Steve Quinn', 'Ashleigh Jo Sizemore', 'Jeff Tenney', 'Jennifer Trudrung', 'Ashton Lee Woolen', 'Coleman Youmans', 'E. Roger Mitchell', 'Jason Davis', 'Ella Wahlestedt', 'Amber Thrower']","['adventure', 'monsters', 'imagination']",Rob Letterman
2685,2685,227,The Outsiders,1983-03-25,33697647,91,False,10000000,"When two poor Greasers, Johnny and Ponyboy, are assaulted by a vicious gang, the Socs, and Johnny kills one of the attackers, tension begins to mount between the two rival gangs, setting off a turbulent chain of events.",24.929,/l9os0HcXY8BOkvUWAx4rvby3j6L.jpg,"['Crime', 'Drama']","street gang, based on novel or book, children's home, coming of age, gang, juvenile delinquent, tulsa, oklahoma, based on young adult novel, teenager",1983,"['C. Thomas Howell', 'Matt Dillon', 'Ralph Macchio', 'Patrick Swayze', 'Rob Lowe', 'Emilio Estevez', 'Tom Cruise', 'Glenn Withrow', 'Diane Lane', 'Leif Garrett', 'Darren Dalton', 'Michelle Meyrink', 'Tom Waits', 'Gailard Sartain', 'William Smith', 'Tom Hillmann', 'Hugh Walkinshaw', 'Sofia Coppola', 'Teresa Wilkerson Hunt', 'Linda Nystedt', 'S.E. Hinton', 'Brent Beesley', 'John C. Meier', 'Ed Jackson', 'Daniel R. Suhart', 'Nicolas Cage', 'Trey Callaway', 'Ronald Colby', 'Flea', 'Cam Neely', 'Jonnie Parnell']","['brotherhood', 'violence', 'identity']",Francis Ford Coppola
2686,2686,11690,Bloodsport,1988-02-26,65000000,92,False,1500000,"U.S. soldier Frank Dux has come to Hong Kong to be accepted into the Kumite, a highly secret and extremely violent martial arts competition. While trying to gain access into the underground world of clandestine fighters, he also has to avoid military officers who consider him to be AWOL. After enduring a difficult training and beginning a romance with journalist Janice Kent, Frank is given the opportunity to fight. But can he survive?",24.918,/kndxR9TRK0kJ5hxzDprRSS80F2W.jpg,"['Action', 'Drama']","martial arts, sports, biography, fistfight, sensei, mixed martial arts, hong kong, tournament, underground fighting, walled city, kowloon, action hero",1988,"['Jean-Claude Van Damme', 'Bolo Yeung Sze', 'Donald Gibb', 'Leah Ayres', 'Norman Burton', 'Forest Whitaker', 'Roy Chiao', 'Philip Chan', 'Kenneth Siao Wai-Keung', 'Paulo Tocha', 'Pierre Rafini', 'Kimo Lai Kwok Ki', 'Bill Yuen Ping Kuen', 'Shun-Yin Leung', 'Joshua Schroder', 'John Cheung Ng-Long', 'Jahangir Ghaffari', 'Johnny Cheung Wa', 'Michel Qissi', 'Bernard Mariano', 'Sean Ward', 'Johnny Lai', 'AP George', 'Charles Wang', 'Dennis Chiu', 'David Ho', 'Eric Neff', 'Michael Chan', 'Rick Erikson', 'John Law', 'Mandy Chan Chi-Man', 'Claude Heme', 'Susan Sheers', 'Wilson Lee']","['competition', 'pride', 'glory']",Newt Arnold
2687,2687,13654,101 Dalmatians II: Patch's London Adventure,2002-11-06,0,74,False,0,"Being one of 101 takes its toll on Patch, who doesn't feel unique. When he's accidentally left behind on moving day, he meets his idol, Thunderbolt, who enlists him on a publicity campaign.",24.917,/rFTt7pNSCJKLZ2RZldJuq6ON6Ti.jpg,"['Family', 'Adventure', 'Comedy', 'Animation']","london, england, sequel, puppy, dog, dalmatian, aftercreditsstinger",2002,"['Barry Bostwick', 'Jason Alexander', 'Martin Short', 'Bobby Lockwood', 'Susanne Blakeslee', 'Samuel West', 'Maurice LaMarche', 'Jeff Bennett', 'Jodi Benson', 'Tim Bentinck', 'Kath Soucie', 'Mary MacLeod', 'Michael Lerner', 'Kathryn Beaumont', 'Nicolette Little', 'Ursula Brooks', 'Nick Meaney', 'Corey Burton', 'Sean Cameron Michael', 'Jim Cummings', ""Cornelia Hayes O'Herlihy"", 'Aria Noelle Curzon', 'Rob Paulsen', 'Sophie Uliano', 'Phil Proctor', 'Nikita Hopkins', 'Clive Revill', 'Daamen J. Krall', 'MacKenzie Sells', 'Kasha Kropinski', 'Joe Lavery', 'Tara Strong', 'Peter Lavin', 'Clive Swift', 'Eli Russell Linnetz', 'Ben Tibber', 'Frank Welker']","['loyalty', 'rescue', 'family']",Jim Kammerud
2688,2688,9513,Garfield: A Tail of Two Kitties,2006-06-15,141702264,78,False,60000000,"Jon and Garfield visit the United Kingdom, where a case of mistaken cat identity finds Garfield ruling over a castle. His reign is soon jeopardized by the nefarious Lord Dargis, who has designs on the estate.",24.915,/osfMaHucgLtHtsMa6TQLTooE3G7.jpg,"['Animation', 'Comedy', 'Family', 'Adventure']","luxury, london, england, cat, mistake in person, wretch, prince, mistaken identity, based on comic, royalty, animal, nobility",2006,"['Breckin Meyer', 'Jennifer Love Hewitt', 'Billy Connolly', 'Bill Murray', 'Tim Curry', 'Ian Abercrombie', 'Roger Rees', 'Lucy Davis', 'Lena Cardwell', 'Veronica Alicino', 'Jane Carr', 'Oliver Muirhead', 'JB Blanc', 'Vernee Watson-Johnson', 'Russell Milton', 'Ben Falcone', 'Bryce Lenon', 'Judi Shekoni', 'Melanie Tolbert', 'David Kallaway', 'Brian Manis', 'Roscoe Lee Browne', 'Greg Ellis', 'Bob Hoskins', 'Sharon Osbourne', 'Joe Pasquale', 'Jane Leeves', 'Jane Horrocks', 'Richard E. Grant', 'Vinnie Jones', 'Rhys Ifans', 'Jim Piddock', 'Kenneth Danziger', 'Neil Dickson', 'Robin Atkin Downes', 'Johnny Gidcomb', 'Jean Gilpin', 'Andy Kreiss', 'Peter Lavin', 'Susan Leslie', 'Hope Levy', 'Paula J. Newman', 'Justin Shenkarow', 'Mark Sussman', 'Diz White', 'Marie Del Marco', 'Ed Pearce', 'Penny Smith', 'Joe Towne', 'Martin Tyler']","['humor', 'laziness', 'duality']",Tim Hill
2690,2690,300669,Don't Breathe,2016-06-08,159047649,89,False,9900000,A group of teens break into a blind man's home thinking they'll get away with the perfect crime. They're wrong.,24.908,/8fIgsHFQtg47xxN7SBwZkg0tZJn.jpg,"['Thriller', 'Horror']","kidnapping, thief, blind, held captive, break in, blind man, trapped in a house",2016,"['Stephen Lang', 'Jane Levy', 'Dylan Minnette', 'Daniel Zovatto', 'Emma Bercovici', 'Franciska Törőcsik', 'Christian Zagia', 'Katia Bokor', 'Sergej Onopko', 'Olivia Gillies', 'Dayna Clark']","['survival', 'home invasion', 'fear']",Fede Álvarez
2691,2691,207932,Inferno,2016-10-13,220021259,121,False,75000000,"After waking up in a hospital with amnesia, professor Robert Langdon and a doctor must race against time to foil a deadly global plot.",24.901,/dtMJQzCxw2AY6tfcxhzlFpiD3BM.jpg,"['Mystery', 'Thriller', 'Action']","amnesia, based on novel or book, italy, europe, sequel, murder, conspiracy, religion, church, virus, symbology",2016,"['Tom Hanks', 'Felicity Jones', 'Omar Sy', 'Irrfan Khan', 'Sidse Babett Knudsen', 'Ben Foster', 'Ana Ularu', 'Ida Darvish', 'Paolo Antonio Simioni', 'Alessandro Grimaldi', 'Fausto Maria Sciarappa', 'Robin Mugnaini', 'Paul Ritter', 'Vincenzo Tanassi', 'Alessandro Fabrizi', 'Simone Mariani', 'Gábor Urmai', 'Jon Donahue', 'Fortunato Cerlino', 'Attila Árpa', 'Kata Sarbó', 'Francesca Inaudi', 'Maria Grazia Mandruzzato', 'Philip Arditti', 'Mehmet Ergen', 'Vincent Riotta', 'Luca Fiorilli', 'Cristian Stelluti', 'Alberto Basaluzzo', 'Gábor Nagypál', 'Gianni Annoni', 'Yang Haiwen', 'Mirjam Novak', 'Rebecka Johnston', 'Sardar Tagirovsky', 'Gäbor Atlasz', 'Gábor Dióssy', 'Peter Schueller', 'Lili Gesler', 'Felipe Torres Urso', 'Dino Conti', 'Mario Acampa', 'Pasquale Corrente', 'Kerem Ozen', 'Xavier Laurent', 'Büyükkol Mehmet Onur', 'Bálint Adorjáni', 'Zsolt Páll', 'Peter Linka']","['mystery', 'religion', 'conspiracy']",Ron Howard
2692,2692,2636,The Specialist,1994-10-07,170362582,110,False,45000000,"May Munro is a woman obsessed with getting revenge on the people who murdered her parents when she was still a girl. She hires Ray Quick, a retired explosives expert to kill her parent's killers. When Ned Trent, embittered ex-partner of Quick's is assigned to protect one of Quick's potential victims, a deadly game of cat and mouse ensues.",24.896,/9CVAjtkSaFs9FyddGfThj11ZuQq.jpg,"['Action', 'Thriller']","based on novel or book, explosive, fistfight, revenge, organized crime, urban setting, explosives expert, neo-noir, action hero",1994,"['Sylvester Stallone', 'Sharon Stone', 'James Woods', 'Rod Steiger', 'Eric Roberts', 'Mario Ernesto Sánchez', 'Sergio Doré Jr.', 'Chase Randolph', 'Jeana Bell', 'Brittany Paige Bouck', 'Emilio Estefan Jr.', 'LaGaylia Frazier', 'Ramón González Cuevas', 'Tony Munafo', 'Cheito Quinonez', 'Tony Tatis', 'Mercedes Enriquez', 'Yeniffer Behrens', 'Scott Blake', 'Rex Reddick', 'Jeff Bornstein', 'Allan Graf', 'Juan F. Cejas', 'Marcela Cardona', 'Brent Sexton', 'Yamilet Hidalgo', 'Alfredo Álvarez Calderón', 'Steve Raulerson', 'David Caprita', 'Mayte Vilán', 'Bud Ekins', 'John Archie', 'Frank A. DeVito III', 'Bobbi Evors', 'Jon Curry', 'Chris Conrad', 'Carmen More', 'Anabel Gracia', 'Guillermo Gentile', 'Ashley Nolan', 'Victoria Bass', 'Mario Roberts', 'Jeff Moldovan', 'Gene Hartline', 'Antoni Corone', 'Steve Gladstone', 'Jackie Davis', 'Carl Ciarfalio']","['violence', 'revenge', 'seduction']",Luis Llosa
2693,2693,37958,Immortals,2011-11-10,226904017,110,False,75000000,"Theseus is a mortal man chosen by Zeus to lead the fight against the ruthless King Hyperion, who is on a rampage across Greece to obtain a weapon that can destroy humanity.",24.886,/swJ3VuuSMJUDoi899VuXG5OqmPG.jpg,"['Fantasy', 'Action', 'Drama']","army, poison, mythology, zeus, sword fight, minotaur, poseidon, spear, bow and arrow, labyrinth, ancient greece, greek god, muscular men, fantasy",2011,"['Henry Cavill', 'Mickey Rourke', 'Stephen Dorff', 'Freida Pinto', 'Luke Evans', 'John Hurt', 'Joseph Morgan', 'Isabel Lucas', 'Kellan Lutz', 'Daniel Sharman', 'Peter Stebbings', 'Stephen McHattie', 'Greg Bryk', 'Alan van Sprang', 'Anne Day-Jones', 'Steve Byers', 'Matthew G. Taylor', 'Romano Orzari', 'Corey Sevier', 'Conrad Pla', 'Neil Napier', 'Tyrone Benskin', 'Abdul Ayoola', 'Dylan Smith', 'Robert Naylor', 'Mercedes Leggett', 'Kaniehtiio Horn', 'Ayisha Issa', 'Jason Cavalier', 'Danny Blanco Hall', 'Robert Maillet', 'Alain Chanoine', 'Edward Yankie', 'Gage Munroe', 'Marcello Bezina', 'Aron Tomori', 'Roc LaFortune', 'Jade Larocque', 'Charlie Duret', 'Alisha Nagarsheth', 'Makayla Jade McManus-Leggett', 'Madison McAleer', 'Zelia Mouana-Bankouezi', 'André Kasper', 'Tyler Hynes', 'Carlo Mestroni', 'Chantal Simard', 'Brent Skagford', 'Kevin Kelsall', 'Patrick Sabongui', 'Samuel Platel', 'Lise Sita', 'Francis Lafrenière', 'Shyrelle Yates', 'Austin Beauchamp', 'John Churchill', 'Jimmy Duperval', 'Mark Margolis', 'Tamas Menyhart', 'James A. Woods']","['myth', 'war', 'sacrifice']",Tarsem Singh
2694,2694,342470,All the Bright Places,2020-02-28,0,108,False,0,Two teens facing personal struggles form a powerful bond as they embark on a cathartic journey chronicling the wonders of Indiana.,24.882,/4SafxuMKQiw4reBiWKVZJpJn80I.jpg,"['Romance', 'Drama']","suicide, indiana, usa, based on novel or book, based on young adult novel",2020,"['Elle Fanning', 'Justice Smith', 'Alexandra Shipp', ""Kelli O'Hara"", 'Lamar Johnson', 'Virginia Gardner', 'Felix Mallard', 'Sofia Hasmik', 'Keegan-Michael Key', 'Luke Wilson', 'Chris Grace', 'John Ivers', 'Sharon Ivers', 'Isabella Fay', 'Nicole Forester', 'Sara Katrenich', 'Alex Haydon', 'Jonathan Schaffer', 'Brian Andrus', 'Ming Wang']","['grief', 'connection', 'hope']",Brett Haley
