,Unnamed: 0,id,title,release_date,revenue,runtime,adult,budget,overview,popularity,poster_path,genres,keywords,year,actors,emotions,director
2597,2597,944,Lethal Weapon 4,1998-07-10,285444603,127,False,140000000,Officers Martin Riggs and Roger Murtaugh of the Los Angeles Police Department must stop a dangerous crime lord from China from getting his brother out of jail.,25.434,/w8qaZ1OuBuI2NhySynW0n4kHWgT.jpg,"['Action', 'Adventure', 'Comedy', 'Crime', 'Thriller']","showdown, police, sequel, mixed martial arts, los angeles, california, house fire, wisecrack humor, buddy cop, lapd, maverick cop, revolver, action hero",1998,"['Mel Gibson', 'Danny Glover', 'Joe Pesci', 'Rene Russo', 'Chris Rock', 'Jet Li', 'Darlene Love', 'Traci Wolfe', 'Kim Chan', 'Steve Kahan', 'Damon Hines', 'Ebonie Smith', 'Michael Chow', 'Danny Arroyo', 'Elizabeth Sung', 'Bob Jennings', 'Jeanne Chinn', 'Conan Lee', 'Mary Ellen Trainor', 'Jessica Jann', 'Eddy Ko Hung', 'Al Leong', 'Danny Wynands', 'Jack Kehler', 'Richard Riehle', 'Tony Keyes', 'Roger Yuan', 'Jeff Imada', 'Simon Rhee', 'Zu-Wu Qian', 'Raymond Ma', 'Paul Tuerpe', 'James Lew', 'James Wing Woo', 'Raymond Moy', 'François Chau', 'Stephen Liska', 'Roland Kickinger', 'Benjamin King', 'Al Sapienza', 'Jamie Donovan', 'Marian Collier', 'Barret Swatek', 'Kerry Kletter', 'Sarah Sullivan', 'Greg Bronson', 'Ray Chang', 'Dana Lee', 'George Cheung', 'Philip Tan', 'Shawn Michaels', 'Calvin Jung', 'Al Goto', 'Sam Arnold']","['action-packed', 'humorous', 'intense']",Richard Donner
2598,2598,168,Star Trek IV: The Voyage Home,1986-11-26,133000000,119,False,24000000,"It's the 23rd century, and a mysterious alien power is threatening Earth by evaporating the oceans and destroying the atmosphere. In a frantic attempt to save mankind, Kirk and his crew must time travel back to 1986 San Francisco where they find a world of punk, pizza and exact-change buses that are as alien as anything they've ever encountered in the far reaches of the galaxy. A thrilling, action-packed Star Trek adventure!",25.43,/xY5TzGXJOB3L9rhZ1MbbPyVlW5J.jpg,"['Science Fiction', 'Adventure']","spacecraft, saving the world, teleportation, san francisco, california, starship, whale, marine biologist, uss enterprise-a, time travel, humpback whale, space opera, whaling ship, aircraft carrier, outer space, space probe, cloaking device",1986,"['William Shatner', 'Leonard Nimoy', 'DeForest Kelley', 'James Doohan', 'George Takei', 'Walter Koenig', 'Nichelle Nichols', 'Mark Lenard', 'Jane Wyatt', 'Majel Barrett', 'Robert Ellenstein', 'John Schuck', 'Brock Peters', 'Robin Curtis', 'Catherine Hicks', 'Michael Snyder', 'Michael Berryman', 'Mike Brislane', 'Grace Lee Whitney', 'Jane Wiedlin', 'Vijay Amritraj', 'Nick Ramus', 'Thaddeus Golas', 'Marty Pistone', 'Scott Devenney', 'Viola Kates Stimpson', 'Phil Rubenstein', 'John Miranda', 'Joe Knowland', 'Bob Sarlatte', 'Everett Lee', 'Richard Harder', 'Alex Henteloff', 'Tony Edwards', 'Eve Smith', 'Tom Mustin', 'Greg Karas', 'Raymond Singer', 'David Ellenstein', 'Judy Levitt', 'Teresa E. Victor', 'James Menges', 'Kirk R. Thatcher', 'Jeff Lester', 'Joe Lando', 'Newell Tarrant', 'Mike Timoney', 'Jeff Martin', 'Joseph Naradzay', 'Donald W. Zautcke', 'Monique DeSart', 'Madge Sinclair', 'Kimberly L. Ryusaki', 'Philip Weyland']","['adventurous', 'hopeful', 'uplifting']",Frank Capra III
2599,2599,522681,Escape Room,2019-01-03,155712077,100,False,9000000,"Six strangers find themselves in circumstances beyond their control, and must use their wits to survive.",25.429,/8Ls1tZ6qjGzfGHjBB7ihOnf7f0b.jpg,"['Horror', 'Thriller', 'Mystery']","chicago, illinois, key, riddle, code, puzzle, game, clue, magnet, box, cube, escape room, traumatized person, teamwork, mysterious box, sliding puzzle, pool table, death game",2019,"['Taylor Russell', 'Logan Miller', 'Jay Ellis', 'Deborah Ann Woll', 'Nik Dodani', 'Tyler Labine', 'Yorick van Wageningen', 'Cornelius Geaney Jr.', 'Russell Crous', 'Bart Fouche', 'Jessica Sutton', 'Paul Hampshire', 'Vere Tindale', 'Kenneth Fok', 'Caely-Jo Levy', 'Jamie-Lee Money', 'Jeremy Jess Boado', 'Inge Beckmann', 'Carl Coetzee', 'Katheryn Griffiths', 'Gary Green', 'Raven Swart', 'Dan Gruenberg', 'Gino Lee', 'Álex Martínez', 'Rebecca Riedy', 'Adam Robitel', 'Pete Sepenuk', 'Mario Tardón', 'Alfredo Tavares']","['suspenseful', 'intense', 'dramatic']",Adam Robitel
2600,2600,372519,The Ten Commandments: The Movie,2016-01-28,37070177,120,False,39307171,Follows Moses leading and conducting the Hebrew people from the slavery of Egypt to the freedom towards the Promised Land according to the Ancient Testament Bible book of the Exodus. The story told like never before is faithful to the Scriptures.,25.41,/yctfYDrHAPcJP54D2BCH9R5GTY2.jpg,['Drama'],,2016,"['Guilherme Winter', 'Camila Rodrigues', 'Sergio Marone', 'Paulo Gorgulho', 'Giselle Itié', 'Vera Zimmermann', 'Denise Del Vecchio', 'Zécarlos Machado', 'Larissa Maciel', 'Sidney Sampaio', 'Petrônio Gontijo', 'Luciano Szafir', 'Marco Antônio Gimenez', 'Bernardo Velasco', 'José Victor Pires', 'Victor Pecoraro', 'Heitor Martinez', 'Day Mesquita']","['faith', 'sacrifice', 'inspiration']",Alexandre Avancini
2601,2601,289720,Outcast,2014-09-26,5148503,98,False,25000000,"A mysterious warrior teams up with the daughter and son of a deposed Chinese Emperor to defeat their cruel brother, who seeks their deaths.",25.405,/efsgCTlofzIuysfokEp7hwQnUho.jpg,['Action'],"asia, emperor, crusade, knight, chinese emperor, warrior, 12th century, the crusades",2014,"['Nicolas Cage', 'Hayden Christensen', 'Liu Yifei', 'Andy On', 'Anoja Dias Bolt', 'Byron Lawson', 'Fernando Chien', 'Jawed Berni', 'Preston Baker', 'Ron Smoorenburg', 'Alaa Safi', 'Paul Philip Clark', 'Manel Soler', 'Daxing Zhang', 'Max Huang', 'Jack Tu', 'Vander McLeod', 'Jike Junyi', 'Alexandre Bailly', 'Wang Bozhao', 'Kahina Carina', 'Simon Chin', 'Jiahang Su', 'William Herbert', 'Brian Ho', 'Eason Hung', 'Shi Liang', 'Zhao Lixin', 'Coco Wang', 'Zhang Zheng', 'Harold Wang', 'Zhu Weiguang', 'Marshall Zhao', 'Michael Qiang Gao', 'Xu Wei', 'Ivan Kotik', 'Magnus Garneij', 'Erik Sords', 'Marc Philip Goodman', 'Pierre Bourdaud', 'Ash Gordey', 'Fredrik Yderström', 'Andrew Dasz', 'Steven Dasz', 'Tomer Oz', 'Eskindir Tesfay', 'Shane P. Zhang']","['redemption', 'exile', 'action']",Nick Powell
2602,2602,8916,Antz,1998-10-02,171757863,83,False,60000000,"A neurotic worker ant in love with a rebellious princess rises to unlikely stardom when he switches places with a soldier. Signing up to march in a parade, he ends up under the command of a bloodthirsty general. But he's actually been enlisted to fight against a termite army.",25.402,/lWPjxbUMpAHFkJpZHHNWhQaRsax.jpg,"['Adventure', 'Animation', 'Comedy', 'Family']","princess, work, worker, hero, general, ant, assignment, friends, soldier, individuality",1998,"['Woody Allen', 'Sharon Stone', 'Dan Aykroyd', 'Anne Bancroft', 'Danny Glover', 'Gene Hackman', 'Jane Curtin', 'Sylvester Stallone', 'Jennifer Lopez', 'Christopher Walken', 'John Mahoney', 'Paul Mazursky', 'Grant Shaud', 'Jim Cummings', 'April Winchell', 'Jerry Sroka']","['individuality', 'society', 'humor']",Eric Darnell
2603,2603,658009,Ip Man: Kung Fu Master,2019-12-23,0,82,False,0,Ip Man’s promising career as a Policeman is ruined after he is framed for murder and targeted by a mob boss’s daughter.,25.397,/kHZN7zZGsWik9Sg3APaHGeTK5Jm.jpg,"['Action', 'Drama']","martial arts, kung fu",2019,"['Dennis To Yu-Hang', 'Yuanli Ruoxin', 'Tong Xiaohu', 'Yue Dongfeng', 'Ren Yu', 'Chang Qinyuan', 'Zhao Xiaoguang', 'Li Rizhu', 'Guo Jiayi', 'Michael Wong']","['honor', 'martial arts', 'justice']",Li Liming
2604,2604,13285,Barbie: Fairytopia - Mermaidia,2006-03-14,0,75,False,0,"In this animated follow-up to Fairytopia, Elina enlists the help of a mermaid, Nori, to save her friend Nalu, a merman prince who has been captured by the wicked Laverna.",25.393,/igsqS7rpnkAT92Iqo5sYwTs1KWo.jpg,"['Animation', 'Family', 'Adventure', 'Fantasy']","fairy, mermaid, based on toy",2006,"['Kelly Sheridan', 'Lee Tockar', 'Christopher Gaze', 'Kathleen Barr', 'Chiara Zanni', 'Andrea Libman', 'Brittney Wilson', 'Pam Hyatt', 'Tabitha St. Germain', 'Venus Terzo', 'Blu Mankuma', 'Alessandro Juliani', 'Nicole Oliver', 'Teryl Rothery', 'Raphael Wagner']","['fantasy', 'friendship', 'self-discovery']",William Lau
2605,2605,11411,Superman IV: The Quest for Peace,1987-07-24,19300000,90,False,17000000,"With global superpowers engaged in an increasingly hostile arms race, Superman leads a crusade to rid the world of nuclear weapons. But Lex Luthor, recently sprung from jail, is declaring war on the Man of Steel and his quest to save the planet. Using a strand of Superman's hair, Luthor synthesizes a powerful ally known as Nuclear Man and ignites an epic battle spanning Earth and space.",25.384,/vhs3P0JwqzlgfBqhjnCWDEOtDmS.jpg,"['Action', 'Adventure', 'Science Fiction']","saving the world, superhero, mountain, nuclear missile, convertible, us army, sequel, alter ego, laboratory, super power, catholic school, newspaper editor, nuclear weapons, disarmament, volcanic eruption, great wall of china, superhuman strength",1987,"['Christopher Reeve', 'Margot Kidder', 'Gene Hackman', 'Mariel Hemingway', 'Jackie Cooper', 'Marc McClure', 'Jon Cryer', 'Sam Wanamaker', 'Mark Pillow', 'Damian McLawhorn', 'William Hootkins', 'Jim Broadbent', 'Stanley Lebor', 'Don Fellows', 'Robert Beatty', 'Bradley Lavelle', 'Mac McDonald', 'Steve Plytas', 'Czeslaw Grocholski', 'John Hollis', 'Bob Sherman', 'Eiji Kusuhara', 'Yuri Borienko', 'Boris Isarov', 'Dorota Zięciowska', 'Jayne Brook', 'Susannah York', 'Diana Hunter', 'Indira Joshi', 'Jiří Stanislav', 'Ron Travis', 'Matthew Freeman', 'Douglas W. Iles', 'Ted Maynard', 'Raymond Marlowe', 'John Cagon', 'Malcolm Bullivant', 'Mark Caven', 'Nicholas Colicos', 'David Garth', 'Esmond Knight', 'Keith Edwards', 'Eugene Lipinski', 'Dennis Creaghan', 'Philip Fox', 'Jimmy Fung', 'Guinevere John', 'Peter Penry-Jones', 'Witold Schejbal', 'Rex Robinson', 'Kerry Shale', 'Samantha Weysom', 'Kenneth Coombs', 'Stephanie English', 'Jill Goldston', 'Colin Hunt']","['hope', 'peace', 'determination']",Sidney J. Furie
2606,2606,10637,Remember the Titans,2000-09-29,136706683,113,False,30000000,"After leading his football team to 15 winning seasons, coach Bill Yoast is demoted and replaced by Herman Boone – tough, opinionated and as different from the beloved Yoast as he could be. The two men learn to overcome their differences and turn a group of hostile young men into champions.",25.374,/825ohvC4wZ3gCuncCaqkWeQnK8h.jpg,['Drama'],"high school, friendship, sports, ku klux klan, politics, american football, 1970s, trainer, race politics, civil rights, apartheid, racial segregation, based on true story, racist, high school sports, coaction, racial tension, xenophobia, virginia, head coach",2000,"['Denzel Washington', 'Will Patton', 'Wood Harris', 'Ryan Hurst', 'Donald Faison', 'Craig Kirkwood', 'Ethan Suplee', 'Kip Pardue', 'Hayden Panettiere', 'Nicole Ari Parker', 'Kate Bosworth', 'Earl Poitier', 'Ryan Gosling', 'Burgess Jenkins', 'Neal Ghant', 'David Jefferson', 'Preston Wigasi Brant', 'John Michael Weatherly', 'Gregory Alan Williams', 'Brett Rice', 'Richard Fullerton', 'J. Don Ferguson', 'Krysten Leigh Jones', 'Afemo Omilami', 'Andrew Masset', 'Tim Ware', 'Tom Turbiville', 'Tom Nowicki', 'Jim Grimshaw', 'David Dwyer', 'Bo Keister', 'Lou Walker', 'Marion Guyot', 'Rhubarb Jones', 'Bob Neal', 'Dan Albright', 'Mike Pniewski', 'Sharon Blackwood', 'Paula Claire Jones', 'Kelly Cheston', 'Walker Jones', 'Ronald L. Conner', 'Courtney James Stewart', 'E.Y. Coley', 'John Wesley', 'B. Keith Harmon', 'Andy Francis', 'Stuart Greer', 'Derick Marshall', 'Scott Thomas', 'Kevin Dankosky', 'David Chandley', 'Scott Slade', 'Ric Reitz', 'Steve Barnes', 'Rory Griffin', 'Ryan Kowalske', 'Thomas Elliott', 'C. Stephen Browder', 'Jameel Jackson', 'Randy D. Patman Jr.', 'Jemal L. Webb', 'Shawn Cummings', 'Michael Rouby', 'Ray Stoney', 'John Paul Rice', 'Shanda Lee Munson', 'David de Vries', 'Andrew Collins', ""Stephen O'Neil Martin"", 'Matt Adams', 'Marcus M. Moore', 'Ryan Duncan', 'Lauren Aparicio', 'Nicky Buggs', 'Tyreese Burnett', 'Don Cochran', 'Darren W. Conrad', 'Doshia Darmane', 'Alton Glass', 'Jyn Hall', 'Lucinda Jenney', 'Tina King', 'Ron Marino', 'Tess Panzer', 'Xavier Rivers', 'Irone Singleton', 'Jonathan Thompson', 'Shayne Tingle']","['inspiration', 'unity', 'overcoming']",Boaz Yakin
2607,2607,8204,The Spiderwick Chronicles,2008-02-14,164170327,95,False,90000000,"Upon moving into the run-down Spiderwick Estate with their mother, twin brothers Jared and Simon Grace, along with their sister Mallory, find themselves pulled into an alternate world full of faeries and other creatures.",25.373,/uN7MUMaCXfa8DbMMp61A8iXEcEG.jpg,"['Family', 'Adventure', 'Fantasy']","sibling relationship, parent child relationship, fairy, family relationships, single mother, alternate reality, hidden truth, goblin, magical creature, based on young adult novel",2008,"['Freddie Highmore', 'Sarah Bolger', 'David Strathairn', 'Mary-Louise Parker', 'Nick Nolte', 'Joan Plowright', 'Andrew McCarthy', 'Seth Rogen', 'Martin Short', 'Jordy Benattar', 'Lise Durocher-Viens', 'Tod Fennell', 'Mariah Inger', 'Jeremy Lavalley', 'Kyle Switzer', 'Tyler Patrick Jones', 'Ron Perlman']","['mystery', 'fantasy', 'curiosity']",Mark Waters
2608,2608,508439,Onward,2020-02-29,141940042,103,False,200000000,"In a suburban fantasy world, two teenage elf brothers embark on an extraordinary quest to discover if there is still a little magic left out there.",25.372,/f4aul3FyD3jv3v4bul1IrkWZvzq.jpg,"['Family', 'Animation', 'Adventure', 'Comedy', 'Fantasy']","elves, magic, dead father, dead parent, fantasy world, teenage protagonist, brother brother relationship",2020,"['Tom Holland', 'Chris Pratt', 'Julia Louis-Dreyfus', 'Octavia Spencer', 'Mel Rodriguez', 'Kyle Bornheimer', 'Lena Waithe', 'Ali Wong', 'Grey DeLisle', 'Tracey Ullman', 'Wilmer Valderrama', 'John Ratzenberger', 'George Psarras']","['grief', 'hope', 'family']",Seong-Young Kim
2609,2609,11702,The Replacement Killers,1998-02-06,19204929,87,False,30000000,"Hired assassin John Lee is asked by Chinatown crime boss Terence Wei to murder the young son of policeman Stan Zedkov. Lee has the boy in his sights, but his conscience gets the better of him, and he spares the child's life. Afraid that Wei will take revenge on his family in China, Lee seeks out expert forger Meg Coburn to obtain the passport he needs to get out of the country, but a band of replacement killers is soon on his trail.",25.369,/5JAVd0lYhkB2dsDtt84Qt6grNIn.jpg,"['Action', 'Drama', 'Crime', 'Thriller', 'Mystery']","drug dealer, sniper, martial arts, china, police, hitman, funeral, assault rifle, chinatown, conscientious objector, revenge, organized crime, fugitive, on the run, los angeles, california, one man army, sunglasses, drug lord, silencer, uzi, police raid, contract killer, action hero, replacement",1998,"['Chow Yun-Fat', 'Mira Sorvino', 'Michael Rooker', 'Kenneth Tsang', 'Jürgen Prochnow', 'Til Schweiger', 'Danny Trejo', 'Clifton Collins Jr.', 'Carlos Gómez', 'Frank Medrano', 'Leo Lee', 'Patrick Kilpatrick', 'Randall Duk Kim', 'Andrew J. Marton', 'Sydney Coberly', 'Yau-Gene Chan', 'Carlos Leon', 'Nicki Micheaux', 'Max Daniels', 'James Wing Woo', 'Albert Wong', 'Christopher Doyle', 'Robert Apisa', 'Norm Compton', 'Cle Sloan', 'Paul Higgins', 'James Lew', 'Thomas Rosales Jr.', 'Eddie Perez', 'Mario Roberts', 'Richard L. Duran', 'David Gene Gibbs', 'Rodger LaRue', 'Al Leong', 'Dennis Keiffer', 'Jimmy Ortega']","['revenge', 'loyalty', 'intensity']",Antoine Fuqua
2610,2610,55931,The Animatrix,2003-05-09,0,102,False,5000000,"Straight from the creators of the groundbreaking Matrix trilogy, this collection of short animated films from the world's leading anime directors fuses computer graphics and Japanese anime to provide the background of the Matrix universe and the conflict between man and machines. The shorts include Final Flight of the Osiris, The Second Renaissance, Kid's Story, Program, World Record, Beyond, A Detective Story and Matriculated.",25.345,/eDjIG2hAeMU5cxLrd6oiQqdqoZt.jpg,"['Animation', 'Science Fiction']","martial arts, artificial intelligence (a.i.), hacker, virtual reality, dystopia, post-apocalyptic future, cyberpunk, alternate reality, adult animation, matrix, short compilation, anime, action hero, supernatural power",2003,"['Keanu Reeves', 'Carrie-Anne Moss', 'Clayton Watson', 'Pamela Adlon', 'Melinda Clarke', 'John DiMaggio', 'Kevin Michael Richardson', 'Tom Kenny', 'Rick Gomez', 'Tara Strong', 'Bette Ford', 'Julia Fletcher', 'Dane A. Davis', 'Debi Derryberry', 'Jill Talley', 'Dwight Schultz', 'James Arnold Taylor', 'John DeMita', 'Hedy Burress', 'Phil LaMarr', 'Victor Williams', 'John Wesley', 'Alex Fernandez', 'Allison Smith', 'Matt McKenzie', 'Tress MacNeille', 'Kath Soucie', ""Terrence 'T.C.' Carson"", 'Rodney Saulsberry', ""Olivia d'Abo"", 'Jack Fletcher', 'Akio Otsuka']","['futurism', 'philosophy', 'dystopia']",Yoshiaki Kawajiri
2611,2611,273153,Summertime,2015-08-19,0,105,False,0,"In 1971, a young woman moves from the French countryside to Paris and begins a passionate love affair with a feminist leader.",25.345,/ugqdTcTEiIl37jv0QiSUlpplEke.jpg,"['Comedy', 'Drama', 'Romance']","farm, feminism, love, lgbt, woman director, sisterhood, mother daughter relationship, lesbian",2015,"['Izïa Higelin', 'Cécile de France', 'Noémie Lvovsky', 'Laetitia Dosch', 'Kévin Azaïs', 'Loulou Hanssen', 'Benjamin Bellecour', 'Sarah Suco', 'Calypso Valois', 'Natalie Beder', 'Bruno Podalydès', 'Antonia Buresi', 'Julie Lesgages', 'Jean-Henri Compère', 'Benjamin Baroche', 'Alix Bénézech', 'Nathalie Lovighi', 'Mika Tard', 'Dominique Bernardi', 'Juan Lopez Ballo', 'Grégory Vouland', 'Sébastien Novac', 'Jack Gomez', 'Patrice Tepasso', 'Franc Bruneau', 'Stéphane Otero', 'Odile Perez', 'Camille Charbeau', 'Yannick Chassagne', 'Siegrid Alnoy', 'Loïc Risser', 'Kasia Trepagnier']","['desire', 'youth', 'heat']",Catherine Corsini
2612,2612,238713,Spy,2015-05-06,235666219,120,False,65000000,"A desk-bound CIA analyst volunteers to go undercover to infiltrate the world of a deadly arms dealer, and prevent diabolical global disaster.",25.334,/vPBmfMHxQvRRNGYD5S5ko2KnX56.jpg,"['Action', 'Comedy', 'Crime']","cia, budapest, hungary, paris, france, undercover agent, rome, italy, spy, arms dealer, bulgaria, disaster, nuclear bomb, female spy, heiress, bumbling, aftercreditsstinger, duringcreditsstinger, analyst, spycraft, beauty vs brains, handler, special assignment",2015,"['Melissa McCarthy', 'Rose Byrne', 'Jason Statham', 'Jude Law', 'Miranda Hart', 'Allison Janney', 'Bobby Cannavale', 'Peter Serafinowicz', 'Morena Baccarin', 'Raad Rawi', 'Jessica Chaffin', 'Sam Richardson', 'Katie Dippold', 'Jaime Pacheco', 'Romain Apelbaum', 'Richard Brake', 'Steve Bannos', 'Carlos Ponce', 'Will Yun Lee', 'Michael McDonald', 'Adam Ray', 'Lukács Bicskey', 'Attila Bardóczy', 'Julian Miller', 'Ed Kear', 'Nargis Fakhri', 'Andrii Danylko', 'Attila Árpa', 'Bálint Adorjáni', 'Jamie Denbo', 'Alessandro De Marco', 'Peter Linka', 'Zach Woods', 'Luca Fiorilli', 'Sergej Onopko', 'Yuri Buzzi', 'Dimitri Andreas', 'Mitch Silpa', 'Matt Devere', 'Péter Farkas', 'Björn Gustafsson', 'Ben Falcone', 'Iván Kamarás', 'Greta Csizmadia', 'Klaudia Halasi', '50 Cent', 'Zalán Takács', 'Dénes Bernáth', 'Zsolt Zágoni', 'Levente Törköly', 'Paul Feig', 'Matt Mullins']","['humor', 'espionage', 'empowerment']",Paul Feig
2613,2613,583083,The Kissing Booth 2,2020-07-24,0,132,False,0,"With college decisions looming, Elle juggles her long-distance romance with Noah, changing relationship with bestie Lee and feelings for a new classmate.",25.333,/mb7wQv0adK3kjOUr9n93mANHhPJ.jpg,"['Comedy', 'Romance']",,2020,"['Joey King', 'Jacob Elordi', 'Joel Courtney', 'Molly Ringwald', 'Taylor Zakhar Perez', 'Maisie Richardson-Sellers', 'Meganne Young', 'Stephen Jennings', 'Carson White', 'Bianca Bosch', 'Camilla Wolfson', 'Zandile Madliwa', 'Judd Krok', 'Sanda Shandu', 'Hilton Pelser', 'Frances Sholto-Douglas', 'Evan Hengst', 'Joshua Daniel Eady', 'Trent Rowe', 'Michelle Allen', 'Nathan Lynn', 'Byron Langley', 'Morné Visser', 'Chloe Williams', 'D. David Morin', 'Aidan Scott', 'Joseph Gaza', 'Caleb Swanepoel', 'Dylan Edy', 'Julian Place', 'Glen Biderman-Pam', 'Julie Summers', 'Jason K. Ralph', 'Robyn Scott', 'Kevin Otto', 'Amrain Ismail-Essop', 'Waldemar Schultz', 'Tasche Adams', 'Maria Pretorius', 'Sean Barenblatt', 'Shana Mans', 'Toni Jean Erasmus', 'Jeanne Neilson', 'Grant Ross', 'Motsi Tekateka', 'Kai Luke Brummer', 'Nadia Kretschmer', 'Lya du Toit', 'Robin B. Smith', 'Cesar Velasquez Ponce', 'Bianca Amato', 'Carishma Basday', 'Noa Milan', 'Matthew Dylan Roberts']","['romance', 'confusion', 'youth']",Vince Marcello
2614,2614,19899,Couples Retreat,2009-09-19,171844840,113,False,70000000,"Four couples, all friends, descend on a tropical island resort. Though one husband and wife are there to work on their marriage, the others just want to enjoy some fun in the sun. They soon find, however, that paradise comes at a price: Participation in couples therapy sessions is mandatory. What started out as a cut-rate vacation turns into an examination of the common problems many face.",25.325,/igXVSRZsNX3TZsKrQqSyEJvzHRF.jpg,"['Comedy', 'Romance']","island, married couple, tahiti, couples therapy, love, beautiful woman, divorce, divorcee, tropical, aftercreditsstinger, duringcreditsstinger, french polynesia",2009,"['Vince Vaughn', 'Jason Bateman', 'Jon Favreau', 'Faizon Love', 'Kristin Davis', 'Malin Åkerman', 'Kristen Bell', 'Jean Reno', 'Temuera Morrison', 'Peter Serafinowicz', 'Carlos Ponce', 'Tasha Smith', 'Kali Hawk', 'John Michael Higgins', 'Jonna Walsh', 'Gattlin Griffith', 'Colin Baiocchi', 'Vernon Vaughn', 'Jersey Jim', 'Paul Boese', 'Daniel Cage Theodore', 'Phillip Jordan', 'Ken Jeong', 'Charlotte Cornwell', 'Amy Hill', 'Karen David', 'Alyssa Julya Smith', 'Alexis Knapp', 'Joy Bisco', 'Robert Esser', 'Janna Fassaert', 'Xavier Tournaud', 'Dana Fox', 'Justin Deeley', 'Scott Burn', 'Micah Mason', 'Christophe Santoro', 'Yann Marequa', 'Sacha Perrault', 'Zofia Moreno', 'Steve Byrne', 'Brendan Wayne', 'David Merheb', 'Billy Loa', 'Chu Vang', 'Jeremy Olson', 'Bronx Style Bob', 'J-Ray', 'Hanna Brophy', 'Lyndsay Magellan', 'Marketa Janska', 'Chantelle Barry', 'James Ferris', 'Jordann Kimley', 'Jon Fleming', 'Debbi Burns', 'Josh Cowdery', 'Darren Elliot Fulsher', 'Eli Jane', 'Kristine Kay Kelly', 'Natalina Maggio', 'Aneliese Roettger', 'Katie Stegeman', 'Giota Trakas', 'Robert Paul Taylor']","['conflict', 'relationships', 'comedy']",Rip Murray
2615,2615,686,Contact,1997-07-11,171120329,150,False,90000000,"A radio astronomer receives the first extraterrestrial radio signal ever picked up on Earth. As the world powers scramble to decipher the message and decide upon a course of action, she must make some difficult decisions between her beliefs, the truth, and reality.",25.311,/bCpMIywuNZeWt3i5UMLEIc0VSwM.jpg,"['Drama', 'Science Fiction', 'Mystery']","based on novel or book, nasa, extraterrestrial technology, new mexico, prime number, radio wave, wormhole, fanatic, spirituality, religion, scientist, sabotage, ham radio, astronomy, alien contact, mechanical engineering, observatory, eccentric man, radio telescope",1997,"['Jodie Foster', 'Matthew McConaughey', 'James Woods', 'John Hurt', 'Tom Skerritt', 'William Fichtner', 'David Morse', 'Angela Bassett', 'Geoffrey Blake', 'Max Martini', 'Rob Lowe', 'Jake Busey', 'Tucker Smallwood', 'Jena Malone', 'Sami Chester', 'Timothy McNeil', 'Laura Elena Surillo', 'Henry Strozier', 'Larry King', 'Thomas Garner ', 'Conroy Chino', 'Dan Gifford', 'Vance Valencia', 'Donna Kelley', 'Leon Harris', 'Claire Shipman', 'Behrooz Afrakhan', 'Saemi Nakamura', 'Maria Celeste Arraras', 'Tabitha Soren', 'Geraldo Rivera', 'Ian Whitcomb', 'Jay Leno', 'Natalie Allen', 'Robert D. Novak', 'Geraldine A. Ferraro', 'Ann Druyan', 'Kathleen Kennedy', 'Michael Albala', 'Ned Netterville', 'Leo Lee', 'William Jordan', 'David St. James', 'Jill Dougherty', 'Haynes Brooke', 'John Holliman', 'Bobbie Battista', 'Dee Dee Myers', 'Bryant Gumbel', 'Linden Soles', 'Steven Ford', 'Alexander Zemeckis', 'Janie Peterson', 'Philippe Bergeron', 'Jennifer Balgobin', 'Anthony Hamilton', 'Rebecca T. Beucler', 'Marc Macaulay', 'Pamela Wilsey', 'Jeffery Thomas Johnson', 'Yuji Okumoto', 'Gerry Griffin', 'Brian Alston', 'Rob Elk', 'Mark Thomason', 'José Rey', 'Todd Patrick Breaugh', 'Alex Veadov', 'Alice Kushida', 'Robin Gammell', 'Richardson Morse', 'Seiji Okamura', 'Bernard Shaw', 'Mak Takano', 'Hiroshi Tom Tanaka', 'Catherine Dao', 'Kristoffer Ryan Winters', 'Valorie Armstrong', 'Jim Hild', 'William L. Thomas', 'Diego Montoya', 'Jonathan Adler', 'Robert Aguilar Jr.', 'Mark Bailey', 'Matt Bennett', 'Tony Boldi', 'Christopher Boyer', 'Christine Brady', 'Ray Buffer', 'Mark Byrne', 'Candice T. Cain', 'Michael Chaban', 'Aixa Clemente', 'Bill Clinton', 'Derrick Damions', 'Elaina Erika Davis', 'Joey Dente', 'Michael Egan', 'Jeff Elmore', 'Pamela Fischer', 'Carl Gilliard', 'William B. Kaplan', 'Boris Lee Krutonog', 'Ming Lo', 'Sunshine Logroño', 'Denise Loveday', 'Neal Matarazzo', 'Bill Miller', 'Molly Mueller', 'Paul L. Nolan', 'Marisa Petroro', 'Errica Poindexter', 'J.A. Preston', 'Frank Principe', 'Billy Quinn', 'Thomas Reid', 'Leo Rogstad', 'Russell Sanderlin Sr.', 'Frank Silva', 'John A. Taylor', 'Todd Thompson', 'Cenk Uygur', 'Holly Cross Vagley', 'Eric Alan Wendell', 'Delaney Williams', 'Gregory L. Williams']","['wonder', 'science', 'existentialism']",Robert Zemeckis
