,Unnamed: 0,id,title,release_date,revenue,runtime,adult,budget,overview,popularity,poster_path,genres,keywords,year,actors,emotions,director
2716,2716,10304,Starship Troopers 2: Hero of the Federation,2004-04-24,0,92,False,7000000,"In the sequel to Paul Verhoeven's loved/reviled sci-fi film, a group of troopers taking refuge in an abandoned outpost after fighting alien bugs, failing to realize that more danger lays in wait.",24.743,/9iqrqOjLaFcGNnSQlJxYLfgrhqn.jpg,"['Adventure', 'Horror', 'Action', 'Science Fiction']","general, extraterrestrial technology, troops, us army, alien life-form, creature",2004,"['Colleen Porch', 'Richard Burgi', 'Lawrence Monoson', 'Brenda Strong', 'Ed Lauter', 'Cy Carter', 'Kelly Carlson', 'Ed Quinn', 'Sandrine Holt', 'J.P. Manoux', 'Drew Powell', 'Billy Brown', 'Jason-Shane Scott', 'Brian Tee', 'David Wells', 'Tim Conlon', 'Bobby C. King', 'Stephen Stanton', 'Sean Delon', 'Ty Williams', 'Heather Elizabeth', 'Oliver Keller']","['military', 'fear', 'desperation']",Mark Anthony Little
2717,2717,324670,Spectral,2016-12-09,0,109,False,70000000,A special-ops team is dispatched to fight supernatural beings that have taken over a European city.,24.743,/fYtIWhTDgPTcutD24f53Dcc7BAE.jpg,"['Science Fiction', 'Thriller', 'Action']","supernatural, military",2016,"['James Badge Dale', 'Emily Mortimer', 'Gonzalo Menendez', 'Max Martini', 'Ryan Robbins', 'Bruce Greenwood', 'Jimmy Akingbola', 'Brian Caspe', 'Clayne Crawford', 'Ursula Parker', 'Louis Ozawa', 'Miklós Bányai', 'Dylan Smith', 'James D. Dever', 'Royce Pierreson', ""Mark O'Neal"", 'Declan Hannigan', 'Narantsogt Tsogtsaikhan', 'Batzorig Tsogbaatar', 'Philip Bulcock', 'Peter Schueller', 'Peter J. Chaffey', 'Filip Watermann', 'Mike Bodie', 'Aaron Șerban', 'András Ábel', 'Zoltan Lörincz', 'Zoltán Téglás', 'Thomas Kelly', 'Stephen Root', 'Cory Hardrict']","['mystery', 'war', 'technology']",Monica Tatu
2718,2718,9560,A Walk in the Clouds,1995-05-27,50012507,103,False,20000000,World War II vet Paul Sutton falls for a pregnant and unwed woman who persuades him -- during their first encounter -- to pose as her husband so she can face her family.,24.721,/xencQzZnUWDRAOUydjf9PWet8Ae.jpg,"['Drama', 'Romance']","pregnancy, world war ii, vineyard, love, remake, harvest, grape, abandoned woman",1995,"['Keanu Reeves', 'Aitana Sánchez-Gijón', 'Anthony Quinn', 'Angélica Aragón', 'Evangelina Elizondo', 'Debra Messing', 'Giancarlo Giannini', 'Freddy Rodríguez', 'Don Amendolia', 'Juan Jiménez', 'Gregory Paul Martin', 'Mary Pat Gleason', 'John Dennis Johnston', 'Ivory Ocean', 'Macon McCalman', 'Julie Guevara', 'Dana Walsh']","['romance', 'hope', 'healing']",Ingrid Urich-Sass
2719,2719,8470,John Q,2002-02-15,102244770,116,False,36000000,"John Quincy Archibald is a father and husband whose son is diagnosed with an enlarged heart and then finds out he cannot receive a transplant because HMO insurance will not cover it. Therefore, he decides to take a hospital full of patients hostage until the hospital puts his son's name on the donor's list.",24.72,/xEE91LvXiqgs7Hmdl44LCzHtFf6.jpg,"['Drama', 'Thriller', 'Crime']","chicago, illinois, parent child relationship, heart attack, kidnapping, heart disease, hostage-taking, hospital",2002,"['Denzel Washington', 'James Woods', 'Kimberly Elise', 'Robert Duvall', 'Shawn Hatosy', 'Eddie Griffin', 'Kevin Connolly', 'Ethan Suplee', 'Ray Liotta', 'Anne Heche', 'Laura Harring', 'Heather Wahlquist', 'Daniel E. Smith', 'David Thornton', 'Paul Johansson', 'Obba Babatundé', 'Troy Byer', 'Troy Winbush', 'Martha Chaves', 'Gabriela Oltean', 'Ron Annabelle', 'Barry G. King', 'Larissa Laskin', 'Vanessa Branch', 'Stephanie Moore', 'James Finnerty', 'Michael Jaye', 'Yanna McIntosh', 'Linda Massad', 'Lester Mathews', 'Noam Jenkins', 'Allegra Fulton', 'Darrin Brown', 'Shera Danese', 'Kirsta Teague', 'Rick Sood', 'Scott Bloom', 'Dina Spybey-Waters', 'Carlos Diaz', 'Joe Duer', 'Simon Sinn', 'Jeff Douglas', 'Keram Malicki-Sánchez', 'Philip Williams', 'Nigel Shawn Williams', 'Frank Cassavetes', 'Colin Evans', 'Angelo Tsarouchas', 'Marcia Johnson', 'Vijay Mehta', 'Andrew Schaff', 'Malcolm Nefsky', 'Jay Leno', 'Gloria Allred', 'Larry King', 'Arianna Huffington', 'Ted Demme', 'Nas', 'Bill Maher', 'Claire Rankin', 'Philip Craig', 'Gerry Quigley']","['desperation', 'family', 'justice']",Nick Cassavetes
2720,2720,72431,Red Tails,2012-01-19,50365377,125,False,58000000,"The story of the Tuskegee Airmen, the first African-American pilots to fly in a combat squadron during World War II.",24.717,/jiORLnBsGcVcqIibkGBE213zAyh.jpg,"['Drama', 'Action', 'Adventure', 'History', 'War']","world war ii, fighter pilot, u.s. air force, fighter airplane, tuskegee airmen, 1940s, african american history",2012,"['Bryan Cranston', 'David Oyelowo', 'Cuba Gooding Jr.', 'Daniela Ruah', 'Terrence Howard', 'Andre Royo', 'Robert Kazinsky', 'Lee Tergesen', 'Matthew Leitch', 'Michael B. Jordan', 'Method Man', 'Gerald McRaney', 'Matthew Marsh', 'Barnaby Kay', 'Chris Riedell', 'Leslie Odom Jr.', 'Nate Parker', 'Marcus T. Paulk', 'Kevin Phillips', 'Paul Fox', 'Lars van Riesen', 'David Gyasi', 'Josh Dallas', 'Okezie Morro', 'Aml Ameen', 'Nathaniel Martello-White', 'Anthony Welsh', 'Rick Otto', 'Rupert Penry-Jones', 'Ryan Early', 'Brian Gross', 'Ciarán McMenamin', 'Matthew Alan', 'Michael Dixon', 'Paul Hampshire', 'Leon Ockenden', 'Dan Hirst', 'Mark Doerr', 'Richard Conti', 'Philip Bulcock', 'Dave Power', 'Sam Daly', 'Justin Irving', ""Tina D'Marco"", 'Jaime King', 'Sam Kennard', 'Tristan Mack Wilds', 'Ne-Yo', 'Elijah Kelley', 'Tommy Wright']","['patriotism', 'racism', 'heroism']",Anthony Hemingway
2721,2721,381283,mother!,2017-09-13,44516999,121,False,30000000,"A couple's relationship is tested when uninvited guests arrive at their home, disrupting their tranquil existence.",24.705,/2yOKarmL8B4oXaLXUdHu882SUbu.jpg,"['Drama', 'Thriller', 'Horror']","husband wife relationship, nightmare, nihilism, chaos, pregnancy, bible, house, vandalism, cult, surrealism, writer, nature, death, madness, stranger, chaotic, forbidden fruit, mother nature, uninvited guest",2017,"['Jennifer Lawrence', 'Javier Bardem', 'Ed Harris', 'Michelle Pfeiffer', 'Brian Gleeson', 'Domhnall Gleeson', 'Jovan Adepo', 'Amanda Chiu', 'Patricia Summersett', 'Eric Davis', 'Raphael Grosz-Harvey', 'Emily Hampshire', 'Abraham Aronofsky', 'Luis Oliva', 'Stephanie Ng Wan', 'Chris Gartin', 'Stephen McHattie', 'Ambrosio De Luca', 'Gregg Bello', 'Arthur Holden', 'Henry Kwok', 'Alex Bisping', 'Koumba Ball', 'Robert Higden', 'Elizabeth Neale', 'Kristen Wiig', 'Scott Humphrey', 'Marcia Jean Kurtz', 'Anton Koval', 'Carolyn Fe', 'Anana Rydvald', 'Cristina Rosato', 'Pierre Simpson', 'Mylene Savoie', 'Gitz Crazyboy', ""Shaun O'Hagan"", 'Sabrina Campilii', 'Stanley B. Herman', 'Mizinga Mwinga', 'Genti Bejko', 'Andreas Apergis', 'Julianne Jain', 'Julien Irwin Dupuy', 'Bronwen Mantel', 'Amanda Warren', 'Mason Franklin', 'Laurence Leboeuf', 'Sarah-Jeanne Labrosse', 'Xiao Sun', 'Melissa Toussaint', 'Fred Nguyen Khan', 'Danny MAlin', 'Adam Bernett', 'Bineyam Girma', 'Mercedes Leggett', 'Alain Chanoine', 'Kimberly Laferriere', 'Deena Aziz', 'Izabela Dąbrowska', 'Hamza Haq', 'Vitali Makarov', 'Daniela Sandiford', 'Nathaly Thibault', 'Chloë Bellande', 'Nobuya Shimamoto']","['chaos', 'madness', 'isolation']",Darren Aronofsky
2722,2722,798544,Summer Ghost,2021-11-12,0,40,False,0,"An urban legend says that lighting fireworks at an abandoned airfield will beckon the ""summer ghost,"" a spirit that can answer any question. Three teenagers, Tomoya, Aoi, and Ryo, each have their own reason to show up one day. When a ghost named Ayane appears, she reveals she is only visible to those ""who are about to touch their death."" Compelled by the ghost and her message, Tomoya begins regularly visiting the airfield to uncover the true purpose of her visits.",24.696,/mMXaAvvSw24hYNchhCtCM5z6fhB.jpg,"['Animation', 'Drama', 'Mystery', 'Fantasy']","slice of life, school, anime, short film",2021,"['Chiaki Kobayashi', 'Miyuri Shimabukuro', 'Rina Kawaei', 'Nobunaga Shimazaki']","['melancholy', 'beauty', 'acceptance']",
2723,2723,819,Sleepers,1996-10-18,165615285,147,False,44000000,Two gangsters seek revenge on the state jail worker who during their stay at a youth prison sexually abused them. A sensational court hearing takes place to charge him for the crimes.,24.691,/yUpiEk2EojS9ZEXb3nIQonQCYYF.jpg,"['Crime', 'Drama', 'Thriller']","child abuse, sexual abuse, court case, court, repayment, sadistic, pastor, juvenile prison, juvenile delinquent, child",1996,"['Kevin Bacon', 'Robert De Niro', 'Dustin Hoffman', 'Jason Patric', 'Brad Pitt', 'Brad Renfro', 'Minnie Driver', 'Billy Crudup', 'Ron Eldard', 'Vittorio Gassman', 'Terry Kinney', 'Bruno Kirby', 'Frank Medrano', 'Joe Perrino', 'Geoffrey Wigdor', 'Jonathan Tucker', 'Peter Appel', 'Joseph Attanasio', 'Gerry Becker', 'Eugene Byrd', 'Pasquale Cajano', 'Robert W. Castle', 'John Di Benedetto', 'Jeffrey Donovan', 'George Georgiadis', 'Marco Greco', 'Saverio Guerra', 'Paul Herman', 'Lennie Loftin', 'Chuck Low', 'Ruth Maleczech', 'Danny Mastrogiorgio', 'Mary B. McCann', 'Pat McNamara', 'Peter McRobbie', 'Dash Mihok', 'Michael P. Moran', ""Mick O'Rourke"", 'James Pickens Jr.', 'Wendell Pierce', 'Sean Patrick Reilly', 'Peter Rini', 'Larry Romano', 'Tom Signorelli', 'John Slattery', 'Patrick Tull', 'Aida Turturro', 'James Rosin', 'Ralph Tabakin']","['trauma', 'revenge', 'brotherhood']",Barry Levinson
2724,2724,517093,Balkan Line,2019-03-21,4944386,130,False,3500000,"After the NATO bombing of Yugoslavia in 1999, the Yugoslav army pulls out of Kosovo region, leaving Serbian people at the mercy of the Albanian UCK terrorists. A small band of soldiers must take over the Slatina airport, and hold it until the Russian peacekeepers arrive.",24.684,/okiB4NUriKKbGjAtVSzveicPTtu.jpg,"['Drama', 'Action', 'War']",,2019,"['Anton Pampushnyy', 'Gosha Kutsenko', 'Miloš Biković', 'Milena Radulović', 'Gojko Mitić', 'Ravshana Kurkova', 'Dmitry Frid', ""Aleksandar Srećković 'Kubura'"", 'Svetlana Chuikina', 'Miodrag Radonjić', 'Nikola Ranđelović', 'Emir Kusturica', 'Kirill Poluhin', 'Nodari Dzhanelidze', 'Sergey Marin', 'Nikita Kologrivyy', 'Aleksandar Radojičić', 'Aleksandar Lazić', 'Roman Kurtsyn', 'Efim Petrunin', 'Roman Vorontsov', 'Anvar Khalilulaev', 'Vsevolod Yashkin', 'Daniel Kovačević', 'Lada Imamovich', 'Danila Dedovets', 'Vasilisa Nemtsova', 'Anya Alach', 'Ekaterina Popova', 'Vadim Byrkin', 'Michael Khmurov', 'Konstantin Samoukov', ""Srđan 'Žika' Todorović"", 'Kirill Byrkin', 'Dmitry Vyatkin', 'Branka Pujić', 'Veronika Volokha', 'Dobrila Stojnić', 'Oleg Morozov', 'Đorđe Marković', 'Ivan Mihailović', 'Yelena Charkviani', 'Anna Gallyamova', 'Valentina Muravskaya']","['war', 'intense', 'resistance']",Andrey Volgin
2725,2725,49797,I Saw the Devil,2010-08-12,0,144,False,0,"Kyung-Chul is a dangerous psychopath who kills for pleasure. Soo-Hyun, a top-secret agent, decides to track down the murderer himself. He promises himself that he will do everything in his power to take vengeance against the killer, even if it means that he must become a monster himself.",24.682,/zp5NrmYp80axIGiEiYPmm1CW6uH.jpg,"['Thriller', 'Horror']","psychopath, cemetery, police chief, secret agent, revenge, murder, serial killer, mercilessness, severed head, brutality, cannibal, tracking device, south korea, sadistic killer",2010,"['Lee Byung-hun', 'Choi Min-sik', 'Jeon Kuk-hwan', 'Cheon Ho-jin', 'Oh San-ha', 'Kim Yoon-seo', 'Nam Bo-ra', 'Lee Jun-hyuk', 'Yoon Chae-yeong', 'Choi Moo-seong', 'Kim In-seo', 'Kim Kap-soo', 'Um Tae-goo', 'Choi Jin-ho', 'Mi-nam Jeong', 'Jo Deok-jae', 'Jang Jeong-won', 'Park Seo-yeon', 'Lee Seol-gu', 'Kim Yeong-chan', 'Goo Yong-wan', 'Kim Dae-hye', 'Kim Jae-geon', 'Park Ji-yeon', 'Son Young-soon', 'Nam Hyeon-joo', 'Han Chul-woo', 'Sin Jeong-hoon', 'Han Se-joo', 'Park Jeong-gi', 'Jo Myeong-yeon', 'Kim Bong-soo', 'Kim Kang-il', 'Sin Sin-Beom', 'Seol Chang-hee', 'Yoon Byung-hee', 'Jung Tae-sung', 'Jang In-seo']","['revenge', 'cruelty', 'darkness']",Kim Jee-woon
2727,2727,109424,Captain Phillips,2013-10-10,218791811,134,False,55000000,"The true story of Captain Richard Phillips and the 2009 hijacking by Somali pirates of the US-flagged MV Maersk Alabama, the first American cargo ship to be hijacked in two hundred years.",24.668,/vjsEi2JytAT76qrtUHPIhXExZAm.jpg,"['Action', 'Drama', 'Thriller']","ship, fisherman, hijacking, somalia, poverty, pirate, terrorism, commando, hijack, cargo ship, ship hijacking, somali",2013,"['Tom Hanks', 'Barkhad Abdi', 'Barkhad Abdirahman', 'Faysal  Ahmed', 'Mahat M. Ali', 'Michael Chernus', 'David Warshofsky', 'Corey Johnson', 'Chris Mulkey', 'Yul Vazquez', 'Max Martini', 'Catherine Keener', 'Omar Berdouni', 'Mohamed Ali', 'Issak Farah Samatar', 'Thomas Grube', 'Mark Holden', 'San Shella', 'Terence Anderson', 'Marc Anwar', 'David Webber', 'Amr El-Bayoumi', 'Vincenzo Nicoli', 'Kapil Arun', 'Louis Mahoney', 'Peter Landi', 'Angus MacInnes', 'Ian Ralph', 'Kristian Hjordt Beck', 'Kurt Larsen', 'Bader Choukouko', 'Idurus Shiish', 'Azeez Mohammed', 'Abdurazak Ahmed Adan', 'Duran Mohamed Hassan', 'Nasir Jama', 'Kadz Souleiman', 'Scott Oates', 'David B. Meadows', 'Shad Jason Hamilton', 'Adam Wendling', 'Billy Jenkins', 'Mark Semos', 'Dean Franchuk', 'Rey Hernandez', 'Christopher Stadulis', 'Roger Edwards', 'John Patrick Barry', 'Raleigh Morse', 'Dale McClellan', 'Hugh Middleton', 'Raymond Care', 'Stacha Hicks', 'Will Bowden', 'Len Anderson IV', 'Giovanni Alabiso', 'Devon Black', 'Joshua Brown', 'Steve Campbell', 'Bob Dio', 'Maria Dizzia', 'Herman Gambhir', 'Georgia Goodman']","['tension', 'survival', 'courage']",Paul Greengrass
2728,2728,483906,Polar,2019-01-25,0,118,False,0,"When a retiring assassin realizes that he is the target of a hit, he winds up back in the game going head to head with a gang of younger, ruthless killers.",24.667,/qOBEpKVLl8Q9CZScbOcRRVISezV.jpg,"['Action', 'Crime', 'Drama']","assassin, hitman, montana, chile, based on graphic novel, isolated house, criminal organization, neo-noir, forced retirement",2019,"['Mads Mikkelsen', 'Vanessa Hudgens', 'Katheryn Winnick', 'Fei Ren', 'Ruby O. Fee', 'Matt Lucas', 'Robert Maillet', 'Anthony Grant', 'Josh Cruddas', 'Lovina Yavari', 'Ayisha Issa', 'Pedro Miguel Arce', 'Anastasia Marinina', 'Richard Dreyfuss', 'Inga Cadranel', 'Jill Frappier', 'Nia Roam', 'Julian Richings', 'Johnny Knoxville', 'Roman Lebeau', 'Dmitry Chepovetsky', 'Sofia Grossi', 'Martin Zolotarev', 'Marsha Mason', 'Ken Hall', 'Calwyn Shurgold', 'Emily Debowski', 'Jamillah Ross', 'Michael Ayres', 'Maria Nash', 'Moon Mason', 'Oksana Zilinskas', 'Callum Shoniker', 'Ava Augustin', 'Connor Laidman', 'Robert Clarke', 'Craig Burnatowski', 'Joe Delfin', 'Yana Gold', 'Drew Catherine', 'Brandy Dawley', 'Sima Fisher', 'Pastel Supernova', 'Carrie Eklund', 'Lee Villeneuve', 'Neven Pajkic', 'Andrei Kovski', 'Nobuya Shimamoto', 'Matt Birman']","['brutal', 'loneliness', 'cold']",Jonas Åkerlund
2729,2729,2503,The Bourne Ultimatum,2007-08-03,442824138,115,False,70000000,"Bourne is brought out of hiding once again by reporter Simon Ross who is trying to unveil Operation Blackbriar, an upgrade to Project Treadstone, in a series of newspaper columns. Information from the reporter stirs a new set of memories, and Bourne must finally uncover his dark past while dodging The Company's best efforts to eradicate him.",24.667,/15rMz5MRXFp7CP4VxhjYw4y0FUn.jpg,"['Action', 'Drama', 'Mystery', 'Thriller']","assassin, government, corruption, paris, france, based on novel or book, madrid, spain, espionage, prosecution, fake identity, revelation, europe, interpol, sequel, flashback, conspiracy, shootout, motorcycle, foot chase, dark past, langley virginia, moscow, russia, action hero, security leak, bourne, jason bourne",2007,"['Matt Damon', 'Julia Stiles', 'David Strathairn', 'Scott Glenn', 'Paddy Considine', 'Edgar Ramírez', 'Albert Finney', 'Joan Allen', 'Tom Gallop', 'Corey Johnson', 'Daniel Brühl', 'Joey Ansah', 'Colin Stinton', 'Dan Fredenburgh', 'Lucy Liemann', 'Bryan Reents', 'Arkie Reece', 'John Roberson', 'Russ Huards', 'Mark Bazeley', ""Sinead O'Keeffe"", 'Charles Venn', 'Scott Adkins', 'Branko Tomović', 'Laurentiu Possa', 'Trevor St. John', 'Albert Jones', 'Jeffrey Lee Gibson', 'Uriel Emil Pollack', 'Omar Hernández', 'William H. Burns', 'Michael Wildman', 'Kai Martin', 'Michael Ahl', 'Alex Argenti', 'Martin Ballantyne', 'Arthur Benjamins', 'David Boston', 'Glynis Brooks', 'Mahmud Chowdhury', 'James Ciccone', 'Casey Cipriani', 'Brian Cox', 'Julie Eagleton', 'Richard El Khazen', 'Ronald E. Giles', 'Ilan Krigsfeld', 'Kirk Lambert', 'Chris Mansfield', 'Bill Massof', 'Luis Mottola', 'Mark Mottram', 'Karl Olsen', 'Jose Pecino', 'Franka Potente', 'Walter A. Saunders III', 'James Schram', 'Mark Shrimpton', 'Tina Simmons', 'Brian Smyj', 'John Snowden', 'Albert Tang', 'Paul Thornton', 'Anthony Wanzer', 'John Warman', 'Chris Wilson', 'Simon John Wilson', 'Ben Youcef', 'Sebastian Feldman']","['action', 'memory', 'spy']",Paul Greengrass
2730,2730,116322,The Legend of La Llorona,2011-10-21,0,81,False,0,"Based on a famous Mexican legend, a group of kids must stop the ghost of a woman whose guilt over the drowning of her own children leads her to abduct youngsters who wander the woods at night.",24.664,/vBiqoYfDIWKKzZTiQScqgCO09UD.jpg,"['Family', 'Animation', 'Fantasy', 'Horror', 'Comedy', 'Action']","based on myths, legends or folklore",2011,"['Rafael Inclán', 'Yair Prado', 'Mónica del Carmen', 'Mayté Cordero', 'Rosario Zúñiga', 'Mercedes Hernández', 'Andrés Couturier', 'Rocío Lara', 'Miguel Couturier', 'Jesús Guzmán', 'Erick Cañete', 'Valeria Russek', 'Humberto Solórzano', 'Romina Marroquín', 'Carlos del Campo']","['folklore', 'haunting', 'motherhood']",Alberto Rodríguez
2731,2731,9618,Tango & Cash,1989-12-22,63408614,104,False,55000000,"Ray Tango and Gabriel Cash are narcotics detectives who, while both being extremely successful, can't stand each other. Crime Lord Yves Perret, furious at the loss of income that Tango and Cash have caused him, frames the two for murder. Caught with the murder weapon on the scene of the crime, the two have no alibi. Thrown into prison with most of the criminals they helped convict, it appears that they are going to have to trust each other if they are to clear their names and catch the evil Perret.",24.659,/7xGDaxBE8NazccpXN6oiwoOe67b.jpg,"['Action', 'Adventure', 'Comedy', 'Thriller']","prisoner, war on drugs, los angeles, california, buddy cop",1989,"['Sylvester Stallone', 'Kurt Russell', 'Teri Hatcher', 'Jack Palance', 'Brion James', 'James Hong', 'Marc Alaimo', 'Philip Tan', 'Michael J. Pollard', ""Robert Z'Dar"", 'Lewis Arquette', 'Edward Bunker', 'Leslie Morris', 'Roy Brocksmith', 'Susan Krebs', 'David Byrd', 'Richard Fancy', 'Jerry Martinez', 'Michael Jeter', 'Bing Russell', 'Alphonse Walter', 'Peter Stensland', 'Phil Rubenstein', 'Elizabeth Sung', 'Clint Howard', 'Ed DeFusco', 'Jack Goode Jr.', 'Geoff Vanderstock', 'Larry Humburger', 'Mark Wood', 'Andre Rosey Brown', 'Savely Kramarov', 'Michael Francis Clarke', 'Anne Cooper', 'Tammy Richardson', 'Patti Davis', 'Richard L. Duran', 'Doug Ford', 'Kenneth Pruitt', 'Ronald Moss', 'Rick Dominguez', 'Kristen Dalton', 'Tamara Landry', 'Anna Joyner', 'Melissa Bremner', 'Christie Mucciante', 'Lucia Neal', 'Roxanne Kernohan', 'Dori Courtney', 'Dale Swann', 'John Walter Davis', 'Adolfo Quinones', 'David Lea', 'Glenn Morshower', 'Salvador Espinoza', 'Christopher Wolf', 'Larry White', 'Richard J. Larson', 'Fred Trombley', 'Matt Tufo', 'David Phillips', 'Lewis Guido', 'James Reilley', 'Gilbert Esparza', 'Martin Valinsky', 'Donald Zinn', 'Duane Allen', 'Robert David Armstrong', 'Philip Weyland', 'Paul Lewis', 'Ron Cummins', 'Benny Urquidez', 'Billy Blanks', 'Geoffrey Lewis', 'Michael Lent', 'Roberto Rodriquez']","['buddy cop', 'chaos', 'humor']",Andrei Konchalovsky
2732,2732,506072,Prospect,2018-10-02,22777,98,False,4000000,"A teenage girl and her father travel to a remote alien moon, aiming to strike it rich. They've secured a contract to harvest a large deposit of the elusive gems hidden in the depths of the moon's toxic forest. But there are others roving the wilderness and the job quickly devolves into a fight to survive.",24.655,/1HpAwszXLsD8GeypDzK0me7fPFA.jpg,['Science Fiction'],"survival, alien planet, space western, natural resources, father daughter relationship, giant forest, toxic atmosphere",2018,"['Sophie Thatcher', 'Pedro Pascal', 'Jay Duplass', 'Andre Royo', 'Sheila Vand', 'Anwan Glover', 'Luke Pitzrick', 'Arthur Deranleau', 'Alex McCauley', 'Doug Dawson', 'Krista Johnson', 'Brian Gunter', 'Trick Danneker', 'Christopher Morson', 'Shepheard Earl', 'Ben Little']","['hope', 'suspense', 'survival']",Zeek Earl
2733,2733,14442,Ella Enchanted,2004-04-09,27388767,96,False,31000000,"Ella lives in a magical world in which each child, at the moment of their birth, is given a virtuous ""gift"" from a fairy godmother. Ella's so-called gift, however, is obedience. This birthright proves itself to be quite the curse once Ella finds herself in the hands of several unscrupulous characters whom she quite literally cannot disobey. Determined to gain control of her life and decisions, Ella sets off on a journey to find her fairy godmother who she hopes will lift the curse. The path, however, isn't easy -- Ella must outwit a slew of unpleasant obstacles including ogres, giants, wicked stepsisters, elves and Prince Charmont's evil uncle, who wants to take over the crown and rule the kingdom.",24.654,/dH8yHmqUra0gqzMJJKXiyfKkB57.jpg,"['Family', 'Fantasy', 'Comedy']","based on novel or book, elves, magic, fairy tale, fairy, prince, fantasy world, giant, ogre, obedience, fairy godmother",2004,"['Anne Hathaway', 'Hugh Dancy', 'Cary Elwes', 'Aidan McArdle', 'Joanna Lumley', 'Lucy Punch', 'Jennifer Higham', 'Minnie Driver', 'Eric Idle', 'Steve Coogan', 'Jimi Mistry', 'Vivica A. Fox', 'Parminder Nagra', 'Jim Carter', 'Patrick Bergin', 'Donna Dent', 'Ankita Malkan', 'Sally-Ann Tingle', 'Aimee Brigg', 'Helen Norton', 'Emmet Kirwan', 'Christopher Kelly', 'Audrey Hamm', 'Mikel Murfi', 'Rory Keenan', 'Aonghus Og McAnally', 'Aaron Monaghan', 'Heidi Klum', 'Alvaro Lucchesi', 'Paraic Breathnach', 'Daniel Naprous', 'Nora-Jane Noone', 'Pat Kinevane', 'Andrea Irvine', 'Merrina Millsapp', 'Amelia Crowley', 'Pat McGrath', 'Susan Mary Ward', 'Ron Yuan', 'Johnny Nguyen']","['fantasy', 'humor', 'self-discovery']",Tommy O'Haver
2734,2734,11231,The Next Karate Kid,1994-07-18,15876353,107,False,12000000,"Mr. Miyagi decides to take Julie, a troubled teenager, under his wing after he learns that she blames herself for her parents' demise and struggles to adjust with her grandmother and fellow pupils.",24.648,/wI3gCi9w1cuUJCiwhviAy46we9Q.jpg,"['Action', 'Drama', 'Family', 'Adventure']","high school, martial arts, sports, buddhist monk, becoming an adult, karate, revenge, teen movie, los angeles, california, classmate",1994,"['Pat Morita', 'Hilary Swank', 'Michael Ironside', 'Constance Towers', 'Chris Conrad', 'Arsenio', 'Michael Cavalieri', 'Walton Goggins', 'Jim Ishida', 'Rodney Kageyama', 'Seth Sakai', 'Eugene Boles', 'Keena Keel', ""Tom O'Brien"", 'Thomas Downey', 'Brian McGrail', 'Wayne Chou', 'Daniel Inouye', 'Gustave Johnson', 'Brian Smiar', 'Christopher Beam', 'Eric Beam', 'Scott Powderly', 'Davis Robinson', 'Anthony Ejarque', 'Steven Mark Friedman', 'Christopher Wilder', 'Annette Miller', 'Bud Ekins', 'Paul Bronk', 'Fred Fontana', 'Julie Weintraub', 'Johnny Melton', 'Chad Melton', 'Scott Strupe', 'Phillip V. Caruso', 'Robert Harrell', 'Dan Marshall', 'Frank Principe', 'Robin Reck', 'Hebron Simckes-Joffe', 'Mark Vafiades', 'Dared Wright', 'Jason Yee']","['discipline', 'empowerment', 'training']",Christopher Cain
2735,2735,10995,The Lover,1992-01-22,5013090,115,False,0,"A poor French teenage girl engages in an illicit affair with a wealthy Chinese heir in 1920s Saigon. For the first time in her young life she has control, and she wields it deftly over her besotted lover throughout a series of clandestine meetings and torrid encounters.",24.648,/zARAlov5WMxCef4JBD7f0H3RR1f.jpg,"['Drama', 'Romance']","lolita, virgin, vietnam, based on novel or book, age difference, arranged marriage, lover, saigon, indochina, loss of virginity, love, sexual attraction, older man younger woman relationship, lust, desire, french girl, sexual awakening, southeast asia, chinese man, illicit affair, 1920s, sex with a minor, erotic romance, ho chi minh",1992,"['Jane March', 'Tony Leung Ka-Fai', 'Frédérique Meininger', 'Arnaud Giovaninetti', 'Melvil Poupaud', 'Lisa Faulkner', 'Jeanne Moreau', 'Xiem Mang', 'Philippe Le Dem', 'Ann Schaufuss', 'Tania Torrens', 'Espérance Pham Thai Lan', 'Hélène Patarot', 'Yvonne Wingerter', 'Raymonde Heudeline', 'Quach Van An', 'Do Minh Vien', 'Frédéric Auburtin', 'Alido H. Gaudencio', 'Vu Dinh Thi', 'Truong Thu', 'Thi Cam Thuy Nguyen', 'Lu Van Trang', 'Vu Kim Trong']","['desire', 'culture', 'tragedy']",Jean-Jacques Annaud
2736,2736,553604,Honest Thief,2020-09-03,31220247,99,False,0,"A bank robber tries to turn himself in because he's falling in love and wants to live an honest life...but when he realizes the Feds are more corrupt than him, he must fight back to clear his name.",24.647,/zeD4PabP6099gpE0STWJrJrCBCs.jpg,"['Thriller', 'Action', 'Crime', 'Drama']","bomb, bank robber, criminal past, divorce, fbi agent",2020,"['Liam Neeson', 'Kate Walsh', 'Jai Courtney', 'Jeffrey Donovan', 'Anthony Ramos', 'Robert Patrick', 'Jasmine Cephas Jones', 'Devon Diep', 'Herlin Navarro', 'James Milord', 'Lewis D. Wheeler', 'Jose Guns Alves', 'Michael Malvesti', ""Patty O'Neil"", 'Birol Tarkan Yıldız', 'Adam Teper', 'Osmani Rodriguez', 'Tazzie']","['guilt', 'truth', 'justice']",Nicholas Mastandrea
