,Unnamed: 0,id,title,release_date,revenue,runtime,adult,budget,overview,popularity,poster_path,genres,keywords,year,actors,emotions,director
3062,3062,660120,The Worst Person in the World,2021-10-13,11800000,128,False,5000000,"The chronicles of four years in the life of Julie, a young woman who navigates the troubled waters of her love life and struggles to find her career path, leading her to take a realistic look at who she really is.",23.063,/p5nLFV9aa76zhFK91Qi0xRlXvQ1.jpg,"['Drama', 'Comedy', 'Romance']","bookshop, photographer, pregnancy, man woman relationship, magic mushroom, cancer, break-up, older man younger woman relationship, oslo, norway, controversial artist, turning thirty",2021,"['Renate Reinsve', 'Anders Danielsen Lie', 'Herbert Nordrum', 'Hans Olav Brenner', 'Helene Bjørnebye', 'Vidar Sandem', 'Maria Grazia Di Meo', 'Lasse Gretland', 'Karen Røise Kielland', 'Marianne Krogh', 'Thea Stabell', 'Deniz Kaya', 'Eia Skjønsberg', 'Ruby Dagnall', 'Torgny Amdam', 'Rebekka Jynge', 'Sigrid Sollund', 'Are Skeie Hermansen', 'Siri Forberg', 'Sofia Schandy Bloch', 'Anna Dworak', 'Savannah Marie Schei', 'August Wilhelm Méd Brenner', 'Karla Nitteberg Aspelin', 'Tumi Løvik Jakobson', 'Jonathan Nielssen', 'Maren Emilie Haagenrud Buskoven', 'Olav Stubberud', 'Martin Gran', 'Geir Ørnholt', 'Tobias Klemeyer Smith', 'Nataniel Nordnes', 'Trygve Indrelid', 'Trude Schjelderup Iversen', 'Zoe Maland Rogers', 'Jonas Lund', 'Hildur Kristinsdottir', 'Johanna Brym Ryg', 'Thomas Teige', 'Margrethe Glambek', 'Ine Jansen', 'Gisle Tveito']","['confusion', 'regret', 'longing']",Joachim Trier
3063,3063,2055,Open Range,2003-08-29,68296293,139,False,22000000,A former gunslinger is forced to take up arms again when he and his cattle crew are threatened by a corrupt lawman.,23.061,/d0zydHSE3kaidjDdlc4T6xnp113.jpg,"['Western', 'Action', 'Drama', 'Adventure', 'Romance']","gunslinger, montana, horse, beef, ranger, shootout, doctor, thunderstorm, cowboy, crooked sheriff, civil war veteran, 19th century, land baron, vengeance, lawman",2003,"['Kevin Costner', 'Robert Duvall', 'Michael Gambon', 'Michael Jeter', 'Diego Luna', 'James Russo', 'Abraham Benrubi', 'Kim Coates', 'Annette Bening', 'Dean McDermott', 'Herb Kohler', 'Peter MacNeill', 'Cliff Saunders', 'Patricia Stutz', 'Julian Richings', 'Ian Tracey', 'Rod Wilson', 'Diego Diablo Del Mar', 'Patricia Benedict', 'Tim Koetting', 'Tom Carey', 'Kurtis Sanheim', 'Billy Morton', 'Alex Zahara', 'Chad Camilleri', 'Greg Schlosser', 'Guy Bews', 'Lorette Clow', 'Alexis Cerkiewicz']","['justice', 'land', 'honor']",Darren Robson
3064,3064,201085,Crimson Peak,2015-10-13,74679822,119,False,55000000,"In the aftermath of a family tragedy, an aspiring author is torn between love for her childhood friend and the temptation of a mysterious outsider. Trying to escape the ghosts of her past, she is swept away to a house that breathes, bleeds… and remembers.",23.058,/s6cFBCAlfFBwBKVgJOme3JpjZLo.jpg,"['Horror', 'Romance']","psychopath, poison, haunted house, mining, murder, gothic, incest, ghost, old mansion, brutal murder",2015,"['Mia Wasikowska', 'Jessica Chastain', 'Tom Hiddleston', 'Charlie Hunnam', 'Jim Beaver', 'Burn Gorman', 'Leslie Hope', 'Jonathan Hyde', 'Doug Jones', 'Bruce Gray', 'Emily Coutts', 'Alec Stockwell', 'Brigitte Robinson', 'Gillian Ferrier', 'Tamara Hope', 'Kimberly-Sue Murray', 'Sofia Wells', 'Joanna Douglas', 'Bill Lake', 'Jim Watson', 'Javier Botet', 'Peter Spence', 'Danny Waugh', 'Sean Hewitt', 'William Healy', 'Matia Jackett', 'Karen Glave', 'Khadijah Roberts-Abdullah', 'John Carter Craig', 'Martin Julien', 'Brian Kaulback', 'Richard Kerr', 'Shane McPherson', 'Tim Blake', 'Thomas Dorey', 'Erik Bauersfield', 'Joan Washington', 'Beatrice Basso', 'Mitzi McCall', 'Susanne Blakeslee', 'Drew Davis', 'T.J. McGibbon', 'Anneliese Goldman', 'Jenna Weir', 'Amanda Smith', 'Laura Waddell']","['love', 'haunting', 'guilt']",Guillermo del Toro
3065,3065,614409,To All the Boys: Always and Forever,2021-02-12,0,115,False,0,Senior year of high school takes center stage as Lara Jean returns from a family trip to Korea and considers her college plans — with and without Peter.,23.054,/iepqdM52f4w75fNcvgRF5QoIAjm.jpg,"['Romance', 'Comedy', 'Drama']","based on novel or book, south korea, asian american, seoul, south korea",2021,"['Lana Condor', 'Noah Centineo', 'Janel Parrish', 'Anna Cathcart', 'Ross Butler', 'Madeleine Arthur', 'Emilija Baranac', 'Trezzo Mahoro', 'Sarayu Blue', 'John Corbett', 'Henry Thomas', ""Sofia Black-D'Elia"", 'June B. Wilde', 'Kelcey Mawema', 'Jeon Ho-young', 'C. Ernst Harth', 'Ese Atawo', 'Rhianna Jagpal', 'Michael Delleva', 'Molly Grace', 'Momona Tamada', 'Rian McCririck', 'Jenny Han', 'Linda Ko', 'James Li', 'Julie Tao', 'Vonnie Bennetto', 'Joey Pacheco', 'Jara Zeimer', 'Anisha Cheema', 'Susie Lee', 'Rish Shah', 'Nathan Parrott', 'Kayla Deorksen', 'Jerry Yang', 'Lisa Durupt', 'Kalyn Miles', 'Sarah Formosa', 'Mariesa Crouse', 'Danielle Brokopp', 'Janelle McDermoth', 'Katie Do', 'Addison Sartino', 'Brandon Yangmi', 'Austin Fraser', 'Pierce Turcotte', 'Dan Cipriano', 'Eun-Mi Jeon', 'Song Hoon', ""Kevin 'Woo-Young' Seon"", 'Ahn Jae-Jun', 'Eun-Seok Lee', 'Gina Jun']","['romance', 'growth', 'farewell']",Marlon Hero
3066,3066,87492,Foxcatcher,2014-11-14,12096300,134,False,24000000,The greatest Olympic Wrestling Champion brother team joins Team Foxcatcher led by multimillionaire sponsor John E. du Pont as they train for the 1988 games in Seoul - a union that leads to unlikely circumstances.,23.052,/w6Sl079QtUcQ9dVQ2RP6aN9NBXx.jpg,"['Drama', 'Thriller']","sports, wrestling, biography, based on true story, ex-boyfriend ex-girlfriend relationship",2014,"['Steve Carell', 'Channing Tatum', 'Mark Ruffalo', 'Sienna Miller', 'Vanessa Redgrave', 'Anthony Michael Hall', 'Guy Boyd', 'Brett Rice', 'Jackson Frazer', 'Samara Lee', 'Francis J. Murphy III', 'Jane Mowder', 'David Bennett', 'Lee Perkins', 'Robert Haramia', 'Daniel Hilt', 'Bryan Cook', 'David Zabriskie', 'Zach Rey', 'Reece Humphrey', 'J.D. Bergman', 'Corey Jantzen', 'Frederick Feeney', 'Mark Schultz', 'Lee Kemp', 'Jake Herbert', 'Donald Modrick', 'Gabrielle Burton', 'Kevin Cooke', 'Richard E. Chapla Jr.', 'Bill Ehrin', 'Roger Callard', 'Dan Anders', 'Barry Vlanich', 'Sam Brehm', 'Stan Dziedzic', 'David Miller', 'Brian Baumgartner', 'Joe Russo', 'Ken Williams', 'Gene Mills', 'John C. Baxter', 'Rick Steigerwald', 'Marc Snider', 'Jaz Securo', 'Corey Walker', 'Alan Oppenheimer', 'Joe Fishel', 'Jackson Nunn', 'Lou Consolo']","['obsession', 'control', 'madness']",Bennett Miller
3067,3067,5680,"Elvira, Mistress of the Dark",1988-09-30,5596267,96,False,7500000,"When her great aunt dies, famed horror hostess Elvira heads for the uptight new England town of Falwell to claim her inheritance of a haunted house, a witch's cookbook and a punk rock poodle. But once the stuffy locals get an eyeful of the scream queen's ample assets, all hell busts out & breaks loose.",23.039,/tr9ajyzn0xRZhgp30SMdwhzFNJW.jpg,"['Horror', 'Comedy']",hostess,1988,"['Cassandra Peterson', 'William Morgan Sheppard', 'Daniel Greene', 'Edie McClurg', 'Susan Kellermann', 'Jeff Conaway', 'Ellen Dunning', 'Ira Heiden', 'Scott Morris', 'Tress MacNeille', 'Frank Collison', 'Kris Kamm', 'Lee McLaughlin', 'Kurt Fuller', 'Larry Jenkins', 'Damita Jo Freeman', 'Bill Cable', 'Hugh Gillin', 'John Paragon', 'Alex Magno', 'Pat Crawford Brown', 'William Duell', 'Lynne Marie Stewart', 'Jack Fletcher', 'Robert Benedetti', 'Joey Arias', 'Deron McBee', 'Dick Miller', 'Raleigh Bond', 'Phil Rubenstein', 'Edwina Moore', 'Mario Celario', 'Bill Swearingen', 'Charles Woolf', 'Bill Dance', 'William Cort', 'Sharon Hays', 'Bill Morey', 'Kate Brown', 'Eve Smith', 'Tony Burrer', 'Alan Dewames', 'Tim Hill', 'James Hogan', 'Sebastian Russell', 'Read Scot', 'James Zyzack Sterling', 'Peter Blanco Jr.', 'Gabriel Colbert', 'Michael A. Jackson', 'Derek Givens', 'Mark David Fritsche', 'Heather Holty Newton', 'Terry Ray']","['seduction', 'humor', 'rebellion']",James Signorelli
3068,3068,519465,Queen of Hearts,2019-03-27,0,127,False,19000000,"Anne, a brilliant and dedicated advocacy lawyer specialising in society’s most vulnerable, children and young adults, lives what appears to be the picture-perfect life with her doctor-husband, Peter, and their twin daughters. When her estranged teenage stepson, Gustav, moves in with them, Anne’s escalating desire leads her down a dangerous rabbit hole which, once exposed, unleashes a sequence of events destined to destroy her world.",23.033,/dfFVDIgovEfQZn53VRKLV2JQnRJ.jpg,['Drama'],"lawyer, older woman younger man relationship, woman director, erotic thriller, age-gap relationship, stepmother stepson relationship",2019,"['Trine Dyrholm', 'Gustav Lindh', 'Magnus Krepper', 'Liv Esmår Dannemann', 'Silja Esmår Dannemann', 'Stine Gyldenkerne', 'Preben Kristensen', 'Frederikke Dahl Hansen', 'Ella Solgaard', 'Carla Philip Røder', 'Peter Khouri', 'Mads Knarreborg', 'Marie Dalsgaard', 'Elias Budde Christensen', 'Noel Bouhon Kiertzer', 'Nessie Beik', 'Stanley Bakar', 'Anders Hedegaard Andersen', 'Mathias Rahbæk']","['lust', 'power', 'betrayal']",May el-Toukhy
3069,3069,82525,Savages,2012-07-06,82966152,131,False,45000000,Pot growers Ben and Chon face off against the Mexican drug cartel who kidnapped their shared girlfriend.,23.031,/a5h5FvryxiALwfv3FzgUKxJHHPG.jpg,"['Crime', 'Drama', 'Thriller']","explosive, widow, american abroad, eye gouging, dea agent, shot, southern california, surrogate daughter, laguna beach, california, enforcer, gardner, skull mask, dea",2012,"['Taylor Kitsch', 'Blake Lively', 'Aaron Taylor-Johnson', 'John Travolta', 'Salma Hayek Pinault', 'Benicio del Toro', 'Emile Hirsch', 'Demián Bichir', 'Sandra Echeverría', 'Diego Cataño', 'Joaquín Cosío', 'Jake McLaughlin', 'Joel David Moore', 'Leonard Roberts', 'Shea Whigham', 'Jana Banker', 'Candra Docherty', 'Nana Agyapong', 'Gary Stretch', 'Karishma Ahluwalia', 'Jonathan Carr', 'Antonio Jaramillo', 'Alexander Wraith', 'Anthony Cutolo', 'Kurt Collins', 'Amber Brenner', 'Ali Wong', 'Sala Baker', 'Tara Stone', 'Matthew Saldivar', 'Sean Stone', 'Wilfredo Lopez', 'Lucinda Serrano', 'Charles Haugk', 'Sam Medina', 'Ben Hernandez Bray', 'Gonzalo Menendez', 'Maya Merker', 'Donnabella Mortel', 'Trevor Donovan', 'Leana Chavez', 'Gillian Zinser', 'Florine Elena Deplazes', 'Kaj Mollenhauer', 'Alexandra Gold Jourden', 'Charles Ingram', 'Akima', 'Dennis Garcia', 'Eddie Follis', 'Holly Follis', 'Schae Harrison', 'Mía Maestro', 'Bill Blair', 'Chester the Chihuahua']","['violence', 'drugs', 'chaos']",Oliver Stone
3070,3070,1491,The Illusionist,2006-08-18,87892388,110,False,16500000,"With his eye on a lovely aristocrat, a gifted illusionist named Eisenheim uses his powers to win her away from her betrothed, a crown prince. But Eisenheim's scheme creates tumult within the monarchy and ignites the suspicion of a dogged inspector.",23.03,/4I1oOPHNrHLcvz3wTMuETJLws9z.jpg,"['Fantasy', 'Drama', 'Thriller', 'Romance']","princess, magic, rivalry, love, vienna, austria, super power, crown prince, duchess, childhood sweetheart",2006,"['Edward Norton', 'Paul Giamatti', 'Jessica Biel', 'Rufus Sewell', 'Eddie Marsan', 'Aaron Taylor-Johnson', 'Eleanor Tomlinson', 'Jake Wood', 'Tom Fisher', 'Karl Johnson', 'Vincent Franklin', 'Nicholas Blane', 'Philip McGough', 'Erich Redman', 'Michael Carter', 'Andreas Grothusen', 'Brian Caspe', 'Ellen Savaria', 'Vítězslav Bouchner', ""David O'Kelly"", 'Richard Rowlands', 'Reuben-Henry Biggs', 'Robert Russell', 'Noel Le Bon', 'David Fellowes', 'Jan Nemejovský', 'Ivo Novák', 'Vladimír Kulhavý', 'Duke Faeger', 'Brendan Gunn', 'Ryan James', 'Petr Meissel', 'Jeff Smith', 'Ivan Urbánek', 'James Babson', 'Jaroslav Vízner', 'Jiří Vacek', 'Noelle Trkulja', 'Anezka Novak', 'Alistair Macnaughtan', 'Nancy Bishop', 'John Early', 'Eva Kelemenová', 'Alfred Strejček', 'Fasihiddin Khasanov', 'Jan Cibulka', 'Erdenbileg Sengee', 'Sondom Nararbadrakh', 'Cheng Feng', 'Purevdorj Boldsaikhan', 'Vadam Bat-Orshikh', 'Robin Ferenc', 'Dominik Havelka', 'Elias Bauer', 'Thomas McEnchroe', 'Oliver Blaha', 'Laurie Athey', 'David Forest', 'Matthew Blood-Smyth', 'Vanessa Gendron']","['mystery', 'illusion', 'romance']",Neil Burger
3071,3071,9477,King Arthur,2004-07-07,203567857,126,False,120000000,"The story of the Arthurian legend, based on the 'Sarmatian hypothesis' which contends that the legend has a historical nucleus in the Sarmatian heavy cavalry troops stationed in Britain, and that the Roman-British military commander, Lucius Artorius Castus is the historical person behind the legend.",23.026,/5Mqmke8JKE7s8JeYNp7XtzxQXbL.jpg,"['Adventure', 'War', 'History', 'Action']","roman empire, king arthur, battle, 5th century, northumbria, hadrian’s wall",2004,"['Clive Owen', 'Ioan Gruffudd', 'Keira Knightley', 'Mads Mikkelsen', 'Joel Edgerton', 'Hugh Dancy', 'Ray Winstone', 'Stephen Dillane', 'Ray Stevenson', 'Til Schweiger', 'Stellan Skarsgård', 'Sean Gilder', 'Ken Stott', 'Charlie Creed-Miles', 'David Murray', 'Ned Dennehy', 'Phelim Drew', 'Des Braiden', 'Bosco Hogan', 'David Wilmot', 'Lochlann Ó Mearáin', 'Ivano Marescotti', 'Clive Russell', 'Graham McTavish', 'Dessie Gallagher', 'Elliot Henderson-Boyle', 'Owen Teale', 'Dawn Bradfield', 'Pat Kinevane', 'Paul Tall-Order Ritchie', 'Lorenzo De Angelis']","['loyalty', 'betrayal', 'myth']",Antoine Fuqua
3072,3072,102362,Dead Man Down,2013-03-08,18074539,118,False,0,"In New York City, a crime lord's right-hand man is seduced by a woman seeking retribution.",23.025,/8xWo2WE36JdBwlCmwvXM4bb5rBg.jpg,"['Thriller', 'Action', 'Crime', 'Drama']","new york city, revenge, mysterious woman, crime lord",2013,"['Colin Farrell', 'Noomi Rapace', 'Terrence Howard', 'Dominic Cooper', 'Isabelle Huppert', 'Luis Da Silva, Jr.', 'John Cenatiempo', 'Stuart Bennett', 'Franky G', 'F. Murray Abraham', 'Declan Mulvey', 'Roy James Wilson', 'Armand Assante', 'Myles Humphus', 'Stephen Hill', 'Aaron Vexler', 'James Biberi', 'Andrew Stewart-Jones', 'Krystal Tini', 'William Zielinski', 'Jessica Jean Wilson', 'Christopher Cline', 'Kimberly S. Fairbanks', 'Michael McKiddy', 'Beata Dalton', 'Accalia Quintana', 'Jay Santiago', 'Maria Laboy', 'Saul Stein', 'Roy Milton Davis', 'Jennifer Mudge', 'Ante Novakovic', 'Kresh Novakovic', 'Jennifer Butler', 'Raymond Mamrak', 'Bobby Beckles', 'Raw Leiba', 'Hisham Tawfiq', 'Nnamdi  Nwosa', 'R. Marcos Taylor', 'Jeremy Sample', 'John Wooten', 'Stephen Mann', 'Aleksander Mici', 'Giuseppe Bausilio']","['revenge', 'loss', 'secrecy']",Niels Arden Oplev
3073,3073,290595,The Huntsman: Winter's War,2016-04-06,164989338,114,False,115000000,"As two evil sisters prepare to conquer the land, two renegades—Eric the Huntsman, who aided Snow White in defeating Ravenna in Snowwhite and the Huntsman, and his forbidden lover, Sara—set out to stop them.",23.024,/cjAGYsTPmmhZOwzrgon0Drpu43K.jpg,"['Action', 'Adventure', 'Drama']","witch, strong woman, magic, fairy tale, female soldier, female empowerment, huntsman, wicked woman, live action remake",2016,"['Chris Hemsworth', 'Charlize Theron', 'Emily Blunt', 'Jessica Chastain', 'Nick Frost', 'Sam Claflin', 'Rob Brydon', 'Sheridan Smith', 'Alexandra Roach', 'Sope Dirisu', 'Sophie Cookson', 'Sam Hazeldine', 'Colin Morgan', 'Conrad Khan', 'Niamh Walter', 'Nana Agyeman-Bediako', 'Amelia Crouch', 'Fred Tatasciore', 'Ralph Ineson', 'Lynne Wilmot', 'Robert Portal', 'Robert Wilfort', 'David Mumeni', 'Kara Lily Hayworth', 'Madeleine Worrall', 'Osi Okerafor', 'Ryan Donaldson', 'Chinna Wodu', 'Andrew Rothney', 'Tim Delap', 'Antony Acheampong', 'Ian Davies', 'George Watkins', 'Aj Bediako', 'Maya Wasowicz', 'Sam Coulson', 'Yusuf Hofri', 'Eshan Gopal', 'Annie Guy', 'Natahlia Colbourne', 'Jadey Duffield', 'Liam Neeson']","['sisters', 'power', 'fantasy']",K.C. Colwell
3074,3074,3558,"Girl, Interrupted",1999-12-21,48350205,127,False,40000000,"Set in the changing world of the late 1960s, Susanna Kaysen's prescribed ""short rest"" from a psychiatrist she had met only once becomes a strange, unknown journey into Alice's Wonderland, where she struggles with the thin line between normal and crazy. Susanna soon realizes how hard it is to get out once she has been committed, and she ultimately has to choose between the world of people who belong inside or the difficult world of reality outside.",23.023,/dOBdatHIVppvmRFw2z7bf9VKJr9.jpg,['Drama'],"based on novel or book, escape, suicide attempt, identity, insanity, female friendship, based on true story, borderline personality disorder, psychiatric hospital, mental institution, female protagonist, based on memoir or autobiography, psychiatrist, mental illness, psychiatric ward, meditative, 1960s, factual, distressing, exuberant",1999,"['Winona Ryder', 'Angelina Jolie', 'Clea DuVall', 'Brittany Murphy', 'Elisabeth Moss', 'Jared Leto', 'Jeffrey Tambor', 'Vanessa Redgrave', 'Whoopi Goldberg', 'Angela Bettis', 'Jillian Armenante', 'Drucie McDaniel', 'Alison Claire', 'Christina Myers', 'Joanna Kerns', 'Travis Fine', 'Gloria Barnhart', 'Josie Gammell', 'Bruce Altman', 'Mary Kay Place', 'Ray Baker', 'KaDee Strickland', 'Christian Monroe', 'Kurtwood Smith', 'David Scott Taylor', 'Janet Greer', 'Christopher Grimaldi', 'Ginny Graham', 'Richard Domeier', 'John Kirkman', 'Sally Bowman', 'Misha Collins', 'John Lumia', 'Marilyn Brett', 'Henry Alex Rubin', 'Marilyn Spanier', 'Linda Gilvear', 'Allen Strange', 'Spencer Gates', 'Rebecca Derrick', 'Anne Connors', 'Steve Altes', 'Joe Gerety', 'Anne Lewis', 'Donny Martino', 'John Levin', 'Irene Longshore', 'Katie Rimmer', 'Jonathan Martin Spirk']","['trauma', 'identity', 'rebellion']",James Mangold
3075,3075,913,The Thomas Crown Affair,1999-08-06,124305181,113,False,48000000,"A very rich and successful playboy amuses himself by stealing artwork, but may have met his match in a seductive detective.",23.016,/5yqs1MVlqdIg1DY5adC5jFx3d7j.jpg,"['Drama', 'Crime', 'Romance']","martinique, claude monet, glider, insurance agent, stolen painting",1999,"['Pierce Brosnan', 'Rene Russo', 'Denis Leary', 'Frankie Faison', 'Faye Dunaway', 'Esther Cañadas', 'James Saito', 'Michael Lombard', 'Fritz Weaver', 'Charles Keating', 'Mark Margolis', 'Ben Gazzara', 'Bill Ambrozy', 'Michael Bahr', 'Robert D. Novak', 'Joe H. Lamb', 'Mischa Hausserman', 'Daniel Oreskes', 'Dominic Chianese Jr.', 'Ritchie Coster', 'Gregg Bello', 'John P. McCann', 'Gino Lucci', 'George Christy', 'Mike Danner', 'James J. Archer', 'John Elsen', 'Robert Spillane', 'Daniel Jamal Gibson', 'Cynthia Darlow', 'Sherry Koftan', 'Jane DeNoble', 'Gene Bozzi', 'Ryan Hecht', 'Paul Simon', 'Tom Tammi', 'Mark Zeisler', 'Mark Zimmerman', 'Daniel Southern', 'James Yaegashi', 'Ira Wheeler', 'David Adkins', 'John McKay', 'Melissa Maxwell', 'Colleen Hamm', 'Timothy Wheeler', 'John Thrall Bush', 'Dominic Marcus', 'Robert Lewis Stephenson', 'David Toney', 'Phillip Douglas', 'Jeffrey Dreisbach', 'R.J. Remo', 'Caleb Archer', 'Dennis Creaghan', 'Randy Phillips', 'Gloria Barnes', 'Mimi Weddell', 'Pat Friedlander', 'Gary L. Catus', 'Jeremy Nagel', 'John C. Havens', 'Annie Rose Murray', 'Bill Tatum', 'Teddy Coluca', 'Michael Charles', 'Orlando Carafa', 'Ben Epps', 'Kim D. Cannon', 'Douglas Kahelemauna Nam', 'Richard Russell Ramos', 'John Seidman', 'Robert Ian Mackenzie', 'Yusef Bulos', 'Ray Virta', 'Thomas Michael Sullivan', 'J. Paul Boehmer', 'Tony Cucci', 'Paul Geoffrey', 'R.E. Rodgers', 'Tom Bloom', 'Kim Craven', 'Marion McCorry', 'Sean Haberle', 'Mikel Sarah Lambert', 'Angelo Fraboni', 'Melanie LaPatin', 'Jodi Ellen Melnick', 'Tony Meredith', 'Michael Terrace', 'Simon Jones', 'Jodi White', 'Timothy Klein', 'Steven E. Lawler', 'Andy Redmond', 'Charles Gemmill', 'Norman Steiner', 'Steve Bilich', 'Josh Mowery', 'Diana Berry', 'Alberto Suarez', 'Mark A. Langston', 'Stan Klimecko', 'Daniel Maysen', 'Kimberly Evan', 'Victoria Rong', 'Eliot Sash']","['deception', 'romance', 'power']",John McTiernan
3076,3076,10131,A Nightmare on Elm Street 4: The Dream Master,1988-08-19,49400000,94,False,13000000,"Dream demon Freddy Krueger is resurrected from his apparent demise, and rapidly tracks down and kills the remainder of the Elm Street kids. However, Kristen, who can draw others into her dreams, wills her special ability to her friend Alice. Alice soon realizes that Freddy is taking advantage of that unknown power to pull a new group of children into his foul domain.",23.012,/boStYG7jKdoIZTduiOOsUVknD13.jpg,"['Horror', 'Thriller']","high school, martial arts, dream, nightmare, sadism, psychopath, supernatural, diner, resurrection, ohio, sequel, murder, slasher, alcoholic, disfigurement, nightmare becomes reality, supernatural horror",1988,"['Robert Englund', 'Rodney Eastman', 'Danny Hassel', 'Andras Jones', 'Tuesday Knight', 'Ken Sagoes', 'Lisa Wilcox', 'Brooke Bundy', 'Nicholas Mele', 'Toy Newkirk', 'Brooke Theiss', 'John Beckman', 'Kisha Brackel', 'Wanda Bursey', 'Hope Marie Carlton', 'Kristen Clayton', 'Duane Davis', 'Richard Garrison', 'Jeff Levine', 'Joanna Lipari', 'Joie Magidow', 'Jacquelyn Masche', 'Robert Shaye', 'Jody Montana', ""Pat O'Neal"", 'Linnea Quigley', 'Cheryl Richardson', 'Mickey Yablans', 'Renny Harlin']","['dreams', 'fear', 'resilience']",Renny Harlin
3077,3077,11954,Lifeforce,1985-06-21,11603545,102,False,25000000,A space shuttle mission investigating Halley's Comet brings back a malevolent race of space vampires who transform most of London's population into zombies. The only survivor of the expedition and British authorities attempt to capture a mysterious but beautiful alien woman who appears responsible.,23.009,/953hMDf9G2ZRIEs97M6iFIYWtWF.jpg,"['Science Fiction', 'Horror', 'Thriller']","space marine, flying saucer, vampire, comet, alien, halley's comet",1985,"['Steve Railsback', 'Peter Firth', 'Frank Finlay', 'Mathilda May', 'Patrick Stewart', 'Michael Gothard', 'Nicholas Ball', 'Aubrey Morris', 'Nancy Paul', 'John Hallam', 'John Keegan', 'Bill Malin', 'Derek Benfield', 'Jerome Willis', 'John Woodnutt', 'John Forbes-Robertson', 'Peter Porteous', 'Katherine Schofield', 'Owen Holder', 'Jamie Roberts', 'Russell Sommers', 'Patrick Connor', 'Sidney Kean', 'Paul Cooper', 'Chris Sullivan', 'Burnell Tucker', 'Chris Jagger', 'John Larroquette']","['sci-fi', 'terror', 'body horror']",Tobe Hooper
3078,3078,9392,The Descent,2005-07-08,57130027,99,False,3500000,"After a tragic accident, six friends reunite for a caving expedition. Their adventure soon goes horribly wrong when a collapse traps them deep underground and they find themselves pursued by bloodthirsty creatures. As their friendships deteriorate, they find themselves in a desperate struggle to survive the creatures and each other.",23.007,/mxFPI4KYBk5ri9cPteIS8jiDFgj.jpg,"['Adventure', 'Horror']","panic, darkness, mutant, expedition, cave, claustrophobia, trauma, gore, female friendship, rope, climbing, appalachia, friends, female protagonist, best friend, creature, survival horror, grieving, speleology, brutal violence, camcorder, suspenseful",2005,"['Shauna Macdonald', 'Natalie Mendoza', 'Alex Reid', 'MyAnna Buring', 'Saskia Mulder', 'Nora-Jane Noone', 'Leslie Simpson', 'Oliver Milburn', 'Molly Kayll', 'Craig Conway', 'Tristan Matthiae', 'Mark Cronfield', 'Stephen Lamb', 'Catherine Dyson', 'Julie Ellis', 'Sophie Trott', 'Stuart Luis', 'Justin Hackney']","['terror', 'claustrophobia', 'survival']",Neil Marshall
3079,3079,15582,Teen Wolf Too,1987-11-20,7900000,95,False,3000000,"Although awkward college student Todd Howard is particularly adept at science, he's paying for school with an athletic scholarship that he will lose should he not fare well in an upcoming boxing tournament. Luckily for Todd, he has inherited the same family curse that once turned his cousin into a werewolf. As he transforms into the hairy, fanged, howling monster, he finds both his physical agility and his popularity skyrocketing -- but at what cost?",23.007,/unfbmoUTIsQzQF09RJZVN1GKr6b.jpg,"['Comedy', 'Fantasy', 'Family']","werewolf, teenager",1987,"['Jason Bateman', 'Kim Darby', 'John Astin', 'Paul Sand', 'Mark Holton', 'James Hampton', 'Estee Chandler', 'Robert Neary', 'Stuart Fratkin', 'Beth Miller', 'Rachel Sharp', 'David Burton', 'William H. Burton Jr.', 'Kathleen Freeman', 'Eric Matthew', 'D.A. Matzke', 'Marty Denkin', 'Patrick McCord', 'Kevin Kaye', 'Michael Zorek', 'Lawrence Parks', 'Ruth McArthur', 'Peter J. Fogel', 'Scott Craig Jones', 'Joey Meran', 'Kelly Reed', 'Sally Murphy', 'Janelle Brady', 'Michael Worth', 'Stephanie Epper']","['youth', 'awkwardness', 'humor']",Christopher Leitch
