,Unnamed: 0,id,title,release_date,revenue,runtime,adult,budget,overview,popularity,poster_path,genres,keywords,year,actors,emotions,director
5936,5936,122800,Freelancers,2012-08-10,0,96,False,11000000,"The son of a slain NYPD officer joins the force, where he falls in with his father's former partner and a team of rogue cops. His new boss, Sarcone, will see if he has what it takes to be rogue through many trials and tribulations of loyalty, trust and respect. When the truth about his father's death is revealed revenge takes him over and he won't stop until justice has been truly served.",15.334,/8jdYImZW75JlZN70A0uzls4uL16.jpg,"['Mystery', 'Drama', 'Action', 'Crime']","bartender, revenge, nypd, kingpin",2012,"['50 Cent', 'Forest Whitaker', 'Robert De Niro', ""Ryan O'Nan"", 'Matt Gerald', 'Beau Garrett', 'Malcolm Goodwin', 'Robert Wisdom', 'Dana Delany', 'Vinnie Jones', 'Anabelle Acosta', 'Pedro Armendáriz Jr.', 'Michael McGrady', 'Andre Royo', 'Roger Edwards', 'LaJessie Smith', 'Dominique DuVernay', 'Cassie Shea Watson', 'Raeden Greer', 'Jeff Chase', 'Danny A. Abeckaser', 'Douglas M. Griffin', 'Ambyr Childers', 'Hilary Cruz', 'Amin Joseph', 'Shantel Jackson', 'Phil Laak', 'Antonio Esfandiari', 'Jesse Pruett', 'Javier Carrasquillo', 'Craig Leydecker', 'John L. Armijo', 'Candice Michele Barley', 'Met Salih', 'Brian Oerly', 'Edgar Leza', 'Sam Medina', 'Kevin Beard']","['corruption', 'loyalty', 'violence']",Jessy Terrero
5937,5937,70584,Hellraiser: Revelations,2011-10-18,0,75,False,350000,"Two friends in Mexico discover the Lament Configuration and unleash Pinhead, but one decides to try to survive by swapping himself with someone else. Once they go missing, family members go in search of them, but find Pinhead instead.",15.329,/m1uUFFpoEagIsyR7kUhxM5zrjqC.jpg,['Horror'],"pinhead, demon, puzzle box, cenobite",2011,"['Steven Brand', 'Nick Eversman', 'Tracey Fairaway', 'Devon Sorvari', 'Stephan Smith Collins', 'Fred Tatasciore', 'Jay Gillespie', 'Sebastien Roberts', 'Sanny van Heteren', 'Daniel Buran', 'Jolene Andersen', 'Adel Marie Ruiz', 'Sue Ann Pien', 'Camelia Dee']","['pain', 'guilt', 'fear']",Víctor García
5938,5938,16258,The Butterfly Effect 3: Revelations,2009-01-09,0,90,False,0,"The story revolves around a man trying to uncover the mysterious death of his girlfriend and save an innocent man from the death chamber in the process, by using his unique power to time travel. However in attempting to do this, he also frees a spiteful serial-killer.",15.327,/7utgDyfae053YExAuUKcwkzUKMs.jpg,"['Science Fiction', 'Thriller', 'Drama', 'Crime']","fire, recession, diary, time travel, murder, bear trap, bathtub",2009,"['Mia Serafino', 'Rachel Miner', 'Chris Carmack', 'Melissa Jones', 'Lynch R. Travis', 'Sarah Habel', 'Chantel Giacalone', 'Hugh Maguire', 'Kevin Yon', 'Richard Wilkinson', 'Linda Boston', 'Ulysses Hernandez', 'Michael Paul Place', 'Catherine Towne', 'Michael Ellison', 'Dennis North', 'Peter Malota', 'Emily Sutton-Smith', 'Trevor Callaghan', 'Sonya A. Avakian', 'Alexis Sturr', 'Andrea Foster', 'Daniel Spink']","['regret', 'paradox', 'tension']",Seth Grossman
5939,5939,11861,How to Make an American Quilt,1995-10-06,41200020,116,False,10000000,"Soon-to-be-wed graduate student Finn Dodd develops cold feet when she suspects her fiancé is cheating on her. In order to clear her head, Finn visits her grandmother, Hy, and great aunt, Glady Joe Cleary, in Grasse, Calif. There, Finn learns that Hy and Glady Joe are members of a group of passionate quilters, and over the course of her visit she is regaled with tales of love and life by women who have collected rich experiences and much wisdom.",15.326,/vwYRaERccwXWCYrTzeWRZRarJOo.jpg,"['Drama', 'Romance']","marriage proposal, wedding vows, married couple, marriage, monogamy, advice, quilt, love, family holiday, extramarital affair, grandmother, woman director",1995,"['Winona Ryder', 'Anne Bancroft', 'Ellen Burstyn', 'Kate Nelligan', 'Jean Simmons', 'Maya Angelou', 'Alfre Woodard', 'Dermot Mulroney', 'Lois Smith', 'Kate Capshaw', 'Rip Torn', 'Johnathon Schaech', 'Samantha Mathis', 'Joanna Going', 'Esther Rolle', 'Jared Leto', 'Claire Danes', 'Alicia Goranson', 'Holland Taylor', 'Tim Guinee', ""Derrick O'Connor"", 'Loren Dean', 'Melinda Dillon', 'Richard Jenkins', 'Denis Arndt', 'Adam Baldwin', 'Michael McElroy', 'Ari Meyers', 'Jane Alden', 'Tamala Jones', ""Rae'Ven Larrymore Kelly"", 'Will Estes', 'Mykelti Williamson', 'Kaela Green', 'Kaelynn Craddick', 'Sara Craddick', 'Gail Strickland', 'Krysten Lee Wilson', 'Kellie Lynn Wilson', 'Brian McElroy', 'Paige Kettner', 'Ryanne Kettner', 'Annie Mae Hunter', 'Matt Zusser', 'David Williams', 'Harvey E. Lee Jr.', 'Debra Stricklin', 'María Celedonio', 'Charles Parks', 'Jonah Rooney']","['reflection', 'love', 'nostalgia']",Jocelyn Moorhouse
5940,5940,21733,Dragons Forever,1988-02-11,0,93,False,0,"A hot-shot lawyer is hired by a Hong Kong chemical plant to dispose of opposition to their polluting ways. But when he falls for a beautiful woman out to stop the plant, he is torn in a conflict of interest and asks his trusty friends Samo and Biao to help out at least until they discover the true purpose of the plant.",15.326,/1LC7DKzV3Q86hKkKqaK7w3YDULF.jpg,"['Action', 'Comedy', 'Romance']","factory, martial arts, kung fu, garbage, court case, fight, gangster, trial, beautiful woman, neighbor, lawyer, art, neurotic, gun runner",1988,"['Jackie Chan', 'Sammo Hung Kam-Bo', 'Yuen Biao', 'Deanie Yip Tak-Han', 'Pauline Yeung Bo-Ling', 'Yuen Wah', 'Billy Chow Bei-Lei', 'Steve Lee Ka-Ting', 'Phillip Ko Fai', 'Crystal Kwok', 'Shum Wai', 'Woo Fung', 'Stanley Fung Shui-Fan', 'Roy Chiao', 'James Tien Chun', 'Lo Lieh', 'Tai Bo', 'Lau Kar-Wing', 'Fung Hak-On', 'Paul Chung Fat', 'Wong Yu', 'Yuen Cheung-Yan', 'David Lam Wai', 'Chin Ka-Lok', 'Wan Fat', 'Chan Tat-Kwong', 'Dick Wei', 'Yuen Miu', 'Ka Lee', 'Peter Chan Lung', 'Shing Fui-On', 'Pauline Wong Yuk-Wan', 'Chiang Lung', 'Chan Ging', 'Danny Chow Yun-Kin', 'Benny Lai Keung-Kuen', 'Johnny Cheung Wa', 'Rocky Lai Keung-Ken', 'Benny Urquidez', 'Chow Gam-Kong', 'Pang Yun-Cheung', 'Cho Wing', 'King Lee King-Chu', 'Siu Tak-Foo', 'Lung Ying', 'Kwan Yung', 'Cheung Wing-Cheung', 'Chan Man-Ching', 'Sze Mei-Yee', 'Chen Chi-Hwa', 'Patrick Frzebar', 'Chan Fu-Keung', 'Chan Ging-Chi', 'Wu Ma', 'Lau Shung-Fung', 'Kenneth Smyth', 'Lui Siu-Ming', 'Sam Hang-San', 'Jim James', 'Ho Chi-Moon', 'Ernest Mauser', 'Lui Kim-Kwong', 'Chung Chi-Yung', 'Fei Pak', 'Frank Liu Zong-Ji', 'Poon Cheung', 'Fruit Chan', 'James Ha Chim-Si', 'Nicky Li Chung-Chi']","['action', 'loyalty', 'humor']",Roland Chan Ngok-Chung
5941,5941,2046,The Gift,2000-03-16,12008642,112,False,10000000,"Annie Wilson, young widow and mother of three, makes her living foretelling others' futures⁠—though her own has become cloudier than even she can see. Threatened by a client's violent husband and plagued by visions of a missing local woman, Annie finds herself pulled into a thicket of lies and deception in which her extraordinary gift may ultimately get her killed.",15.326,/nQdBE1P0r4ZrgGqy5EX8sL2kXG6.jpg,"['Horror', 'Drama', 'Thriller', 'Mystery']","small town, sheriff, dream, fortune teller, nightmare, court, widow, tarot cards, premonition, backwoods, pond, extrasensory perception, clairvoyant, abusive husband, southern gothic",2000,"['Cate Blanchett', 'Giovanni Ribisi', 'Keanu Reeves', 'Katie Holmes', 'Greg Kinnear', 'Hilary Swank', 'Michael Jeter', 'Kim Dickens', 'Gary Cole', 'Rosemary Harris', 'J.K. Simmons', 'Chelcie Ross', 'John Beasley', 'Lynnsee Provence', 'Hunter McGilvray', 'Nathan Lee Lewis', 'Benjamin Peacock', 'Alex Lee', 'Clay James', 'David Brannen', 'Russell Durham Comegys', 'Janell McLeod', 'Robby Preddy', 'Lucky Lawrence', 'Mo', 'Boots Kutz', 'Buck Edwards', 'D.J. Pawlak', 'Kipp Chambers', 'Dallas Johnson', 'Stuart Greer', 'Jeff Bragg', 'Danny Elfman', 'S.D. Stephens', 'Samuel E. Parlin Jr.', 'Ed Reddick', 'Rebecca Koon', 'Erik Cord', 'Yvetta Young', 'Sam Edens', 'Earl Maddox', 'Shawn McBride', 'Ray Wineteer']","['mystery', 'guilt', 'suspense']",Sam Raimi
5942,5942,7516,Smokin' Aces,2006-12-09,57103895,109,False,17000000,"When a Las Vegas performer-turned-snitch named Buddy Israel decides to turn state's evidence and testify against the mob, it seems that a whole lot of people would like to make sure he's no longer breathing.",15.32,/nrdnN8WqvyOt8Bnl3hgWcZD6ZyM.jpg,"['Action', 'Comedy', 'Crime', 'Thriller']","sniper, neo-nazism, police, hitman, gun, gangster, fbi, bodyguard, dark comedy, shootout, drugs, female corpse",2006,"['Ryan Reynolds', 'Andy García', 'Martin Henderson', 'Chris Pine', 'Ray Liotta', 'Alicia Keys', 'Common', 'Taraji P. Henson', 'Davenia McFadden', 'Jeremy Piven', 'Ben Affleck', 'Peter Berg', 'Matthew Fox', 'Jason Bateman', 'Nestor Carbonell', 'Kevin Durand', 'Tommy Flanagan', 'Joel Edgerton', 'Curtis Armstrong', 'Joseph Ruskin', 'Alex Rocco', 'Maury Sterling', 'Christopher Michael Holley', 'Mike Falkow', 'Joe Drago', 'Jeff Habberstad', 'Wayne Newton', 'George Fisher', 'Vladimir Kulich', 'David Proval', 'Lorna Scott', 'Brian Bloom', 'Patrick St. Esprit', 'R. Paul Wilson', 'Janet Edwards', 'Suzanne Stover', 'Scott Halberstadt', 'Matthew Fox', 'Zach Cumer', 'Max Murphy', 'Marianne Muellerleile', 'Clare Carey', 'Alice Dinnean']","['chaos', 'violence', 'betrayal']",John M. Morse
5943,5943,9876,Stop! Or My Mom Will Shoot,1992-02-21,70611210,87,False,0,"A tough police sergeant's mother comes to visit him, and promptly starts trying to fix up his life, much to his embarrassment. For his birthday she buys him a machine gun out of the back of a van, and begins to further interfere with his job and love life, eventually helping him with a case he's on.",15.32,/meHDNuHPqCTOjgU3COImhxVa5H0.jpg,"['Action', 'Comedy']","police, submachine gun, gunfight, los angeles, california, criminal, buddy cop, 1990s, street shootout",1992,"['Sylvester Stallone', 'Estelle Getty', 'JoBeth Williams', 'Roger Rees', 'Martin Ferrero', 'Gailard Sartain', 'John Wesley', 'Al Fann', 'Ella Joyce', 'J. Kenneth Campbell', 'Nicholas Sadler', 'Dennis Burkley', 'Ving Rhames', 'Jana Arnold', 'Christopher Collins', 'Mark Mikesell', 'Matthew Powers', 'Richard Schiff', 'Brigitta Stenberg', 'Vanessa Angel', 'Marjean Holden', 'Joey DePinto', 'Larry Campbell', 'Shari Shaw', 'Kimberley LaMarque', 'Amy Kirkpatrick', 'J. David Krassner', 'Patti Yasutake', 'Norm Compton', 'A. Michael Lerner', 'Jophery C. Brown', ""J.W. 'Corkey' Fornof"", 'Charles Renneisen', 'John D. Sarviss', 'Roydon Clark', 'Manny Perry', 'Justin De Rosa', 'Ernie Lively', 'Richard Suggett', 'Art T. Yago', 'Julia Montgomery', 'Shelley A. Hill', 'Pixie', 'Matt Johnston']","['absurdity', 'family', 'humor']",Roger Spottiswoode
5944,5944,4251,Veer-Zaara,2004-11-12,29385320,192,False,7000000,"Squadron Leader Veer Pratap Singh, a pilot in the Indian air force, rescues the stranded Zaara, a woman from Pakistan, following a bus accident, and their lives are forever bound.",15.32,/7rc8qXMjMcemhVFjKP2JWCS1Wpz.jpg,"['Drama', 'Romance']","prison, class society, love of one's life, pilot, musical, pakistan, india, kashmir conflict",2004,"['Shah Rukh Khan', 'Preity Zinta', 'Rani Mukerji', 'Amitabh Bachchan', 'Hema Malini', 'Divya Dutta', 'Anupam Kher', 'Kirron Kher', 'Boman Irani', 'Manoj Bajpayee', 'Zohra Sehgal', 'Akhilendra Mishra', 'Tom Alter', 'Yash Chopra', 'S.M. Zaheer', 'Gurdas Mann', 'Rushad Rana', 'Vinod Negi', 'Balwant Bansal', 'Anup Kanwal Singh', 'Vicky Ahuja', 'Sanjay Singh Bhadli', 'Chandni Jas Keerat', 'Kulbir Badesron', 'Shivaya Singh', 'Banwarhlal Jhol', 'Syed Firdaus']","['love', 'separation', 'hope']",Yash Chopra
5945,5945,13920,Radio,2003-10-24,53293628,109,False,35000000,"High school football coach, Harold Jones befriends Radio, a mentally-challenged man who becomes a student at T.L. Hanna High School in Anderson, South Carolina. Their friendship extends over several decades, where Radio transforms from a shy, tormented man into an inspiration to his community.",15.319,/uQ6ci4iFHhB6TWB2f4wftR7AEly.jpg,['Drama'],"friendship, sports, biography",2003,"['Cuba Gooding Jr.', 'Ed Harris', 'Alfre Woodard', 'S. Epatha Merkerson', 'Debra Winger', 'Chris Mulkey', 'Sarah Drew', 'Brent Sexton', 'Riley Smith', 'Patrick Breen', 'Bill Roberson', 'Michael Harding', 'Rebecca Koon', 'Hi Bedford-Roberson', 'Michael Kroeker', 'Mark Robert Ellis', 'Shelley Reid', 'Leonard Wheeler', 'Bert Beatson', 'Deborah McTeer', 'Tammy Arnold', 'Michael Flippo', 'Ringo Starr']","['inclusion', 'kindness', 'perseverance']",Michael Tollin
5946,5946,347186,Haikyuu!! Movie 2: Winners and Losers,2015-09-18,0,88,False,0,"Karasuno High enters the Inter-High Volleyball Tournament and immediately proves they're ""flightless crows"" no more. After their first match, Karasuno dukes it out against Date Tech High and their famous Iron Wall, which shut down every spike of Karasuno's ace, Asahi, during a previous match. Karasuno, however, breaks through the Iron Wall this time and proceeds to the Round of 16. The newly rejuvenated Karasuno fights Aoba Johsai High and seeks to have the same outcome as their first practice match.",15.318,/kilrCmrOOQqM4RFLnuOAlgUfRZC.jpg,"['Animation', 'Comedy']","sports, volleyball, based on manga, shounen, anime",2015,"['Ayumu Murase', 'Kaito Ishikawa', 'Koki Uchiyama', 'Soma Saito', 'Nobuhiko Okamoto', 'Toshiki Masuda', 'Yuu Hayashi', 'Miyu Irino', 'Yoshimasa Hosoya', 'Koutaro Nishiyama', 'Nobuyori Sagara', 'Daisuke Namikawa', 'Satoshi Hino', 'Kaori Nazuka', 'Toru Sakurai', 'Hiroyuki Yoshino', 'Makoto Furukawa', 'Atsushi Tamaru', 'Isamu Yusen', 'Arthur Lounsbery', 'Hiroki Matsukawa', 'Masatomo Nakazawa', 'Takashi Onozuka', 'Hiroshi Kamiya', 'Kazunari Tanaka', 'Mitsuaki Hoshino']","['teamwork', 'passion', 'growth']",Susumu Mitsunaka
5947,5947,10632,The Hunted,2003-03-11,34234008,94,False,55000000,"In the wilderness of British Columbia, two hunters are tracked and viciously murdered by Aaron Hallum. A former Special Operations instructor is approached and asked to apprehend Hallum—his former student—who has 'gone rogue' after suffering severe battle stress from his time in Kosovo.",15.316,/iIl3l7BPenoVpdRJAqIXeIgMQvV.jpg,"['Drama', 'Action', 'Thriller', 'Crime']","hunter, fbi, knife, balkan war, woods, slaughter, survivalist, maniac, special forces, killing spree, combat, ex soldier, dark past, manhunt",2003,"['Tommy Lee Jones', 'Benicio del Toro', 'Connie Nielsen', 'Leslie Stefanson', 'John Finn', 'Mark Pellegrino', 'Ron Canada', 'José Zúñiga', 'Jenna Boyd', 'Rex Linn', 'Lonny Chapman', 'Eddie Velez', ""Carrick O'Quinn"", 'Evis Xheneti', 'Neno Pervan', 'Zoran Radanovich', 'Caitlin Marie Clements', 'Ayanna Berkshire', 'Robert Blanche', 'Anjenique Hughes', 'Katie O’Grady', 'Peter Simpson', 'Tara Walker', 'Bobby Preston', 'Alexander MacKenzie', 'Johnny Cash', 'Hank Cartwright']","['survival', 'tension', 'remorse']",William Friedkin
5948,5948,11523,View from the Top,2003-03-21,19526014,87,False,30000000,"No one thought Donna would go very far. But when she sets her sights on becoming a first-class international flight attendant, Donna throws caution to the wind and takes off in pursuit of her dream. The ride is anything but smooth, however, and Donna's laugh-packed journey of a lifetime is rocked by more turbulence than she bargained for.",15.315,/mjKloEexvZcJBbkoX9XKx83B40z.jpg,"['Comedy', 'Romance', 'Drama']","airplane, stewardess, boss, first class, mentor protégé relationship, airport lounge, flight attendant, small town girl, airplane flight",2003,"['Gwyneth Paltrow', 'Christina Applegate', 'Mark Ruffalo', 'Candice Bergen', 'Joshua Malina', 'Mike Myers', 'Kelly Preston', 'Stacey Dash', 'Rob Lowe', 'Marc Blucas', 'Frederick Coffin', 'Jon Polito', 'Concetta Tomei', 'Robyn Peterson', 'Nadia Dajani', 'John Francis Daley', 'Priscilla Inga Taylor', 'Matt Roth', 'DonnaMarie Recco', 'Daniel Raymont', 'Connie Sawyer', 'David Hayward', 'Chelsey Cole', 'Troy Evans', 'Merrilee McCommas', 'George Kennedy', 'Candice T. Cain', 'Valentin Siroon', 'Jessica Capshaw', 'Mary McNeal', 'Stephanie Miller', 'Susan Mosher', 'Victoria Garcia-Kelleher', 'Stephen Tobolowsky', 'Anastacia Spiegel', 'Amanda Wycoff', 'Dawn-Marie Whelan', 'Jeff Yagher', 'Greg Bronson', 'Roark Critchlow', 'Chad Everett', 'Wayne Federman', 'Clarinda Ross', 'Jackie Zane']","['ambition', 'romance', 'humor']",Bruno Barreto
5949,5949,13532,Fanboys,2009-02-06,948753,90,False,0,"In 1999, Star Wars fanatics take a cross-country trip to George Lucas' Skywalker Ranch so their dying friend can see a screening of The Phantom Menace before its release.",15.312,/fitksX4J3xfBjT38YgDUXOlBkHk.jpg,"['Adventure', 'Comedy']","fan, road trip, rivalry, fan culture, urination, buddy, cross country, space opera, 1990s, fandom",2009,"['Sam Huntington', 'Jay Baruchel', 'Dan Fogler', 'Kristen Bell', 'Christopher Rodriguez Marquette', 'David Denman', 'Christopher McDonald', 'Isaac Kappy', 'Seth Rogen', 'Charlie B. Brown', 'Tarek Bishara', 'Stephen Pina', 'Danny Trejo', 'Allie Grant', 'Ethan Suplee', 'Jaime King', 'Pell James', 'William Shatner', 'Carrie Fisher', 'Billy Dee Williams', 'Kevin Smith', 'Jason Mewes', 'Zak Knutson', 'Joe Lo Truglio', 'Chuck Borden', 'Ray Park', 'Will Forte', 'Craig Robinson', 'Clark Sanchez', 'Lou Taylor Pucci', 'Noah Segan', 'Stanley Shunkamolah', 'Hugh Elliot', 'Danny McBride', 'Peter Mayhew', 'Armin Shimerman']","['fandom', 'friendship', 'adventure']",Kyle Newman
5950,5950,14310,Infernal Affairs III,2003-12-12,0,118,False,250000,"While Yeung Kam Wing is trying to remove all connections between the mob and him, his actions are being carefully observed by Lau Kin Ming, who bears a personal grudge against him.",15.307,/6Uo3UK5qgusrOtamSWBQNavQ99Q.jpg,"['Crime', 'Drama', 'Action']","sequel, flashback",2003,"['Andy Lau', 'Tony Leung', 'Leon Lai', 'Chen Daoming', 'Anthony Wong', 'Eric Tsang', 'Kelly Chen', 'Sammi Cheng', 'Carina Lau', 'Edison Chen', 'Shawn Yue', 'Eddie Li Yu-Yeung', 'Chapman To Man-Chat', 'Waise Lee Chi-Hung', 'Gordon Lam Ka-Tung', 'Berg Ng Ting-Yip', 'Wan Chi-Keung', 'Vincent Wan Yeung-Ming', 'Au Hin-Wai', 'Courtney Wu', 'Mason Chiu', 'Benjamin Yuen Wai-Ho', 'Lam Chi-Tai', 'Chan Shek-Kong', 'Chan Kwok-Wing']","['regret', 'deception', 'tension']",Andrew Lau
5951,5951,11197,Evil,2003-09-16,528245,113,False,0,"Stockholm, the fifties. Though academically bright, violent pupil Erik Ponti is expelled from his state school with the headmaster’s words “there’s only one word for people like you – evil… what you need is a good thrashing, and more”. In fact already Erik frequently receives a ‘good’ thrashing at the hands of his sadistic stepfather – so he is packed off by his mother to boardingschool",15.307,/gruXA29fquPuRHbam75kXQMaGju.jpg,['Drama'],"based on novel or book, private school, spanking, discipline, oppression, corporal punishment, boys' boarding school",2003,"['Andreas Wilson', 'Henrik Lundström', 'Gustaf Skarsgård', 'Linda Zilliacus', 'Jesper Salén', 'Mats Bergman', 'Johan Rabaeus', 'Marie Richardson', 'Lennart Hjulström', 'Björn Granath', 'Filip Berg', 'Ulf Friberg', 'Kjell Bergqvist', 'Fredrik af Trampe', 'Peter Eggers', 'Henrik Linnros', 'Sannamari Patjas', 'Magnus Roosmann', 'Danny Saucedo']","['bullying', 'resistance', 'rage']",Mikael Håfström
5952,5952,50126,Fallen,2006-07-23,0,84,False,0,"For high schooler Aaron Corbett, turning 18 means becoming not just a man but a nephilim, too -- half human, half angel, with supernatural abilities.",15.304,/bAyvqgi3RjQIPnt0CDInZ27opNK.jpg,"['TV Movie', 'Drama', 'Fantasy']","based on novel or book, angel, supernatural, fallen angel, orphan, nephilim, adoptive parent",2006,"['Paul Wesley', 'Rick Worthy', 'Lisa Lackey', 'Fernanda Andrade', 'Chelah Horsdal', 'Russell Porter', 'Alex Ferris', 'Tom Skerritt', 'Darren Scott', 'Byron Mann', 'Malcolm Stewart', 'Jesse Hutch', 'Stuart Cowan', 'Carmen Lavigne', 'Jennifer Marie Chung', 'Sharon Canovas', 'Byron Lawson', 'Jim Shield', 'Peter Williams', 'Tony Devon', 'Will Yun Lee', 'Eileen Pedde', 'David Orth', 'Kwesi Ameyaw', 'Phillip Mitchell', 'Jennifer Kitchen', 'Michal Suchánek', 'Kevin Cameron', 'Rhys Williams', 'Graham Wardle', 'Diego Klattenhoff', 'Matt Ward', 'Paul Wu']","['supernatural', 'mystery']",Mikael Salomon
5953,5953,10775,Infernal Affairs,2002-12-12,8708932,101,False,125000,"Chan Wing Yan, a young police officer, has been sent undercover as a mole in the local mafia. Lau Kin Ming, a young mafia member, infiltrates the police force. Years later, their older counterparts, Chen Wing Yan and Inspector Lau Kin Ming, respectively, race against time to expose the mole within their midst.",15.304,/gix9thDBXfjJ8M7rYbihqbQGBcP.jpg,"['Drama', 'Action', 'Thriller', 'Crime', 'Mystery']","undercover agent, undercover, hong kong",2002,"['Tony Leung', 'Andy Lau', 'Eric Tsang', 'Anthony Wong', 'Kelly Chen', 'Sammi Cheng', 'Elva Hsiao', 'Chapman To Man-Chat', 'Gordon Lam Ka-Tung', 'Shawn Yue', 'Edison Chen', 'Berg Ng Ting-Yip', 'Wan Chi-Keung', 'Dion Lam', 'Tony Ho', 'Courtney Wu', 'Hui Kam Fung', 'Chaucharew Wichai', 'Au Hin-Wai', 'Lee Tin-Cheung', 'Victy Wong Yin-Keung', 'Yiu Man-Kei', 'Benjamin Yuen Wai-Ho', 'Wong Chi-Wang', 'Addy Sung Gam-Loi', 'Cheng Wing-Yee', 'Mak Wai-Gok', 'Kui Mei-Yee', 'Tam Kon-Chung', 'Che Jan-Bong', 'Chin Yiu-Wing', 'Ho Chung-Wai', 'Simon Yu Sai-Tang', 'So Wai-Nam', 'Lai Chi-Wai', 'Leung Ho-Kai', 'Terry Lee Ji-Ming', 'Alex Lee Yip-Kin', 'Chow Pok-Foo', 'Hui On-Tat', 'Ho Wing-Ning', 'Simon Cheung Yuk-San', 'Leung Chiu-Yee', 'Chang Kin-Yung', 'Lee Wah-Chu', 'Pauline Yeung Yung-Lin']","['loyalty', 'identity', 'betrayal']",Alan Mak Siu-Fai
5954,5954,415214,Operation Mekong,2016-09-30,173000000,124,False,30200000,Chinese narco-cops take their mission to the Golden Triangle following the Mekong River massacre of innocent fishermen by the region's drug lord.,15.301,/wghFabaZgRorsMQWuPtKUlzq4W1.jpg,"['Action', 'Adventure', 'Crime', 'War']","china, boat, river, illegal drugs, incident, mekong",2016,"['Zhang Hanyu', 'Eddie Peng Yu-Yan', 'Joyce Feng', 'Wu Xudong', 'Zhan Liguo', 'Liu Xianda', 'Sun Chun', 'Zhao Jian', 'Shi Zhanjie', 'Jonathan Wu', 'Chen Baoguo', 'Vithaya Pansringarm', 'Ken Lo Wai-Kwong', 'Mandy Wei', 'Li Jiaxuan', 'Hao Wenting', 'Pawarith Monkolpisit', 'Carl Ng Ka-Lung', 'Wang Xiaolong', 'Bhubhing Bhangsa-Ard', 'Ren Rui', 'Keerati Sivakua']","['patriotism', 'violence', 'justice']",Dante Lam Chiu-Yin
5955,5955,10139,Milk,2008-11-05,54589558,128,False,20000000,"The true story of Harvey Milk, the first openly gay man ever elected to public office. In San Francisco in the late 1970s, Harvey Milk becomes an activist for gay rights and inspires others to join him in his fight for equal rights that should be available to all Americans.",15.301,/ot4ImF4b7QbS6XsTdMH3pWxNmX2.jpg,"['History', 'Drama']","california, election campaign, politics, homophobia, san francisco, california, 1970s, mayor, politician, biography, based on true story, murder, male homosexuality, morality, election, lgbt, candlelight vigil, lgbt activist, mayoral campaign, gay history, gay theme, gay rights",2008,"['Sean Penn', 'Emile Hirsch', 'Josh Brolin', 'Diego Luna', 'James Franco', 'Alison Pill', 'Victor Garber', ""Denis O'Hare"", 'Joseph Cross', 'Stephen Spinella', 'Boyd Holbrook', 'Lucas Grabeel', 'Jeff Koons', 'Brent Corrigan', 'Dave Franco', 'Elias McConnell', 'Ashlee Temple', 'Brandon Boyce', 'Kelvin Yu', 'Cleve Jones', 'Dustin Lance Black', 'Joshua Grannell', 'Blake Cooper Griffin', 'Tim Halpin', 'Richard Gross', 'Drew Kuhse', 'Catherine Cook', 'Joe Meyers', 'Ryan Hellquist', 'Anita Bryant', 'Walter Cronkite', 'Ronald Reagan', 'Harvey Milk', 'Dan White', 'Howard Rosenman', 'Lynn McRee', 'Jerry Brown']","['hope', 'activism', 'resilience']",Gus Van Sant
5956,5956,5,Four Rooms,1995-12-09,4257354,98,False,4000000,It's Ted the Bellhop's first night on the job...and the hotel's very unusual guests are about to place him in some outrageous predicaments. It seems that this evening's room service is serving up one unbelievable happening after another.,15.295,/75aHn1NOYXh4M7L5shoeQ6NGykP.jpg,['Comedy'],"hotel, new year's eve, witch, bet, sperm, hotel room, anthology, los angeles, california, hoodlum, multiple storylines, woman director",1995,"['Tim Roth', 'Jennifer Beals', 'Antonio Banderas', 'Valeria Golino', 'David Proval', 'Sammi Davis', 'Amanda de Cadenet', 'Madonna', 'Ione Skye', 'Lili Taylor', 'Alicia Witt', 'Tamlyn Tomita', 'Lana McKissack', 'Danny Verduzco', 'Patricia Vonne', 'Salma Hayek Pinault', 'Quentin Tarantino', 'Paul Calderon', 'Marisa Tomei', 'Kathy Griffin', 'Lawrence Bender', 'Kimberly Blair', 'Quinn Hellerman', 'Marc Lawrence', 'Paul Skemp', 'Unruly Julie McClean', 'Laura Rush', 'Bruce Willis']","['absurdity', 'chaos', 'dark humor']",Allison Anders
5957,5957,33278,Deadly Friend,1986-10-10,8988731,91,False,0,"After his friend is killed by her abusive father, the new kid in town attempts to save her by implanting a robotic microchip into her brain.",15.293,/h2lmu6tNqL1LxWFJ73N9WZW7Uba.jpg,"['Horror', 'Science Fiction']","child abuse, artificial intelligence (a.i.), based on novel or book, resurrection, revenge, robot, exploding head, alcoholic, brawl, circuit board, paranoiac",1986,"['Matthew Labyorteaux', 'Kristy Swanson', 'Michael Sharrett', 'Anne Twomey', 'Anne Ramsey', 'Richard Marcus', 'Russ Marin', 'Lee Paul', 'Andrew Roperto', 'Charles Fleischer', 'Robin Nuyen', 'Frank Cavestani', 'Merritt Olsen', 'William H. Faeth', 'Joel Hile', 'Tom Spratley', 'Jim Ishida']","['grief', 'fear', 'obsession']",Wes Craven
