,Unnamed: 0,id,title,release_date,revenue,runtime,adult,budget,overview,popularity,poster_path,genres,keywords,year,actors,emotions,director
5891,5891,624479,Superman II: The Richard Donner Cut,2006-11-02,0,116,False,54000000,"Superman agrees to sacrifice his powers to start a relationship with Lois Lane, unaware that three Kryptonian criminals he inadvertently released are conquering Earth.",15.414,/3YBiNR15YyEnqN6zlc6GUCEa1Ia.jpg,"['Science Fiction', 'Action', 'Adventure']","saving the world, superhero, based on comic, sequel, niagara falls, criminal, super power, phantom zone, superhuman strength",2006,"['Christopher Reeve', 'Margot Kidder', 'Gene Hackman', 'Marlon Brando', 'Ned Beatty', 'Jackie Cooper', 'Sarah Douglas', ""Jack O'Halloran"", 'Valerie Perrine', 'Clifton James', 'E.G. Marshall', 'Marc McClure', 'Terence Stamp', 'John Ratzenberger', 'Gordon Rollings', 'Angus MacInnes', 'Richard LeParmentier', 'Don Fellows', 'Michael Shannon', 'Tony Sibbald', 'Tommy Duggan', 'Pamela Mandell', 'Pepper Martin', 'Shane Rimmer', 'Richard Donner', 'Cleon Spencer', 'Carl Parris', 'Matt Kaminsky', 'Austin Majors', 'Aaron Smolinski', 'Maxwell Craig', 'Jim Dowdall']","['sacrifice', 'heroism', 'love']",Richard Donner
5892,5892,21521,Project A: Part II,1987-08-19,0,106,False,0,"Dragon is now transferred to be the police head of Sai Wan district, and has to contend with a gangster kingpin, anti-Manchu revolutionaries, some runaway pirates, Manchu Loyalists and a corrupt police superintendent.",15.413,/oY6wOuPmeeDoKjPdPlMwwmDCYmA.jpg,"['Action', 'Comedy']","kung fu, corruption, police, pirate, framed, historical",1987,"['Jackie Chan', 'Maggie Cheung', 'Rosamund Kwan Chi-Lam', 'Carina Lau', 'David Lam Wai', 'Bill Tung Biu', 'Kwan Hoi-San', 'Isabella Wong', 'Regina Kent', 'Tai Bo', 'Chris Lee Kin-Sang', 'Mars', 'Ben Lam Kwok-Bun', 'Ken Lo Wai-Kwong', 'Lau Siu-Ming', 'Chu Tit-Wo', 'John Cheung Ng-Long', 'Lee Hoi-Sang', 'Michael Chan Wai-Man', 'Johnny Wang Lung-Wei', 'Mai Kei', 'Hon Yee-Sang', 'Chan Dik-Hak', 'Fan Mei-Sheng', 'Alan Chan Kwok-Kuen', 'Benny Lai Keung-Kuen', 'Frankie Poon Bin-Chung', 'Rocky Lai Keung-Ken', 'Johnny Cheung Wa', 'Ray Lui', 'Wan Fat', 'Wong San', 'Lo Gwok-Wai', 'Lin Wen-Wei', 'Kenny Ho Kar-King', 'Lung Tin-Sang', 'Anthony Chan Yau', 'Johnny Ngan Kwok-Leung', 'Ricky Hui Koon-Ying', 'Kenny Bee', 'Go Shut-Fung', 'Michael Lai Siu-Tin', 'Lui Fong', 'Billy Ching Sau-Yat', 'Clarence Ford', 'Woo Fung', 'Peter Chan', 'Wellson Chin Sing-Wai', 'Cheng Kwun-Min', 'Božidar Smiljanić', 'David Hodgins', 'Joe Rednar', 'Peter Mak', 'Lam Kwok-Hung', 'Yuen Ling-To', 'Baau Wai-Leung', 'Christopher Chan Sai-Tang', 'Danny Chow Yun-Kin', 'Nicky Li Chung-Chi', 'Tony Wong Yuk-Long', 'Roberta Chow Chung-Hang', 'Lau Kwok-Shing', 'Lai Sing-Kwong', 'Leung Hak-Shun', 'Patrick Frzebar', 'Chan Tat-Kwong', 'Hon Chun', 'Mak Shu-San']","['adventure', 'bravery', 'humor']",Chow Wing-Tuen
5893,5893,360404,"Monster High: Boo York, Boo York",2015-10-19,0,72,False,0,"It's fright lights, big city when the Monster High ghouls head to Boo York! Cleo de Nile is invited to attend a gancy gala celebrating the return of the magical comet and, of course, she brings along her beast friends. But their trip isn't all fun and frightseeing because Nefera, Cleo's sister, uses the comet's power for her own spooktacularly sneaky plans. Can the monsters unwrap the mystery of the comet in time to stop Nefera? Find out in Booy York, Boo York, the first-ever Monster High musical, featuring eight original songs.",15.413,/jdYMuynxD7T6wovmE5mHzy6u91J.jpg,"['Animation', 'Family', 'Music']",high school,2015,"['Salli Saffioti', 'Missi Hale', 'TJ Smith', 'Evan Smith', 'Wendee Lee', 'Kate Higgins', 'Debi Derryberry', 'Laura Bailey', 'Audu Paden', 'Erin Fitzgerald', 'Cindy Robinson', 'Lauren Weisman', 'Cam Clarke', 'Jonquil Goode', 'Rachel Staman']","['fun', 'friendship', 'self-expression']",William Lau
5894,5894,332,Inspector Gadget,1999-07-23,134400000,78,False,75000000,"John Brown is a bumbling but well-intentioned security guard who is badly injured in an explosion planned by an evil mastermind. He is taken to a laboratory, where Brenda, a leading robotics surgeon, replaces his damaged limbs with state-of-the-art gadgets and tools. Named ""Inspector Gadget"" by the press, John -- along with his niece, Penny, and her trusty dog, Brain -- uses his new powers to discover who was behind the explosion.",15.413,/eKpK8FaQDpkgp3HHm3YrIDqUjWh.jpg,"['Action', 'Adventure', 'Comedy', 'Family']","superhero, gadget, nerd, villain, slapstick comedy, based on cartoon, scientist, super villain",1999,"['Matthew Broderick', 'Rupert Everett', 'Joely Fisher', 'Michelle Trachtenberg', 'Andy Dick', 'Cheri Oteri', 'Mike Hagerty', 'Dabney Coleman', 'D.L. Hughley', 'René Auberjonois', 'Frances Bay', 'Mr. T', 'Richard Kiel', 'Richard Lee-Sung', 'Bobby Bell', 'Hank Barrera', 'Keith Morrison', 'John Kim', 'Jesse Yoshimura', 'Aaron Meyerson', 'Cliff Emmich', 'Richard Penn', 'J.P. Manoux', 'Brian George', 'Alexander Witt', 'E.J. Callahan', 'Chad Parker', 'Frank Masi', 'Mary Chris Wall', 'Linda Cevallos', 'Loralyn Peterson', 'Andy Heyward', 'Don Adams', 'Danny Nero']","['clumsiness', 'heroism', 'humor']",David Kellogg
5895,5895,9042,The Cave,2005-08-26,33296457,97,False,30000000,"After a group of biologists discovers a huge network of unexplored caves in Romania and, believing it to be an undisturbed eco-system that has produced a new species, they hire the best American team of underwater cave explorers in the world. While exploring deeper into the underwater caves, a rockslide blocks their exit, and they soon discover a larger carnivorous creature has added them to its food chain.",15.412,/gMfJo22XulGLA8h8yAjiLhdQusv.jpg,"['Action', 'Adventure', 'Horror', 'Thriller']","cave, fall, creature, diver, swimwear, caving, romania",2005,"['Cole Hauser', 'Lena Headey', 'Morris Chestnut', 'Eddie Cibrian', 'Piper Perabo', 'Daniel Dae Kim', 'Kieran Darcy-Smith', 'Rick Ravanello', 'Marcel Iureș', 'Vlad Rădescu', 'Simon Kunz', 'David Kennedy', 'Alin Panc', 'Zoltan Butuc', 'Brian Steele']","['terror', 'mystery', 'survival']",Bruce Hunt
5896,5896,36086,Boa vs. Python,2004-11-09,0,92,False,1200000,"After an overly ambitious businessman transports an 80-foot python to the United States, the beast escapes and starts to leave behind a trail of human victims. An FBI agent and a snake specialist come up with a plot to combat the creature by pitting it against a bioengineered, 70-foot boa constrictor. It's two great snakes that snake great together!",15.41,/6tckykOvjyXvemGMXTZZ4utWM0C.jpg,"['Horror', 'Science Fiction']","miami, florida, snake, animal attack, giant snake, creature, hunting, giant animal, python, animal horror, boa constrictor",2004,"['David Hewlett', 'Jaime Bergman', 'Kirk B.R. Woller', 'Adamo Palladino', 'Angel Boris Reed', 'Mariana Stansheva', 'Griff Furst', 'Ivo Naidenov', 'George R. Sheffey', 'Atanas Srebrev', 'Harry Anichkin', 'Jeff Rank', 'Assen Blatechki', 'Velizar Binev', 'Jonas Talkington', 'Nikolai Sotirov', 'Ryan Spike Dauner', 'Dessi Morales', 'John Hansson', 'Uti Bachvarov', 'Edward McDermott', 'D.J. Johnson', 'John Klimas', 'Andres Rojas', 'Michelle Llorens', 'Shero Rauf']","['absurdity', 'danger', 'creature-feature']",David Flores
5897,5897,13225,FernGully: The Last Rainforest,1992-04-10,32710894,76,False,24000000,"When a sprite named Crysta shrinks a human boy, Zak, down to her size, he vows to help the magical fairy folk stop a greedy logging company from destroying their home: the pristine rainforest known as FernGully. Zak and his new friends fight to defend FernGully from lumberjacks — and the vengeful spirit they accidentally unleash after chopping down a magic tree.",15.408,/jAD6Ofuz4PiYFV3fd3oBP6aOTyM.jpg,"['Family', 'Fantasy', 'Animation', 'Adventure']","pollution, fairy, musical, bat, environment, rainforest, logger, poison gas, independent film",1992,"['Samantha Mathis', 'Jonathan Ward', 'Christian Slater', 'Tim Curry', 'Robin Williams', 'Tone Loc', 'Grace Zabriskie', 'Geoffrey Blake', 'Robert Pastorelli', 'Cheech Marin', 'Tommy Chong', 'Townsend Coleman', 'Brian Cummings', 'Kathleen Freeman', 'Naomi Lewis', 'Danny Mann', 'Neil Ross', 'Pamela Adlon', 'Anderson Wong', 'Janet Gilmore', 'Harry Shearer', 'Rodger Bumpass']","['wonder', 'nature', 'hope']",Bill Kroyer
5898,5898,132137,Werewolf: The Beast Among Us,2012-10-09,0,93,False,5000000,"Set in a 19th century village, a young man studying under a local doctor joins a team of hunters on the trail of a wolf-like creature.",15.407,/sPT0hkNMXwDDAbQhFV2mWSRrbpg.jpg,"['Drama', 'Horror', 'Thriller']",,2012,"['Ed Quinn', 'Guy Wilson', 'Stephen Rea', 'Rachel DiPillo', 'Adam Croasdell', 'Ana Ularu', 'Steven Bauer', 'Nia Peeples', 'Zoltan Butuc', 'Razvan Gheorghiu', 'Iulia Cârstea']","['fear', 'hunt', 'suspense']",Louis Morneau
5899,5899,20235,Belle's Magical World,1998-02-16,0,92,False,0,"Belle, the Beast, Lumiere, Cogsworth and the rest of those zany castle residents use their imaginations to embark on three magical, storybook adventures. This direct-to-video anthology serves as a ""sequel"" to Disney's animated hit film. In ""The Perfect World,"" Belle and the Beast learn about forgiveness. In ""Fifi's Folly,"" Lumiere's girlfriend is jealous of his bond with Belle. And in ""Broken Wing,"" the Beast learns to be kind to an injured bird.",15.404,/lq5LnHRxjGw0HlQ6inMdmDdzEE.jpg,"['Animation', 'Family']","princess, friendship",1998,"['Robby Benson', ""Paige O'Hara"", 'David Ogden Stiers', 'Jerry Orbach', 'Anne Rogers', 'Gregory Grudt', 'Kimmy Robertson', 'Frank Welker', 'Jeff Bennett', 'Jim Cummings', 'Rob Paulsen', 'April Winchell', 'Jo Anne Worley']","['friendship', 'forgiveness', 'magic']",
5900,5900,17097,After Sex,2007-09-26,0,78,False,825000,"Sex is a background to examine intimacy and vulnerability. Looks at the complexity of modern day relationships told through eight separate couples. Through dialogue and compromising situations, the film takes us from the beginning of a relationship to the aftermath of one, and examines every stage in between seeing humor within the drama, heartache and confusion of it all.",15.402,/4n41P5CKHFFkQ3s8VJieNmqUkn7.jpg,"['Comedy', 'Romance', 'Drama']","coming out, sexuality, lesbian relationship, relationship, gay theme",2007,"['Marc Blucas', 'Jose Pablo Cantillo', 'Emmanuelle Chriqui', 'James DeBello', 'Noel Fisher', 'Dave Franco', 'Mila Kunis', 'Taryn Manning', 'Natalie Elizabeth Marston', ""Jeanette O'Connor"", ""Keir O'Donnell"", 'Tanc Sade', 'Zoe Saldaña', 'Jane Seymour', 'Timm Sharp', 'Charity Shea', 'John Witherspoon']","['intimacy', 'vulnerability', 'connection']",Eric Amadio
5901,5901,15487,The Greatest Game Ever Played,2005-09-30,15431177,120,False,25000000,"A biopic of 20-year-old Francis Ouimet who defeated his golfing idol and 1900 US Open Champion, Harry Vardon.",15.401,/kh4vd6wKa6j9xVFzxhQrsT0p2YN.jpg,['Drama'],"friendship, sports, golf, 1900s, idol, biographical, golfers, biopic",2005,"['Shia LaBeouf', 'Stephen Dillane', 'Josh Flitter', 'Peter Firth', 'Elias Koteas', 'Peyton List', 'Scott Faulconbridge', 'James Paxton', 'Tom Rack', 'Armand Laroche', 'Peter Hurley', 'Gregory Terlecki', 'Jonathan Higgins', 'Matthew Knight', 'Luke Askew', 'Amanda Tilson', 'Jamie Merling', 'Eugenio Esposito', 'Marnie McPhail', 'Robin Wilcock', 'Michael Sinelnikoff', 'Justin Ashforth', 'Arthur Holden', 'Len Cariou', 'Nicolas Wright', 'Max Kasch', 'Danette MacKay', 'George Asprey', 'Stephen Marcus', 'Joe Jackson', 'Luke Kirby', 'Tim Peper', ""Mike 'Nug' Nahrgang"", 'Dawn Upshaw', 'James Bradford', 'Marc James Beauchamp', 'Michael Weaver', 'Pierre Boudreau', 'Dennis St John', 'Terry Reid', 'Stephen Spreekmeester', 'Philip Pretten', 'Patrick Whitebean', 'Walter Massey', 'Melissa Carter', 'Melanie Beaulne', 'Jeremy Thibodeau', 'Alexina Cowan', 'Frank Fontaine', 'Marcel Jeannin', 'Charles S. Doucet', 'Brian Wrench', 'Nicole Braber', 'Kyle MacDougall', 'Jesse Rath', 'Domenico Salvaggio', 'Howard Ryshpan', 'Jamie Scavone', 'Paul Cagelet', 'Steven Wallace Lowe', 'Dominique Desrochers', 'Francesco Giannini', 'Johnny Griffin', 'David Rigby']","['determination', 'inspiration', 'underdog']",
5902,5902,9801,Bridget Jones: The Edge of Reason,2004-11-10,262500000,108,False,40000000,"Bridget Jones is becoming uncomfortable in her relationship with Mark Darcy. Apart from discovering that he's a conservative voter, she has to deal with a new boss, a strange contractor and the worst vacation of her life.",15.401,/42v82AwTnhaL1JkNcQK8PRAh46P.jpg,"['Comedy', 'Romance']","london, england, lovesickness, thailand, clumsy fellow, to drop brick, persuasion, capture, woman director",2004,"['Renée Zellweger', 'Colin Firth', 'Hugh Grant', 'Jacinda Barrett', 'Jim Broadbent', 'Gemma Jones', 'Sally Phillips', 'Celia Imrie', 'James Faulkner', 'Shirley Henderson', 'James Callis', 'Neil Pearson', 'Jessica Hynes', 'Donald Douglas', 'Shirley Dixon', 'Dominic McHale', 'Rosalind Halstead', 'Luis Soto', 'Tom Brooke', 'Alba Fleming Furlan', 'Lucy Robinson', 'David Verrey', 'Mark Tandy', ""Stephanie O'Rourke"", 'Jeremy Paxman', 'Flaminia Cinque', 'Trevor Fox', 'Alex Jennings', 'Catherine Russell', 'Ian McNeice', 'Philip Gardner', 'Wolf Kahler', 'Lilo Baur', 'Hannes Flaschberger', 'Sabina Michael', 'Paul Humpoletz', 'Paul Nicholls', 'David Auker', 'Patrick Baladi', 'Rong Kaomulkadee', 'Hu Tingting', 'Michelle Wen Lee', 'Hon Ping Tang', 'Suthas Bhoopongsa', 'Jason Watkins', 'Vee Vimolmal', 'Melissa Ashworth', 'Pui Fan Lee', 'Oliver Chris', 'Sam Hazeldine', 'Amanda Haberland', 'Neil Dudgeon', 'Peter Gordon', 'Sam Beazley', 'Simón Andreu', 'Arturo Venegas', 'Richard Braine', 'Nikita Ramsey', 'Jade Ramsey']","['awkwardness', 'romance', 'humor']",Beeban Kidron
5903,5903,69798,The Inbetweeners Movie,2011-08-19,88823111,97,False,4478250,"High school graduation just wouldn’t be complete without an un-chaperoned, uninhibited and unforgettable final holiday. At least that’s what Will, Jay, Simon and Neil think when they book a two-week stay on an exotic Greek island. As their dreams of sun-drenched days and booze-filled nights are left hopelessly unfulfilled, the lads fight their way into the party scene with hilariously humiliating results in this smash hit UK raunchy comedy.",15.4,/nePYsVp0qU8EbSXeUdr3xEkHlzN.jpg,['Comedy'],"holiday, british youth, briton abroad",2011,"['Simon Bird', 'James Buckley', 'Blake Harrison', 'Joe Thomas', 'Emily Head', 'Lydia Rose Bewley', 'Laura Haddock', 'Tamla Kari', 'Jessica Knappett', 'Theo Barklem-Biggs', 'Theo James', 'Anthony Stewart Head', 'Victoria Willing', 'Greg Davies', 'Henry Lloyd-Hughes', 'Belinda Stewart-Wilson', 'Robin Weaver', 'Martin Trenaman', 'Alex Macqueen', 'David Schaal', 'Sophie Colquhoun', 'Carolin Stoltz', 'Etalia Turnbull', ""Lauren O'Rourke"", 'Dominic Frisby', 'Lily Lovett', 'Cush Jumbo', 'Bobby Hirston', 'Tracey Temperton', 'Jimmy Roussounis', 'Matthew Wilson', 'Eloise Joseph', 'Andrew Spiers', 'Catherine Breeze', 'Christopher Miltiadou', 'Malcolm Scates', 'David Mumeni', 'Storme Toolis', 'Fernando Lopez', 'David Avery', 'Katarina Gellin', 'Shane Heron', 'Christie Aaria Emby', 'Emma Louise Cargill', 'Donna Combe', 'James Lee Hunt', 'Tyrone Jeffers', 'Aimee Kelly', 'TJ Nelson', 'Miltos Yerolemou']","['embarrassment', 'humor', 'friendship']",Ben Palmer
5904,5904,14144,Daddy Day Camp,2007-08-08,18197398,89,False,6000000,"Seeking to offer his son the satisfying summer camp experience that eluded him as a child, the operator of a neighborhood daycare center opens his own camp, only to face financial hardship and stiff competition from a rival camp.",15.4,/fhuhSVb3j8SShe6FhnVUAfSRg6h.jpg,"['Family', 'Comedy']","summer camp, grandparent grandchild relationship, competition, vomit, toilet, colonel, rivalry",2007,"['Cuba Gooding Jr.', 'Tamala Jones', 'Paul Rae', 'Lochlyn Munro', 'Richard Gant', 'Brian Doyle-Murray', 'Taggart Hurtubise', 'Frank Gerrish', 'JJ Neward', 'Paul Kiernan', 'Bart Johnson', 'Christy Summerhays', 'Jorji Diaz Fadel', 'Talon G. Ackerman', 'Joshua David McLerran', 'Spencir Bridges', 'Dallin Boyce', 'Telise Galanis', 'Molly Jepson', ""Tad D'Agostino"", 'Tyger Rawlings', 'Zachary Allen', 'Sean Patrick Flaherty', 'Richard J. Cliffson', 'Kate Fischer', 'Dimitrius Deslis', 'Ginger Williams', 'Janice Power', 'Jennifer Lyon', 'Melinda Ratner']","['chaos', 'family', 'humor']",
5905,5905,406,La Haine,1995-05-31,15300000,98,False,2600000,"After a chaotic night of rioting in a marginal suburb of Paris, three young friends, Vinz, Hubert and Saïd, wander around unoccupied waiting for news about the state of health of a mutual friend who has been seriously injured when confronting the police.",15.397,/gfdhSzPyAWtAizqs4ytc0MwOlQg.jpg,['Drama'],"neo-nazism, police brutality, hip-hop, paris, france, socially deprived family, breakdance, ghetto, male friendship, racism, xenophobia, day in a life, paris suburb, dramatic, critical, conceited",1995,"['Vincent Cassel', 'Hubert Koundé', 'Saïd Taghmaoui', 'Abdel Ahmed Ghili', 'Solo', 'Joseph Momo', 'Héloïse Rauth', 'Rywka Wajsbrot', 'Olga Abrego', 'Laurent Labasse', 'Choukri Gabteni', 'Nabil Ben Mhamed', 'Benoît Magimel', 'Médard Niang', 'Arash Mansour', 'Abdel-Moulah Boujdouni', 'Mathilde Vitry', 'Christian Moro', 'Édouard Montoute', 'JiBi', 'Félicité Wouassi', 'Fatou Thioune', 'Thang-Long', 'Cut Killer', 'Sabrina Houicha', 'Sandor Weltmann', 'François Levantal', 'Julie Mauduech', 'Karin Viard', 'Peter Kassovitz', 'Christophe Rossignon', 'Vincent Lindon', 'Mathieu Kassovitz', 'Anthony Souter', 'Florent Lavandeira', 'Teddy Marques', 'Samir Khelif', 'Tadek Lokcinski', 'Virginie Montel', 'Andrée Damant', 'Marcel Marondo', 'Karim Belkhadra', 'Marc Duret', 'Eric Pujol', 'Philippe Nahon', 'Sébastien Tavel', 'François Toumarkine', 'José Dalmat', 'Zinedine Soualem', 'Bernie Bonvoisin', 'Cyril Ancelin', 'Patrick Médioni']","['anger', 'despair', 'injustice']",Eric Pujol
5906,5906,4953,Be Kind Rewind,2008-01-20,30600000,102,False,20000000,"A man whose brain becomes magnetized unintentionally destroys every tape in his friend's video store. In order to satisfy the store's most loyal renter, an aging woman with signs of dementia, the two men set out to remake the lost films.",15.396,/6vSig2xxiD5OUnSdn8bsc5ldNJb.jpg,"['Drama', 'Comedy']","delusion, nuclear power plant, video store, videotape",2008,"['Jack Black', 'Yasiin Bey', 'Danny Glover', 'Mia Farrow', 'Melonie Díaz', 'Irv Gooch', 'Chandler Parker', 'Arjay Smith', 'Marcus Carl Franklin', 'Blake Hightower', 'Amir Ali Said', 'Paul Dinello', 'Sigourney Weaver', 'Heather Lawless', 'Kid Creole', 'Matt Walsh', 'Basia Rosas', 'P.J. Byrne', 'Quinton Aaron', 'Gio Perez', 'Tomasz Soltys', 'David Slotkoff', 'Frank Heins', 'Karolina Wydra', 'Harvey Hogan', 'Ted McElwee', 'Walter Helbig', 'Victor Dickerson', 'David M. Sheppard', 'Marc Alan Austen', 'Paul Barman', 'Karen Spitzer', 'Allie Woods Jr.', 'McKinley Page', 'Francisco Fabian', 'Kishu Chand', 'Ann Longo', 'Parrie Hodges', 'Jon Glaser', 'Marceline Hugot', 'John Tormey', 'Frank Girardeau']","['creativity', 'friendship', 'humor']",Michel Gondry
5907,5907,793,Blue Velvet,1986-09-19,8618766,120,False,6000000,"The discovery of a severed human ear found in a field leads a young man on an investigation related to a beautiful, mysterious nightclub singer and a group of criminals who have kidnapped her child.",15.396,/7hlgzJXLgyECS1mk3LSN3E72l5N.jpg,"['Crime', 'Mystery', 'Thriller']","drug dealer, small town, sexual obsession, detective, nightclub, ear, surrealism, psychological abuse, murder, drugs, policeman, voyeurism, criterion, neo-noir",1986,"['Isabella Rossellini', 'Kyle MacLachlan', 'Dennis Hopper', 'Laura Dern', 'Hope Lange', 'Dean Stockwell', 'George Dickerson', 'Priscilla Pointer', 'Frances Bay', 'Jack Harvey', 'Ken Stovitz', 'Brad Dourif', 'Jack Nance', 'J. Michael Hunter', 'Dick Green', 'Fred Pickler', 'Philip Markert', 'Leonard Watkins', 'Moses Gibson', 'Selden Smith', 'Peter Carew', 'Jon Jon Snipes', 'Angelo Badalamenti', 'Jean-Pierre Viale', 'Donald Moore', 'A. Michelle Depland', 'Michelle Sasser', 'Katie Reid']","['dread', 'curiosity', 'disturbance']",David Lynch
5908,5908,9469,He Got Game,1998-05-01,21567853,136,False,25000000,A basketball player's father must try to convince him to go to a college so he can get a shorter prison sentence.,15.395,/kd8hRaysUQOz7AvSorZDJHuihcJ.jpg,['Drama'],"prison, parent child relationship, forgiveness, homicide, release from prison, begnadigung, college, basketball",1998,"['Denzel Washington', 'Ray Allen', 'Rosario Dawson', 'Milla Jovovich', 'Hill Harper', 'Ned Beatty', 'Jim Brown', 'Joseph Lyle Taylor', 'Bill Nunn', 'Michele Shay', 'John Turturro', ""Shaquille O'Neal"", 'Charles Barkley', 'Michael Jordan', 'Jill Kelly', 'Chasey Lain', 'Robin Roberts', 'Scottie Pippen', 'Reggie Miller', 'Bill Walton', 'Dick Vitale', 'Bobby Cremins', 'Rick Pitino', 'Jim Boeheim', 'George Karl', 'Clem Haskins', 'Denny Crum', 'Nolan Richardson', 'Roy Williams', 'John Chaney', 'John Thompson', 'Lute Olson', 'Dean Smith', 'Jennifer Esposito', 'Zelda Harris', 'Lonette McKee', 'Thomas Jefferson Byrd', 'Roger Guenveur Smith', 'Rick Fox', 'Leonard Roberts', 'Arthur J. Nascarella', 'Ron Cephas Jones', 'Al Palagonia', 'Heather Hunter', 'Kim Director']","['pressure', 'family', 'ambition']",Spike Lee
5910,5910,45287,Fighting Spirit: Champion Road,2003-06-25,0,90,False,0,"Makunouchi Ippo is the new Featherweight champion of Japan and is now ready for his first title defense. His opponent, the former Jr. Featherweight champion and a medical student, Sanada Kazuki. In addition to this feud, Sanada is being coached by Kamogawa's former rival, Hama Dankichi. What makes things worse is that Sanada works at the same hospital where Kumi is a nurse at and everybody at the hospital wants Sanada to win. Not only does Ippo have to defend his title, he has to reclaim his love.",15.392,/8OEX6C9h85Hg7rtsCBKIwyrpoRh.jpg,"['Animation', 'Action', 'Comedy']",sports,2003,"['Kohei Kiyasu', 'Rikiya Koyama', 'Kenji Utsumi', 'Masaya Onosaka', 'Tomokazu Seki', 'Wataru Takagi', 'Masahiro Tanaka', 'Keiji Fujiwara']","['perseverance', 'grit', 'triumph']",Satoshi Nishimura
5911,5911,333674,Intruders,2016-01-15,0,90,False,0,"Anna suffers from agoraphobia so crippling that when a trio of criminals break into her house, she cannot bring herself to flee. But what the intruders don't realize is that agoraphobia is not her only psychosis.",15.392,/5zRiFh5d1hWmYDqcYKz6uSUXKnl.jpg,"['Drama', 'Thriller', 'Horror']",agoraphobia,2016,"['Beth Riesgraf', 'Martin Starr', 'Jack Kesy', 'Rory Culkin', 'Leticia Jimenez', 'Joshua Mikel', 'Timothy McKinney']","['fear', 'childhood', 'protection']",Adam Schindler
5912,5912,11846,Father of the Bride,1991-12-20,89325780,105,False,20000000,"George Banks is an ordinary, middle-class man whose 22 year-old daughter Annie has decided to marry a man from an upper-class family, but George can't think of what life would be like without his daughter. His wife tries to make him happy for Annie, but when the wedding takes place at their home and a foreign wedding planner takes over the ceremony, he becomes slightly insane.",15.388,/g6OTK7l6EX2JP5r00O5fG6BZJlh.jpg,"['Comedy', 'Romance']","daughter, wedding planner, bride, son-in-law, father-in-law, fool, remake, los angeles, california, wedding, father daughter relationship",1991,"['Steve Martin', 'Diane Keaton', 'Kimberly Williams-Paisley', 'Kieran Culkin', 'George Newbern', 'Martin Short', 'BD Wong', 'Peter Michael Goetz', 'Kate McGregor-Stewart', 'Carmen Hayward', 'April Ortiz', 'Mina Vasquez', 'Gibby Brand', 'Richard Portnow', 'Barbara Perry', 'Martha Gehman', 'Frank Kopyc', 'David Pasquesi', 'Ira Heiden', 'Thomas Wagner', 'Marissa Lefton', 'Sarah Rose Karr', 'Amy Young', 'Hallie Meyers-Shyer', 'Annie Meyers-Shyer', 'Morgan Dox', 'Elisa Mandell', 'Christine Beliveau', 'Natasha Wieland', 'Eric Kay', 'Scott Hogan', 'Peter James Cooper', 'Ed Williams', 'Patricia Meyers', 'Irving Meyers', 'Mark Steen', 'Robert Bauer', 'Kevin Shaw', 'Bruce A. Block', 'Peter Murnik', 'Chauncey Leopardi', 'Steve Tyrell', 'Tom Irish', 'Eugene Levy', 'Britt Leach', 'Pamela Matheson']","['love', 'nostalgia', 'family']",Bruce Carter
5913,5913,12914,Stargate: Continuum,2008-07-29,0,98,False,7000000,Ba'al travels back in time and prevents the Stargate program from being started. SG-1 must somehow restore history.,15.388,/aP22JTw7or68WwqwFu1Bwrg66Ev.jpg,"['Action', 'Adventure', 'Science Fiction', 'TV Movie']","spacecraft, time travel, space travel, alien, alien invasion, changing history",2008,"['Ben Browder', 'Amanda Tapping', 'Christopher Judge', 'Michael Shanks', 'Claudia Black', 'Beau Bridges', 'Richard Dean Anderson', 'Cliff Simon', 'Don S. Davis', 'William Devane', 'Steve Bacic', 'Gary Jones', 'Peter Williams', 'Jacqueline Samuda', 'Jay Williams', 'Corey Turner']","['adventure', 'loyalty', 'sacrifice']",Martin Wood
