,Unnamed: 0,id,title,release_date,revenue,runtime,adult,budget,overview,popularity,poster_path,genres,keywords,year,actors,emotions,director
5958,5958,70667,Kon-Tiki,2012-08-24,0,118,False,16600000,"The true story about legendary explorer Thor Heyerdahl and his epic crossing of the Pacific on a balsa wood raft in 1947, in an effort to prove it was possible for South Americans to settle in Polynesia in pre-Columbian times.",15.292,/dhSaxMcHTjq7el2vcqKRUIKmxhb.jpg,"['Adventure', 'History']","ocean, shark attack, pacific, raft, lost at sea, sea voyage",2012,"['Pål Sverre Hagen', 'Anders Baasmo Christiansen', 'Tobias Santelmann', 'Gustaf Skarsgård', 'Odd-Magnus Williamson', 'Jakob Oftebro', 'Agnes Kittelsen', 'Manuel Cauchi', 'Richard Trinder', 'Søren Pilmark', 'Peter Wight', 'Jo Adrian Haavind', 'Ian Bonar', 'Eilif Hellum Noraker', 'Elisabeth Matheson']","['adventure', 'discovery', 'courage']",Joachim Rønning
5959,5959,263109,Shaun the Sheep Movie,2015-02-05,106209378,85,False,25000000,"When Shaun decides to take the day off and have some fun, he gets a little more action than he bargained for. A mix up with the Farmer, a caravan and a very steep hill lead them all to the Big City and it's up to Shaun and the flock to return everyone safely to the green grass of home.",15.291,/dhVYlfMNc2bfXPB83LLL00I4l9n.jpg,"['Family', 'Animation', 'Comedy', 'Adventure']","sheep, amnesia, countryside, stop motion, memory loss, hospital, best friend, dog, disguise, farmer, hospitalization, claymation, hairstylist, sheep farm, plasticine",2015,"['Justin Fletcher', 'John Sparkes', 'Omid Djalili', 'Rich Webber', 'Kate Harbour', 'Tim Hands', 'Simon Greenall', 'Andy Nyman', 'Emma Tate', 'Jack Paulson', 'Sean Connolly', 'Henry Burton', 'Dhimant Vyas', 'Sophie Laughton', 'Nia Medi James', 'Stanley Unwin', 'Nick Park']","['humor', 'adventure', 'friendship']",Richard Starzak
5960,5960,65057,The Descendants,2011-09-09,177243185,115,False,20000000,"With his wife Elizabeth on life support after a boating accident, Hawaiian land baron Matt King takes his daughters on a trip from Oahu to Kauai to confront a young real estate broker, who was having an affair with Elizabeth before her misfortune.",15.289,/8cDq5UlOPYeKm39okALCEOsZPxk.jpg,"['Comedy', 'Drama']","daughter, infidelity, hawaii, father-in-law, beach house, boating accident, estate, dying mother, teenage daughter, trustee, trust fund, wild girl, wild child, realtor",2011,"['George Clooney', 'Shailene Woodley', 'Amara Miller', 'Nick Krause', 'Patricia Hastie', 'Grace A. Cruz', 'Kim Gennaula', 'Karen Kuioka Hironaga', 'Carmen Kaichi', 'Kaui Hart Hemmings', 'Beau Bridges', 'Matt Corboy', 'Matt Esecson', 'Michael Ontkean', 'Stanton Johnston', 'Jon McManus', 'Hugh Foster', 'Tiare R. Finney', 'Tom McTigue', 'Milt Kogan', 'Mary Birdsong', 'Rob Huebel', 'Laird Hamilton', 'Aileen ""Boo"" Arnold', 'Esther Kang', 'Melissa Kim', 'Robert Forster', 'Barbara L. Southern', 'Celia Kenney', 'Matt Reese', 'Zoel Turnbull', 'Matthew Lillard', 'Judy Greer', 'Linda Rose Herman', 'Scott Michael Morgan', 'Darryl K. Gonzales', 'Koko Kanealii', 'Romey ""Keola"" Yokotake', 'Fileena Bahris', 'Dennis Falt', 'Sisa Grey', 'Tom Holowach', 'Dane Justman', 'James Koons', 'John A. Weaver', 'Larry Wegger', 'Joseph Wilson', 'Joji Yoshida']","['grief', 'forgiveness', 'family']",Alexander Payne
5961,5961,45242,Dennis the Menace Strikes Again!,1998-07-14,0,71,False,0,"Barricade the doors. Lock the windows. Because he's baaaack. That one-boy wrecking crew, Dennis the Menace, returns for more mischief and mayhem. Based on the comic strip and TV show about a mischievous little boy with a gift for the potentially lethal prank.",15.288,/c6fxRpHNdSA3yv8prMo1sNzOcgF.jpg,"['Family', 'Comedy']",,1998,"['Don Rickles', 'George Kennedy', 'Justin Cooper', 'Betty White', 'Brian Doyle-Murray', 'Carrot Top', 'Dwier Brown', 'Heidi Swedberg', 'Keith Reece', 'Jacqueline Steiger', 'Danny Turner', 'Alexa PenaVega', 'Danny Breen', 'Brooke Candy', 'Tom Forrest', 'Brian Habicht', 'Darrell Harris', 'Angelo Tiffe', 'John Zarchen', 'Louis Perez', 'George Wendt']","['mischief', 'humor', 'innocence']",Charles T. Kanganis
5962,5962,9430,Go,1999-04-09,28451622,98,False,6500000,"Grocery store clerk Simon occasionally sells drugs from his cash register at work, so when soap opera actors Adam and Zack come looking for Ecstasy on a quiet Christmas Eve, they are surprised to find Ronna covering his shift. Desperate for money, Ronna decides to become an impromptu drug dealer, unaware that Adam and Zack are secretly working for obsessed narcotics officer Burke.",15.288,/kP0OOAa4GTZSUPW8fgPbk1OmKEW.jpg,"['Crime', 'Comedy', 'Thriller']","drug dealer, ecstasy, rave, clubbing, marijuana, drug dealing, los angeles, california, las vegas, drugs, lgbt, high, bisexual man, grocery store, multiple storylines, multiple perspectives, narcotics, christmas, famous actor, gay theme, christmas eve",1999,"['Sarah Polley', 'Timothy Olyphant', 'Katie Holmes', 'Desmond Askew', 'Jay Mohr', 'Scott Wolf', 'Taye Diggs', 'William Fichtner', 'Nathan Bexton', 'Breckin Meyer', 'James Duval', 'J.E. Freeman', 'Jimmy Shubert', 'Jane Krakowski', 'Melissa McCarthy', 'Robert Peters', 'Suzanne Krull', 'Jay Paulson', 'Katharine Towne', 'Nikki Fritz', 'Tane McClure', 'Courtland Mead', 'Josh Paddock', 'Manu Intiraymi', 'Natasha Melnick', 'Rita Maye Bland', 'Jodi Bianca Wise', 'Tony Denman', 'Marisa Johnston', 'Willie Amakye', 'Scott Hass', 'Ken Kupstis', 'Shann Christen', 'Sean Everett', 'Walter Ludwig', 'Bob Pepper', 'Dana Schick', 'J. Karen Thomas', 'D. Danny Warhol', 'AlgeRita Wynn', 'Monique Yates Jr.']","['chaos', 'youth', 'impulsiveness']",Doug Liman
5963,5963,2662,House of 1000 Corpses,2003-04-11,17949758,89,False,7000000,Two teenage couples traveling across the backwoods of Texas searching for urban legends of serial killers end up as prisoners of a bizarre and sadistic backwater family of serial killers.,15.285,/afISpRBO81uaLy5hrMHqyof6C1J.jpg,"['Horror', 'Crime']","upper class, psychopath, halloween, urban legend, satanic ritual",2003,"['Sid Haig', 'Bill Moseley', 'Sheri Moon Zombie', 'Karen Black', 'Erin Daniels', 'Chris Hardwick', 'Rainn Wilson', 'Jennifer Jostyn', 'Tom Towles', 'Walton Goggins', 'Matthew McGrory', 'Robert Allen Mukes', 'Dennis Fimple', 'Jake McKinnon', 'Harrison Young', 'Irwin Keyes', 'Michael J. Pollard', 'Chad Bannon', 'William Bassett', 'David Reynolds', 'Joe Dobbs III', 'Judith Drake', 'Gregg Gibbs', 'Ken Johnson', 'Irvin Mosley Jr.', 'Tom Towles', 'Walter Phelan', 'Rob Zombie']","['sadism', 'fear', 'madness']",Rob Zombie
5964,5964,16229,Prozac Nation,2001-09-08,0,95,False,0,"When talented young writer Elizabeth Wurtzel earns a scholarship to Harvard, she sees it as her chance to escape the pressures of her working-class background and concentrate on her true talent. But what starts out so promising leads to self-destructive behavior and paralyzing depression that reflects an entire generation's struggle to navigate the effects of divorce, drugs, sex, and high expectations.",15.285,/4QB1h6mxlmQVM8BtYMybTwL2foc.jpg,"['Drama', 'Romance']","depression, based on novel or book, harvard university, based on true story, borderline personality disorder, writer, therapy, mental illness, young adult, 1990s, degradation of lifestyle, lou reed",2001,"['Christina Ricci', 'Jason Biggs', 'Anne Heche', 'Michelle Williams', 'Jonathan Rhys Meyers', 'Jessica Lange', 'Lou Reed', 'Jesse Moss', 'Nicholas Campbell', 'Zoe Miller', 'Sheila Paterson', 'Rob Freeman', 'Nicole Parker', 'Frida Betrani', 'Klodyne Rodney', 'Ian Tracey', 'Wendy Noel', 'Bill Marchant', 'Tom Kent', 'Christine Anton', 'Cindy Lentol', 'Paula Plum', 'Paul Hoover', 'Tammy Bentz', 'Emily Perkins', 'Maddy Capozzi', 'Claude de Martino', 'Charles Andre', 'Mike Mitchell', 'Brad Swaile', 'Charles Siegel', 'Charles Singh', 'Chiara Zanni', 'Stephen Basilone', 'Devon Diep', 'Jack Fleischer', 'Colby Johannson', 'Alma Martinez', 'Josh Mead', 'Todd Poudrier', 'Jennifer Rappo', 'Ron Truppa', 'Andrew Washington']","['depression', 'vulnerability', 'identity']",Erik Skjoldbjærg
5965,5965,13825,The Lazarus Project,2008-10-24,558000,99,False,9750000,"After Ben Garvey foolishly turned back to crime, he thought his life was over when he was sentenced to death by lethal injection. But his death sentence isn't quite what it seems, as Ben regains consciousness near an eerie psychiatric ward, where he's told he's been hired as the groundskeeper. With the state of his soul in question, and the love for his wife and daughter all the more real and powerful, Ben must figure out if he's truly cheated death, or if he's become part of something far more sinister.",15.282,/qxf1AkFJskLrBM2WGwf8FpGcbiu.jpg,"['Drama', 'Thriller']","death penalty, robbery, lethal injection, criminal past, symbol, chainsaw, death",2008,"['Paul Walker', 'Piper Perabo', 'Lambert Wilson', 'Linda Cardellini', 'Shawn Hatosy', 'Bob Gunton', 'Malcolm Goodwin', 'Brooklynn Proulx', 'Tony Curran', 'Ross McMillan', 'Aaron Hughes', 'Sean Skene', 'John Callander', 'Alex Sol', 'Peter Jordan', 'Chuck Robinson', 'David Duncan', 'Richard Thomas', 'Frank Adamson', 'Ofield Williams', ""Mike O'Brien"", 'Leigh Enns', 'Ty Wood', 'Steven Ratzlaff', 'Dan Skene', 'Susan Kelso', 'Manfred Maretzki', 'Aryanna Zamonsky', 'Lisa Durupt', 'Onalee Ames', 'Jessica Burleson', 'Tracy Beemer']","['regret', 'mystery', 'redemption']",Ronaldo Nacionales
5966,5966,8923,Green Street Hooligans,2005-09-09,3154346,109,False,0,"After being wrongfully expelled from Harvard University, American Matt Buckner flees to his sister's home in England. Once there, he is befriended by her charming and dangerous brother-in-law, Pete Dunham, and introduced to the underworld of British football hooliganism. Matt learns to stand his ground through a friendship that develops against the backdrop of this secret and often violent world. 'Green Street Hooligans' is a story of loyalty, trust and the sometimes brutal consequences of living close to the edge.",15.282,/tfLj69EoP1b8ZWfLyg5FGJ5LC38.jpg,"['Crime', 'Drama']","london, england, sports, harvard university, hooligan, revenge, football (soccer), cruelty, american, brutality, reputation, woman director, bar fight, firm",2005,"['Elijah Wood', 'Charlie Hunnam', 'Claire Forlani', 'Ross McCall', 'Leo Gregory', 'Marc Warren', 'Rafe Spall', 'Kieran Bew', 'Geoff Bell', 'Henry Goodman', 'Francis Pope', 'Christopher Hehir', 'Terence Jay', 'David Alexander', 'Oliver Allison', 'James Allison', 'Joel Beckett', 'Scott Christie', 'David Carr', 'Jacob Gaffney', 'Jamie Kenna', 'Johnny Palmiero']","['brotherhood', 'violence', 'loyalty']",Lexi Alexander
5967,5967,333352,Eye in the Sky,2015-09-07,18704595,102,False,13000000,"A UK-based military officer in command of a top secret drone operation to capture terrorists in Kenya discovers the targets are planning a suicide bombing and the mission escalates from “capture” to “kill.” As American pilot Steve Watts is about to engage, a nine-year old girl enters the kill zone, triggering an international dispute reaching the highest levels of US and British government over the moral, political, and personal implications of modern warfare.",15.282,/faRGb9SuyGuZpsNRoIxoVSLLCId.jpg,"['Drama', 'Thriller', 'War']","drone, terrorism, duringcreditsstinger, us military, air force base, combat drone",2015,"['Helen Mirren', 'Aaron Paul', 'Alan Rickman', 'Barkhad Abdi', 'Jeremy Northam', 'Phoebe Fox', 'Armaan Haggio', 'Aisha Takow', 'Monica Dolan', 'Richard McCabe', 'Babou Ceesay', 'John Heffernan', ""Michael O'Keefe"", 'Laila Robins', 'Iain Glen', 'Faisa Hassan', 'Bob Chappell', 'Alex Gallafent', 'Carl Beukes', 'Kate Liquorish', 'Richard Stephenson', 'Gabriella Pinto', 'Tylan Wray', 'Hossain Dahir', 'Mondé Sibisi', 'Warren Masemola', 'Ahmed Mohamed Ali', 'Lemogang Tsipa', 'Paul Spaulding', 'Gavin Hood', 'Kenneth Fok', 'Zak Rowlands', 'Henry Pilime', 'Sammy Maina', 'Hassan Abdullah', 'Ebby Weyime', 'Vusi Kunene', 'Mohammed Ali Sahra', 'Chaltu Ahmed', 'Francis Chouler', 'Ed Suter', 'Roberto Kyle', 'Omar Abu Kadir', 'Kim Suzanne Engelbrecht', 'James Alexander', 'Dileef Rahim', 'Robert Omache', 'Istar Takow', 'Bronson Mwangi', 'Lex King', 'Andrew Ahula', 'Hilowli Hassan', 'Abdi Mohamed Osman', 'Dek Hassan', 'Ali Mohamed', 'Ma Mohamed', 'Jessica Jones', 'Daniel Fox', 'Graham Hopkins', 'Sonia Esgueira', 'Mohamed Abdirahmaan', 'Mohamed Fidow', 'Sabrina Hassan Abdulle', 'Fatima Mohamed Mohamud', 'Timayare Shamso Hassan', 'Fowzia Dahir', 'Abdilatief Takow', 'Fatumo Sheknoor Ali', 'Hamdi Adam Shire', 'Thelma Mabina', 'Sandile Ntobla']","['dilemma', 'tension', 'ethics']",Gavin Hood
5968,5968,33613,The Girl Who Kicked the Hornet's Nest,2009-11-27,43498108,147,False,4000000,"After taking a bullet to the head, Salander is under close supervision in a hospital and is set to face trial for attempted murder on her eventual release. With the help of journalist Mikael Blomkvist and his researchers at Millennium magazine, Salander must prove her innocence. In doing this she plays against powerful enemies and her own past.",15.282,/92byRQBuuiLcfKnBi5NOuipSgV8.jpg,"['Action', 'Thriller', 'Crime', 'Mystery']","hacker, hospital, pedophile, newspaper man, threat, millennium",2009,"['Michael Nyqvist', 'Noomi Rapace', 'Lena Endre', 'Annika Hallin', 'Jacob Ericksson', 'Sofia Ledarp', 'Anders Ahlbom Rosendahl', 'Micke Spreitz', 'Georgi Staykov', 'Mirja Turestedt', 'Hans Alfredson', 'Lennart Hjulström', 'Jan Holmquist', 'Niklas Hjulström', 'Johan Kylén', 'Tanja Lorentzon', 'Magnus Krepper', 'Michalis Koutsogiannakis', 'Jacob Nordenson', 'Peter Andersson', 'Tomas Köhler', 'Per Oscarsson', 'Rolf Degerlund', 'Tehilla Blad', 'Alexandra Hummingson', 'Agnes Kittelsen', 'Alexandra Pascalidou', 'Niklas Falk']","['revenge', 'truth', 'justice']",Daniel Alfredson
5969,5969,24662,Cats Don't Dance,1997-03-26,3566637,75,False,32000000,"Danny, an ambitious singing and dancing cat, goes to Hollywood and overcomes several obstacles to fulfill his dream of becoming a movie star.",15.28,/5Fq3lsn398I5djODa3v8fQW9ssC.jpg,"['Animation', 'Comedy', 'Family', 'Music']","dance, musical, anthropomorphism, hollywood, singing, child star, evil child, acting, interspecies romance, 1930s, golden age, hulking brute, interspecies friendship",1997,"['Scott Bakula', 'Jasmine Guy', 'Natalie Cole', 'Ashley Peldon', 'Lindsay Ridgeway', 'Frank Welker', 'Don Knotts', 'George Kennedy', 'John Rhys-Davies', 'Kathy Najimy', 'René Auberjonois', 'Hal Holbrook', 'Betty Lou Gerson', 'Dee Bradley Baker', 'David Johansen', 'Mark Dindal', 'Bob Bergen', 'Debi Derryberry', 'Bill Farmer', 'Barbara Goodson', 'Catherine Battistone', 'Vanessa Theme Ament', 'Rick Logan', 'Matthew Herried']","['ambition', 'joy', 'dreams']",David Steinberg
5970,5970,14613,Next Avengers: Heroes of Tomorrow,2008-09-02,3800000,78,False,0,The children of the Avengers hone their powers and go head to head with the very enemy responsible for their parents' demise.,15.277,/fpG1NDbcLV2a7c8X7LC4FPISBT7.jpg,"['Animation', 'Family', 'Action', 'Adventure', 'Science Fiction']","based on comic, superhero team",2008,"['Noah Crawford', ""Brenna O'Brien"", 'Aidan Drummond', 'Dempsey Pappion', 'Tom Kane', 'Fred Tatasciore', 'Michael Adamthwaite', 'Adrian Petriw', 'Shawn Macdonald', 'Nicole Oliver', 'Ken Kramer']","['legacy', 'courage', 'teamwork']",Jay Oliva
5971,5971,14635,The Rookie,2002-03-25,75597042,127,False,20000000,"Jim Morris never made it out of the minor leagues before a shoulder injury ended his pitching career twelve years ago. Now a married-with-children high-school chemistry teacher and baseball coach in Texas, Jim's team makes a deal with him: if they win the district championship, Jim will try out with a major-league organization. The bet proves incentive enough for the team, and they go from worst to first, making it to state for the first time in the history of the school. Jim, forced to live up to his end of the deal, is nearly laughed off the try-out field--until he gets onto the mound, where he confounds the scouts (and himself) by clocking successive 98 mph fastballs, good enough for a minor-league contract with the Tampa Bay Devil Rays. Jim's still got a lot of pitches to throw before he makes it to The Show, but with his big-league dreams revived, there's no telling where he could go.",15.274,/sQ2TLmcYxuWNWn5QDNUc2UDQBW1.jpg,"['Drama', 'Family']","sports, parent child relationship, baseball, life's dream, growing up",2002,"['Dennis Quaid', 'Rachel Griffiths', 'Jay Hernandez', 'Beth Grant', 'Angus T. Jones', 'Brian Cox', 'Rick Gonzalez', 'Chad Lindberg', 'Angelo Spizzirri', 'Royce D. Applegate', 'Russell Richardson', 'Raynor Scheine', 'Chris Sheffield', 'Brandon Smith', 'Trevor Morgan', 'David Blackwell', 'Blue Deckert', 'Danny Kamin', 'Rebecca Spicher', 'Raymond Rivera', 'Marco Sanchez', 'Cynthia Dorn', 'Robert Lewis', 'Seth Spiker', 'Beau Holden', 'Cam Banfield', 'Barbie Burke', 'Carlos A. Gonzalez', 'Kyle Scott Jackson', 'Bert Beatson', 'Anthony Moore', 'Brian Shoop', 'Mark Ciardi', 'Willie Dirden', 'Chuck Morgan', 'Eric Nadel', 'Richard Dillard', 'James Fletcher', 'John Wayne Shafer', 'Charles Sanders', 'Randall Wallace', 'Tim Jackson', 'John Williams', 'Jim Morris', 'J.D. Evermore', 'Mark Robert Ellis', 'Julio Cesar Cedillo', 'Lindsay Cady', 'Deborah Abbott', 'Patty Allieri', 'Johnny Bartee', 'Jason Bohn', 'Fred Bothwell', 'Matthew Brown', 'Royce Clayton', 'Peter Cornwell', 'Rhett Ashley Crosby', 'Lisa Del Dotto', 'Gareth B. DePutron', 'Mark Falvo', 'Archie Fields', 'Charles Gibson', 'Ryan Hancock', 'Jade Hanley', 'John C. Hogwood', 'Michael S. Koenig', 'Nora J. Moore', 'Dan Murphy', 'Ray L. Perez', 'Jess Price', 'George Renteria', 'Robert Rosado', 'Bobby Shue', 'Brent Smiga', 'Gary Teague', 'Aaron Wells', 'Christine Wolf']","['hope', 'perseverance', 'inspiration']",John Lee Hancock
5972,5972,10712,Far from Heaven,2002-09-02,29027914,107,False,13500000,"In 1950s Connecticut, a housewife's life is upended by a marital crisis and mounting racial tensions in society.",15.271,/uhwp04fSV9hVzzMruckODvZFGTj.jpg,"['Drama', 'Romance']","husband wife relationship, black people, housewife, botanist, connecticut, interracial relationship, male homosexuality, relationship, suburb, 1950s, people, relationships, gay theme, melodrama",2002,"['Julianne Moore', 'Dennis Quaid', 'Dennis Haysbert', 'Patricia Clarkson', 'Viola Davis', 'James Rebhorn', 'Bette Henritze', 'Michael Gaston', 'Ryan Ward', 'Lindsay Andretta', 'Jordan Nia Elizabeth', 'Kyle Timothy Smith', 'Celia Weston', 'Barbara Garrick', 'Olivia Birkelund', 'Stevie Ray Dallimore', 'Mylika Davis', 'Jason Franklin', 'Gregory Marlow', 'C.C. Loveheart', 'June Squibb', 'Laurent Giroux', 'Alex Santoriello', 'Matt Malloy', 'J.B. Adams', 'Kevin Carrigan', 'Chance Kelly', 'Declan Baldwin', 'Brian Delate', 'Pamela Evans Haynes', 'Joe Holt', 'Ben Moss', 'Susan Willis', 'Karl Schroeder', 'Lance Olds', 'Johnathan McClain', 'Nicholas Joy', 'Virl Andrick', 'Jezabel Montero', 'Geraldine Bartlett', 'Ernest Rayford', 'Duane McLaughlin', 'Betsy Aidem', 'Mary Anna Klindtworth', 'Ted Neustadt', 'Thomas Torres', 'Blondell Cooper']","['repression', 'grace', 'prejudice']",Todd Haynes
5973,5973,10956,Joe Dirt,2001-04-10,30987695,91,False,17700000,"Joe Dirt is a janitor with a mullet hairdo, acid-washed jeans and a dream to find the parents that he lost at the Grand Canyon when he was a belligerent, trailer park-raised eight-year-old. Now, blasting Van Halen in his jacked-up economy car, the irrepressibly optimistic Joe hits the road alone in search of his folks.",15.271,/nQoZBpLqGydDjVRXILTx06DoLCF.jpg,"['Mystery', 'Adventure', 'Comedy', 'Romance', 'Drama']","trailer park, parent child relationship, loss of loved one, white trash, grand canyon, looking for  birth parents, road trip, crude humor, meteorite, redneck, janitor, child abandonment, mullet, woman director, flatulence",2001,"['David Spade', 'Dennis Miller', 'Brittany Daniel', 'Kid Rock', 'Adam Beach', 'Erik Per Sullivan', 'Jaime Pressly', 'Christopher Walken', 'Megan Taylor Harvey', 'Caroline Aaron', 'Fred Ward', 'John Farley', 'Bob Zany', 'Bean Miller', 'Lee Walker', 'Que Kelly', 'Kathleen Randazzo', 'Liz Torres', 'Elisa Leonetti', 'Chris Wylde', 'Justin Staffer', 'Justin Kupanoff', 'Hamilton Camp', 'Tom McGillen', 'John Kirk', 'Anthony Mastromauro', 'Greg M. Martin', 'Angela Paton', 'Robb Skyler', 'Tyler Mane', 'Gordon Michaels', 'Lenny Schmidt', 'Rance Howard', 'Erin Murphy', 'Bree Turner', 'Natalia Cigliuti', 'Avery Rosin', 'Brian Thompson', 'Steven Brill', 'Mitzi Martin', 'Mark Abney', 'Ian Falk', 'Matthew Siemonsma', 'Joshua Ferrell', 'Alexandra Amoscato', 'Brian Chiesa', 'Eric Marquette', 'Fred Stoller', 'Steve Schirripa', 'Kevin Farley', 'Richard Riehle', 'Blake Clark', 'Hal Fishman', 'Eddie Money', 'David Garry', 'Jourdan Fremin', 'Karl Makinen', 'James Tupper', 'Jana Sandler', 'Rosanna Arquette', 'Michael Arturo', 'Joe Don Baker', 'Carson Daly', 'Kathleen Freeman', 'Kevin Nealon', 'Brian Ruppert']","['humor', 'resilience', 'search']",Dennie Gordon
5974,5974,11510,Repossessed,1990-09-14,1382462,80,False,0,"It's been some time since Father Jebedaiah Mayii exorcised the Devil from little Nancy Aglet, who is now grown up with a husband and two children of her own. But the prince of darkness wants to go a second round and has returned to repossess her! With Father Mayii unwilling to help, Father Luke Brophy tries his best to help Nancy, even when TV's Ernest Weller plans to air the exorcism live on TV.",15.268,/jDTP5KgWwvuKfOyJ2PJfTqVYnxJ.jpg,"['Comedy', 'Horror']","rock 'n' roll, exorcism, live-reportage, spoof, devil",1990,"['Linda Blair', 'Ned Beatty', 'Leslie Nielsen', 'Anthony Starke', 'Thom Sharp', 'Lana Schwab', 'Benj Thall', 'Dove Dellos', 'Jacquelyn Masche', 'Melissa Moore', 'Willie Garson', 'Erna Gregory', 'Richard Halpern', 'Carol Shermer', 'Kathy Topia', 'Gary Howe Scott', 'Linda Brennan', 'Murray Langston', 'Melissa Shear', 'Glen Vincent', 'Barbara Alyn Woods', 'Douglas W. Kelly', 'Robert Fuller', 'Peter Gaulke', 'Greg Lewis', 'John Copage', 'Dani Douthette', ""Timothy D'Arcy"", 'Jack Hanrahan', 'Marc Siegler', 'Chuck Kovacic', 'Peggy Faracy', 'May Quigley', 'Annie Waterman', 'Roger Scott', 'Nancy Kaine', 'John Ingle', ""Bryan O'Byrne"", 'Ben Kronen', 'Fred D. Scott', 'Johnny Dark', 'Doug Draizin', 'Belle Avery', 'Jake Steinfeld', 'Aaron Baker', 'Norman Large', 'Karen Person', 'Charlotte J. Helmkamp', 'Army Archerd', 'Bob Drew', 'Frazer Smith', 'Jack LaLanne', 'Joseph V. Perry', 'Sheryl Bernstein', 'Wally George', 'Floyd Levine', 'George A. Simonelli', 'Eugene Greytak', 'Dawn Mazzella', 'Bob Zany', 'Jesse Ventura', 'Gene Okerlund', 'Ian Abercrombie', 'Sara Matthews', 'Julie Strain']","['parody', 'absurdity', 'silliness']",Bob Logan
5975,5975,9263,Now and Then,1995-10-20,27400000,100,False,12000000,"Waxing nostalgic about the bittersweet passage from childhood to puberty, four childhood girlfriends — Teeny, Chrissy, Samantha and Roberta — recall the magical summer of 1970. During their walk down memory lane, they reconcile experiences with boys, secrets, bullies and more.",15.266,/q31Ks8oAmM4Nq2CcGjyYYpdBAmh.jpg,"['Comedy', 'Drama', 'Romance']","1970s, female friendship, coming of age, gynecologist, photocopier, truth or dare, woman director",1995,"['Christina Ricci', ""Rosie O'Donnell"", 'Thora Birch', 'Melanie Griffith', 'Gaby Hoffmann', 'Demi Moore', 'Ashleigh Aston Moore', 'Rita Wilson', 'Devon Sawa', 'Walter Sparrow', 'Cloris Leachman', 'Lolita Davidovich', 'Janeane Garofalo', 'Hank Azaria', 'Bonnie Hunt', 'Rumer Willis', 'Bradley Coryell', 'Justin Humphrey', 'Travis Robertson', 'James Wilson Keane', 'Ric Reitz', 'Kellen Crosby', 'Joey Stinson', 'James Paul Cleckler', 'Tucker Stone', 'Jamison B. Dowd', 'Beverly Shelton', 'Geoff McKnight', 'T.S. Morgan', 'Carl Espy', 'Brendan Fraser', 'Alice Tew', 'Rand Courtney', 'Brandon Kleyla', 'Haviland Stillwell', 'Dave Thompson']","['nostalgia', 'friendship', 'growth']",Lesli Linka Glatter
5976,5976,62977,The Lost Bladesman,2011-04-28,23774400,107,False,0,"During the warring period of the three kingdoms, ancient China is in turmoil. To unify the country, general Cao Cao, the real power behind the Emperor, enlists the aid of the greatest warrior in the land, Guan Yu.  However, Guan Yu is a loyal friend of Cao Cao's enemy Liu Bei so to persuade the peerless warrior to fight, Cao Cao takes his beloved Qi Lan hostage.  After leading Cao Cao's forces to victory Guan Yu sets out with Qi Lan to rejoin Liu Bei.  Now Cao Cao has deemed him too great a threat to live, and on the journey he must face all the forces at the Emperor's command sent to destroy him.",15.264,/rBYeOpWSMzw18DKR3sCkyKdChxa.jpg,"['History', 'Drama', 'Action', 'War']","based on novel or book, warlord, battle, 3rd century, the lost bladesman",2011,"['Donnie Yen', 'Jiang Wen', 'Sun Li', 'Alex Fong Chung-Sun', 'Shao Bing', 'Andy On', 'Wang Xuebing', 'Edison Wang', 'Dong Yong', 'Li Zonghan', 'Nie Yuan', 'Chin Siu-Ho', 'Zhou Bo', 'Yu Ailei', 'Hei Zi', 'Sang Ping', 'Chen Hong']","['honor', 'loyalty', 'tragedy']",Alan Mak Siu-Fai
