,Unnamed: 0,id,title,release_date,revenue,runtime,adult,budget,overview,popularity,poster_path,genres,keywords,year,actors,emotions,director
6859,6859,11384,The Hard Way,1991-03-08,65595485,111,False,24000000,"Seeking to raise his credibility as an actor and to land a role as a tough cop on a new show, Hollywood action star Nick Lang works a deal with New York City Police Capt. Brix, who by chance is one of his fans. Nick will be paired with detective Lt. John Moss and learn how to act like a real cop. But when Nick drives John crazy with questions and imitating him, he gets in the way of John's pursuit of a serial killer.",13.404,/c6u5p9A6dfbyFArkNM5Y6kHdTQw.jpg,"['Action', 'Comedy', 'Crime']","dual identity, undercover agent, police, identity, detective, role reversal, movie star, buddy cop, manhattan, new york city",1991,"['Michael J. Fox', 'James Woods', 'Stephen Lang', 'Annabella Sciorra', 'John Capodice', 'Luis Guzmán', 'LL Cool J', 'Mary Mara', 'Delroy Lindo', 'Conrad Roberts', 'Christina Ricci', 'Penny Marshall', 'George Cheung', 'Frank Geraci', 'Sophie Maletsky', 'Lewis Black', 'Rand Foerster', 'Anderson Matthews', 'Kathy Najimy', 'Yasiin Bey', 'Dwayne McClary', 'Sharrieff Pugh', 'Anthony Thomas', ""Howard 'Stick' Baines"", 'Shawn McLean', 'Curtis McClarin', 'Keenan Leung', 'Bill Cobbs', 'Reno', 'John Costelloe', 'Leif Riddell', 'Johnny Sanchez', 'Joseph Tripi', 'Karen Lynn Gorney', 'Janet Sarno', 'Jan Speck', 'Holly Kuespert', 'John Ring', 'Michael Jeffrey Woods', 'William Truesdale', 'Mark Woodcock', 'Ed Setrakian', 'David Sosna', ""Adore O'Hara"", 'Michael Badalucco', 'Jordanna Freedman', 'Merrill Witten', 'Fracaswell Hyman', 'Mario Bosco', 'Bryant Gumbel', 'Trish Cook', 'Fabio', 'George Gerard', 'David Hummel', 'Jim Lavin', 'Anibal O. Lleras', 'Isabella Martinez Wall', 'Paul Mormando', 'Ronald Rand', 'Kariim Ratcliff', 'Andrew D. Schwartz', 'Charles Scorsese', 'Frank Stellato']","['action', 'comedy', 'buddy cop']",John Badham
6860,6860,12716,My Father's Glory,1990-08-29,0,105,False,0,"Raised by his science teacher father, Joseph Pagnol, and seamstress mother Augustine, young Marcel grows up during the turn of the century in awe of his rationalist dad. When the family takes a summer vacation in the countryside, Marcel becomes friends with Lili, who teaches him about rural life.",13.4,/4zwgcaKqIJ5GB6kCPpyMLZuNyoi.jpg,"['Adventure', 'Drama']","parent child relationship, provence, southern france, biography, teacher, rural area, summer, based on memoir or autobiography, hill, turn of the century, 1900s",1990,"['Philippe Caubère', 'Nathalie Roussel', 'Didier Pain', 'Thérèse Liotard', 'Julien Ciamaca', 'Victorien Delamare', 'Joris Molinas', 'Benoit Martin', 'Paul Crauchet', 'Pierre Maguelon', 'Michel Modo', 'Jean Rougerie', 'Victor Garrivier', 'Raoul Curet', 'Annick Danis', 'Maxime Lombard', 'Michèle Loubet', 'René Loyon', 'Benjamin Detriche', 'Jean-Pierre Darras', 'Louis Lalanne', 'Sébastien Grazzini', 'Andrée Damant']","['nostalgia', 'family', 'childhood']",Jean-Claude Ventura
6861,6861,21915,Booty Call,1997-02-26,20060051,79,False,0,"Rushon is sexually pent-up and ready to take thing things to the next level with his girlfriend, Nikki. But when he calls for a date, she asks to make it a double — bringing along her brash friend, Lysterine, whom Rushon sets up with his lewd buddy, Bunz. Things go better than expected. As the evening transitions from the restaurant to the bedroom, the two men go on a madcap search for what will surely make the night complete: condoms.",13.397,/1pQpHVm3AXIwbBUnwGEQ0q95E0L.jpg,['Comedy'],"friendship, date, sexuality, male friendship, blind date, female friendship, romantic comedy, vulgarity, best friend, chinese restaurant, racial stereotype, buddy comedy, female buddy",1997,"['Jamie Foxx', 'Tommy Davidson', 'Vivica A. Fox', 'Tamala Jones', 'Amy Monique Waddell', 'Wiley Moore', 'Kam Ray Chan', 'Ric Young', 'Ammie Sin', 'Scott LaRose', 'Bernie Mac', 'Olivia Yap', 'Karen Robinson', 'Gedde Watanabe', 'Art Malik', 'Amanda Tapping', 'David Hemblen']","['comedy', 'romance', 'sexuality']",Jeff Pollack
6862,6862,9451,Election,1999-04-23,14902041,103,False,25000000,"Tracy Flick is running unopposed for this year’s high school student election. But Jim McAllister has a different plan. Partly to establish a more democratic election, and partly to satisfy some deep personal anger toward Tracy, Jim talks football player Paul Metzler to run for president as well.",13.393,/5gPOFU6IPvDrx50XaPCK4twNw79.jpg,"['Comedy', 'Drama']","infidelity, high school, jealousy, politics, museum, motel, dark comedy, vandalism, ambition, graduation, satire, bias, scandal, feud, teacher, crush, morality, trust, election, overachiever",1999,"['Matthew Broderick', 'Reese Witherspoon', 'Chris Klein', 'Jessica Campbell', 'Mark Harelik', 'Phil Reeves', 'Molly Hagan', 'Delaney Driscoll', 'Colleen Camp', 'Frankie Ingrassia', 'Matt Malloy', 'Jeanine Jackson', 'Holmes Osborne', 'Loren Nelson', ""Nicholas D'Agosto"", 'Emily Martin', 'Jonathan Marion', 'Amy Falcone', 'Matt Justesen', 'Nick Kenny', 'B.J. Tobin', 'Christa Young', 'David V. Wenzel', 'Joel Parks', 'Larry Kaiser', 'Marilyn Tipp', 'Jeannie Brayman', 'James Devney', 'L. Carmen Novoa', 'Jason Paige', 'Matt Golden', 'Heather Koenig', 'Jillian Crane', 'Kaitlin Ferrell', 'John Ponzio', 'Rohan Quine']","['satire', 'ambition', 'high school']",Alexander Payne
6863,6863,34152,Crooklyn,1994-05-13,0,115,False,14000000,"From Spike Lee comes this vibrant semi-autobiographical portrait of a school-teacher, her stubborn jazz-musician husband and their five kids living in '70s Brooklyn.",13.393,/iFqe07F78SO0SIBzWcK4I5MwNvP.jpg,"['Comedy', 'Drama']","black people, 1970s, jazz singer or musician, dysfunctional family, teacher, urban, parenthood, brooklyn, new york city, semi autobiographical, street kid",1994,"['Alfre Woodard', 'Delroy Lindo', 'David Patrick Kelly', 'Zelda Harris', 'Carlton Williams', 'Sharif Rashed', 'Tse-Mach Washington', 'Christopher Knowings', 'José Zúñiga', 'Isaiah Washington', 'Ivelka Reyes', 'Spike Lee', 'Vondie Curtis-Hall', 'Frances Foster', 'Manny Perez', 'RuPaul', 'Keith Johnson', 'Tiasha Reyes', 'Raymond Reliford', 'Harvey Williams', 'Peewee Love', 'Bokeem Woodbine', 'Mildred Clinton', 'Emelise Aleandri', 'Omar Scroggins', 'Danielle K. Thomas', 'Asia Gilyard', 'Carmen Tillery', 'N. Jeremi Reyes', 'Norman Matlock', 'Patriece Nelson', 'Taneal Royal', 'Kendell Freeman', 'Kewanna Bonaparte', 'Gary Perez', 'Arthur French', 'Yolande Morris', 'Dan Grimaldi', 'Susan J. Jacks', 'Christopher Wynkoop', 'Rene Ojeda', 'Tracy Vilar', 'Michele Shay', 'Hector M. Ricci Jr.', 'Nadijah Abdul-Khalia', 'Bruce Hawkins', 'Richard Whiten', 'Michelle Rosario', 'Maurie A. Chandler', 'Monet A. Chandler', 'Zay Smith', 'Derrick Peart', 'Ulysses Terrero', 'Johnette Cook', 'Désirée Murray', 'Jesse Astro', 'Jose Camel', 'Joie Lee']","['family', 'coming-of-age', 'urban life']",Spike Lee
6864,6864,64084,Scorned,1993-07-14,0,100,False,0,A vengeful widow worms her way into the home of the man she holds responsible for her husband's suicide.,13.39,/latrrZjz5kwVz3Am3ajLaCrJ1LW.jpg,"['Drama', 'Thriller']","widow, seduction, death, erotic movie, pretending to be gay",1993,"['Shannon Tweed', 'Andrew Stevens', 'Kim Morgan Greene', 'Daniel McVicar', 'Michael D. Arenz', 'Stephen Young', 'Perla Walter', 'Paul Carr', 'Ron Melendez', 'Wil Shriner', 'Robyn LeAnn Scott', 'Anya Longwell', 'Leslie Sachs']","['revenge', 'thriller', 'betrayal']",Barry Avrich
6865,6865,13437,Avenging Angelo,2002-08-30,0,97,False,0,"A woman who has recently discovered that she is the daughter of Angelo, a major mafia boss, decides to wreak vengeance when he is killed by a hitman. She's aided by his faithful bodyguard, with whom she soon falls in love.",13.387,/hl4mI28D4NhE6ePNgPojQuyEYw7.jpg,"['Action', 'Comedy', 'Crime']","hitman, bodyguard, mafia boss, organized crime, mafia, one man army, action hero",2002,"['Sylvester Stallone', 'Madeleine Stowe', 'Anthony Quinn', 'Raoul Bova', 'Harry Van Gorkum', 'Billy Gardell', 'George Touliatos', 'Angelo Celeste', 'Ezra Perlman', 'Carin Moffat', 'Dawn Greenhalgh', 'Angelo Tsarouchas', 'Nancy Beatty', 'Lori Alter', 'Kristina Nicoll', 'Gino Marrocco', 'Francesco Zimone', 'Brandon Carrera', 'Sandra Biondi', 'Gema Zamprogna', 'Katie Nicole Evans', 'Julie Jones', 'Curtis Sullivan', 'Laird Mackintosh', 'Luciana Calvet', 'Kevin Law', 'Jeremy Nasmith', 'Luke Scheuer', 'Barbara Szablowski', 'Jeannette Zingg', 'Ola Sturik', 'Boyd Banks', 'Sharon Heldt', 'Joan Giammarco', 'Lynn MacKenzie', 'Ben E. Nason', 'Elisa Tibollo', 'John Gilbert']","['action', 'comedy', 'revenge']",Myron Hoffert
6866,6866,9423,Virus,1999-01-14,30700000,99,False,75000000,"When the crew of an American tugboat boards an abandoned Russian research vessel, the alien life form aboard regards them as a virus which must be destroyed.",13.383,/5Np88iigCfnXvMlMKmCcbPVIbYQ.jpg,"['Horror', 'Action', 'Science Fiction']","desertion, tornado, alien life-form, evil, insurance, virus",1999,"['Jamie Lee Curtis', 'William Baldwin', 'Donald Sutherland', 'Joanna Pacula', 'Marshall Bell', 'Sherman Augustus', 'Cliff Curtis', 'Julio Oscar Mechoso', 'Levan Uchaneishvili', 'Yuri Chervotkin', 'Keith Flippen', 'Olga Rzhepetskaya-Retchin', 'David Eggby']","['sci-fi', 'horror', 'technology']",Deirdre Horgan
6867,6867,15596,Back to School,1986-06-13,91258000,96,False,11000000,"Self-made millionaire Thornton Melon decides to get a better education and enrolls at his son Jason's college. While Jason tries to fit in with his fellow students, Thornton struggles to gain his son's respect, giving way to hilarious antics.",13.383,/bIQH3dptGaMBtwos7j9lEHt65BV.jpg,['Comedy'],"college, tutor, whirlpool, clothing store, bribe, clothing store owner, back to school, father and son",1986,"['Rodney Dangerfield', 'Sally Kellerman', 'Burt Young', 'Keith Gordon', 'Robert Downey Jr.', 'William Zabka', 'Paxton Whitehead', 'Adrienne Barbeau', 'M. Emmet Walsh', 'Terry Farrell', 'Ned Beatty', 'Severn Darden', 'Sam Kinison', 'Robert Picardo', 'Kurt Vonnegut', 'Edie McClurg', 'Sarah Abrell', 'Dana Allison', 'Boris Aplon', 'Nora Boland', 'Kimberlin Brown', 'Lisa Denton', 'Bob Drew', 'Holly Hayes', 'Jason Hervey', 'Leslie Scarborough', 'James Ingersoll', 'Michael McGrady', 'Santos Morales', 'Beth Peters', 'Phil Rubenstein', 'Timothy Stack', 'Steve Sweeney', 'Stacey Toten', 'John William Young', 'Brad Zutaut', 'Josh Saylor', 'William Grauer', 'Kristen Aldrich', 'Becky LeBeau', 'Tricia Hill', 'Jill D. Merin', 'John William James', 'Eric Alver', 'Theresa Lyons', 'Dallas Winkler', 'Lisa Montgomery', 'Kimberlee Carlson', 'Curtis Stone', 'Michael Reid', 'Cactus Moser', ""Brian O'Doughtery"", 'Davey Faragher', 'Cliffie Stone', 'Danny Elfman', 'Leon Schneiderman', 'Steve Bartek', 'Dale Turner', 'Johnny Vatos Hernandez', 'John Avila', ""Sam 'Sluggo' Phipps"", 'Mike Bacich']","['comedy', 'education', 'family']",Alan Metter
6868,6868,27150,Silent Rage,1982-04-02,10500000,103,False,4500000,"A mentally ill man in a small Texas town goes on a killing rampage and is fatally wounded by police. When doctors use an experimental serum to bring him back to life, the killer develops superhuman strength and the town sheriff must pursue him.",13.378,/9LwR6SFLuzbbzYgXdGnVHahBqrO.jpg,"['Action', 'Horror', 'Science Fiction', 'Romance']","small town, martial arts, kung fu, showdown, sheriff, experiment, chase, texas, murder, superhuman, motorcycle gang, super power, axe murder, super villain, taekwondo, bar fight, hand to hand combat, regeneration, action hero, genetic experiment",1982,"['Chuck Norris', 'Ron Silver', 'Toni Kalem', 'Brian Libby', 'Steven Keats', 'William Finley', 'Stephen Furst', 'Stephanie Dunnam', 'Joyce Ingle', 'Jay De Plano', 'Lillette Zoe Raley', 'Mike Johnson', 'Linda Tatum', 'Kathleen Lee', 'Desmond Dhooge', 'Joe Farago', 'John Barrett', 'Paula Selzer', 'Sandy Lang', 'Sonny Jones', 'Russel Higgenbotham', 'Eddie Galt', 'David Unger']","['action', 'horror', 'suspense']",Michael Miller
6869,6869,15592,Beaches,1988-12-21,57041866,123,False,20000000,"A privileged rich debutante and a cynical struggling entertainer share a turbulent, but strong childhood friendship over the years.",13.376,/vol5TCGHDbi8r0yo0TrIGFiGxJ7.jpg,"['Comedy', 'Drama']","loss of loved one, female friendship, class differences, buddy, death of mother, childhood friends, dying young, cardiomyopathy",1988,"['Bette Midler', 'Barbara Hershey', 'John Heard', 'Spalding Gray', 'Lainie Kazan', 'James Read', 'Grace Johnston', 'Mayim Bialik', 'Marcie Leeds', 'Carol Williard', 'Allan Kent', 'Phil Leeds', 'Lynda Goodfriend', 'Nikki Plant', 'Michael French', 'Robert Ball', 'Frank Campanella', 'Diane Frazen', 'Michael Elias', 'Patrick Richwood', 'Tracy Reiner', 'Zachary Weintraub', 'Nicky Blair', 'Joshua Levinson', 'Lori Marshall', 'Jenifer Lewis', 'Charlotte Crossley', 'Julie Bond', 'Kimberly Morgan', 'Andrea Paris', 'Adrienne Parker', 'Ken Gibbel', 'Harvey Miller', 'Héctor Elizondo', 'Whit Hertford', 'Garry Marshall', 'Lori Sigrist', 'Terri Sigrist']","['friendship', 'drama', 'tragedy']",
6870,6870,10479,Rules of Engagement,2000-04-07,71000000,128,False,60000000,A Marine Colonel is brought to court-martial after ordering his men to fire on demonstrators surrounding the American embassy in Yemen.,13.368,/38iMM0sHOqNz315ApF9bEjT4rFA.jpg,"['War', 'Drama']","vietnam veteran, court case, wound, colony, life-saver, lawyer",2000,"['Tommy Lee Jones', 'Samuel L. Jackson', 'Guy Pearce', 'Ben Kingsley', 'Bruce Greenwood', 'Anne Archer', 'Blair Underwood', 'Philip Baker Hall', 'Dale Dye', 'Amidou', 'Mark Feuerstein', 'Nicky Katt', 'Ryan Hurst', 'John Speredakos', 'Baoan Coleman', 'Richard McGonagle', 'G. Gordon Liddy', 'Todd Kimsey']","['military', 'drama', 'justice']",William Friedkin
6871,6871,10269,Yentl,1983-11-18,30400000,132,False,12000000,"Rebbe Mendel is a single father who teaches the Talmud, a sacred text of Judaism, to the boys of his small Polish town. Behind closed doors, he also instructs his daughter, Yentl, despite the fact that girls are forbidden to study religious scripture. When Yentl's father dies, she still has a strong desire to learn about her faith -- so she disguises herself as a male, enrolls in a religious school, and unexpectedly finds love along the way.",13.367,/AcCX4tKqwP5BTfRTQEqZW3qabl3.jpg,"['Music', 'Drama', 'Romance']","musical, studies, disguise, unhappiness, boys' school, woman director",1983,"['Barbra Streisand', 'Mandy Patinkin', 'Amy Irving', 'Nehemiah Persoff', 'Steven Hill', 'Allan Corduner', 'Ruth Goring', 'David de Keyser', 'Bernard Spear', 'Doreen Mantle', 'Lynda Baron', 'Jack Lynn', 'Anna Tzelniker', 'Miriam Margolyes', 'Mary Henry', 'Robbie Barnett', 'Ian Sears', 'Frank Baker', 'Anthony Dean Rubeš', 'Renata Buser', 'Kerry Shale', 'Danny Brainin', 'Gary Brown', 'Jonathan Tafler', 'Peter Whitman', 'Teddy Kempner', 'Norma Atallah', 'Mark English', 'Milena Glogarová', 'Derek Lyons', 'Chris Parsons', 'Peter Ross-Murray', 'Beth Porter']","['identity', 'gender roles', 'music']",Steve Lanning
6872,6872,13555,The Funhouse,1981-03-13,7886857,96,False,0,"Rebellious teen Amy defies her parents by going to a trashy carnival that has pulled into town. In tow are her boyfriend, Buzz, and their friends Liz  and Richie. Thinking it would be fun to spend the night in the campy ""Funhouse"" horror ride, the teens witness a murder by a deformed worker wearing a mask. Locked in, Amy and her friends must evade the murderous carnival workers and escape before it leaves town the next day.",13.366,/9eFgNrkTbXk1TBPuzxdOEjutNoC.jpg,['Horror'],"mask, carnival, slasher, funhouse, video nasty, deformed face",1981,"['Elizabeth Berridge', 'Cooper Huckabee', 'Kevin Conway', 'Largo Woodruff', 'Miles Chapin', 'Jeanne Austin', 'Jack McDermott', 'Shawn Carson', 'David Carson', 'Sonia Zomina', 'Ralph Morino', 'Herb Robins', 'Mona Agar', 'William Finley', 'Susie Malnik', 'Sylvia Miles', 'Sid Raymond', 'Larry Ross', 'Frank Grimes', 'Frank Schuller', 'Peter Conrad', 'Mildred Hughes', 'Glen Lawrence', 'Shawn McAllister', 'Sandy Mielke', 'Mike Montalvo', ""Sherman 'Big Train' Bergman"", 'Raymond Forchion', 'David Mandel']","['horror', 'carnival', 'thrills']",Tobe Hooper
6873,6873,11018,Year of the Dragon,1985-08-16,18707466,134,False,24000000,"In New York, racist Capt. Stanley White becomes obsessed with destroying a Chinese-American drug ring run by Joey Tai, an up-and-coming young gangster as ambitious as he is ruthless. While pursuing an unauthorized investigation, White grows increasingly willing to violate police protocol, resorting to progressively violent measures -- even as his concerned wife, Connie, and his superiors beg him to consider the consequences of his actions.",13.363,/c8SfIgwR5mfu0c0qTBKbsvBfecJ.jpg,"['Action', 'Crime', 'Thriller']","drug smuggling, heroin, chinatown, chinese mafia, cop",1985,"['Mickey Rourke', 'John Lone', 'Ariane', 'Leonard Termo', 'Raymond J. Barry', 'Caroline Kava', 'Eddie Jones', 'Joey Chin', 'Victor Wong', 'K. Dock Yip', 'Bau Hon-Lam', 'Way Dong Woo', 'Jimmy Sun', 'Daniel Davin', 'Mark Hammer', 'Dennis Dun', 'David Lee', 'Jack Kehler', 'Tony Lip', 'Al Leong', 'Fabia Drake', 'Tisa Chang', 'Gerald Orange', 'Fan Mei-Sheng', 'Yukio Yamamoto', 'Doreen Chan', 'Yip Ha-Lei', 'Dermot A. McNamara', 'Vallo Benjamin', 'Myra Chen', 'Chin Feng', 'Yuk Fan Yiu', 'Richie Hsiu', 'Jack Lee', 'Irene Jung', 'Josie Lee', 'Jiwon Chang', 'Kelly Wong', 'Chi Moy', 'Johnny Shia', 'Gardell Tung', 'Jeff Khowong', 'Chen Chao-jung', 'Jerry Chang', 'Aileen Ho', 'Lisa Lee', 'Sammy Lee', 'Keenan Leung', 'James Scales', 'Ming C. Lee', 'Kader Ma', 'Paul J.Q. Lee', 'Manuel Fung', 'Emily Woo Yamasaki', 'Roza Ng', 'Gloria Au', 'Jadin Wong', 'Lin Ngan Ng', 'Janice Wong', 'Bruno Millotti', ""Lucille D'Agnillo"", 'Julian Szumilo', 'Cecelia Pei', 'Quan Eng', 'George Kodisch', 'Bruce Kennedy', 'James Chin', 'Matthew Tung', 'Pat Fuji', 'Geoff Lee', 'Kuni Mikami', 'Billy Asai', 'Chi On Soo Hoo', 'John Sparks', 'Carmine Venezia', 'Anthony Parrillo', 'Matthew Castiglione', 'Steve Hanson', 'Raymond Gardner', 'Michael Acampora', 'Espérance Pham Thai Lan', 'Steven Chen', 'Paul Scaglione', 'Joseph Bonaventura', 'Jilly Rizzo']","['crime', 'drama', 'culture clash']",Michael Cimino
6874,6874,42337,Beau Pere,1981-09-15,0,123,False,0,"Rémi is a man trapped in a deteriorating marriage. When his wife is unexpectedly killed in a car accident, Rémi is left with his stepdaughter, Marion, who chooses to stay with him rather than live with her birth father. After the initial shock passes, Rémi is caught off-guard when Marion begins expressing her attraction to him. Initially repulsed, Marion's mature beauty wears him down as he finally caves to her seductions.",13.361,/hzGFiFY8wYeqxM8T4O4HFmXTqca.jpg,"['Drama', 'Romance']","lolita, jazz, job-hopping, stepfather, breaking the fourth wall, teenage girl, tenant, car accident, pianist, dead mother, sexual desire, sexual awakening, underage sex, pipe smoking, money problems, estrangement, death of wife, sex with a minor, daughter–in–law father–in–law relationship, young girl seduces old man, stepfather stepdaughter relationship, depressed man",1981,"['Patrick Dewaere', 'Ariel Besse', 'Maurice Ronet', 'Geneviève Mnich', 'Maurice Risch', 'Nathalie Baye', 'Nicole Garcia', 'Macha Méril', 'Yves Gasc', 'Rose Thiéry', 'Pierre Le Rumeur', 'Catherine Alcover', 'Henri-Jacques Huet', 'Jacques Rispal', 'Maurice Biraud', 'Michel Berto', 'Sandy Whitelaw']","['taboo', 'drama', 'relationships']",Bertrand Blier
6875,6875,570,Fat Girl,2001-03-07,0,86,False,0,"Anaïs is twelve and bears the weight of the world on her shoulders. She watches her older sister, Elena, whom she both loves and hates. Elena is fifteen and devilishly beautiful. Neither more futile, nor more stupid than her younger sister, she cannot understand that she is merely an object of desire. And, as such, she can only be taken. Or had. Indeed, this is the subject: a girl's loss of virginity. And, that summer, it opens a door to tragedy.",13.361,/afzbY1h7huuxlITigPfcyQSkqLs.jpg,['Drama'],"puberty, first time, rape, sibling relationship, parent child relationship, holiday, southern france, women's sexual identity, summer vacation, woman director, new french extremism",2001,"['Anaïs Reboux', 'Roxane Mesquida', 'Libero De Rienzo', 'Arsinée Khanjian', 'Romain Goupil', 'Laura Betti', 'Albert Goldberg', 'Odette Barrière', 'Ann Matthijsse', 'Pierre Renverseau', 'Jean-Marc Boulanger', 'Frederick Bodin', 'Michel Guillemin', 'Josette Cathalan', 'Claude Sésé', 'Marc Samuel']","['coming-of-age', 'sexuality', 'sisterhood']",Catherine Breillat
6876,6876,4916,Guilty as Sin,1993-06-04,22886222,107,False,0,"Before a criminal lawyer knows what has happened, she is forced to defend a wife killer she knows is guilty.",13.359,/yqEFrL47aqfKf1glpkv06sk8dom.jpg,"['Drama', 'Mystery', 'Thriller']","odvjetnik, đavo",1993,"['Rebecca De Mornay', 'Don Johnson', 'Stephen Lang', 'Jack Warden', 'Dana Ivey', 'Ron White', ""Norma Dell'Agnese"", 'Sean McCann', 'Luis Guzmán', 'Robert Kennedy', 'James Blendick', 'Tom Butler', 'Christina Grace', 'Lynne Cormack', 'Barbara Eve Harris', 'Simon Sinn', 'John Kapelos', 'Tom McCamus', 'Harvey Atkin', 'Anthony Sherwood', 'Chris Benson', 'Melanie Nicholls-King', 'Johnie Chase', 'Brigit Wilson', 'Alberto De Rosa', 'Yanira Contreras', 'Shelley Young', 'Sandi Ross', 'Peter Blais', 'Denis Akiyama', 'Lili Francks', 'Roland Rothchild', 'Jack Newman', 'Gene Mack', 'Tom Quinn']","['thriller', 'courtroom', 'deception']",Sidney Lumet
6877,6877,15762,Night of the Creeps,1986-08-21,591366,90,False,5000000,"In 1959, an alien experiment crashes to earth and infects a fraternity member. They freeze the body, but in the modern day, two geeks pledging a fraternity accidentally thaw the corpse, which proceeds to infect the campus with parasites that transform their hosts into killer zombies.",13.359,/A3s2tQGNb6mhlr1hPZeE5F8IUwp.jpg,"['Horror', 'Comedy', 'Science Fiction']","spacecraft, monster, experiment, police, morgue, undead, alien, murder, sorority, serial killer, zombie, corpse, fraternity, parasite, horror comedy, ax",1986,"['Jason Lively', 'Steve Marshall', 'Jill Whitlow', 'Tom Atkins', 'Wally Taylor', 'Allan Kayser', 'Bruce Solomon', 'Vic Polizos', 'Dick Miller', 'Ken Heron', 'Alice Cadogan', 'June Harris', 'David Paymer', 'David Oliver', 'Evelyne Smith', 'Leslie Ryan', 'Suzanne Snyder', 'Elizabeth Cox', 'John J. York', 'Robert Kerman', 'Earl Ellis', 'Robert Kurtzman', 'Howard Berger', 'Daniel Frishman', 'Greg Nicotero', 'Dave Alan Johnson', 'Jim Townsend', 'Lori Lively', 'Kevin Thompson', 'Joseph S. Griffo', 'Jay Arlen Jones', 'Elizabeth Alda', 'Robert Kino', 'Chris Tashima']","['horror', 'comedy', 'zombies']",
6878,6878,1024,Heavenly Creatures,1994-09-12,3049135,109,False,5000000,"Wealthy and precocious teenager Juliet transfers from England to New Zealand with her family, and soon befriends the quiet, brooding Pauline through their shared love of fantasy and literature. When their parents begin to suspect that their increasingly intense and obsessive bond is becoming unhealthy, the girls hatch a dark plan for those who threaten to keep them apart.",13.357,/uvb86wVCIqD3Rlbr0GTNgWDF7Zo.jpg,"['Drama', 'Fantasy']","mother, obsession, literature, christchurch, based on true story, love, friends, murder, relationship, 1950s",1994,"['Melanie Lynskey', 'Kate Winslet', 'Sarah Peirse', 'Diana Kent', 'Clive Merrison', ""Simon O'Connor"", 'Jed Brophy', 'Peter Elliott', 'Gilbert Goldie', 'Geoffrey Heath', 'Kirsti Ferry', 'Ben Skjellerup', 'Darien Takle', 'Elizabeth Moody', 'Liz Mullane', 'Moreen Eason', 'Pearl Carpenter', 'Lou Dobson', 'Jesse Griffin', 'Glen Drake', 'Nic Farra', 'Chris Clarkson', 'Ray Henwood', 'John Nicoll', 'Michael Maxwell', 'Raewyn Pelham', 'Toni Jones', 'Glenys Lloyd-Smith', 'Wendy Watson', 'Jean Guérin', 'Stephen Reilly', 'Andrea Sanders', 'Ben Fransham', 'Jessica Bradley', 'Alex Shirtcliffe-Scott', 'Barry Thomson', 'Peter Jackson']","['friendship', 'fantasy', 'crime']",Peter Jackson
6879,6879,11217,Club Dread,2004-02-27,5001655,104,False,8500000,When a serial killer interrupts the fun at the swanky Coconut Pete's Coconut Beach Resort -- a hedonistic island paradise for swingers --- it's up to the club's staff to stop the violence ... or at least hide it!,13.347,/9slWyVotwxZNthMcKoeFaK3tgNz.jpg,"['Comedy', 'Horror']","island, machete, beautiful woman, serial killer, slasher spoof, murder hunt",2004,"['Kevin Heffernan', 'Jay Chandrasekhar', 'Brittany Daniel', 'Bill Paxton', 'Steve Lemme', 'Jordan Ladd', 'Elena Lyons', 'Paul Soter', 'Erik Stolhanske', 'Tanja Reichert', 'Nat Faxon', 'Julio Bekhor', 'Bryan Scott', 'M.C. Gainey', 'Lindsay Price', 'Samm Levine', 'Veronica Segura', 'Ryan Falkner', 'Greg Cipes', 'Dan Montgomery Jr.', 'Michael Weaver', 'Richard Perello', 'Michael Yurchak', 'Jessica Moreno']","['comedy', 'horror', 'slasher']",Jay Chandrasekhar
