,Unnamed: 0,id,title,release_date,revenue,runtime,adult,budget,overview,popularity,poster_path,genres,keywords,year,actors,emotions,director
5737,5737,50087,Pokémon: Zoroark - Master of Illusions,2010-07-10,0,96,False,0,Ash and his friends must stop a greedy media mogul from using the shape-shifting Zoroark to capture the time-travelling Celebi.,15.791,/tWgH64RZmm2rIHtO2DNnfN3DZa8.jpg,"['Family', 'Animation', 'Adventure', 'Fantasy']","reunion, battle, based on video game, evil plot, anime",2010,"['Rica Matsumoto', 'Ikue Otani', 'Yuji Ueda', 'Megumi Toyoguchi', 'Etsuko Kozakura', 'Megumi Hayashibara', 'Shin-ichiro Miki', 'Inuko Inuyama', 'Unsho Ishizuka', 'Takashi Tsukamoto', 'Natsuki Kato', 'Takanori Jinnai', 'Shoko Nakagawa', 'Koichi Yamadera', 'Yuzuru Fujimoto', 'Ai Satou', 'Kazuya Masuda', 'Romi Park', 'Kurumi Mamiya', 'Katsuyuki Konishi', 'Kenta Miyake', 'Kiyotaka Furushima', 'Rie Kugimiya']","['friendship', 'deception', 'adventure']",Kunihiko Yuyama
5738,5738,9486,Johnny English,2003-03-14,160583018,88,False,40000000,"A lowly pencil pusher working for MI7, Johnny English is suddenly promoted to super spy after Agent One is assassinated and every other agent is blown up at his funeral. When a billionaire entrepreneur sponsors the exhibition of the Crown Jewels—and the valuable gems disappear on the opening night and on English's watch—the newly-designated agent must jump into action to find the thief and recover the missing gems.",15.789,/lx3Y7teA6DaoQ6cIhwzrlnDZpFW.jpg,"['Adventure', 'Action', 'Comedy']","hero, funeral, spy, intelligence, queen, coronation, secret agent, slapstick comedy, spoof, explosion, agent, pen, duringcreditsstinger",2003,"['Rowan Atkinson', 'Natalie Imbruglia', 'Ben Miller', 'John Malkovich', 'Greg Wise', 'Tasha de Vasconcelos', 'Douglas McFerran', 'Steve Nicolson', 'Terence Harvey', 'Kevin McNally', 'Tim Pigott-Smith', 'Nina Young', 'Rowland Davies', 'Philippa Fordham', 'Tim Berrington', 'Simon Bernstein', 'Martin Lawton', 'Neville Phillips', 'Oliver Ford Davies', 'Takuya Matsumoto', 'Peter Tenn', 'Sam Beazley', 'Kevin Moore', 'Faruk Pruti', 'Marc Danbury', 'Jack Raymond', 'Jenny Galloway', 'Haylie Ecker', 'Tania Davis', 'Eos Chater', 'Gay-Yee Westerhoff', 'Chris Tarrant', 'James Greene', 'Clive Graham', 'Trevor McDonald', 'Tina Simmons', 'Philip Harvey']","['clumsiness', 'humor', 'bravery']",Alex Streeter
5739,5739,902,The City of Lost Children,1995-05-17,1738611,108,False,18000000,"A scientist in a surrealist society kidnaps children to steal their dreams, hoping that they slow his aging process.",15.782,/whwT3Q9JxbAYzEc3t7uYYcCbTMf.jpg,"['Fantasy', 'Science Fiction', 'Adventure']","rescue, friendship, island, dream, clone, dystopia, eye, aging, steampunk, childhood, child kidnapping, flea",1995,"['Ron Perlman', 'Dominique Pinon', 'Judith Vittet', 'Daniel Emilfork', 'Jean-Claude Dreyfus', 'Geneviève Brunet', 'Odile Mallet', 'Mireille Mossé', 'Serge Merlin', 'Rufus', 'Ticky Holgado', 'Cris Huerta', 'Jean-Louis Trintignant', 'Joseph Lucien', 'Mapi Galán', 'Briac Barthélémy', 'Pierre-Quentin Faesch', 'Alexis Pivot', 'François Hadji-Lazaro', 'Dominique Bettenfeld', 'Lotfi Yahya Jedidi', 'Thierry Gibault', 'Marc Caro', 'Ham Chau Luong', 'Frankie Pain', 'Enrique Villanueva', 'Dominique Chevalier', 'Lorella Cravotta', 'Éric Houzelot', 'Philippe Beautier', 'Marc Amyot', 'Jean-Philippe Labadie', 'Raphaèle Bouchard', 'Elisabeth Etienne', 'Rachel Boulenger', 'Michel Motu', 'Nane Germon', 'Léo Rubion', 'Guillaume Billod-Morel', 'Bezak', 'Hong Mai Thomas', 'René Pivot', 'Daniel Adric', 'Christophe Salengro', 'René Marquant', 'Michel Smolianoff', 'Lili Cognard', 'Angélique Philibert', 'Marie Piémontèse', 'Antoinette Dias', 'Zak Russomanno', 'Djamila Bouda', 'Lauren Geoffroy', 'Cyril Aubin', 'Bruno Journée', 'Jérémie Freund', 'Joris Geneste', 'Julie Bernard', 'Valentin Simonet', 'Eglantine Blanckaert', 'Gaëtan Bouyala', 'Mickael Bussinger', 'Jonathan Gatinois', 'Joshka Kaufmann', 'Morgan Mariac', 'Caroline Marsily', 'Geoffroy Morange', 'Sébastien Thaissart', 'Charlotte Bienfait', 'Camille Dufeu', 'Robinson Fouille', 'Alysia Hoffeurt', 'Sandy Kontargyris', 'Andrew Laupen', 'Théo Madueno', 'Arthur Mazet', ""Fackry M'Saidie"", 'Gabriel Pierre', 'Bérangère Pivot', 'Charlotte Ribaud-Chevrey', 'Laura Robert', 'Caroline Rochand', 'Carolane Yvan', 'Margot Tostivint', 'Buster Verbraeken', 'Mathieu Kassovitz']","['dreamlike', 'mystery', 'loneliness']",Jean-Pierre Jeunet
5740,5740,13937,Raising Cain,1992-08-07,37170057,92,False,12000000,"When neighborhood kids begin vanishing, Jenny suspects her child psychologist husband, Carter, may be resuming the deranged experiments his father performed on Carter when he was young. Now, it falls to Jenny to unravel the mystery. And as more children disappear, she fears for her own child's safety.",15.781,/5vRn138vnZeUNFe32qTuPGKkVLR.jpg,"['Thriller', 'Crime']","child abuse, kidnapping, detective, attempted murder, swamp, flashback, psychologist, hospital, evil twin, hypnotism, multiple personality",1992,"['John Lithgow', 'Lolita Davidovich', 'Steven Bauer', 'Frances Sternhagen', 'Gregg Henry', 'Tom Bower', 'Mel Harris', 'Teri Austin', 'Gabrielle Carteris', 'Barton Heyman', 'Amanda Pombo', 'Kathleen Callan', 'Ed Hooks', 'Karen Kahn', 'Noe Montoya', 'Riq Boogie Espinoza', 'Carolyn Morrell', 'W. Allen Taylor', 'Scott Townley', 'Mary Uhland', 'Steve Schill', 'James Van Harper']","['paranoia', 'madness', 'confusion']",Brian De Palma
5741,5741,2294,Jay and Silent Bob Strike Back,2001-08-22,33788161,104,False,22000000,"When Jay and Silent Bob learn that their comic-book alter egos, Bluntman and Chronic, have been sold to Hollywood as part of a big-screen movie that leaves them out of any royalties, the pair travels to Tinseltown to sabotage the production.",15.781,/aEsAdMAhwKYFgnHHxMOknktQYKK.jpg,['Comedy'],"experiment, movie business, comic book, breaking the fourth wall, self mocking, monkey actor, gigantic hand",2001,"['Jason Mewes', 'Kevin Smith', 'Ben Affleck', 'Shannon Elizabeth', 'Eliza Dushku', 'Ali Larter', 'Jennifer Schwalbach Smith', 'Will Ferrell', 'Chris Rock', 'Jason Lee', ""Brian O'Halloran"", 'Jeff Anderson', 'Judd Nelson', 'George Carlin', 'Carrie Fisher', 'Seann William Scott', 'Matt Damon', 'Jon Stewart', 'Jules Asner', 'Steve Kmetko', 'Tracy Morgan', 'Gus Van Sant', 'Jamie Kennedy', 'Wes Craven', 'Shannen Doherty', 'Mark Hamill', 'Amy Noble', 'Harley Quinn Smith', 'Ever Carradine', 'Brian Andrew Saible', 'Gavin Brooks', 'John Willyung', 'Jake Richardson', 'Nick Fellinger', 'Vincent Pereira', ""Ernest O'Donnell"", 'Tango', 'Marc Blucas', 'Matthew James', 'Jane Silvia', 'Carmen Llywelyn', 'Dan Etheridge', 'Eric Winzenried', 'Jonathan Gordon', 'John Maynard', 'Robert Holtzman', 'Tom Dorfmeister', 'Joe Quesada', 'Diedrich Bader', 'Scott Mosier', 'James J. McLauchlin', 'Joseph D. Reitman', 'Paul Dini', 'Quentin Wright', 'Greg Owen', 'Ralph B. Meyer', 'Bryan Johnson', 'Walt Flanagan', 'Renée Humphrey', 'Joey Lauren Adams', 'Dwight Ewell', 'Alanis Morissette', 'Morris Day', 'Jerome Benton', 'Garry Johnson', 'Monte Moir', 'Torrell Ruffin', 'Ricky Smith', 'Jason Biggs', 'Greg Bronson', 'Thomas Burke', 'William B. Davis', 'Alice Dinnean', 'Stephanie Entin', 'Dennyann Giambrone', 'Aytl Jensen', 'Mark Steven Johnson', 'Zak Knutson', 'Brian Lynch', 'David Mandel', 'Art Oughton', 'Derek Raser', 'Bob Schreck', 'Scott Sener', 'John Strand', 'James Van Der Beek', 'Nicole Vanderhoff', 'Scott William Winters']","['humor', 'rebellion', 'absurdity']",Kevin Smith
5742,5742,12651,Memphis Belle,1990-09-07,0,107,False,23000000,"The ""Memphis Belle"" is a World War II bomber, piloted by a young crew on dangerous bombing raids into Europe. The crew only have to make one more bombing raid before they have finished their duty and can go home. In the briefing before their last flight, the crew discover that the target for the day is Dresden, a heavily-defended city that invariably causes many Allied casualties",15.78,/epsraI4swsSu9Fyefj7vPPhsOHK.jpg,"['Drama', 'War', 'Action']","world war ii, bomber, u.s. air force, danger of life, soldier, military airplane, heroic mission, flying fortress, nazi germany",1990,"['Matthew Modine', 'Eric Stoltz', 'Tate Donovan', 'D. B. Sweeney', 'Billy Zane', 'Sean Astin', 'Harry Connick Jr.', 'Bradley Lavelle', 'Reed Diamond', 'Courtney Gains', 'Neil Giuntoli', 'David Strathairn', 'John Lithgow', 'Jane Horrocks', 'Ben Browder', 'Steven Mackintosh', 'Martin McDougall', 'Morag Siller', 'Mac McDonald', 'Jodie Brooke Wilson', 'Keith Edwards']","['camaraderie', 'courage', 'tension']",Michael Caton-Jones
5743,5743,34421,The Perfect Weapon,1991-03-15,14061361,83,False,10000000,"Jeff, a young delinquent, is enrolled by his father in a kenpo school, in the hopes of teaching the boy some self-discipline. Years later, Jeff's mentor, Kim, is being threatened by one of the Korean mafia families. Jeff tries to help his old friend, but is too late to prevent Kim's death at the hands of an unknown hitman. Vowing revenge, Jeff takes on all of the families, using his martial arts skills to find the man who killed his friend.",15.777,/ap9Ppr0IeJ0t9VCIru9syZrrNmc.jpg,"['Action', 'Drama', 'Crime']",,1991,"['Jeff Speakman', 'John Dye', 'Mako', 'James Hong', 'Mariska Hargitay', 'Dante Basco', 'Beau Starr', 'Seth Sakai', 'Professor Toru Tanaka', 'Clyde Kusatsu', 'Cary-Hiroyuki Tagawa', 'Craig Ng', 'John Koyama', 'Roger Yuan', 'Shaun Shimoda', 'Yoshimi Imai', 'Ralph Ahn', 'Troy Fromin', 'Leland Sun', 'James Lew', 'Ray Sua', 'Leo Lee', 'Chris Tashima', 'Bill Saito', 'Al Leong', 'Branscombe Richmond', 'Jeff Imada', 'Carl Ciarfalio', 'Philip Tan', 'Thomas Rosales Jr.', 'Gary Price', 'Al Goto', 'Will Leong', 'Tom Hermann', 'Micah Roberts', 'Ryan Bohannon', 'Justin Webb', 'Nikki Feemster', 'Cha Cha Sandoval-McMahon', 'Don Pulford', 'Al Jones', 'Tom Elliott', 'Francine Lee', 'Phil Chong', 'Roger Ito', 'Simone Boisseree', 'Lou Voiler', 'Alan Stock', 'Mark DiSalle', 'Cole S. McKay', 'Greg Landerer', 'Robert Apisa', 'Gregory J. Barnett', 'Kenny Endoso', 'Ken Hanes', 'Mario Roberts']","['discipline', 'revenge', 'action']",Mary Elizabeth Gentle
5744,5744,59387,The Powerpuff Girls Movie,2002-07-03,16426471,74,False,11000000,"Based on the hit animated television series, this feature film adaptation tells the story of how Blossom, Bubbles and Buttercup - three exuberant young girls - obtain their unique powers, become superheroes and join forces to foil evil mutant monkey Mojo Jojo's plan to take over the world.",15.775,/qWiiB9RFKQSF4tpG2NWnZ0gjB9Q.jpg,"['Animation', 'Action', 'Family']","martial arts, experiment, professor, superhero, cartoon, kindergarten, sister, prequel, female protagonist, monkey, urban setting, super power, heroine, super villain, good versus evil, based on tv series",2002,"['Cathy Cavadini', 'Tara Strong', 'E. G. Daily', 'Roger L. Jackson', 'Tom Kane', 'Tom Kenny', 'Jennifer Hale', 'Jennifer Martin', 'Jeff Bennett', 'Grey DeLisle', 'Phil LaMarr', 'Rob Paulsen', 'Kevin Michael Richardson', 'Frank Welker']","['bravery', 'identity', 'teamwork']",Mike Moon
5745,5745,10052,Dragonfly,2002-02-22,52322400,104,False,60000000,A grieving doctor is being contacted by his late wife through his patient's near death experiences.,15.773,/oMRyQniB5ESA4DoyJVLVJifSExB.jpg,"['Thriller', 'Fantasy']","pregnancy, car crash, dragonfly, jungle, hospital, doctor, humanitarian, spiritism",2002,"['Kevin Costner', 'Joe Morton', 'Ron Rifkin', 'Susanna Thompson', 'Kathy Bates', 'Jacob Smith', 'Robert Bailey Jr.', 'Jay Thomas', 'Lisa Banes', 'Matt Craven', 'Leslie Hope', 'Kim Staunton', 'Liza Weil', 'Nigel Gibbs', 'Casey Biggs', 'Heidi Swedberg', 'Mary Beth Fisher', 'Jamie Sue Sherrill', 'Samantha Smith', 'Peter Hansen', ""Deirdre O'Connell"", 'Justina Machado', 'Linda Hunt', 'David Doty', 'Jacob Vargas']","['loss', 'mystery', 'faith']",Tom Shadyac
5746,5746,177,The Fisher King,1991-09-20,41895491,138,False,24000000,Two troubled men face their terrible destinies and events of their past as they join together on a mission to find the Holy Grail and thus to save themselves.,15.773,/7WfXoh6bWHz2Wu5Bt9oT8QDDgiW.jpg,"['Comedy', 'Drama']","homeless person, unsociability, holy grail, sense of guilt, loss of loved one, cynic, gun rampage, talk show, suppressed past, yuppie, forgiveness, legend, self-discovery, housebreaking, mental illness",1991,"['Robin Williams', 'Jeff Bridges', 'Amanda Plummer', 'Mercedes Ruehl', 'Michael Jeter', 'William Jay Marshall', 'Chris Howell', 'Adam Bryant', 'Paul Lombardi', 'David Hyde Pierce', 'Ted Ross', 'Lara Harris', 'Warren Olney', 'Frazer Smith', 'Kathy Najimy', 'Harry Shearer', 'Melinda Culea', 'James Remini', 'Mark Bowden', 'John Ottavino', 'Brian Michaels', 'Jayce Bartok', 'Dan Futterman', 'Bradley Gregg', 'William Preston', 'Al Fann', 'Stephen Bridgewater', 'John Heffernan', 'Richard LaGravenese', 'Anita Dangler', 'Mark Bringelson', 'Johnny Paganelli', 'Diane Robin', 'Benjamin Redman', 'Lisa Blades', 'Christian Clemenson', 'Carlos Carrasco', 'Joe Jamrog', 'John de Lancie', 'Lou Hancock', 'Caroline Cromelin', 'Kathleen Bridget Kelly', 'Pat Fraley', 'Mel Bourne', 'Kristen Connors', 'Jack Mulcahy', 'Tom Waits', ""Craig 'Radio Man' Castaldo""]","['redemption', 'madness', 'friendship']",Terry Gilliam
5747,5747,13969,First Daughter,2004-09-24,0,105,False,30000000,"Samantha MacKenzie, the daughter of the president of the United States, arrives at college with a group of Secret Service agents. Samantha, however, resents their presence and decides she wants to attend school just like a normal student. Her father agrees to recall the agents but secretly assigns James, an undercover agent, to pose as a student. They fall in love, but their romance is jeopardized when Samantha learns James' true identity.",15.767,/iUZ3hDMo8SGY2IoujCKwVt8ukm9.jpg,"['Family', 'Comedy', 'Drama', 'Romance']","daughter, usa president, undercover, college, romantic comedy, first lady, lying, young adult, u.s. secret service agent, overprotective father",2004,"['Katie Holmes', 'Marc Blucas', 'Amerie', 'Michael Keaton', 'Margaret Colin', 'Lela Rochon', 'Michael Milhoan', 'Dwayne Adway', 'Hollis Hill', 'Ken Moreno', 'Andrew Caple-Shaw', 'Alex Avant', 'Barry Livingston', 'Piper Cochrane', 'Adam Donshik', 'Damon Whitaker', 'Steve Tom', 'Peter White', 'Parry Shen', 'Johnny Sneed', 'Marilyn McIntyre', 'Ryan Raddatz', 'Toby Moore', 'Freddy Bouciegues', 'Austin Priester', 'Scott Hamm Duenas', 'Philip Boyd', 'Katrina Connor', 'Natalie Core', 'Teck Holmes', 'Sophia Chang', 'Justine Wachsberger', 'Andrea Avery', 'Sheila Shaw', 'Ann Ryerson', 'Andy Umberger', 'Mane Andrew', 'Jeff Michael', 'Kent Shocknek', 'Maria Quiban', 'Ted Garcia', 'Tim Liles', 'Dan Brinkle', 'Michael Connor', 'Nicole Avant', 'Brian A. Smith', 'Tore Birkedal', 'Gunther Jensen', 'Vera Wang', 'Joan Rivers', 'Melissa Rivers', 'Jay Leno', 'Forest Whitaker', 'Sonnet Noel Whitaker', 'Ashlee Gillespie', 'Molly Howe', 'Ryan Izay', 'Chuck Murphy', 'Janet Dey', 'Bobbi Page']","['independence', 'romance', 'youth']",
5748,5748,192712,Kite,2014-06-13,0,90,False,0,"When Sawa's mother and policeman father are found victims of a grisly double homicide, she begins a ruthless pursuit for the man who murdered them. With the help of her father's ex-partner, Karl Aker, and a mysterious friend from her past, she becomes a merciless teen assassin, blasting her way through the dark world of human trafficking only to uncover a devastating truth",15.76,/dnbzXOrqQqlnklpIvQZM4qPzi5R.jpg,"['Drama', 'Action']","neo-noir, based on anime, live action remake",2014,"['Samuel L. Jackson', 'Callan McAuliffe', 'India Eisley', 'Carl Beukes', 'Jaco Muller', 'Terence Bridgett', 'Zane Meas', 'Deon Lotz', 'DeVille Vannik', 'Russel Savadier', 'Cassiel Eatock-Winnik', 'Liam J. Stratton', 'Annabel Linder', 'Christina Storm', 'Jane Van Der Westhuizen', 'Kenneth Nta', 'Craig Macrae', 'Jody Abrahams', 'Danny Keogh', 'Steinman Goosen', 'Jolene Martin', 'Matthew Van Leeve', 'Cleo Rinkwest', 'Sabeehah Tagari', 'Louw Venter', 'Osvaldo Rodriques', 'Adrianna Cottino', 'Santos Viera Flores', 'Aimy-Lee Braaf', 'Leroy Gopal', 'Innes Maas', 'Ian Stock', 'Lionel Newton']","['revenge', 'trauma']",Ralph Ziman
5749,5749,345235,Monk Comes Down the Mountain,2015-07-03,0,113,False,0,"When a young monk is forced to leave his impoverished monastery, he relies on his extraordinary martial arts skills to survive in the outside world. In search of a mentor, he crosses paths with a Kung Fu master who is in possession of the Book of Secrets, which reveals the lost art of the deadly Ape Strike Kung Fu technique. The rare book is coveted by a sinister father and son who will go to any extremes to obtain it. The monk finds himself immersed in a deadly battle to protect both the book and his master.",15.759,/eS2wMBnOCBUB3g58andUYIVkICF.jpg,"['Action', 'Comedy']",,2015,"['Wang Baoqiang', 'Li Xuejian', 'Fan Wei', 'Lin Chi-Ling', 'Vanness Wu', 'Danny Chan Kwok-Kwan', 'Wang Xueqi', 'Aaron Kwok', 'Dong Qi', 'Tian Zhuangzhuang', 'Yuen Wah', 'Chang Chen', 'Lam Suet', 'Jaycee Chan', 'Chen Ran', 'Xie Ning', 'Jiang Shimeng', 'Huang Fei', 'Tiger Chen Hu', 'Zhang Yilong']","['humor', 'wisdom', 'journey']",Chen Kaige
5750,5750,8952,I Love You Phillip Morris,2009-01-18,20768906,98,False,13000000,"Steve Russell is a small-town cop. Bored with his bland lifestyle, Russell turns to fraud as a means of shaking things up. Before long, Russell's criminal antics have landed him behind bars, where he encounters the charismatic Phillip Morris. Smitten, Russell devotes his entire life to being with Morris regardless of the consequences.",15.758,/qtAuWLGQ7N4PNQ6boZeqqoUY2l9.jpg,"['Comedy', 'Crime', 'Drama', 'Romance']","small town, miami, florida, judge, con man, fraud, insurance fraud, car crash, jail, lgbt, white collar criminal, 1990s, gay theme, gay relationship",2009,"['Jim Carrey', 'Ewan McGregor', 'Leslie Mann', 'Rodrigo Santoro', 'Brennan Brown', 'Nicholas Alexander', 'Tony Bentley', 'Michael Beasley', 'Sean Boyd', 'Marcus Lyle Brown', 'Ana Villafañe', 'Annie Golden', 'Marylouise Burke', 'David Jensen', 'Dameon Clarke', 'Clay Chamberlin', 'Louis Herthum', 'Morgana Shaw', 'Joe Chrest', 'Griff Furst', 'DeVere Jehl', 'Michael Showers', 'Beth Burvant', 'Ladson Deyne', 'Kennon Kepper', 'Andrew Sensenig', 'David Stanford', 'Maureen Brennan', 'Miriam Cruz', 'Tommy Davis', 'Geraldine Glenn', 'Liann Pattison', 'Kathrin Middleton', 'Aunjanue Ellis-Taylor', 'Michael Mandell', 'Antoni Corone']","['love', 'deception', 'freedom']",Stephen E. Hagen
5751,5751,338766,Hell or High Water,2016-08-11,37589296,102,False,12000000,A divorced dad and his ex-con brother resort to a desperate scheme in order to save their family's farm in West Texas.,15.749,/ljRRxqy2aXIkIBXLmOVifcOR021.jpg,"['Western', 'Crime', 'Drama']","brother, bank robber, road trip, gun battle, police officer killed, criminal, bank robbery, held at gunpoint, car fire, cowboy, small western town, neo-western, divorced father, bullet hole",2016,"['Jeff Bridges', 'Chris Pine', 'Ben Foster', 'Gil Birmingham', 'Marin Ireland', 'Kevin Rankin', 'Dale Dickey', 'William Sterchi', 'Kristen Berg', 'Katy Mixon', 'Buck Taylor', 'Keith Meriweather', 'Amber Midthunder', 'Jackamoe Buzzell', 'Joe Berryman', 'Taylor Sheridan', 'Howard Ferguson Jr.', 'Debrianna Mansini', 'Paul Howard Smith', 'Nathaniel Augustson', 'Ariel Holmes', 'Marie A. Kohl', 'Jim Burleson', 'Gregory Cruz', 'Melanie Papalia', 'Kim Gleason', 'Alma Sisneros', 'Margaret Bowman', 'Ivan Brutsche', 'John-Paul Howard', 'Kevin Wiggins', 'Dylan Kenin', 'Nicole Brady', 'Dick Christie', 'Heidi Sulzman', 'Christopher W. Garcia', 'Richard Beal', 'Crystal Gonzales', 'Ricky Lee', 'Lora Martinez-Cunningham', 'Martin Palmer', 'Terry Dale Parks', 'J. Nathan Simmons', 'Danny Winn', 'Rick Anglada']","['desperation', 'family', 'justice']",David Mackenzie
5752,5752,10692,Henry: Portrait of a Serial Killer,1986-09-24,0,83,False,111000,"Henry likes to kill people, in different ways each time. Henry shares an apartment with Otis. When Otis' sister comes to stay, we see both sides of Henry: ""the guy next door"" and the serial killer.",15.747,/yIvaGoLc95R4noKPjfTYUvuV7qp.jpg,"['Crime', 'Horror', 'Thriller']","chicago, illinois, prostitute, rape, psychopath, sadistic, biography, based on true story, sister, murder, serial killer, killing spree, incest",1986,"['Michael Rooker', 'Tracy Arnold', 'Tom Towles', 'Mary Demas', 'Anne Bartoletti', 'Elizabeth Kaden', 'Ted Kaden', 'Denise Sullivan', 'Anita Ores', 'Megan Ores', 'Cheri Jones', ""Monica Anne O'Malley"", 'Bruce Quist', 'Erzsebet Sziky', 'David Katz', 'John Scafidi', 'Benjamen Passman', 'Flo Spink', 'Kurt Naebig', 'Kristin Finger', 'Lily Monkus', 'Ray Atherton', 'Eric Young', 'Rick Paul', 'Peter Van Wagner', 'Tom McKearn', 'Frank Coranado', 'Lisa Temple', 'Brian Graham', 'Sean Ores', 'Pamela Fox', 'Waleed B. Ali', 'Donna Dunlap']","['horror', 'detachment', 'disturbance']",John McNaughton
5753,5753,12689,"Angus, Thongs and Perfect Snogging",2008-07-25,14924998,100,False,0,"Georgia Nicolson is fourteen, lives with nosey parents who don't understand her, an annoying three year old sister and has to wear a beret to school. She would, however, rather be blonde, have a smaller nose and a boyfriend. Revolving around her hilarious journal entries, prepare to be engulfed in the world of the soaring joys and bottomless angst of being a teenager.",15.745,/3WLMr49X84qGiFn1pkCyhS5SEBZ.jpg,"['Comedy', 'Drama', 'Family', 'Romance']","puberty, adolescence, based on novel or book, becoming an adult, parent child relationship, move, precocity, coming of age, snogging, woman director, based on young adult novel",2008,"['Georgia Groome', 'Eleanor Tomlinson', 'Aaron Taylor-Johnson', 'Tommy Bastow', 'Alan Davies', 'Karen Taylor', 'Liam Hess', 'Georgia Henshaw', 'Manjeeven Grewal', 'Kimberley Nixon', 'Ingrid Oliver', 'Sean Bourke', 'Steve Jones', 'Imogen Bain', 'Eva Drew', 'Lizzie Roper', 'Heather Wright', 'Matt Brinkler', 'Jason Ramsey', 'Emma Tierney', 'Natasha Tierney', 'Augustina Amoa']","['awkwardness', 'coming-of-age', 'crush']",Gurinder Chadha
5754,5754,38843,Ramona and Beezus,2010-07-23,27293743,103,False,15000000,"Ramona is a little girl with a very big imagination and a nose for mischief. Her playful antics keep everyone in her loving family on their toes, including her older sister Beezus, who's just trying to survive her first year of high school. Through all the ups and downs of childhood, Ramona and Beezus learn that anything's possible when you believe in yourself and rely on each other.",15.744,/nBdwz67TKj9HDwpSxnCKIkXCQkp.jpg,"['Comedy', 'Family']","sibling relationship, parent child relationship, aunt niece relationship, duringcreditsstinger, woman director",2010,"['Joey King', 'Selena Gomez', 'John Corbett', 'Bridget Moynahan', 'Ginnifer Goodwin', 'Josh Duhamel', 'Sandra Oh', 'Hutch Dano', 'Sierra McCormick', 'Jason Spevack', 'Kathryn Zenna', 'Janet Wright', 'Ruby Curtis', 'Patti Allan', 'Garnet Harding', 'Andrew McNee', 'Tom Pickett', 'Lynda Boyd', 'George C. Wolfe', 'Nancy Robertson', 'Eileen Barrett', 'Donnelly Rhodes', 'Brandi Alexander', 'Taylor Hickson']","['joy', 'imagination', 'family']",Elizabeth Allen Rosenbaum
5755,5755,14695,Havoc,2005-10-16,0,85,False,9000000,"A wealthy Los Angeles teen and her superficial friends wants to break out of suburbia and experience Southern California's ""gangsta"" lifestyle. But problems arise when the preppies get in over their heads and provoke the wrath of a violent Latino gang. Suddenly, their role-playing seems a little too real.",15.744,/r4yMNUroIjxDz8T7zOZWUobQtta.jpg,"['Crime', 'Drama']","high school, hip-hop, street gang, upper class, fight, gun, gangster, underage drinking, marijuana, east los angeles, lingerie, gang rape, suburb, drugs, rebellious youth, inner city, hispanic, bonfire, voyeurism, wild party, gang violence, privileged life, woman director, pacific palisades, sex game, video camera, teenager, violence",2005,"['Anne Hathaway', 'Bijou Phillips', 'Shiri Appleby', 'Michael Biehn', 'Joseph Gordon-Levitt', ""Matt O'Leary"", 'Freddy Rodríguez', 'Laura San Giacomo', 'Mike Vogel', 'Raymond Cruz', 'Alexis Dziena', 'Channing Tatum', 'Sam Hennings', 'Cecilia Peck', 'Josh Peck', 'J. D. Pardo', 'Terri Hanauer', 'Sam Bottoms', 'Jocelyn Towne', 'Jillian McWhirter', 'Laura Breckenridge', 'Alysia Joy Powell', 'Jon Erik', 'Tammy Trull', 'Jossara Jinaro', 'Richard Pagano', 'Angela Meryl', 'John Morrissey', 'Laurel Parmet']","['rebellion', 'identity', 'danger']",Barbara Kopple
