,Unnamed: 0,id,title,release_date,revenue,runtime,adult,budget,overview,popularity,poster_path,genres,keywords,year,actors,emotions,director
5756,5756,10750,Toy Soldiers,1991-04-24,15073942,112,False,0,"After federal agents arrest a drug czar and put him on trial, the cartel leader's vicious son storms a prep school and takes its students hostage. They rebel against the armed intruders and try to take back their academy by any means necessary.",15.74,/nL3ccvqU1Wq1j31feHWAydzpbr2.jpg,"['Action', 'Adventure', 'Thriller']","high school, hostage-taking, terrorism, preparatory school",1991,"['Sean Astin', 'Wil Wheaton', 'Keith Coogan', 'Andrew Divoff', 'R. Lee Ermey', 'Mason Adams', 'Denholm Elliott', 'Louis Gossett Jr.', 'George Perez', 'T.E. Russell', 'Shawn Phelan', 'Michael Champion', 'Tracy Brooks Swope', 'Max Manwell', 'Joe Inscoe', 'Jerry Lyden', 'René Gatica', 'Jeremiah McLerran', 'Jesse Doran', 'Stan Kelly', 'Carole Shoemaker', 'Adam Bonifant', 'Mark Retz', 'Paul Sincoff', 'Richard Travis', 'Janet Lee Orcutt', 'Knowl Johnson', 'Rafael H. Robledo', 'Tom Trigo', 'Jerry Valdez', 'Russell Gannon', 'Richard Warner', 'Chris Northup', 'Joe Banks', 'Rick Warner', 'Sarah Stavrou', 'David Norris', 'Todd Bonifant', 'Mike Rogerson', 'Grady Weatherford', 'Darrell Elmore', 'Dennis Hunsinger', 'Cliff McLaughlin', 'Brian Williams', 'Jeff Ramsey', 'Nick Dimitri', 'Mark Brutsche', 'Cynthia Hayden', 'Denise Gordy', 'Michael Stephen Costello', 'Mimi Eisman', 'Lenny Steinline', 'Lloyd T. Williams', 'Jeremy Caplan', 'Roy Borden', 'John Shaw', 'Jerry Orbach']","['bravery', 'friendship', 'terror']",Michael D. Moore
5757,5757,13761,Pocahontas II: Journey to a New World,1998-08-04,0,72,False,0,"When news of John Smith's death reaches America, Pocahontas is devastated. She sets off to London with John Rolfe, to meet with the King of England on a diplomatic mission: to create peace and respect between the two great lands. However, Governor Ratcliffe is still around; he wants to return to Jamestown and take over. He will stop at nothing to discredit the young princess.",15.737,/gAnmNjw1TCTzS702mj1OwwmXBpM.jpg,"['Family', 'Adventure', 'Animation', 'Romance']","native american, sequel, 17th century",1998,"['Billy Zane', 'Irene Bedard', 'Jim Cummings', 'David Ogden Stiers', 'Linda Hunt', 'Judy Kuhn', 'Jeff Bennett', 'Jean Stapleton', 'Donal Gibson', 'Finola Hughes', 'Russell Means', 'Brad Garrett', 'Gregg Rainwater', 'William Morgan Sheppard', 'Kath Soucie', 'Rob Paulsen', 'Frank Welker', 'April Winchell', 'John Kassir', 'Michelle St. John']","['love', 'exploration', 'conflict']",Bradley Raymond
5758,5758,12715,Firewalker,1986-11-21,11949484,104,False,0,A pair of adventurers try to track down an ancient Aztec/Mayan/Egyptian/Apache horde of gold.,15.735,/v8DC9qUY6KNF4tqYq7agbwFqR78.jpg,"['Action', 'Adventure', 'Comedy']","gold, treasure, martial arts, temple, secret passage, voodoo, wretch, treasure hunt, human sacrifice, jungle, soldier, drinking, central america, disguise, catfight, pretty woman, mexica (aztec), wisecrack humor, buddy comedy, adventurer, bar fight, lost in the desert, woman in peril",1986,"['Chuck Norris', 'Louis Gossett Jr.', 'Melody Anderson', 'Will Sampson', 'Sonny Landham', 'John Rhys-Davies', 'Ian Abercrombie', 'Richard Lee-Sung', 'Zaide Silvia Gutiérrez', 'Álvaro Carcaño', 'John Hazelwood', 'José Escandón', 'Mario Arévalo', 'Miguel Ángel Fuentes', 'Robert Wall', 'Branscombe Richmond']","['adventure', 'humor', 'greed']",J. Lee Thompson
5759,5759,14114,You Got Served,2004-01-30,0,95,False,0,"At Mr. Rad's Warehouse, the best hip-hop crews in Los Angeles compete for money and respect. But when a suburban crew crashes the party, stealing their dancers - and their moves - two warring friends have to pull together to represent the street. Starring hip-hop sensations Marques Houston, Omari Grandberry, Lil' Kim and comedian Steve Harvey.",15.729,/nFwT3QisWFQa3Wlfnw1gC458xJn.jpg,"['Music', 'Drama']","dance, hip-hop, dance performance, breakdance, musical",2004,"['Marques Houston', 'Omarion', 'J-Boog', ""Lil' Fizz"", 'Jennifer Freeman', 'Meagan Good', 'Raz B', 'Michael Taliferro', 'Steve Harvey', ""Lil' Kim"", 'La La Anthony', 'Malcolm David Kelley', 'Wade Robson', 'Alison Faulk', 'Teresa Espinosa', 'Marty Dew', 'Christopher Jones', 'Jackée Harry', 'Jarell Houston', 'Jerome Jones', 'Robert Hoffman', 'Tanee McCall']","['competition', 'friendship', 'pride']",Chris Stokes
5761,5761,145221,Monsters: Dark Continent,2014-10-09,0,119,False,0,"Seven years on from the events of Monsters, and the ‘Infected Zones’ have spread worldwide. Humans have been knocked off the top of the food chain, with disparate communities struggling for survival. American soldiers are being sent abroad to protect US interests from the Monsters, but the war is far from being won.",15.724,/sQ3uSRb0wrgJf9sWc8LxYbnqltC.jpg,"['Thriller', 'Drama', 'Science Fiction']","monster, post-apocalyptic future, sequel, alien, alien invasion, infected",2014,"['Johnny Harris', 'Sam Keeley', 'Joe Dempsie', 'Kyle Soller', 'Nicholas Pinnock', 'Parker Sawyers', 'Sofia Boutella', 'Michaela Coel', 'Jesse Nagy', 'Uriel Emil Pollack', 'Philip Arditti', 'Jacqueline Hicks', 'Amanda Kaspar', 'Donna-Marie Foster']","['despair', 'war', 'hopelessness']",Tom Green
5762,5762,3784,Frankie and Johnny,1991-10-11,22773535,118,False,29000000,"When Johnny is released from prison following a forgery charge, he quickly lands a job as a short-order cook at a New York diner. Following a brief fling with waitress Cora, Frankie develops an attraction for Cora's friend and fellow waitress Frankie. While Frankie resists Johnny's charms initially, she eventually relents when her best friend, Tim, persuades her to give Johnny a chance.",15.721,/zSOh7hriX4mQNVxhCz1yVY4aykn.jpg,"['Drama', 'Romance', 'Comedy']","new york city, waitress, ex-detainee, cooking, restaurant, diner, greek, love, city life",1991,"['Al Pacino', 'Michelle Pfeiffer', 'Héctor Elizondo', 'Nathan Lane', 'Jane Morris', 'Kate Nelligan', 'Greg Lewis', 'Al Fann', 'Glenn Plummer', ""Sean O'Bryan"", 'Fernando López', 'Ele Keats', 'Phil Leeds', 'K Callan', 'Shannon Wilcox', 'Harvey Miller', 'Tim Hopper', 'Robert Ball', 'Terri Sigrist', 'Lori Sigrist', 'Al Sapienza', 'Lorna Thayer', 'Calvin Jung', 'Dedee Pfeiffer', 'Scott Marshall']","['romance', 'insecurity', 'vulnerability']",
5763,5763,9975,Curious George,2006-02-10,69834815,87,False,50000000,"When The Man in the Yellow Hat befriends Curious George in the jungle, they set off on a non-stop, fun-filled journey through the wonders of the big city toward the warmth of true friendship.",15.718,/aGHC2lVMJtCwH6L40K5QnMeNIds.jpg,"['Adventure', 'Animation', 'Comedy', 'Family']","hat, africa, museum, human animal relationship, product placement, balloon, jungle, based on children's book, monkey, family, prediction, cargo ship, curiosity, natural history museum, animal protagonist",2006,"['Will Ferrell', 'Drew Barrymore', 'David Cross', 'Eugene Levy', 'Joan Plowright', 'Dick Van Dyke', 'Frank Welker', ""Ed O'Ross"", 'Michael Chinyamurindi', 'Michael Sorich', 'Billy West', 'Jeff Bennett', 'Kath Soucie', 'Clint Howard', 'Shane Baumel', 'Timyra-Joi Beatty', 'Christopher Chen', 'Jessie Flower', 'Alexander Gould', 'Terrence Hardy Jr.', 'Hailey Noelle Johnson', 'Kelsey Lansdowne', 'Ariel Winter', 'Kimberly Brooks', 'Wendy Cutler', ""Joey D'Auria"", 'Richard Epcar', 'Treva Etienne', 'Eddie Frierson', 'Donald Fullilove', 'Philip Maurice Hayes', 'Bridget Hoffman', 'Rif Hutton', 'Steve Kehela', 'Grier King', 'Donna Lynn Leavy', 'Nadia Lewis', 'John Mariano', 'Caitlin McKenna', 'Kerry Michele', 'Juan Pope', 'Jonny Solomon', 'Mandy Fabian', 'Fred Tatasciore']","['fun', 'curiosity', 'innocence']",Matthew O'Callaghan
5764,5764,13380,One Magic Christmas,1985-11-22,13677222,88,False,0,"Ginny Grainger, a young mother, rediscovers the joy and beauty of Christmas, thanks to the unshakable faith of her six-year-old daughter Abbie and Gideon, Ginny's very own guardian angel.",15.717,/we2KnPBOlQTyZhZtrGLCBlHZG21.jpg,"['Family', 'Fantasy']","parent child relationship, holiday, christmas",1985,"['Mary Steenburgen', 'Gary Basaraba', 'Elisabeth Harnois', 'Arthur Hill', 'Wayne Robson', 'Jan Rubeš', 'Elias Koteas', 'Robbie Magwood', 'Michelle Meyrink', 'Harry Dean Stanton', 'Sarah Polley', 'Graham Jarvis', 'Timothy Webber', 'Joy Thompson', 'John Friesen', 'Debra McGrath', 'Julie Beaulieu', 'Geremy Dingle', 'Jane Schoettle', 'Damir Andrei', 'Amah Harris', 'Rita Tuckett', 'Sam Malkin', 'Gareth Bennett', 'Alf Humphreys', 'Robin McCulloch', 'Rodger Barton', 'John E. Johnson', 'Gary Bush', 'Robert King', 'Genevieve Appleton']","['hope', 'loss', 'redemption']",Phillip Borsos
5765,5765,10533,The Scarlet Letter,1995-10-13,10382407,135,False,50000000,"Set in puritanical Boston in the mid 1600s, the story of seamstress Hester Prynne, who is outcast after she becomes pregnant by a respected reverend. She refuses to divulge the name of the father, is ""convicted"" of adultery and forced to wear a scarlet ""A"" until an Indian attack unites the Puritans and leads to a reevaluation of their laws and morals.",15.716,/8gIU7O3oV6NyWUjlL6ppbpnIZLW.jpg,"['Drama', 'Romance', 'Western']","based on novel or book, boston, massachusetts, pregnancy, witch burning, puritan, period drama, extramarital affair, 17th century",1995,"['Demi Moore', 'Gary Oldman', 'Robert Duvall', 'Robert Prosky', 'Edward Hardwicke', 'Joan Plowright', 'Roy Dotrice', 'Larissa Laskin', 'Amy Wright', 'Dana Ivey', 'Lisa Andoh', 'Sarah Campbell', 'Line Pelletier']","['guilt', 'judgment', 'forbidden love']",Roland Joffé
5766,5766,4244,The Kid,2000-07-07,110317580,104,False,65000000,"Powerful businessman Russ Duritz is self-absorbed and immersed in his work. But by the magic of the moon, he meets Rusty, a chubby, charming 8-year-old version of himself who can't believe he could turn out so badly – with no life and no dog. With Rusty's help, Russ is able to reconcile the person he used to dream of being with the man he's actually become.",15.715,/jNfL8De5IDVIuUYsrNnmPxCQkz8.jpg,"['Fantasy', 'Comedy', 'Family']","age difference, midlife crisis, suppressed past, changing the past or future",2000,"['Bruce Willis', 'Spencer Breslin', 'Emily Mortimer', 'Lily Tomlin', 'Jean Smart', 'Chi McBride', 'Daniel von Bargen', 'Dana Ivey', 'Stanley Anderson', 'Juanita Moore', 'Susan Dalian', 'Esther Scott', 'Deborah May', 'Vernee Watson-Johnson', 'Jan Hoag', 'Melissa McCarthy', 'Elizabeth Arlen', 'Alexandra Barreto', 'John Apicella', 'Brian McGregor', 'Reiley McClendon', 'Brian Tibbetts', 'Brian McLaughlin', 'Steve Tom', 'Marc Copage', 'Rod McLachlan', 'Scott Mosenson', 'Brian Fenwick', 'Duke Faeger', 'Toshiya Agata', 'Joshua Finkel', 'Lou Beatty Jr.', 'E.J. Callahan', 'Daryl Anderson', 'Darrell Foster', 'Michael Wajacs', 'John Travis', 'Larry King', 'Jeri Ryan', 'Nick Chinlund', 'Stuart Scott', 'Rich Eisen', 'Kevon Edmonds', 'Julia Waters', 'Maxine Waters Willard', 'Stephanie Spruill', 'Tanisha Grant', 'Viola Odette Harlow', 'Paul Moncrief', 'Matthew Perry', 'Luigi Francis Shorty Rossi', 'Gary Weeks', 'Harold Greene']","['nostalgia', 'self-discovery', 'healing']",Jon Turteltaub
5767,5767,16221,Dororo,2007-03-15,0,139,False,0,"Hyakkimaru, a warrior on a quest to reclaim 48 of his body parts which were each taken by a demon, is joined by Dororo, a thief on a quest to avenge the death of her parents.",15.714,/vEM9WY9ufaIeX8xHdHyJ8H2udNz.jpg,"['Action', 'Fantasy', 'Horror', 'Science Fiction']","sword fight, decapitation, shaman, katana sword",2007,"['Satoshi Tsumabuki', 'Ko Shibasaki', 'Kiichi Nakai', 'Yoshio Harada', 'Eita Nagayama', 'Mieko Harada', 'Katsuo Nakamura', 'Anna Tsuchiya', 'Kumiko Aso', 'Gekidan Hitori', 'Denden', 'Shun Sugata', 'Tetta Sugimoto', 'Satoshi Hakuzen', 'Misayo Haruki', 'Kurumi Hashimoto', 'Seizô Katô', 'Ryûki Kitaoka', 'Kitaro', 'Motomu Kiyokawa', 'Taigi Kobayashi', 'Dai Matsumoto', 'Kenji Oka', 'Suzuki Sotaro', 'Jimon Terakado', 'Hatsuo Yamaya']","['revenge', 'identity', 'supernatural']",Akihiko Shiota
5768,5768,60420,Like Crazy,2011-10-28,3542353,90,False,250000,"A British college student falls for an American student, only to be separated from him when she's banned from the U.S. after overstaying her visa.",15.713,/8eIhNKnRfayRwWChx0atZh4vGua.jpg,"['Drama', 'Romance']","chair, customs, student visa, parents, blogger",2011,"['Anton Yelchin', 'Felicity Jones', 'Jennifer Lawrence', 'Charlie Bewley', 'Alex Kingston', 'Oliver Muirhead', 'Finola Hughes', 'Chris Messina', 'Ben York Jones', 'Edy Ganem', 'Kayla Barr', 'Iris Taylor Cameron', 'Michael Lovett', 'James Messer', 'Julia Montague', 'Vickie Moss', 'Jo Victoria Russell', 'Jason King', 'Robert Pike Daniel', 'Amanda Carlin']","['longing', 'distance', 'love']",Drake Doremus
5769,5769,10851,Revolver,2005-09-11,7164778,111,False,27000000,"Hotshot gambler Jake Green is long on bravado and seriously short of common sense. Rarely is he allowed in any casino because he's a bona fide winner and, in fact, has taken so much money over the years that he's the sole client of his accountant elder brother, Billy. Invited to a private game, Jake is in fear of losing his life.",15.712,/cXJYFEIGNxiNTCekP1A68ICzJen.jpg,"['Drama', 'Thriller', 'Crime', 'Mystery']","cash, wrong diagnosis, foretelling, waterboarding, safe box, reload, pinstripe suit, driving cap, trash talk",2005,"['Jason Statham', 'Ray Liotta', 'Vincent Pastore', 'André 3000', 'Terence Maynard', 'Andrew Howard', 'Mark Strong', 'Francesca Annis', 'Mem Ferda', 'Anjela Lauren Smith', 'Elana Binysh', 'Shend', 'Bill Moody', 'Stephen Walters', 'Vincent Riotta', 'Tom Wu', 'Ian Puleston-Davies', 'Jimmy Flint', 'Brian Hibbard', 'Bruce Wang', 'Tony Tang', 'George Sweeney', 'Martin Herdman', 'Tony Denham', 'Serge Soric', 'Trevor Stuart', 'Togo Igawa', 'Gary Tang', 'Faruk Pruti', 'Ricky Grover', 'Benjamin Feitelson', 'Abbi Bashir', 'Evie Garrett', 'Louis Dempsey', 'Mario Woszcycki', 'Eddy Lemare', 'Jeff Rudom', 'Mercedes Grower', 'Hon Ping Tang', 'Brendon Burns', 'Joerg Stadler', 'Woon Young Park', 'Jasmine Lennard', 'Kamay Lau', 'Rene Costa']","['confusion', 'ego', 'strategy']",Guy Ritchie
5770,5770,308,Broken Flowers,2005-08-05,46720491,106,False,10000000,"As the devoutly single Don Johnston is dumped by his latest girlfriend, he receives an anonymous pink letter informing him that he has a son who may be looking for him.",15.711,/gd8JNjwgiM6ZgGm6NFAkovQWoYn.jpg,"['Comedy', 'Drama', 'Mystery', 'Romance']","unsociability, midlife crisis, bachelor, amateur detective, ex-boyfriend, ex-girlfriend, veterinarian, anonymous letter, it-expert",2005,"['Bill Murray', 'Sharon Stone', 'Jessica Lange', 'Tilda Swinton', 'Frances Conroy', 'Alexis Dziena', 'Chloë Sevigny', 'Christopher McDonald', 'Julie Delpy', 'Jeffrey Wright', 'Heather Simms', 'Chris Bauer', 'Larry Fessenden', 'Brea Frazier', 'Jarry Fall', 'Korka Fall', 'Saul Holland', 'Zakira Holland', 'Niles Lee Wilson', 'Meredith Patterson', 'Jennifer Rapp', 'Nicole Abisinio', 'Ryan Donowho', 'Dared Wright', 'Suzanne Hevner', 'Brain McPeck', 'Matthew McAuley', 'Pell James', 'Mark Webber', 'Homer Murray', 'Rachel Puchkoff']","['melancholy', 'regret', 'search']",Jim Jarmusch
5771,5771,11616,Go for It,1983-02-01,0,107,False,0,"After Doug picks up hitchhiking Rosco with his truck, they are mistaken for two bank robbers by the traffic police. They manage to escape  only to be confused for two secret agents while trying to take a flight at the airport.",15.704,/gfv6ctg1BTtpQeOkwThe4EzDSK9.jpg,"['Adventure', 'Action', 'Comedy']","prison, cia, mistake in person, fistfight, criminal",1983,"['Terence Hill', 'Bud Spencer', 'Buffy Dee', 'David Huddleston', 'Riccardo Pizzuti', 'Faith Minton', 'Dan Rambo', 'Susan Teesdale', 'Dan Fitzgerald', 'Al Nestor', 'Christine Troples', 'Woody Woodbury', 'Giancarlo Bastianoni', 'Harold Bergman', 'George Coutoupis', 'Alex Edlin', 'Charles P. Harris', 'Joe Hess', 'Mal Jones', 'Jeff Moldovan', 'Raffaele Mottola', 'Clayton Sauer', 'Darcy Shean', 'Joey Silvera', 'Paul Tenn', 'Clarence Thomas']","['ambition', 'expression', 'self-discovery']",Enzo Barboni
5772,5772,791,The Fog,2005-10-14,46201432,100,False,18000000,"Trapped within an eerie mist, the residents of Antonio Bay have become the unwitting victims of a horrifying vengeance. One hundred years earlier, a ship carrying lepers was purposely lured onto the rocky coastline and sank, drowning all aboard. Now they're back – long-dead mariners who've waited a century for their revenge.",15.703,/v9vt49PUDJGkrMVjhb3yiYo7H4Y.jpg,"['Horror', 'Thriller']","sea, small town, ship, gold, island, california, fire, beach, penalty, parent child relationship, prophecy, sword, cemetery, narration, beheading, fog, leprosy, lighthouse, ghost ship, weather service, unatoned crime, remake, killer, denunciation, supernatural power, supernatural horror",2005,"['Tom Welling', 'Maggie Grace', 'Selma Blair', 'DeRay Davis', 'Kenneth Welsh', 'Adrian Hough', 'Sara Botsford', 'Cole Heppell', 'Mary Black', 'Jonathon Young', 'R. Nelson Brown', 'Rade Šerbedžija', 'Matthew Currie Holmes', 'Sonja Bennett', 'Meghan Heffern', 'Douglas Arthurs', 'Christian Bocher', 'Charles Andre', 'Yves Cameron', 'Robert Harper', 'Alex Bruhanski', 'Dan Shea', 'Rick Pearce', 'Eric Breker', 'Stefan Arngrim', 'Steven Cree Molison', 'Xantha Radley', 'August Winter', 'Tatiana Turner', 'John Destry']","['mystery', 'fog', 'ghosts']",Rupert Wainwright
5773,5773,10344,The Fly II,1989-02-10,38903179,105,False,0,"Martin Brundle, born of the human/fly, is adopted by his father's place of employment (Bartok Inc.) while the employees simply wait for his mutant chromosomes to come out of their dormant state.",15.703,/gORksEPahEgO409HYJOZlNVyEpe.jpg,"['Horror', 'Science Fiction']","monster, experiment, mutation, transformation, gore, sequel, industrialist, fly (insect), animal horror",1989,"['Eric Stoltz', 'Daphne Zuniga', 'Lee Richardson', 'John Getz', 'Frank C. Turner', 'Ann Marie Lee', 'Garry Chalk', 'Saffron Henderson', 'Harley Cross', 'Matthew Moore', 'Rob Roy', 'Andrew Rhodes', 'Pat Bermel', 'William S. Taylor', 'Jerry Wasserman', 'Robert Metcalfe', 'Garwin Sanford', 'Bruce Harwood', 'Lorena Gale', 'Bill Dow', 'Duncan Fraser', 'Ken Camroux-Taylor', 'Tom Heaton', 'Allan Lysell', 'Suzanne Ristic', 'Danny Virtue', 'Mike Winlaw', 'Kimelly Anne Warren', 'David Mylrea', 'Cecilia Warren', 'Andrea Mann', 'Sterling Cottingham', 'Rodney Clough Jr.', 'Jeff Goldblum']","['mutation', 'fear', 'tragedy']",Mick Garris
5774,5774,10013,Peggy Sue Got Married,1986-10-10,41382841,103,False,18000000,"Peggy Sue faints at a high school reunion. When she wakes up she finds herself in her own past, just before she finished school.",15.7,/nhxj5XmhWeZbWH6LP8IRenyEjbt.jpg,"['Comedy', 'Drama', 'Fantasy']","time travel, high school reunion",1986,"['Kathleen Turner', 'Nicolas Cage', 'Barry Miller', 'Catherine Hicks', 'Joan Allen', ""Kevin J. O'Connor"", 'Jim Carrey', 'Lisa Jane Persky', 'Lucinda Jenney', 'Wil Shriner', 'Barbara Harris', 'Don Murray', 'Sofia Coppola', ""Maureen O'Sullivan"", 'Leon Ames', 'Randy Bourne', 'Helen Hunt', 'Don Stark', 'Marshall Crenshaw', 'Chris Donato', 'Robert Crenshaw', 'Tom Teeley', 'Graham Maby', 'Ken Grantham', 'Sigrid Wurschmidt', 'Glenn Withrow', 'Harry Basil', 'John Carradine', 'Sachi Parker', 'Vivien Straus', 'Morgan Upton', 'Lewis Leibovich', 'Bill Bonham', 'Joe Lerer', 'Barbara Oliver', 'Martin Scott', 'Marcus Scott', 'Carl Lockett', 'Tony Saunders', 'Vincent Lars', 'Larry E. Vann', 'Lawrence Menkin', 'Daniel R. Suhart', 'Leslie Hilsinger', 'Al Nalbandian', 'Dan Leegant', 'Ron Cook', 'Mary Leichtling', 'Harrod Blank', 'Anna Ferguson']","['nostalgia', 'regret', 'self-reflection']",Francis Ford Coppola
5775,5775,59860,Monte Carlo,2011-07-01,39782683,109,False,20000000,Three young women vacationing in Paris find themselves whisked away to Monte Carlo after one of the girls is mistaken for a British heiress.,15.7,/dcbqyycrWA56HXq5lm41HYuED8Y.jpg,"['Adventure', 'Comedy', 'Romance']","monte carlo, mistaken identity, look-alike, young woman, texan, american abroad",2011,"['Selena Gomez', 'Katie Cassidy', 'Leighton Meester', 'Cory Monteith', 'Andie MacDowell', 'Brett Cullen', 'Luke Bracey', 'Pierre Boulanger', 'Amanda Fairbank-Hynes', 'Valérie Lemercier', 'Joe Camp III', 'Franck de la Personne', 'Máté Haumann', 'István Göz', 'Attila Árpa', 'Joël Lefrançois', 'Virág Bárány', 'Shay Cunliffe', 'Barna Illyés', 'Dániel Mogács', 'Gábor Nagypál', 'Matt Devere', 'Mark Phelan', 'Christophe Malavoy', 'Catherine Tate', 'Giulio Berruti', 'Bruno Abraham-Kremer', 'Romain Cottard', 'Arnaud Aldigé', 'Antal Leisen', 'Richard Rifkin', 'Sophie Thompson', 'George Mendel', 'Séverine Vasselin', 'Vilma Szécsi', ""Ben O'Brien"", 'Bernadett Kis', 'Éva Magyar', 'Kamel Laadaili']","['fun', 'romance', 'identity']",Gabriella Winkler
5776,5776,36691,Solitary Man,2009-09-07,5024782,90,False,15000000,A car magnate watches his personal and professional life hit the skids because of his business and romantic indiscretions.,15.7,/5Dpm8QDoL3w3ZOwVl6rgvjRWxrj.jpg,"['Comedy', 'Drama', 'Romance']","infidelity, bankrupt, loneliness, family drama",2009,"['Michael Douglas', 'Susan Sarandon', 'Danny DeVito', 'Mary-Louise Parker', 'Jenna Fischer', 'Imogen Poots', 'Jesse Eisenberg', 'Richard Schiff', 'Jake Siciliano', 'David Costabile', 'Ben Shenkman', 'Anastasia Griffith', 'Alex Kaluzhsky', 'Simona Williams', 'James Colby', 'Arthur J. Nascarella', 'Bruce Altman', 'Nick H. Toomey', 'Adam Pally', 'Lenny Venito', 'Greg McFadden', 'Ricky Garcia', 'Douglas McGrath', 'Gillian Jacobs', 'Katherine Owens', 'Arizona Muse', 'Jolynn Carpenter', 'Stephanie Danielson', 'Brooklyn Decker', 'Bianca Giancoli', 'Anna Kuchma', 'Olivia Thirlby', 'Lila Urda']","['regret', 'ego', 'decline']",Steven Soderbergh
5777,5777,13466,October Sky,1999-02-19,34698685,108,False,25000000,"Based on the true story of Homer Hickam, a coal miner's son who was inspired by the first Sputnik launch to take up rocketry against his father's wishes, and eventually became a NASA scientist.",15.7,/iZiHYgDjt1A03QJwCnQsDvmZtCR.jpg,"['Drama', 'Family']","small town, based on novel or book, parent child relationship, satellite, biography, rocket, west virginia, mining accident, teacher, coal mine, 1950s, sputnik, rocketry",1999,"['Laura Dern', 'Jake Gyllenhaal', 'Chris Owen', 'Chris Cooper', 'William Lee Scott', 'Chad Lindberg', 'Natalie Canerday', 'Ilya Baskin', 'Chris Ellis', 'Scott Thomas', 'Randy Stripling', 'Courtney Cole-Fendley', 'David Dwyer', 'Terry Loughlin', 'Kaili Hollister', 'David Copeland', 'Don Henderson Baker', 'Tom Kagy', 'Donald Thorne', 'Justin Whitsett', 'Larry Rue', 'Neva Howell', 'Terry Nienhuis', 'Brady Coleman', 'Rick Forrester', 'Terrence Gibney', 'Doug Swander', 'Keeli Hale Kimbro', 'Mark Jeffrey Miller', 'Blaque Fowler', 'Don Tilley', 'Rockford Davis', 'John Bennes', 'Jonathan Fawbush', 'Larry Black', 'Frank Schuler', 'Tommy Smeltzer', 'Charles Lawlor', 'Tom Turbiville', 'Ida Ginn', 'Richard Lumpkin', 'Mark W. Johnson', 'Don Taylor', 'Don G. Campbell', 'Liz Byler', 'Bradford Ryan Lund', 'Frank Hoyt Taylor', 'Dave Hager', 'Ray Elder', 'Andy Stahl', 'Joe Digaetano', 'Thomas Taylor', 'David Ducey', 'Jenny Patterson', 'O. Winston Link']","['inspiration', 'ambition', 'family']",Joe Johnston
5778,5778,323661,Mune: Guardian of the Moon,2015-02-05,15730665,86,False,17000000,"When a faun named Mune becomes the Guardian of the Moon, little did he had unprepared experience with the Moon and an accident that could put both the Moon and the Sun in danger, including a corrupt titan named Necross who wants the Sun for himself and placing the balance of night and day in great peril. Now with the help of a wax-child named Glim and the warrior, Sohone who also became the Sun Guardian, they go out on an exciting journey to get the Sun back and restore the Moon to their rightful place in the sky.",15.698,/4vzqow7mVUahqA4hHoe2UpQOxy.jpg,"['Animation', 'Family', 'Adventure', 'Fantasy']",moon,2015,"['Michaël Grégorio', 'Omar Sy', 'Izïa Higelin', 'Féodor Atkine', 'Éric Herson-Macarel', 'Michel Mella', 'Fabrice Josso', 'Patrick Poivey', 'Jean-Claude Donda', 'Benoît Allemane', 'Patrick Préjean', 'Damien Boisseau', 'Patrice Dozier', 'Emmanuel Curtil', 'Paolo Domingo', 'Alexandre Heboyan']","['wonder', 'balance', 'growth']",Alexandre Heboyan
5779,5779,178,Blown Away,1994-07-01,30156002,121,False,28000000,Blown Away tells the story of Jimmy Dove who works for the Boston bomb squad. Shortly after Dove leaves the force his partner is killed by a bomb that Dove thinks might have been made by someone he knows.,15.697,/kiV3KcjE0bVgfMwRG9HhRFG8Ggq.jpg,['Action'],"concert, computer, boston, massachusetts, fireworks, orchestra, anarchist, flashback, revenge, terrorism, wedding, explosion, roulette wheel, capsized ship, belfast, north ireland, bomb planting, headphones, bomb attack, action hero, blast, human bomb",1994,"['Jeff Bridges', 'Tommy Lee Jones', 'Suzy Amis', 'Lloyd Bridges', 'Forest Whitaker', 'Stephi Lineburg', 'John Finn', 'Caitlin Clarke', 'Christofer de Oni', 'Loyd Catlett', 'Ruben Santiago-Hudson', 'Lucinda Weist', 'Cuba Gooding Jr.', 'Mike Starr', 'Brendan Burns', 'Tricia Heine', 'Josh McLaglen', ""Robert 'Bobby Z' Zajonc"", 'Alan D. Purwin', 'David B. Nowell', 'Dee Nelson', ""Ed O'Keefe"", 'Craig Richard Nelson']","['tension', 'danger', 'loss']",Stephen Hopkins
